Review,Positive,Helpful Votes,Funny Votes,Date
"There’s something about Stray that hits differently. It’s not just a game. It’s an experience. You step into the paws of a small, lost cat, wandering through a city that simultaneously feels alive and wholly abandoned. It’s eerie yet beautiful. Quiet yet filled with stories waiting to be found.
At first, you’re just trying to find your way back home. But as you explore, you realise you’re not just a stray cat but part of something bigger. You meet robots who long for a world they never got to see, a little drone companion who becomes your only friend, and remnants of a past that feels distant but strangely familiar.
There were moments when I just stopped. I sat on rooftops, watching neon signs flicker in the distance. I curled up next to a lonely musician, letting the soft sound of their guitar fill the air. I knocked over bottles and scratched at rugs because why not? Every detail made the world feel real, like I was there.
But what surprised me the most was how human this story felt. Even without words, Stray tells a tale of loss, companionship, and hope. It reminded me there’s always a reason to keep going, even in the loneliest places.
And then the credits rolled. And I just sat there, not ready to leave, not ready to say goodbye. Because sometimes, a game isn’t just pixels and mechanics; it’s a feeling, a memory, a story that becomes part of you.
And Stray? I’ll carry it with me for a long, long time.",True,0,0,2025-02-01 00:07:45
"This game is absolutely amazing. The visuals are stunning, and the story is very touching. I absolutely loved playing it.",True,0,0,2025-01-30 15:01:58
Very nice. A little on the janky side but nothing bad enough that warrants leaving it unplayed.,True,0,0,2025-01-29 21:48:10
"A lovely, sweet, original, creative, beautiful game. Which you can finish! In a reasonable amount of time! It's so nice to finish something for once.",True,0,0,2025-01-29 20:15:51
"[h1]9/10[/h1]

[b]I'm a cat and I LOVE that. OwO[/b]

[h2]Gameplay[/h2]

The control is nice and responsive. You can interact with a lot of things in the game with is really fun: knocking stuff off the edge, scratch the carpet and doors, interact with robots... 

[h2]Story[/h2]
The story is decent and have it's depth. It's fun to explore the world. There are calm and intense moments will balanced.

[h2]Graphics[/h2]
The graphics style is nice and warm. It really created a mysterious yet interactive atmosphere.",True,0,0,2025-01-28 04:02:29
"The art and music in this game are probably my favorite thing. The ambiance is incredible, i'm a huge fan of the Cyberpunk/Nature taking over apocalypse themes in this game. I was not expecting to love this game as much as I did, the story was great and for me there were no dull moments.",True,0,0,2025-01-28 03:01:35
"Very adventurous and thrilling at times, but also very wholesome. I loved this game.",True,0,0,2025-01-28 01:41:05
I wanted a chill adventure game with puzzles. I didn't sign up for stupid chase sequences that are super frustrating and can't be skipped. I'm disappointed and putting this game on a shelf for now.,False,3,4,2025-02-08 06:46:53
"Game is broken due to a game breaking bug which prevents you from proceeding through the game. There are many bugs reported, none have been fixed.",False,1,0,2025-02-25 10:19:12
such a cute game but a little more stressful than typical cozy games at times.,True,1,0,2025-02-26 21:11:10
"[h1]Stray – The Catspiracy is Real[/h1]
I used to think my cat was just a cute, clueless ball of fur. Then I played Stray. Now I sleep with one eye open, fearing the day he hacks my Wi-Fi and leads a robot uprising. This game turns you into a tiny feline parkour master in a cyberpunk world, solving puzzles, outsmarting machines, and knocking over perfectly placed bottles—just because you can. It’s gorgeous, emotional, and a little too convincing.

Verdict: 10/10, my cat is plotting something, and I’m scared. 🐱🤖",True,1,0,2025-02-01 06:08:12
"Stray is a game that captured my attention from start to finish, offering a unique and heartfelt experience that stands out in the gaming landscape. Without diving into spoilers, I can say the story is one of the game’s strongest elements. It’s thoughtfully crafted, drawing you in with its emotional beats and leaving you pondering long after the credits roll. The environments are equally captivating, with every corner of the neon-lit city brimming with detail and atmosphere. It’s a world that feels alive, even in its decay, and I loved every moment spent exploring it.

Playing as a cat in Stray is an experience that feels both refreshing and endearing. The design of the cat itself is fantastic, and while some animations felt a little off at times, it didn’t take away from the gameplay. In fact, these quirks occasionally made me laugh, adding charm to the experience. One feature I absolutely loved was the ability to meow freely—even during cutscenes! It’s such a small detail, but it added so much personality and lighthearted fun to the game.

The gameplay is another highlight, especially the “parkour”-style movement system. As a cat, you can leap to countless places, climb rooftops, and traverse areas in ways that feel uniquely feline. However, I did find it a bit restrictive that you couldn’t jump freely unless there was a designated surface to jump to. A regular jump mechanic, like in many other games, would have added an extra layer of freedom to the experience. That said, it’s a small minus in an otherwise fluid and enjoyable system.

The interactions with the game’s other characters were another element I appreciated. Every character you encounter feels meaningful, with their own purpose and personality. While the protagonist doesn’t speak, the depth given to the friendly characters really stands out, adding emotional weight and connection to the story.

The puzzles struck a great balance for me. They were challenging enough to make me think but not so hard that they became frustrating. The variety of difficulty—from easier puzzles to trickier ones—kept the game engaging throughout, especially if, like me, you enjoy completing 100% of a game.


Overall, Stray was an enjoyable journey that left me wanting more. I couldn’t help but wish for a longer game or even major side stories separate from the main plot—something with its own depth and challenges to expand on this beautifully built world. That said, the game excels at what it sets out to do: delivering a memorable, heartfelt experience in a way that only a cat’s perspective could.",True,1,0,2025-01-28 09:02:36
"Short, but nice to be a cat for a 7 hours in a post apocalypse world.",True,0,0,2025-02-24 23:38:03
This is an excellent game and one I'm very glad to had bought and played through a few times.,True,0,0,2025-02-23 23:16:41
"⭐️⭐️⭐️⭐️⭐️ - A Purrfect Cyberpunk Adventure ⚫⚪

Stray is a truly one-of-a-kind experience. ⚡🏙️ You play as a stray cat, lost in a breathtaking cyberpunk city filled with mystery and heart. 🏚️✨ The world is hauntingly beautiful, with neon-lit alleyways, abandoned apartments, and robotic inhabitants who feel surprisingly human. 🤖💭

Exploring as a cat is incredibly immersive—every leap, scratch, and curious nudge feels natural. 🐾🔍 From knocking things off ledges to squeezing into tight spaces, the attention to detail is remarkable. 🏗️⚙️ And the bond with B-12, your tiny drone companion, adds emotional weight to the journey. 🎒⚡

The atmosphere is unforgettable. The eerie silence, the distant hum of machinery, and the soft piano soundtrack create a world that lingers long after you finish. 🎶🌫️ It’s a short but deeply moving experience that every adventure lover should play.

Final Verdict:
⚫ Immersive & Unique Gameplay
⚪ A Stunning & Emotional World
⚫ A Must-Play for Cat & Sci-Fi Fans

10/10 - A true meowsterpiece! ⚪⚫",True,0,0,2025-02-19 03:18:39
"CAT AND A LITTLE ROBOT FRIEND GAME FOR 30 EUROS? IS IT WORTH IT? Yes.
AAAAAAAA MAN THIS CAT IS SO CUUUUUUUUTEEEEEEEEE AND ROBOTS ARE SO CUTE I CRIEEEEEEEEEED THEIR FRIENDSHIPS ARE SO PRECIOUS................ i love B-12 id die for him even now remembering him my EYES START TO TEAR UP.",True,0,0,2025-02-15 21:17:11
"Adorable with a smidge of horror. The fun of a cat in dystopia, it's exactly what you think.",True,0,0,2025-02-10 23:59:13
"I loved playing this game, it's comforting yet intense and the cat is so so cute! Found myself falling asleep in the couch to the music of the guitarman because it was so cozy, story is also really endeering and nice. Fairy short game but still 10/10",True,0,0,2025-02-05 10:51:43
Its not bad. You can play it with you girlfriend.,True,0,0,2025-02-03 21:47:46
"Really enjoyed this, such a pretty and fun game",True,0,0,2025-02-03 21:44:07
"Perfect game, play it if you want a good story.",True,0,0,2025-02-03 05:25:56
"The chillest, cutest and one of the best looking games i have ever played. It is so relaxing, but a liiiiitle bit short for my taste. Still just remarkable and soooo beautiful. Just buy it damn it!",True,0,1,2025-01-30 17:38:23
"I'm not sure if it's just me or the game, but I got so bored playing it for some reason. It feels overhyped and confusing. Every time I launch it, I end up wanting to put my controller down out of frustration.

",False,3,0,2025-02-04 05:52:20
"Pros:
- You play as a cat - a somewhat unique and interesting concept
- Graphic style is good for the game
- Puzzles were just about right in difficulty for casual gaming
Cons:
- Would have been better just playing a cat in the wilds instead of all the robots and lock down in a depressing city, the beginning was the best part
- No customization, should have been able to choose the color of your cat
- The Zurks could have been fleshed out more and explained (giant red eyes on walls?) and they looked too generic
- The only goal was getting out and helping your friend retrieve memories, then the friend died anyway
- Interaction / Immersion: you can drink water a few times, but it would have been nice to need to drink and eat (scavenge) about...
- It's never addressed why your cat is a puzzle solving genius
- It's never discussed what actually happened and we don't need yet another mystery apocalypse game (giant red eyes?)
- All of the above could have been forgiven, but the ending was very poorly done and rushed. We all just wanted to see our cat family again and get back to the beginning game play. You know when the game was actually fun...",False,0,0,2025-02-27 19:29:27
"Well I liked very much this game, I sure recommend it 100%, it is worth the price entirely. Just give it a try, it will hook you up since the beginning.",True,0,0,2025-02-27 08:39:33
"So... you play as a cat. I don't think we need much more to say. 

Jokes apart it's a chill game with some challenges for who likes to finish games fast.",True,0,0,2025-02-17 10:58:31
"It's hard for me to come up with words that can describe what i experienced playing  this game, it's just everything  you could imagine that is good about a game.",True,0,0,2025-01-29 11:47:23
Can do to a tall walking robot what my cat tries to do to me now and then... 10/10,True,0,0,2025-02-25 11:14:14
Not my usual type of game but I loved this. Fantastic game.,True,0,0,2025-02-14 15:34:16
This game was extremely immersive and entertaining! I loved it!,True,0,0,2025-02-08 19:04:14
"Just a chill game with a great soundtrack, suitable for all ages.",True,0,0,2025-02-06 15:06:38
"[h1] A Small Yet Unforgettable Adventure – Stray is a Masterpiece! [/h1]

[b] ⭐Rating:10/10⭐ [/b]

[i]Stray is an experience that goes far beyond simply ""playing as a cat."" It is an emotional, artistic, and engaging journey that leaves a lasting mark on anyone who plays it.[/i]

[h3] Graphics and Atmosphere [/h3]
Visually, Stray is breathtaking. The developers at BlueTwelve Studio have created a decayed yet fascinating cyberpunk world, where neon lights blend with dark alleys and abandoned streets. Every corner of the city tells a story, and the attention to detail is impressive—from the way the cat moves and grooms itself to the reactions of robotic NPCs to its interactions.

[h3] Immersive Gameplay [/h3]
The gameplay experience is incredibly smooth and realistic. The feline protagonist’s movements are strikingly authentic: jumping between platforms, rubbing against robots, scratching carpets, and meowing at will are all elements that make the immersion total. The balance between exploration, environmental puzzles, and stealth sections creates the perfect mix of relaxation and tension.

[h3] Story and Narrative [/h3]
Despite the protagonist being a cat and unable to speak, Stray manages to tell a deep and emotional story. The bond with B-12, the small drone accompanying the player, develops naturally and touchingly. The mystery behind the city and its inhabitants gradually unfolds, allowing for moments that are both sweet and melancholic.

[h3]Soundtrack and Sound Design[/h3]
The soundtrack is perfect for the game’s atmosphere—delicate, engaging electronic melodies accompany the exploration, enhancing the most emotional moments. The sound design is also exceptional, with realistic effects that bring the world and protagonist to life: the sound of paws on different surfaces, the meows, and even the purring all contribute to making everything feel even more authentic.

[h3]Conclusion[/h3]
Stray is more than just a game; it is an artistic and narrative experience that deserves to be played. Perfect for cat lovers, but also for anyone looking for a unique, touching, and visually stunning adventure. 

🔥[i][u] A must-play for everyone![/u][/i]🔥",True,0,0,2025-02-27 16:36:33
"Smack pots, get in everyone's way, sleep everywhere, watch for the one-eyed [I]pigs[/i]... 
wait... what?

As a cat [i]sidekick[/i], fall into post-human city only to get [i]back to your cat pack[/i] in best, though short, cat sim yet.",True,0,0,2025-02-15 14:06:36
"I like the cat, I like the meowing, plot is good, cat is cute. Robots are cute too. Little Zurks aren't so cute, but kinda cute, but also dangerous.",True,0,0,2025-02-20 05:15:57
Lovely game and story. I really hope there is a Stray 2 some day!,True,0,0,2025-02-19 02:23:11
"Amazing game, as good as Portal 2. 10/10.",True,0,1,2025-02-15 04:24:10
Beautiful game! One of my favourites! loved it!,True,0,0,2025-02-02 20:55:49
"Huh, I don't get it, it's just a boring game with clumsy frustrating controls.",False,6,0,2025-02-22 12:39:12
I wish this were a longer game!  I hope they do a sequel and add different skins and breeds for the cat!,True,0,0,2025-02-17 16:43:51
"you can meow and knock things over. i also cried.
10/10",True,0,0,2025-02-13 23:51:38
"Knocking down cups, tracking a mess into rooms, destroying eldritch evil. Truly the most cat of all cat experiences. 

Buy it.",True,0,0,2025-01-29 04:44:39
"A very beautiful game, absolutely loved the story",True,2,0,2025-02-17 19:08:15
Best cat game ever. My ginger tabby loved it almost as much as I did.,True,1,0,2025-02-27 15:38:18
"Good game and beautiful story and visuals.

Also you can't deny it is cute as f*ck.

Cannot recommend based on current price, and I did originally buy this full price.",True,1,0,2025-02-26 00:21:49
This game is beautifully designed. The story and the concept of the game itself is amazing!!,True,1,0,2025-02-12 11:10:08
i loved the world design and the cat physics and the storyline. stray 2 most anticipated game,True,1,0,2025-02-12 01:57:31
"I am late to playing this game, and I am incredibly broken—in all the good ways. This game has such an amazing story and such complex characters. It has become one of my favorites, and it made me cry like a little boy. Who knew being a cat was this fun yet emotional?",True,1,0,2025-02-12 00:48:12
"Wonderful story, simple gameplay where you can do one of the best things in the world: being a cat! The graphic is super cool as well. Highly recommended!",True,1,0,2025-02-11 18:33:17
"This game is a delight. Original and playful. Its not complicated and there's no replay (its a story, really) but like a decent movie you should just pay up and enjoy it.

* meow *",True,1,0,2025-01-31 17:38:57
"A charming and stylish game. Overall feel and mood of the game is spot-on. Well worth a look. 
It does help if you like cats....",True,1,0,2025-01-31 12:21:45
"In a world of ugly games that are 300GB we are given a beautiful and fun game that is small in file size and well optimized. This is a model for how to make games. The world is shockingly large and pretty for 6GB, the game play feels good, and the story was fun, what more can you say?",True,1,0,2025-01-31 08:21:13
Very enjoyable and fun to play a cat.,True,0,0,2025-02-23 16:05:29
"I just finished my second playthrough of Stray, and I’m already itching to dive back in. This game is an absolute gem—a beautifully crafted experience that stays with you long after the credits roll. From the moment I stepped into the paws of that adorable, curious cat, I was completely immersed in a world that felt so alive, so loved.
The visuals are breathtaking. Every neon-lit alley, every sun-drenched rooftop, and every shadowy corner of the cybercity is a work of art. The attention to detail is staggering, and it’s clear that the developers poured their hearts into creating this world. It’s not just a game; it’s a vibe.
And the story? Oh, the story! It’s heartfelt, mysterious, and deeply emotional. The characters—both human and robotic—are so well-written and memorable. I found myself genuinely caring about their fates, and the connections you build along the way are incredibly touching. The narrative is perfectly paced, with just the right balance of exploration, puzzle-solving, and emotional beats.
What really sets Stray apart is how it makes you feel. It’s not just about being a cat in a futuristic world; it’s about curiosity, resilience, and the bonds we form. It’s a game that makes you stop and appreciate the little things—whether it’s knocking over paint cans, curling up for a nap, or just meowing at the right moment to make someone smile.
I truly hope the developers create another game because I would be first in line to play it. Stray is a rare masterpiece—a game that’s not only fun to play but also leaves a lasting impression. If you haven’t experienced it yet, do yourself a favor and dive in. And if you’ve already played it, well… it’s always a good time to revisit this stunning world.
10/10, would meow again.",True,1,0,2025-02-13 00:28:26
"Nah, because I can't be finishing a game in one sitting lmao!

That aside though, this game is really great! It's a bit of a quick game but considering the price you pay for it, I'd say it's worth it. Maybe try and get it during a sale to save even more!

One thing I would say though is if you're like me and you get upset seeing cats or animals in general get hurt, there is a setting in the game where you can turn off the animation of the kitty collapsing. Or just be a really good gamer and not get caught by enemies at all!

Also sometimes, the camera gets a bit weird especially in certain areas in the game which could be a bit annoying but not game breaking for sure.

Replaying it to get 100% achievements asap! 

All in all, a very good game! 8.5/10 for me!",True,1,0,2025-02-13 00:08:59
"No a terribly difficult game, some mazes and zurgs to worry about. The nameless cat is animated quite well (but sometimes he stands like he's gonna poop, and his eyes are souless). Bought it on sale, and it's worth it.",True,1,0,2025-02-11 18:21:15
"It's great working out how to be a cat, coming up with cat solutions rather than people solutions",True,1,0,2025-02-11 17:54:51
A short game with great sentimental value. A journey of emotions and orange car activities,True,1,0,2025-02-09 16:36:30
stray 2 when stray 2 when stray 2 when stray 2 when stray 2 when stray 2 when stray 2 when stray 2 when stray 2 when stray 2 when stray 2 when stray 2 when stray 2 when stray 2 when stray 2 when,True,1,0,2025-02-09 15:41:33
THIS GAME IS AMAZING. The music the environment the connection built with everything is amazing i love this game it can be a little slow at the start but it is amazing and i love it in every way B-12 is the best <3,True,1,0,2025-02-09 13:29:56
played on ps5 before sony pulled a scum move nd pulled it off my library. nice relaxing game,True,0,0,2025-01-28 03:17:43
"Stray! My boy! 

Dag, this game is good. I bought a fancy laptop with the beastly graphics card. I plugged it into my 4k OLED TV and Stray let me simultaneous know the following things: My laptop is sweet. Stray is sweet. My TV is sweet. I am sweet for coalescing these things. 

The gameplay is not deep. I knew that going in and so should you. It’s not possible to die and lose. All challenges can be retried until you complete them.  The plot moves itself along, you don’t really make choices. I’m good with all of that when it comes to Stray. 

The mechanic and visuals of Stray jumping around and catwalking everything is satisfying. You won’t ever misjudge a jump and miss. You will never attempt to traverse a long pipe and fall off. Stray’s animations as he traverses the dystopian hellscape are very catlike and dynamic. 

Artistically I love the game. Lighting effects, level and character design, writing, vibe, believeabilty - it not only checks those boxes but ticks them too. 

Stray is definitely a cat and solves things in the manner a cat would. I love the idea that he’s walking up to random robots and showing them a photo to see what they’ll say. Strapping a robot onto his back certainly helps him get things done. Great idea and execution. 

Music is whimsical, visionary, and dark. 

Magnificent experience! Somewhat shallow gameplay doesn’t hurt this game at all. Honestly many games with “deep” mechanics are often just busywork and fetch quests anyways. In stray I was always eager to see what’s next and never was bored. The top tier audiovisual presentation is what made this game nearly perfect.",True,1,0,2025-02-11 17:25:04
Good enough that I wish I could play it for the first time again.,True,0,0,2025-02-15 03:53:53
"Great game.
I only wish it was a little longer",True,0,0,2025-02-26 06:18:44
"Wouldn't let me choose ""maybe later"" when trying to get past the popup....silly...but good game otherwise.",True,0,0,2025-02-26 03:18:56
"cool little game,nice for lay back, and enjoy the story.",True,1,0,2025-02-09 17:21:22
"Fun, creative, and adorable.",True,0,0,2025-02-16 21:52:18
"Amazing, beautiful, spectacular.",True,0,0,2025-02-04 20:33:53
Cute cat with cute robots. Best game.,True,1,0,2025-02-27 14:43:01
"Sneak peek into a better life than the one you're living behind the screen.
A must play.",True,0,0,2025-02-19 02:22:35
Love being a stupid cat and making friends with robots,True,0,0,2025-02-17 19:23:56
Charming yet adrenaline-inducing. Story sucks you in. Play it.,True,0,0,2025-02-17 03:38:59
"would have loved for this game to be even longer

10/10 nonetheless",True,0,0,2025-02-01 13:29:44
"Всю игру меня называли ""аутсайдером"" и заставляли ламками ковыряться в проводах, а потом ещё и робот выпилился, обидно блин.",True,0,1,2025-01-30 09:09:37
"it took me an hour to leave my buddy at the end of the game and i cried 3 times, life changed",True,0,0,2025-01-30 03:35:35
"This is the first game in a long time that genuinely brought me to tears. Visually stunning, perfectly written, and satisfying to play all in one.",True,1,0,2025-02-12 05:21:19
I liked it so much!!! Buuut arachnophobia stopped me from finishing :/,True,0,0,2025-02-10 23:30:36
Loved catting around in Hong Kong. 10/10 would recommend,True,0,0,2025-02-07 15:23:57
"This game was so good, the ending almost made me cry :')",True,0,0,2025-02-27 11:54:41
" | \---/ |
 | o_o |
 \_^_/",True,0,0,2025-02-15 13:51:06
Epic story,True,0,0,2025-02-14 17:31:51
"You get to play as a cat, what more could you ask for?",True,0,0,2025-02-10 02:07:43
"Good game, pretty short though",True,0,0,2025-02-08 08:49:57
"Very eciting, I would suggest that you watch this game being played for at least 1 hour before you buy.",True,0,0,2025-02-01 17:04:50
Fun puzzler for all ages with a very cute cat!,True,0,0,2025-02-21 02:18:40
the definitive cat sim without being cheesy or lame. i need a doggo game pronto,True,1,0,2025-02-09 16:59:17
"Meow, Cried while playing, 10/10 Game",True,0,0,2025-02-26 20:45:17
"This game is so beautiful love it, would recommend great story",True,0,0,2025-02-05 03:37:35
"THIS GAME HAS AMAZING VISUALS AND A GREAT, EMOTIONAL STORY. HOWEVER THERE CAN BE SOME SCARY PARTS ESPECIALLY CHAPTER 8, OTHER THAN THAT, I WOULD HIGHLY RECOMMEND THIS GAME.
",True,0,0,2025-01-29 14:37:28
Отличный красочный и интересный квест.,True,0,0,2025-02-13 11:51:42
"GOOD GAME
STORY IS EASY TO FOLLOW
",True,0,0,2025-02-07 10:29:38
a phenomenal single player game that keeps you engaged,True,0,0,2025-02-06 05:33:29
It's fun and there is many achievments.,True,0,0,2025-02-22 22:05:24
"Looks amazing, very good",True,0,0,2025-02-18 22:01:55
"Good Story, good cat",True,0,0,2025-02-13 17:55:52
it was a very fun game espically the way of playing,True,0,0,2025-02-07 15:08:14
One of the best games I have ever played.,True,0,0,2025-02-03 19:09:03
"Short, beautiful, sad, and cute. Sometimes frightening. I loved it.",True,0,0,2025-01-29 19:57:50
Gorgeous game with a lot of heart,True,0,0,2025-02-26 11:41:21
"Super cute cat game, tbh it has to be a 9 out of 10 fr fr",True,0,0,2025-02-19 05:55:17
so cool and also good thumbs up,True,0,0,2025-02-09 22:47:39
