genre,game,commented_date,comment,release_period
Adventure,Stray,2024-12-24,"today we found out that hyunjin sent gifts for christmas at a childrens hospital in seoul for all patients,some of the parents posted pictures of it and said that they couldnt thank him enough for his kind gesture. another person who works there said that he goes there often and plays with kids,he does it in private without showing off on media because thats what real kindness is! the word perfect was made for the one and only hwang hyunjin,hes an ace when it comes to being an idol,yet hes incredibly kind and humble! im so glad i discovered hyunjin and decided to stan him! hes truly the best inspiration!",After
Adventure,Stray,2022-08-09,"so, as much as i love your theories and how dark they can get, i have to say i found a flaw to this one proving it is indeed b12 in the network and not the zurks. other than the fact that b12 literally says his little drone body couldn't handle it but he'll be fine back in the network, the cutscene showing the sentinels crashing is proof it's b12. why would the zurks shut down the sentinels? it wouldn't serve them any purpose and we know it isn't because of uv as that wouldn't make sense to build a police force that shuts down in sunlight. the sentinels shut down because b12 shut them down after he got control.",After
Adventure,Stray,2022-08-16,"i played this game along with my oldest brother. we lost our cat 2 months ago and the cat lived a very very very long life. it was almost 18. she was very social, nice, smart, and a very good cat. i cried playing this game for the first 10 minutes because of how cute it was seeing it interact with the cats and the environment. it really helped with my grief even if i had been happy with her life and that i spent a lot of time with her near the end. i might be biased but i loved this game and i'll always remember that cat through the memories i shared with family and stray. just a shame i couldn't share it with her.",After
Adventure,Stray,2022-07-19,"fun cat fact i want to do one per episode but don't have many at the moment so we'll see what happens ever wonder why cats tend to stop and stare at each other when crossing paths? they're likely squaring each other up. cats have enhanced peripheral vision meaning they view things out of the corners of their eyes better than we do so they tend to only stare directly at things they want to fight, hence why feline staring contests usually end in a brawl. next time you want to pet a cat, try to avoid looking at it as much by looking away every so often or slowly blinking instead as that is a sign of trust in cat language.",After
Adventure,Stray,2024-12-20,"it truly is a true masterpiece that reflects han's exceptional talent, his ability to convey deep emotions through his lyrics is impressive. each word resonates with authenticity and makes us feel understood and accompanied. han not only sings, but touches our hearts. his ability to capture sincere emotions in each verse is amazing. this song is not only beautiful, but it also unites us as fans. there is no doubt that his talent as a songwriter and artist is unmatched and is leaving an indelible mark on the kpop industry. i am proud to be a part of this fandom that feels like a real family that supports the talent of our han.",After
Adventure,Stray,2025-03-07,"naver article kmedia mhn sports confirmed felixs missed flight was due to the managers negligence there was an accident that delayed the departure of group straykids felix. on the morning of the 7th, felix departed for paris, france via incheon international airport to attend an overseas fashion show. felix, who was originally scheduled to depart from terminal 2 of incheon international airport at 1215 pm on the 7th, was confirmed to have departed from terminal 1. an official from felix's agency, jyp entertainment, stated, the manager brought the wrong expired passport, which caused the delay, and he hurriedly boarded the next flight.",After
Adventure,Stray,2022-08-23,"the ending of the game is one thing, but it really made me emotional, how the other cats were desperately meowing when we fell from that pipe. humans could start looking out for their friend, find a way down there and track down the person. these kitties are completely helpless, processing nothing but he's gone, we don't know where he is, we might never see him again. to me, this meowing delivered so much emotion, even without words or faces, and maybe it was even sadder, when there was no meowing anymore after a period of unconsciousness. them supposedly accepting the loss of their friend, with no options to do anything about it........ wonderful game.",After
Adventure,Stray,2023-06-11,"two things 1. b12, as far as we know, is the only being left that is aware of his humanity so the final moments where he shared his companionship with stray is extra touching given that that might have been the final humancat interaction in that world. cat lovers will get an extra kick from that. 2. at the end, when stray walks up the stairs and starts heading to the right, we see a flashing screen. this is similar to the time when we were guided to b12 by flashing lights. this strongly suggests that he's alive somehow through the network and technology. this game was so good, i plan to recommend it to my coworker who is currently dealing with a little kitten",After
Adventure,Stray,2024-11-20,it look so great and you can interact with almost everything with the cat and even destroyed it still interact with the environment. you have to trigger the camera at walls to get a black egde on the screen meanwhile the head of the cat stuck in the wall but you have to force to get such results. the highness of the level of the cat make an amazing atmosphere. i guess i am at the start of the story and like to see every possible place. i don't know what will coming but until the first 4 to 5 hrs i'm impressed of so many great shots where it look more like a movie than a videogame on nintendo switch. noone can tell that the console is the reason when s game look bad.,After
Adventure,Stray,2022-08-10,"i'd have played this if it was simply just a cat running around being a cat but without the robot stuff since that's not typically my type of thing tbh, but i enjoyed watching you play it! i honestly thought there'd be more when i saw this was the finale episode, but it also makes sense that as a cat that can no longer understand the robots that we really would just get out of there and start going about our usual life again. i hope our little kitty managed to find his family again out there! i do find it kinda funny how he got into this mess because he missed a jump in the beginning but then throughout this whole thing was casually jumping here, there, and everywhere lol",After
Adventure,Stray,2022-11-30,"i want to stop by  say that this game is so damn beautiful. like i loved it so much im still thinking about it after playing 2 months ago. the story, graphics, colorrrs, music, controls, ambience, suspense, warm ness, literally the perfect game to play on a chill rainy day. i loved the puzzles and how you had to start from the bottom to get to the top. my favorite section was the slums like there were so many puzzles, hidden doors  places to explore! everything had a purpose! i loved how you could talk to every robot. the story was so good, realistic  wholesome. the creators didnt complicate things with this game and i appreciate that. stray truly deserves game of the year.",After
Adventure,Stray,2024-12-20,"i really like how the alien version is portrayed with a more innocent look, trying to figure things out. he kicks and presses the buttons on the device to make it work because he doesnt know how to use it, while the human version already knows exactly how, having learned over time. the alien version stays in his room playing guitar and jumping on the bed, never leaving the house, so his human version calls him to the outside world. the two connect through the animations, and in the end, they bump into each other, and the pick delivers the message 'hold my hand.' i also love the representation of the planet and the city at the beginning, as they represent each of their homes",After
Adventure,Stray,2022-08-10,"when i read the title i instantly thought of rick astley singing now say goodbyeeeeee edit there is a safer and easier way to get the two sentinels in the cage step 1 hide in the grass by the first door dont open or shut either just leave them alone step 2 meow to get both sentinaels attention you may have to move closer to the second one then move back only in the grass step 3 watch as the sentinels both move backwards and to the side all the way into the cage step 4 lock the second door and you have now done it! edit 2 that robot that was taking weird, it was because he overclocked his processor, you have to talk to him before locking up the sentinels to find that out though",After
Adventure,Stray,2022-07-19,"3925 wow, the attention to detail about cats mannerisms is pretty amazing esp how they put the life like reaction of the way the cats body actually acts when the drone droid put that power backpack on the cats back, because every time i put my cats harness on my cat's back like that he acts the same way when he has it on.. when he bends down and walks with his back slouched down and his back legs lowered down as if hes ready to jump or pounce. this is how life from a cats peerrrrspective would be in a philip k. dick dystopian future city. it's like the sims pet stories mixed with gta mixed with blade runner. as a lifelong lover of cats, scifi, and video games, i can't wait to play this.",After
Adventure,Stray,2023-12-21,stray from the light stray from the path stray through the night stray through the dark stray from the safety of whats known stray till you save me stray till youre home stray for an ending stray for a start stray for a future exhumed from the sparks stray till we suture the wounds of the past stray for the tools noah doomed to the ark stray for a chance stray for a purpose for the discarded stray for the worthless stray for the last of us made to endure it stray for the lost on the way to the surface stray for a city and slip through the seams stray for the sun that weve seen on our screens stray so that one day we might feel its beams stray for tomorrow stray for a dream man i love this song,After
Adventure,Stray,2022-09-10,"damn, i like this theory so much. at first i thought matpat gonna touch the question of where are the human remnants? a.k.a. the bones because, what if the zurks are not just zurks, but a new human subspecies that adapt by conjoining themselves with the zurks? that's why 1.21 gw uv light does not affect them at all, because we are able to withstand the sun better than the zurks. while b12 and the companions are the remaining humans who went digital, what if the current zurks were the remnants of human species who evolved to adapt as the zurk's subspecies? this kinda explains how the zurks have the capability of intelligence to study the robot in the sewer, to get their ways into the network. you're welcome",After
Adventure,Stray,2025-03-15,"dear han, this song is an absolute masterpiece! i dont expect any less from han jisung. youre an ace and so full of talent. i cant think of anything that you cant do. keep up the good work. well always be proud of you, no matter what. i know that life hasnt been very fair to you, yet you still smile through all of it. im so glad that youve been doing better, and i hope you stay this way forever. all we want is you not your tears, han. when you go through hard times, know that your fellow members and stay are there to hold your hand all the way through it. youre an alien, and we love you for it. stay strong. enjoy your youth. dont let any obstacles come in the way of your dreams. we love you, han. you make stay stay.",After
Adventure,Stray,2023-04-10,"i gotta say, this is one of the most well put together games i've ever played. the details, lore, music, and just almost everything is perfect. i still find quite a few bugs, like things floating, but i don't think that really matters as much, as that's not even an issue and this game being a game dedicated to speed running it seems. i've beat it twice, and though i'm not very emotional when it comes to games or videos, the 1st time i beat it it almost made me cry. i watched a few playthroughs before i beat it, and that didn't ruin the experience at all. definitely my most favorite things in the game are the graphics and the cutscenes. 910 game in my opinion, and though i'm bored of it atm, i'll definitely play it again.",After
Adventure,Stray,2022-08-06,"what intrigued me about this game the most was the setting, with the obvious eastern asia influences in the architecture, clothing, and language. this alongside the made in france boxes scattered across midtown raised a lot of questions as to why the robots predominately mimic the humans from this specific region, with a few remnants of western culture such as the cowboy robots. the implications would of course be that the game takes place in eastern asia, but then what about the boxes from france? id doubt theyre that old if theyre just lying around in shops. are there other robot civilizations left in the world? perhaps even some humans? exactly how long has it been since the big apocalyptic disaster that started this all?",After
Adventure,Stray,2023-09-11,"every few weeks i come back to this song. i think it's one of my favourite's from you. i love the song itself, but the lyrics are a triumph in their own right. 143313 is a minute and a half of absolutely masterful poetic lyrics, probably some of the best i've ever heard. every line is beautiful. i've listened to this song no less than 50 times and it still makes me tear up because of how absolutely perfect the movement and artfulness of every syllable is and because of how emotional the meaning is. i don't know if you read comments, but i hope you know how absolutely incredible your lyrical work is. usually i'd go more in depth about my favourite lines, but every single line is as good as the last. it's a big inspiration for me.",After
Adventure,Stray,2022-08-13,"i have a different theory actually regarding the zurk collective in the underground levels of the megastructure. while i do agree that they are not affected by uv light, i don't think they're as much of a threat per se. another important fact that needs to be looked at is that, if they can consume plastics and metal, then why isn't there more structural damage down there? i think the answer is because the mega colony is composed of a form of zurk that cannot eat normally. full eusociality the smaller zurk you see are drones, the hunters, the ones that come back and bring food to the larger hive, which then uses the food to spawn more drones in order to feed itself. without the uv sensitive dronesworkers, the hive as a whole will starve.",After
Adventure,Stray,2022-10-08,"this is probably stupendiums best song along with the fine print. don't get me wrong i love all of stupendiums songs, but this is the first one to get me legitimately teary eyed since the fine print. perfect for a game about the legacy of humanity and the beauty that lies within all life  artificial or otherwise. ik stup's reads a lot of his comments so i'm just gonna say, no one nowadays is making songs like you do. your wordplay and messages are amazing and genuinely heartfelt. we can see all the love you put into each track. sometimes your music makes me sit and think about how my life is going and how i'm living it. i hope i get to listen to your music for as long as you're willing to share this part of yourself with all of us. thank you 3",After
Adventure,Stray,2022-08-03,"i had to put down my 18yo outdoor kitty this last fall. i believe keeping a cat indoors exclusively is inhumane. you can separate the cat from its natural wildlife role, but you can't separate the cat from its primal instincts. cats should be allowed to go outside if they desire to. just a few year ago, my senior kitty appeared outside my car window as i arrived home to present a wild caught sparrow to me. i gave her extreme praise, and let her supplement her domestic diet with some natural caught prey. i know my natural predator cat may be a conflict with many naturalists, but i believe it is more cruel to keep a cat exclusively indoors than to allow her to live naturally outdoors assuming no native species are threatened by cats being outdoors.",After
Adventure,Stray,2025-03-12,i mean like it is peaceful but it's also pretty sad because like b12 sacrifices her own body to save all the robots from the zurks in the dead city where it's completely filled with hundreds of zurks and the reason is because the sewer is filled with trash so the small bacteria eats the trash and grows and because there is no one there treat the sewer the bacteria eats all the of the trash and grows massive eyes and those eyes are leaders they control the zurks when they see a robot or a human and animals they will command the zurks to kill them and there is a gigantic eye ball which is basically the president of the zurks and commands the eyes when to attack so the eyes would send many zurks to kill you and that's how they took over the city. hoped that helped,After
Adventure,Stray,2024-05-20,"i don't think i'll ever get over changbin's sound duality when singing vs rapping ever but seungmin's adlibs are so addicting too  i love the outro of this song so much aaaaaaaaaaa edit i didn't expect this comment to blow up but all of them did very well! there's just very few clips of changbin singing out there and i've always loved how he could pull off both so well but so differently too, which makes those few seconds just hit me different  i only mentioned seungmin's adlib coz i thought he was the one doing adlibs since the last chorus until the end while chan is the one mainly singing the lyrics  but it was actually the other way around in postchorus sorry asdfghjk needless to say, despite their original positions, ot8 have amazing vocals and this song showcased them!",After
Adventure,Stray,2022-07-27,"i think where this game really excels is in its atmosphere, world building, and pacing. yes, it is a simple, short game that definitely has indie flaws. flaws aside, i became totally immersed in strays world and the small touches where the game allows you to explore at your own pace really sold it for me. the catnap spots you can find where the game gradually zooms out to show you the level design all while beautiful atmospheric music plays felt refreshing and highly enjoyable. i also appreciate that the main reward for exploration were memoriesexposition related to the story. while the game would be nice with more cosmetic or materialistic rewards, the memories drew me into the story and really made me want to solve the mystery of the plot, which felt like the correct choice in my opinion.",After
Adventure,Stray,2023-10-22,"very impressed. and being a writer myself im a tough critic! the dialogue? not sparkly, but it works. plot structure? good. directing? not disturbing which given this particular tale should have been but it was adequate. but the story is fantastic! shocking, insightful, quite compelling and very intriguing. what a character study into the human mind and ioved the balancing act with forcing us to be unsettled by jennifer and at the same time yanking on our hearts for her. she seemed to be one of those rare people who were born without a conscience. like she was handicapped, more than just sociopath, a special needs person who is missing the ability to see people as more than mere bugs. she had me riveted! its rare to find such quality film making these days. heavy applause for the writerdirector.",After
Adventure,Stray,2022-07-27,"i appreciate your honesty when reviewing. its something ive honestly come to massively respect. yes you do the funny and yes sometimes i dont quite agree with your reviews of games. but you explain your points so well in serious videos like this, that i honestly respect the rating you give the game. at the end of the day i know everything is subjective and some people will get mad because all they will take away from this is that you said cat game not purfect, but criticism can be used to improve if used properly. if the devs ever see this video, i hope they dont get offended or disappointed in their game. i hope instead they see it as encouragement that they still can create something even better. anyways thanks for reading my essay, i got to get back to actually doing homework instead of getting distracted.",After
Adventure,Stray,2022-08-06,"mat really assumes the consciousness of the zerg hivemind is comparable enough to that of a human, and therefore the same process that digitizes human consciousness can be used on the zerg as well. but we know they are not comparable. zerg lack basic sentient instincts that humans had, that every living mammal has. for example, they see other zerg get killed by the uv lamp, but they don't hide from it or avoid it. and also, assuming that the zerg can comprehend the concept of digitizing consciousness, or even the concept of consciousness to begin with is a massive stretch. it's easy to forget that consciousness is an abstract concept made by the human mind to simplify the astronomically complex processes that take place in our brain. why would a species that hasn't even developed intelligence yet would see the robots and understand the process by which they were made?",After
Adventure,Stray,2023-11-09,"there needs to be a sequel where another plague is discovered or maybe bots that try to make sure nobody gets outside. i know thats basically what stray was but maybe this time since sentinels were powered off at the end, it could be a group of robots that live in midtown try to keep anyone else from going outside because the group found old papers from when humans lived and the papers had info about a plague like the zurks but they cannot be killled by light like the sun. everyone would see the group of robots as bad guys until the middle of the game where the group of robots tell the outsiders about the plague they found that they don't know how to kill. and much like the zurks in stray, when your outside you have to run from the new plague while search for more storylore and a way to defend yourself and everyone else from the new plague. idk i just thought of this lol",After
Adventure,Stray,2022-08-30,"the saddest part is the cats can't talk  so stray can't tell his tribe about his adventures. where he's been, what has happened to him and what he did  all his story will remain untold to everyone. well, except for b12 who's now has other things to worry about, and us  who play this game and watch those videos on youtube. i could say  this is very symbolic. many of us have a lot to tell  but we will not. because nobody will believe anyway. and nobody cares. daily routine is the alpha and omega of any society and everything, that is not the part of daily routine has zero value to majoryty of population  even families of those who's been somewhere, has seen and did something unordinary. so your story is only yours. and, maybe even you will forget it someday... because it was long ago, and doesn't matter anymore... one more time  i'm amazed, how deep the story of this game is.",After
Adventure,Stray,2023-08-17,"after stray finally came to xbox i was able to play it and since completing it i have been able to listen to this song after having to avoid it for so long because of spoilers and it was worth the wait! your song captures both the desperation of the robots for something outside their normal, for the outside, while also including parts that are more somberly accepting their condition, like when we first meet momo or seamus. these characters were trying to find a way to stray from whats happened and get back what they want and gave up until we showed that it was possible. i also absolutely love your wordplay in this one. eternity of servitude with no one left to serve it to and now we grapple with the syntax, humanity was doomed but we have to pay your sin tax are such beautiful constructed lines i would expect nobody besides you to be able to come up with. beautiful work stupes",After
Adventure,Stray,2022-07-31,"i like how you acknowledge that a lot of people look at stray and go oh shit you can play as a cat? 1010 and cos of that people sometimes focus on how cool the premise is more than what the actual gameplay is like. but at the same time you acknowledge that playing as a cat is still an incredibly fun concept. and then you take it one step further and actually break down how the game makes you feel like you're a cat how the simple movement mechanics lets players navigate any obstacle with ease, while the incredibly lifelike animations captures the gracefulness of your movement. which is why the few jerky animations or visual bugs are so harmful to a game that prides itself on its smallest details. rocksolid analysis. yep them's my thoughts. i've always loved how you recognise the good with the bad in order to consistently provide balanced reviews. its honestly amazing. thanks for the vid!!",After
