genre,game,commented_date,comment,release_period
Adventure,Stray,2021-03-07,happy 200m,Before
Adventure,Stray,2020-06-18,best game ever,Before
Adventure,Stray,2022-06-19,"i see a cat, i buy.",Before
Adventure,Stray,2022-06-02,my cat wants this so bad,Before
Adventure,Stray,2022-06-23,this game is rated awww!,Before
Adventure,Stray,2022-07-18,256 bro my heart melted 3,Before
Adventure,Stray,2022-06-02,everybody wants to be a cat,Before
Adventure,Stray,2020-06-13,that meow sold me this game,Before
Adventure,Stray,2020-06-14,my cat showed me this trailer,Before
Adventure,Stray,2022-06-04,0042 that is such cat behaviour,Before
Adventure,Stray,2022-07-18,cant wait to play this tomorrow,Before
Adventure,Stray,2022-06-16,people are waaaay too friendly!,Before
Adventure,Stray,2022-07-12,100 why is this part so adorable,Before
Adventure,Stray,2022-07-18,cant wait to play this tomorrow d,Before
Adventure,Stray,2022-07-18,just glad they didnt give it a 7.,Before
Adventure,Stray,2020-06-17,thank you for the subtitle at 125,Before
Adventure,Stray,2020-06-11,that purr sound at the end though,Before
Adventure,Stray,2020-08-24,125 this is how you sell a game...,Before
Adventure,Stray,2022-06-02,"as a cat fan, this game gets a 1010",Before
Adventure,Stray,2022-07-18,ign the cat is adorable people goty,Before
Adventure,Stray,2020-06-12,when he said meow.......i felt that,Before
Adventure,Stray,2020-07-03,"whoever you are,im so proud of you.",Before
Adventure,Stray,2022-07-18,a game every cat's owner should play,Before
Adventure,Stray,2020-06-11,the real winner of this presentation,Before
Adventure,Stray,2022-05-30,justice was not served. what a shame,Before
Adventure,Stray,2022-06-25,there is even a dedicated meow butten,Before
Adventure,Stray,2022-06-08,for my cat who sadly passed last week,Before
Adventure,Stray,2022-07-18,all games should have cats in it! 810,Before
Adventure,Stray,2020-06-18,cat meow me where is preorder button?,Before
Adventure,Stray,2020-06-17,i want to play this game right meow!!,Before
Adventure,Stray,2022-06-02,1010 just for the cat hiding in the box,Before
Adventure,Stray,2022-06-03,"omfg. as a cat lover, this game hits me",Before
Adventure,Stray,2022-07-18,it makes you feel like a stray. 810 ign,Before
Adventure,Stray,2020-06-17,a little cat with a backpack? i'm sold.,Before
Adventure,Stray,2022-07-18,this game really makes you feel like cat,Before
Adventure,Stray,2020-07-03,please stays lets all unite for them!!!!,Before
Adventure,Stray,2021-07-30,105 this shot right here is a masterpiece,Before
Adventure,Stray,2020-06-17,cat meow me human.exe has stopped working,Before
Adventure,Stray,2021-06-16,happy 1st anniversary to this masterpiece,Before
Adventure,Stray,2020-06-14,"meow yep, this is already game of the year",Before
Adventure,Stray,2022-06-05,can we meow all the time if we are hungry ?,Before
Adventure,Stray,2022-06-03,as a lover of cats...im so ready for this!!,Before
Adventure,Stray,2020-06-11,id literally buy the ps5 just for this game,Before
Adventure,Stray,2020-06-17,stray kids everywhere all around the world.,Before
Adventure,Stray,2020-07-03,i can't explain how addictive this song is.,Before
Adventure,Stray,2022-06-02,"can't wait to play, looks like a lot of fun!",Before
Adventure,Stray,2022-06-05,"i will play with my cat, we loved this game!",Before
Adventure,Stray,2020-06-13,cats? we play as a cat myyy wallet is ready!,Before
Adventure,Stray,2022-06-03,they finally showed the combat! looks amazing!,Before
Adventure,Stray,2022-06-20,i'm a doglover but i'm so hyped for this game.,Before
Adventure,Stray,2020-06-11,ign this game really makes you feel like a cat,Before
Adventure,Stray,2020-07-02,han's rap is so satisfying i can't get over it,Before
Adventure,Stray,2020-06-18,"stray kids is stray kids, no one can copy them",Before
Adventure,Stray,2020-07-03,this is the best song i've heard all year xoxo,Before
Adventure,Stray,2022-07-18,youve convinced me to preorder this game today!,Before
Adventure,Stray,2022-05-10,"greg's mother is a really good mommy, very kind",Before
Adventure,Stray,2022-07-04,amazing how some people can become so twisted!!,Before
Adventure,Stray,2020-06-21,"people, this is the evolution of chan's kitchen",Before
Adventure,Stray,2022-06-03,plot twist it's the cat of love death and robots,Before
Adventure,Stray,2022-07-18,a not so nimble cat sounds like my cat to me lol,Before
Adventure,Stray,2022-06-05,and this year's game of the year.... stray!!!!!!!,Before
Adventure,Stray,2020-06-19,the perfect game doesnt exist stray hold my catnip,Before
Adventure,Stray,2020-06-11,"i always wanted to be a cat, i can finally be a cat",Before
Adventure,Stray,2020-06-24,no one skz being a group full of visuals and talent,Before
Adventure,Stray,2020-06-19,just dont kill the cat at the end all im asking game,Before
Adventure,Stray,2020-07-03,when minho said du du du du du du i really felt that,Before
Adventure,Stray,2020-07-03,hyunjin's long hair and seungmin's pink hair whaattt,Before
Adventure,Stray,2020-06-12,"this gives me the feels, i've recently lost my cat...",Before
Adventure,Stray,2022-06-03,"well, i've always wanted to be a cat. this is purrfect!",Before
Adventure,Stray,2020-06-14,2014 goat simulator 2019 untitled goose game 2021 stray,Before
Adventure,Stray,2022-06-03,"this actually looks really cool, i really wanna play it.",Before
Adventure,Stray,2022-07-18,"pretty unique looking game, gonna give it a go sometime.",Before
Adventure,Stray,2020-06-14,me this is interesting cat meows me haha wallet go empty,Before
Adventure,Stray,2020-06-12,there better be a meow button if not im not getting it .,Before
Adventure,Stray,2022-06-14,it's kinda scary to have someone like jennifer near you!,Before
Adventure,Stray,2020-06-12,me now this is a badass concept for a game... cat meow me,Before
Adventure,Stray,2020-06-11,people video games cause violence... me playing this game,Before
Adventure,Stray,2022-05-11,having a stranger in your house  is never  a good  idea .,Before
Adventure,Stray,2020-06-21,dislikes are from people who can't handle han's hot sauce,Before
Adventure,Stray,2020-06-17,stray kids  master of cooking youtube  master of freezing,Before
Adventure,Stray,2022-06-03,"man, been waiting so long for this. can't wait to play it!",Before
Adventure,Stray,2020-06-11,this was one of my favorite trailers. what a cool concept.,Before
Adventure,Stray,2022-02-15,"let's take a paws, and appreciate how purrfect this looks.",Before
Adventure,Stray,2020-06-18,"this comeback is not an individual era, its everyone's era",Before
Adventure,Stray,2020-06-19,funfact straykids dont need visual. visual need straykids.,Before
Adventure,Stray,2022-06-03,who ever pitched this idea and setting both deserve a raise,Before
Adventure,Stray,2022-06-03,as a cat lover i really want to play this when it comes out,Before
Adventure,Stray,2022-07-18,can't help but smile looking at this game. stunning concept,Before
Adventure,Stray,2020-12-25,this looks a better cyberpunk game than the cyberpunk 2077.,Before
Adventure,Stray,2020-06-11,"this games gonna play with our feelings, im calling it now.",Before
Adventure,Stray,2020-06-13,can we choose our kitty color? i want to play as a siamese.,Before
Adventure,Stray,2022-05-20,i like his mother. she a sweetie and she's got personality.,Before
Adventure,Stray,2022-05-15,her ankle got better really quickly when she saw his house.,Before
Adventure,Stray,2020-07-02,felix killing part cooking like a chef im a 5 star michelin,Before
Adventure,Stray,2020-06-11,i will throw my money at anything that lets me play as a cat,Before
Adventure,Stray,2020-06-20,when skz said because we're one of a kind stay yes. you are.,Before
Adventure,Stray,2020-06-11,ive never been so excited for a game in my life. cats ftw!!!!,Before
Adventure,Stray,2020-06-23,im listening to this song for a day straight but i aint bored,Before
Adventure,Stray,2022-06-03,"my friend loves cats, cant wait to play through this with him.",Before
Adventure,Stray,2022-06-04,pretty original concept. the environmental designs look great.,Before
Adventure,Stray,2020-07-11,"the atmosphere, the feel of the game. i really really like it.",Before
Adventure,Stray,2020-07-29,felix really has the audacity to kills us like that. smooth af,Before
Adventure,Stray,2020-06-18,"fact straykids doesn't need a concept, the concept needs them.",Before
Adventure,Stray,2022-07-07,058 the fact that you can hide from enemies as a cat is amazing,Before
Adventure,Stray,2020-06-12,true og's will remember this from the hk devblog back from 2015,Before
Adventure,Stray,2022-05-11,i kept waiting for her to get busted. very realistic storyline.,Before
Adventure,Stray,2020-06-18,"someone  who's your favorite chef? stays  ah.. stray kids, why?",Before
Adventure,Stray,2021-04-16,this is the reason i'm getting a ps5. this is a console seller!!,Before
Adventure,Stray,2020-06-17,"not a stray kids fans but daaamn mama, this songs hit differently",Before
Adventure,Stray,2022-07-18,"the children had their fun with elden ring, now its real mens turn",Before
Adventure,Stray,2020-06-18,"du du du du du du tang tang tang tang yes, sir and ma'am  skz 2020",Before
Adventure,Stray,2020-06-17,stray kids weren't kidding when they said this song was addictive.,Before
Adventure,Stray,2022-06-03,i have never considered buying a console or a game until i saw this,Before
Adventure,Stray,2022-07-18,what have you always dreamt of being? a cat in the future. perfect!,Before
Adventure,Stray,2022-06-19,"and their makeup is always perfect, no matter what happens to them.",Before
Adventure,Stray,2020-06-20,lets not stop here lets go 50m and 100m we can do this for our boys,Before
Adventure,Stray,2020-06-17,"skz dont hesitate, pour more. stay dont worry, we will str34m more.",Before
Adventure,Stray,2020-07-02,100m kajja!!! we did it stays yess we did it!! now let's go 200m!!!,Before
Adventure,Stray,2020-06-22,main character cat final boss alinity alternate skin heckin' chonker,Before
Adventure,Stray,2020-07-01,"honestly though the transitions are sick, whoever directed this, wow",Before
Adventure,Stray,2021-07-29,i didnt even have to finish the trailer to know that i want the game.,Before
Adventure,Stray,2020-06-14,this is basically 'detroit become human' through a cat's perspective.,Before
Adventure,Stray,2020-06-11,kojima death stranding stray get out of my way... im a cat delivering,Before
Adventure,Stray,2020-06-28,stays chan said there will be also a surprise gift when this hits 70m,Before
Adventure,Stray,2020-07-03,lets agree that this is one of the best comebacks of this year so far,Before
Adventure,Stray,2022-06-03,the best part of this trailer is when the cat knocks over the bottles.,Before
Adventure,Stray,2020-06-15,cats are one of the main pillars of the internet...this is a safe bet.,Before
Adventure,Stray,2022-06-02,"one of my most anticipated games of the year, what a brilliant concept!",Before
Adventure,Stray,2022-05-06,very dark and depressing movie. maybe too realistic and full of truths.,Before
Adventure,Stray,2022-06-02,loving the vibes of this game cant wait to play it on my birthday month.,Before
Adventure,Stray,2020-06-12,it appears that sony is taking advantage of humanitys greatest weakness.,Before
Adventure,Stray,2022-05-22,i liked this movie a lot. thank you indie rights movies for offering it!,Before
Adventure,Stray,2022-05-09,"dear god, are there really people who live like this? profoundly moving.",Before
Adventure,Stray,2020-06-14,"so lets just take that one love, death  robots episode and make it a game",Before
Adventure,Stray,2020-07-02,"i'm not even a stay, but this felix cooking like a chef make me crazy omg",Before
Adventure,Stray,2022-07-18,"it missed 9 out of 10 by a whisker, but i'm feline fine about 8 out of 10.",Before
Adventure,Stray,2020-06-21,me its best to wait a while to buy a new console cat meow me preorders ps5,Before
Adventure,Stray,2020-06-18,no one not even skz stay so here are the ingredients to make this and that,Before
Adventure,Stray,2020-06-14,this is the actual console seller game. ps5 is day one purchase for me meow,Before
Adventure,Stray,2022-06-03,man i hope this is good. been super compelled by it since the first trailer!,Before
Adventure,Stray,2022-06-03,"literally the best video game protagonist of all time. 1010, would meow again",Before
Adventure,Stray,2022-07-18,it's been a long time since an original looking game actually looks original.,Before
Adventure,Stray,2022-07-18,probably my most anticipated game of the year!! can't wait to play this game!,Before
Adventure,Stray,2020-06-15,developers in 2020 delete every human assets we don't need humans in our game.,Before
Adventure,Stray,2022-05-19,nowadays you can't let strangers in your house or you can't pick up hitchhikers,Before
Adventure,Stray,2020-06-17,felix cooking like a chef i'm a 5 star michelin me replaying it again and again,Before
Adventure,Stray,2020-07-28,i know people are hyped for cyberpunk but this looks way more interesting hahaha,Before
Adventure,Stray,2020-06-11,"this looks really cool, i just hope that this is a third person open world game.",Before
Adventure,Stray,2022-06-03,"man, i'm gonna play this game soooo carefully, i refuse to let the kitty get hurt.",Before
Adventure,Stray,2020-06-18,"no one can copy us, our own game they talking facts no one does it like stray kids",Before
Adventure,Stray,2020-06-21,only available for the pspspspspspspspspspspspspspspspspspspspspspspspspspspspspsps,Before
Adventure,Stray,2022-05-13,maybe its just me but that film had no real beginning middle or end quite confusing,Before
Adventure,Stray,2020-07-03,not a stay but i was sold when changbin started with  !!! this song is chef's kiss.,Before
Adventure,Stray,2022-05-28,greg's mum is like there is a fire in paradise not saying a word.damm she so perfect,Before
Adventure,Stray,2020-06-17,no one stray kids we just keep on making new things. this is why skz is very unique.,Before
Adventure,Stray,2022-05-15,that man on the train showed her kindness...pity she abused it to the extent she did.,Before
Adventure,Stray,2022-07-18,"to a gamer who has an open world fatigue, this game seems to be a breath of fresh air.",Before
Adventure,Stray,2022-07-18,my dream of becoming a cat has moved a step closer to it's goal. thank you technology!,Before
Adventure,Stray,2022-05-11,shocking there are people like this in the world who pray on the innocence of kindness,Before
Adventure,Stray,2022-05-05,"this movie is like all the weird people got together, same as our country these days .",Before
Adventure,Stray,2021-06-29,i fell in love with this based on the trailer alone. ive always wanted to play as a cat,Before
Adventure,Stray,2022-05-23,started watching 15 min ago and i feel like rejection and loneliness makes her rage ...,Before
Adventure,Stray,2022-06-28,i like how they have the cat fight small things instead of gut ripping ethereal monsters,Before
Adventure,Stray,2020-06-17,my therapist ur kpop boys can't hurt you felix cooking like a chef i'm a 5 star michelin,Before
Adventure,Stray,2022-06-03,this is one of the games i have been waiting ages for since its announcement back in 2020,Before
Adventure,Stray,2020-06-17,interesting how the cat is the only living thing.... i'm intrigued by this peculiar game.,Before
Adventure,Stray,2022-06-03,"123 yes, master. i'm preordering your game as we speak, have my money, my soul, my dignity",Before
Adventure,Stray,2020-07-01,depression hello there bois sony releases stray depression understandable have a great day,Before
Adventure,Stray,2022-06-06,a stealth game as a cat? i love the concept. it looks like it will actually be a good game.,Before
Adventure,Stray,2022-07-18,"graphics is great, cool artistic feelings, and the movements and animations are just smooth",Before
Adventure,Stray,2020-08-16,9000!!!   9000            !!       !! its already 90m views! thanks everyone for watching!!,Before
Adventure,Stray,2020-06-30,i remember someone wrote  ps5ps5ps5 as in pspsps on ps5 reveal video... and now we have this,Before
Adventure,Stray,2020-06-17,"i really like the music, the colors and the ambience. looks like it's gonna be a great game.",Before
Adventure,Stray,2021-01-26,me i dont wanna spend my money on another basic futuristic shoo cat mew me i take that back!,Before
Adventure,Stray,2020-06-19,"me idk if i want to spend that much on a console ps5 meow me thats an excellent point, im sold",Before
Adventure,Stray,2020-06-12,"that cat is so cute! that meow at the end, is like it's telling me buy me, and i totally will!",Before
Adventure,Stray,2022-06-05,there is so much left unsaid and it ended too quickly. i will understand if a sequel comes up.,Before
Adventure,Stray,2021-04-15,"if the controller doesn't lightly rumble when stray purrs, i'm going to be very disappointed...",Before
Adventure,Stray,2020-06-11,"yes, yes, yes!!  i am a cat person all the way, i'd absolutely love to play this. i can't wait!",Before
Adventure,Stray,2022-05-07,she hopped up them steps so damn fast with that sprained ankle!  i don't see how he missed that,Before
Adventure,Stray,2020-06-18,"stray kids don't follow trends, trends follow them. stray kids everywhere, all around the world",Before
Adventure,Stray,2022-07-18,this would have been a great addition on gamepass...i'd probably buy a ps5 just for this game...,Before
Adventure,Stray,2022-06-14,i love how the cat trotting has the little head bob perfectly! im so looking forward to this one.,Before
Adventure,Stray,2022-07-18,meow button but no jump button weird choice but im still gonna pick this upfor free on plus extra,Before
Adventure,Stray,2021-07-26,game you play as cat in a world where no humans left me put that game at the top of must play list,Before
Adventure,Stray,2020-08-06,"can we just appreciate how well done the sound design, detail, and world building is in this game?",Before
Adventure,Stray,2021-05-29,ign the way it jumps from street to rooftop is just full of the exaggerated swagger of a stray cat,Before
Adventure,Stray,2020-06-11,"this looks like the episode three robots from the netflix series love, death  robots and i love it!",Before
Adventure,Stray,2020-06-25,"ignore the haters, never interact, dont send hate, because ' stay, we are better than this 'bang chan",Before
Adventure,Stray,2020-06-11,literally all i need to know is that this game lets me play as a cat wearing a backpack. 100 on board.,Before
Adventure,Stray,2020-06-20,that proves that stays are not a small fandom just kinda lazy sometimes... let's do it!! 40m in a week,Before
Adventure,Stray,2020-06-18,"felix cookin like a chef im a 5 sstar michelin me screaming,wheezing,squealing,jumping,hyperventilating",Before
Adventure,Stray,2022-07-02,"why can't we have more games with such an immersive, detailed and atmospheric world. it looks so amazing",Before
Adventure,Stray,2022-05-07,need a part two jennifer ends up with the same clothes on everytime. killing people that get in her way.,Before
Adventure,Stray,2020-06-12,how to convince nongamers to play a video game 1. show them this trailer. 2. tell them you play as a cat.,Before
Adventure,Stray,2022-05-04,i'm pretty sure there are lots of crazy lunatics like this one in america nowadays. this society is sick.,Before
Adventure,Stray,2020-06-17,there should be a warning like there's a 100 guarante that you'll get hurt by hwang hyunjin and lee felix.,Before
Adventure,Stray,2022-06-15,"this game has a cat, a cool dystopian scifi future world and robots with 80s tvs for heads. this is g o l d",Before
Adventure,Stray,2020-06-14,"this looks cool and all, but the real question is can i randomly knock things out of the way for no reason?",Before
Adventure,Stray,2022-06-02,"this game comes out on my sisters birthday who is literally an absolute cat lover. coincidence, i think not!",Before
Adventure,Stray,2020-06-18,"i feel like nobody's talking about the choreography but i do, damn the choreography guys it's kdvdkndkdkf lit",Before
Adventure,Stray,2022-06-03,"from playing tennis to playing as a cat, video games have come a long, long way, and yet are weirdly the same.",Before
Adventure,Stray,2022-06-03,"2 aos esperando desde que conoc que iba a salir este juego y al fin saldr, quiero jugarlo ya, me emociona tanto",Before
Adventure,Stray,2022-07-18,but can you customize your cats appearance? everyone's gonna want to play as a cat that looks like their irl pet,Before
Adventure,Stray,2022-05-05,"wow! she's super lucky, that she didn't run into a lunatic! also, this was a very sad way for this movie to end.",Before
Adventure,Stray,2020-06-28,"if south korea won't give them wins, we're going to give them 100m!! we dit it!! str3am back door lovely stays!!",Before
Adventure,Stray,2020-06-17,me stray kids can't get any better skz wanna bet? seriously they really outdid themselves. i'm so proud i'm a stay,Before
Adventure,Stray,2022-05-15,i can't believe she wasn't caught earlier in the movie when she put that apartment on fire she is a very sick skitzo,Before
Adventure,Stray,2020-07-03,who is here before 100m!? edit on august 27 around 6pm kst god'smenu reached 100m congrats!!! thanks for the likes 3,Before
Adventure,Stray,2022-05-11,really enjoyed watching this...would like to see a part 2 as there seemed more to the story...thank you for uploading.,Before
Adventure,Stray,2020-06-13,"i thought that this game would be about a cat's vision of humanity, where, it truly is humans but it sees us as robots.",Before
Adventure,Stray,2020-06-18,ok but everyone writing comments about how they became a stay is so cute please i'm gonna cry. i love this fandom so much,Before
Adventure,Stray,2022-06-03,game awards 2022 be like yes elden ring might be a masterpiece from every standpoint... but that cat was so fluffy though.,Before
Adventure,Stray,2020-06-26,stays don't need a boyfriend to make us happy. we just want stray kids to hit 100 million views our goal 100 million vi3ws,Before
Adventure,Stray,2020-06-13,if they don't have a trophy when you knock an item off the table and its called ''natural instinct'' i will be disappointed.,Before
Adventure,Stray,2022-06-07,aww this is so adorable and i cant wait to play it. this game has been one of my most anticipated for quite some time now. lol,Before
Adventure,Stray,2022-06-02,excellent film. the psychological studies of the characters are layered and well done. the acting is wonderful and believable.,Before
Adventure,Stray,2022-06-14,i dislike cats but there are 3 cats i respect  catbug  mr. whiskers he sacrificed himself to save his squad mates  and this one,Before
Adventure,Stray,2022-05-19,never ever put anyone is your house if i was the guy saw her sleeping i be like get your ass up this is not a hotel time to go .,Before
Adventure,Stray,2022-06-30,this is brilliant... how come no one thought of that before?! glad they went for a cyberpunk scenery instead of something childish.,Before
Adventure,Stray,2022-07-18,"nobody absolutely nobody bluetwelve studio we made a cat video game. everybody holy crap, thank you! this is amazing and so refreshing.",Before
Adventure,Stray,2020-06-15,"me there is no next gen game that i want, so i'll wait for the console price to go down. cat game exists me i'll find the money somehow!",Before
Adventure,Stray,2022-07-18,"not a sentient super cat,just a regular cat proceeds to open safes,fight monsters, and do complex fetch quest for robotsjust a regular cat",Before
Adventure,Stray,2022-05-08,wish it was always that easy to find a job! new in town guy doesnt even know her name and he hires her? shes a master at drawing people in!,Before
Adventure,Stray,2020-07-11,"something about the atmosphere, the music and the meow make me rly rly emotional.. thank u cat game for making me cry in less than 2 minutes",Before
Adventure,Stray,2022-07-18,support indie games people! they're the ones that truly think out the box and give a unique experience. will have to check this out sometime.,Before
Adventure,Stray,2020-06-18,"im not a stray kids fan nor do i listen to them, i clicked out of curiosity thinking to leave after 15s but oof i stayed and this shit is lit",Before
Adventure,Stray,2020-06-11,"this went directly to my top 1 ps5 games. just epic adventure of being a cat, this is what games used to be and should be. imagination flying.",Before
Adventure,Stray,2022-06-08,this is what creativity and originality looks like. i wish gmers embraced it instead of asking for non stop remakes trying to recapture their youth,Before
Adventure,Stray,2020-06-12,okay how about this... we make a game set in an cyberpunk world. aaaaand how will this compete with 2077? you only play as a stray cat and... sold!!,Before
Adventure,Stray,2022-05-12,"this was a very good movie!! i must say, the actress who played the part of jennifer, played that part extremely well!! she was so very believable!!",Before
Adventure,Stray,2021-07-30,am i the only one that would really love a character customization in this game. how awesome will it be that you could make it look like your own cat,Before
Adventure,Stray,2022-07-18,this game looks gorgeous and its free with ps looks like a decent exclusive to give somthing different in the paint by numbers games weve been getting,Before
Adventure,Stray,2020-06-13,"game developers alright, so how do we promote our new game in a way to make everyone interested? jeffrey, about to be employee of the month uhhhhh meow?",Before
Adventure,Stray,2020-06-21,this is real interesting exploring a world where humans are no more as a cat to see how the robots built up and how they act this looks really promising,Before
Adventure,Stray,2020-06-15,"me at the beginning of the video wow, the philosophical implications of playing as a cat in a world without humans..... me at the endawwww cat said meow",Before
