genre,game,commented_date,comment,release_period
Adventure,Stray,2025-02-01,"when i played it on the ps5 i thought it could easily run in the switch and i still wasn't that impressed with it. maybe i'll give it another chance for the switch. imo i think it looks much better for the switch. it's a gritty atmosphere and environment, so a dumbed down graphics card might make it pop more imo. i'm still not committed to getting it again yet, but i might in the near future.",After
Adventure,Stray,2022-07-31,"no me esperaba un juego asi. la verdad que excelente, ademas de ser hermoso el gatito que el eligieron, su color y movimientos tan reales. la verdad que, entiendo yo, una de las inspiraciones en poner como protagonista a un gato es que hay muchisimos juegos sobre parkour, pero el unico que puede hacer todos esos movimientos de manera completamente real en todas las circunstancias es el mishi.",After
Adventure,Stray,2025-01-29,"when i finished stray, i immediately came online to search for anything that could give me more hope for the ending. it was so devastating to me that stray didn't visibly reunite with their siblings after the whole ordeal and losing b12... your video healed that wound and made me appreciate the ending in a new light. thank you so much for making this, your efforts are so very much appreciated.",After
Adventure,Stray,2022-08-09,"i love this theory, not because it makes a lot of sense with quite a lot of things that can back it up... but it potentially opens a door for a new stray game. let's be honest, the game was proper 6 hours and should have been longer, i honestly believe that making a second game won't be overshadowed by the first game if everything is done correctly here. i still think this game deserves a coop.",After
Adventure,Stray,2022-08-11,"oh no!! i was really loving bucket  b12's little story, i didn't think it'd end so soon! although, truth be told, i love how well seri played this game, trying to examine every little detail. i'm sad we had to part ways with both clementine  b12, they were amazing characters. y'know, imma go watch this series again! love ya content, seri!! 2835 why does this remind me of warriors into the wild.",After
Adventure,Stray,2024-08-01,"im gonna cry. felixs singing voice is so beautiful, the lines he sang said so much about their career as an 8, chan singing the last line just broke me. the videos of their old mvs mixed with this one felt so surreal in the moment, it really made me think of how proud i am of them and how much they achieved. thank you for saving me stray kids and i hope, that i will see you someday in the future",After
Adventure,Stray,2022-10-01,"well...this is delightfully depressing. fantastically made as always, but as an empathic person, seeing all those robots trapped reliving their long gone masters lives endlessly on repeat hurt. and you really did capture the anger and sorrow of them. i'm a cat person as well, so seeing how the cat factored into the song was great. keep it up, i'll be here listening to this until my ears fall off!",After
Adventure,Stray,2022-08-11,i cant stop crying!!!this is so sadpoor b12i am so happy for the cat and i hope bucket finds his familypoor kitten had suffered so much to find a way out and i was really crying when bucket hugged b12this is the best game ever and for me it will always bemy heart is breakingi hope there will be stray 2.i saw in google that this game was very very popular so there is hope that there will be stray 2,After
Adventure,Stray,2025-01-17,"the gameplay mechanics seem so smooth and intuitive. im glad stray developers are focusing on making such polished experiences. its what keeps us players coming back for more. i cant wait to see what updates they bring down the line. keep up the great work your passion for gaming shines through! honestly, i never thought i'd get so invested in a game like this. your videos always inspire me to improve",After
Adventure,Stray,2024-12-20,"han proved once again that he deserves to be a ace. i honestly think he is not just 4th gen ace but ace of kpop cuz he is a genius. not just a singer but also a rapper, dancer, vocalist, guitarist, lyricist, producer. his very unique visuals and savage stage presence are unbeatable. han is such a vibe. thank you for creating such great songs. no doubts this is really a masterpiece. han is our rockstar",After
Adventure,Stray,2022-07-20,"hey seri! i watched this video the day it came out, and when i saw the thumbnail my brain went these graphics cannot be real! i am so ready to play this game when or if it comes out for xbox hopefully, but until then i'm going to be following every episode of this game! d edit the music and story stray follows, even without dialogue, is clear and amazing to watch! also the cats, being a past warriors fan",After
Adventure,Stray,2022-10-03,"stray for the tools noah doomed to the ark. i don't know why, but this line hits really hard for me. the idea that this place that was built to save people has only succeeded in becoming a prison for the ones responsible for building it...heart wrenching. it also reminds me of 'the angel's egg,' if you've ever seen it, for reasons i won't spoil for those who haven't. suffice it to say the line fits it well.",After
Adventure,Stray,2022-07-27,"thank you for saying what i think a lot of other reviewers are kind of afraid to say. stray has it's charm and looks gorgeous, but the mechanics and puzzles are just so simplistic and limiting. add on to the fact that this game is 30 dollars for 5 hours even when you're just wandering around and trying to collect everything with only a single ending and it's probably gonna be a hard sell for a lot of people.",After
Adventure,Stray,2022-07-22,"its been awhile since ive watched any sort of commentary gameplay videos ever since i became selfsufficient enough to buy the games myself. it feels so nostalgic watching this as it just randomly popped up in my recommended, glad to see youre still do well brad! im sure lots of us subscribers are silent as of the moment but know that uve helped all of these 13 million people at one point in their lives. peace!",After
Adventure,Stray,2022-07-26,"i have never cried so bad about a video game in my life. this was so profound and literally cried so much about this and i don't think i would ok for the next days hahaha but really this is something else, after games and games that often just want to make money and don't actually focus in making something new to the public, this was a refresh, and i truly hope we can have another beautiful game just like this.",After
Adventure,Stray,2023-01-23,"well, scrolling the main page and clicking on recommended vids for channels i often watch, nothing would stick today. i'd get into a few seconds in the video and just couldn't keep watching.... dunno what's wrong with me today. but when i hovered over the thumbnail for 'this' gameplay video, it looked interesting. well, wow, definitely worth watching such an interesting departure from the games i usually watch.",After
Adventure,Stray,2022-08-06,"i believe the robots being humans is very plausible, but i'm not so sure the zurks posses the intelligence required to use that robot to get into the system. i mean we dont even see them use basic tools let alone advanced computer systems. if they were getting into the system i feel like they would have to be led or controlled by a human. who knows maybe the zurks genetic mutations weren't so accidental after all",After
Adventure,Stray,2024-12-27,"hallucination. the title fits perfectly with how i'm feeling about this song. it's like you're getting dragged in by his sirenlike voice. i'm so addicted. not only does he get to show his amazing vocals in this song, but by releasing the mv, he shows his wonderful dancing skills and beautiful visuals. i love this side of i.n. i'm hoping to see more of it in the future. thank you for making such a fantastic piece.",After
Adventure,Stray,2024-12-21,"in 'alien,' he says 'somebody reach out and hold me,' in 'human' he says 'it's you who held me tight all this time,' and in 'hold my hand' he says 'baby, hold my hand now.' both versions have shaped and contributed to the han we know today. i once thought that, in a way, the alien had left and only the human remained, but in reality, the alien and the human reached out to each other and became one  our han jisung",After
Adventure,Stray,2022-07-31,"i stumbled across your channel, what seems to have been a lifetime ago. it was back in the day when you were doing a walk through of dark souls. you were the one who really got me into dark souls and even made me wish that one day, perhaps i could do walk through videos to helpentertain others as well... keep up the good work and congratulations on all the success you have made for yourself. keep on going, friend!",After
Adventure,Stray,2022-08-14,"after watching this video, i got curious and returned to the area where you start roaming around with the other cats. if you immediately look back and up towards the building, you'll see an arched structure that's possibly an overpass. i strongly think the passage into the city is up there edit i also realized the butterfly you see in the beginning of the game also appears at the end. it has to be the same location",After
Adventure,Stray,2022-07-22,"the game really is a beautiful story about how friendships come and go. how even just for an afternoon you can make very valuable relationships that will be with you forever. when i beat the game and the cat turned and walked away it made me remember all the cats i've had and lost over the years and it felt like a weird closure. i may never see thor or attila, or kenu again but they will live forever in my memories.",After
Adventure,Stray,2022-08-10,"this was such a good series! my cat actually went missing a bit ago and this somehow helped me get through that. i could imagine that lenore was going on some crazy adventure like bucket helping people out in her own catlike way. thank you so much, you and this game were the reason i didnt fall back into the depression i used to have. again, thank you, and keep going on adventures, it helps more then you might think",After
Adventure,Stray,2024-12-18,writing a song about a childhood movie beauty and beast with such deep words full of meaning is just incredible the perfect combination between hes angel face and his deep voice lol couldnt ask more from felix and the mv just make the lyrics even more meanful in this magical world all of them got such talent hope them to continue like this and rest because they deserve it see you next year at paris ill wait for you!,After
Adventure,Stray,2024-12-20,"this perfectly reflects my age, my life. there are sorrows, struggles and worries, so many things to deal with, but covering all that, what can provide more comfort is take my hand, take my hand and let's overcome this together. they are words said by the same one who wrote this song, han jisung, describing it, and the feeling it transmits is literally those words, thank you for everything, we love you and admire you.",After
Adventure,Stray,2025-03-07,"let's show him our support on new events, fashion magazines, cover. please interact with original sources and official videos, articles, posts by brands, felix account, fashion magazines, media, etc. this is a huge opportunity for him. make sure to hype up original posts about felix. share posts, articles, etc. by original sources, like, comments, save, read articles. tweets about felix and brand with hashtags, tag brand.",After
Adventure,Stray,2024-12-22,"when i hear han sing or see him talk about anything, especially when he talks about himself and how proud he is of who hes become, it makes me so happy. it feels like getting to know him brought the happiness i needed when i was feeling down. it's like a healing that doesn't require any kind of treatment. he makes me happy and motivates me to chase my dreams, so i can feel as proud of myself as i see he feels about himself",After
Adventure,Stray,2024-12-23,"hyunjin is an icon. theres no other idol from 4th gen who could reach his impact. this is definitely the best solo,because not only he showed a lot of talent and proved how hes good at everything,but he also created a song with a true meaning that a lot of people can relate to and get inspiration from it. not for nothing hes the role model of many idols,hes the idol of idols,and our most talented man with the biggest heart.",After
Adventure,Stray,2025-03-04,"lee know, can we just talk about how youth is so good?! im sure he poured his heart into making the song and it really paid off, youth is one of my favorite solos! in addition to this, lee know, you yourself are a great person. you always display love and affection for your members, while still being so savage. but on a serious note, lee lnow, you are so talented whether its singing, dancing, or anything. great job lee know!",After
Adventure,Stray,2025-03-08,"yang jeongin, our maknae who is always on top, our fox, our innie, someone funny and cute, someone with unreal beauty, our cute maknae, who makes stay laugh with his jokes or just being himself, a good dancer, a beautiful vocal, and with a beautiful habit of sticking out his tongue when he does something while dancing, etc, someone who always brings a smile to our faces, we love you innie, and to us you will always be on top.",After
Adventure,Stray,2022-08-11,"this was amazing! also, i dont know if youre going to see this, but theres a game going around called clan generator! its basically like the clan generating websites but a sort of simplistic game with sprites of the characters. and you can timeskip from moon to moon, meaning that theres actually a story in your clan! each moon has a possibility of something to happen and sometimes some moons will just be blank. its really fun!",After
Adventure,Stray,2022-07-29,"i must admit i really enjoyed this game, i found it fairly soothing and took it as more of a walking sim with extra bits of content, theres not any real challenge here but its still fun. nail on the head by dunkey when saying some of the detail is so good that the bits that are not stick out a lot, but i still enjoyed it as a short game with something a bit different. i'd recommend it......however, i'm more of a dog person.. 25",After
Adventure,Stray,2023-11-19,"i'm not even a stay but i have to admit that stray kids really makes the best mvs of kpop atm. the storyline, the actors, the effects. everything enhances the song and i just can't believe that they keep on releasing mvs after mvs without decreasing the quality!! when usually some other kpop groups try to save money, skz really invests a lot into keeping a constant quality. they're really respecting their fans and audience for this",After
Adventure,Stray,2023-11-28,"for new skz stans, i got you. 003 ot8 006 lee know 008 ot8 012 hyunjin center 015 changbin 023 felix 028 hyunjin 031 han 037 bangchan 042 lee know 046 to 052 seungmin singing 057 hyunjin 106 leeknow center 113 changbin 118 felix 120 hyunjin 128 seungmin 132 changbin 139 jeongin  i.n 140 han 146 bangchan singing 156 jeongin 202 felix 212 hyunjin 215 changbin 219 felix 222 hyunjin 225 han 232 felix 237 seungmin 242 bangchan 244 leeknow",After
Adventure,Stray,2022-10-03,"you've made so many dystopian songs in the past. hell, some of the times, you made dark and dystopian songs for games that aren't even originally dark. but this is honestly just something different. i mean, you can just feel the emotion building up more and more as it progresses, trying to figure out it's purpose. this is just flatout amazing. eternity of servitude with no left to serve it to. had to point out the godlike writing ofc",After
Adventure,Stray,2024-12-23,"hyunjin probably has one of the most difficult situations as a kpop artist, being sabotaged left and right in this toxic and corrupt industry. but he still finds positivity and endures all the hardship with grace. he still looks forward to freedom and an ideal world. he has faith in love and defends his selfesteem even though there are people who try to destroy him. i treasure this song so much and thank him for lending me the strength.",After
Adventure,Stray,2023-07-25,"in my opinion, the most heartwarming moment ive ever seen in a video game was actually shown in a photo at 257 in this video even though he doesnt cover it. the cat, gives a musician a sheet of music paper and the musician robot says hes going to practice, you then curl up next to him and he slowly strums you to sleep with beautiful music playing. ill repeat it again, arguably the most heartwarming moment in any video gamevideo game history.",After
Adventure,Stray,2024-12-25,"i wonder if this mv shows us how lino's character deals with a problem at work through his rich imagination? the main character sees the world a little differently. during a conflict at work, he uses his unconventional approach to solve the problem, and everyone is charged with the positive energy of youth. he feels like superman, young and capable of anything. the song and story in the video seem simple, but they carry an important meaning.",After
Adventure,Stray,2023-01-26,"here's the code for the safe so you basically go to elliot and show him the code he will say dufer bar. go to the near by bar, fastest way is to scratch his curtain, head inside and you will see a sign by the counter with the bartender saying dufer bar and when you go to it you will see a picture above it. scratch it and you will see the code to the safe 1283 after that go to the man that plays music, as i expect, i think you know what it is.",After
Adventure,Stray,2023-11-19,"why does it feel so right that the kids all exist in the same space and shift into the space previously occupied by the other effortlessly? i feel like it's a representation of how they pass their vocal lines on to each other, even though each of them have a very distinct tone and personality, they can carry the emotion perfectly from one to the other. what a cool mv. it's so fun to have the acting cameos in there. i loved it. stray kids woo!!3",After
Adventure,Stray,2022-11-02,"this is the greatest game ive ever played. usually i dont get excited about new games, but on this one, i just so happened to discover it the day before release for ps4. sometime later, i played it and, wow! the story was great, the graphics and soundtrack is incredible and i enjoyed every bit of it until the downfall of b12. that part made me shed a tear and normally im tough to not do it. other than that, this game is incredible and you are a cat.",After
Adventure,Stray,2022-08-10,"as bucket stepped into the light once more, everyone below, from the slums to the cities looked up. the sun. the outsiders finally saw the outside, thanks to the smallest member, they all knew that bucket was to thank. for centuries after bucket had passed, the robots remembered him and told his story, the outsiders reunited and life improved. everyone was able to move freely, no fear of zurk. thanks to the strange little outsider. bucket was a hero.",After
Adventure,Stray,2022-08-07,i just found you because of stray. i loved watching every minute of the game and your running commentary. i played games like myst and riven back in the 80s and this reminds me of those type of immersive storypuzzle driven games that i love so much. this may get me back into gaming even! thanks so much for sharing these videos! was so enjoyable! i love that they did a game from a cats perspective! so unique and well done. the creators really know cats!,After
Adventure,Stray,2022-12-20,okay number one the editing in this video is absolutely lovely the little neon lines everywhere are just such a nice touch! and two as someone who has been dreaming about trying to build a 11 recreation on strays map in minecraft the fact that you left the calculations for the size of the city in the video and even made a little map has me nearly jumping up and down in excitement like omg if i can figure out how the fuck to convert that to meters im set,After
Adventure,Stray,2022-10-01,you were able to manage to make a song that im actually starting to tear up too. i keep trying to hold and keep emotions in check but this one hits beats that ultimately i live with. i havent even played stray or seen much of outside you play as a cat and yet somehow i feel like you captured so much of what makes the game and still an original creation that anyone can listen too without context. you truly are stupendous. keep it up you mustached machine.,After
Adventure,Stray,2022-08-06,"question wouldn't the zurks need to operate the same white pod in order to upload themselves into a robot? having one just chained up and connected to some wires in the sewers wouldn't really help them if they can't get in a pod and use it correctly to get in the robot's consciousnessthe network. and that's also assuming that the zurks have enough consciousness in the first place to be uploaded, as all i remember they can do is eat, see, run at you, repeat.",After
Adventure,Stray,2024-09-27,"i am in awe of how the game developers and the graphics artists made such a beautiful game that can run so well even on old hardware. i was not surprised that this runs very well on my ryzen 5 5600 w 64gb ram, an m2 drive and a gtx 1650, but i was very surprised that it ran very smoothly on high settings on my two i74790 pc's with 32gb ram and the gtx 1050 ti's and sata ssd drives. there was no lag whatsoever, and those two computers are getting quite old now.",After
Adventure,Stray,2024-12-16,"this mysterious, beautiful world is something only he could createtruly incredible. the scene of him collapsing among shattered stones evokes the process of sculpting, while the bathtub scene feels like a metaphor for developing photos. they say art shapes the artist, and i.n embodies thata living work of art inspiring its creator. in mythology, goddesses rule music, dance, and poetry, which might explain the use of girl in the lyrics and i.ns androgynous outfits.",After
Adventure,Stray,2023-12-06,"the 3rd verse, in my opinion, is possibly the best verse you've ever done. the opposition of the lines stray till you save me and stray till you're home really shows the conflict at the center of this game and the smooth transition of the words being replaced instead of a entire new line shows how much thought about the final verse and how it serves as a musical thesis on the philosophy and heart of the game. man you are phenomenal in so many ways hats off to you!",After
Adventure,Stray,2023-06-06,"stray is one of those rare games that comes along, seemingly out of nowhere, and is just absolutely mesmerizing. the story, the art, the characters... it reminded me of the power of a great game and why i love them. so many games these days are created to solely be a cash grab, but this one had heart. i really hope they make a sequel. or expand upon other lives in this world they created. like, what happened in other shelter city's across the world? phenomenal game.",After
Adventure,Stray,2024-05-10,"i know that this is a concept in rdr 2, but i was confused by one moment at the moment when the cat runs through the warehouse, you can see robots there, and the cat himself is in his costume, which is why he does not seem to be loaded, or does not yet have a color. i watched the original trailer for this concept and there was everything that is available here, but just apart from that moment with the warehouse and robots, so maybe this piece is a real drain 032  040",After
Adventure,Stray,2022-08-06,"fun little insight stray's cats have round pupils. most small cats have vertical pupils because they're ambush predators. but a few have evolved round pupils instead, indicating that they've adapted to be better daytime chasers rather than nighttime ambushers. this could be in part a product of domestication, where cats are more likely to adapt to their owners' daytime schedules, and aren't pressured into the same ecological niche because humans protect and feed them.",After
Adventure,Stray,2024-03-15,"in my opinion, she is a narcissistic sociopath. she has no empathy for others and once things don't go the way she wants, she will do anything to get satisfaction and rationalizes it, by saying heshe left me no choice. the tears at the end are not remorse for the people she killed. she was feeling sorry for herself because she lost her backpack. the man at the end must be her father because only a parent would want to protect their child no matter what they have done.",After
Adventure,Stray,2022-07-20,"honestly, this is one of the most unique and best games i have played. i really hope they consider making another stray or maybe dlc. i am currently still playing and passed the sewers. honestly, guys and girls this is a must buy and if you have playstation premium it is free with the line up. i would gladly pay money for this game. i am telling you guys and girls this game is worth your time and on ps5 the environments are beautiful. this is a phenomenal looking game.",After
Adventure,Stray,2025-03-19,"un teaser que rene todo lo que quiero se un teaser, meloda, letra, visual, la combinacin de las voces y los tonos de felix y han, un corte que presagia un cambio al final. la letra que es impactante desde el minuto cero. esta track refleja un trabajo profundo y complejo, probablemente el impacto visual de los otros teaser llamar ms la atencin, pero musicalmente truman no defrauda de entrada. y es lo que esperaba de felix y han, una evolucin musical compleja y profunda.",After
