Username,Score %,Review
JKaiya,30,"Loved the game but the farther it went on its life cycle the worse the game became due to the decisioning of new characters added and the nerfs/buffs, and especially lack of changes to fix hard metas like goats. The metagame switch counters also became too heavy. Overwatch 2 was also just a whole lie to the fan base."
aboody60,100,"The game is good in the competitive mode, but the gameplay in the other modes is bad. There is no creativity in the other modes, but the gameplay system is very wonderful. However, the only negative aspect of the game is that the arcade mode is bad."
72Vanish,0,"Fxcking ELO，less charactor，Can match the same team 5 times.When there are no friends to play with, there is no joy at all, and it requires a lot of cooperation"
zionthegoat,60,"Even though blizzard is run by **** idiots that made Overwatch 2 inferior to the original, Overwatch's core gameplay is so good that the game still manages to be pretty fun, if a little frustrating. The fact that we aren't getting PvE like we were promised still pisses me off though."
TokemonX,40,"Game is filled with lots of 'relatable' shallow characters. The company had a chance to remedy this through cinematic cutscenes, more backstories, improved cgi for the pve and less annoying shield Meta. Overwatch really for years has fallen into the trap of 'if we can rebalance, lets do so' and made the game absolutely repugnant compared to when it released. Tank is not fun and barely requires any skille now, theres no concept of retreating or even a way to escape, its mostly just 'help the tank' which every other team mate does. Its never been a 1v1 game, but it feel even less versatile now with no variation of which character to pick. This is insane to me and it ruins any way for now players to enjoy the game, this should only be reserve for competitive, but apparent ly blizzard did notunderstand not everyone wants to play that. Pretty much everyone understands the big ass scam blizzard has made, making skins and herpes cost as much as a full game, so the 'free to play' is an illusion if you want to play the full game, unlike the old game where you could unlock New characters, skins, voice lines through free loot boxes. Gameplay is still fun, but man, paying tank is so easy unless ur fighting a tank. 3.5/10"
vhyles,0,"They promised PvE, which was most likely a sham from the get-go, then seeing they wouldn't be able to deliver anything new they TOOK AWAY content by removing one tank, and praised this as if it's a groundbreaking novelty... all that with the goal of justifying the '2' after the title and justify the making of a 'new' game, which paves the way for them to change the MONETIZATION MODEL and rake in as much as corporate cash as possible thanks to selling overpriced skins to kids and new players who have never played the original Overwatch. The zombification and basterdization of a title, just in the name of pure corporate greed, nothing more nothing less fellas. You know what, let's take away the on-fire, the medals, the cards, the level borders too while we're at it... and add a bland scoreboard no one asked for. Oh, the lootboxes too of course! Let's take them away too! Why give our playerbase the possibility to receive any esthetic in the game for free, while they can pay 10 bucks for a keychain, and 30 bucks for a skin! **** you Blizzard, **** you for deleting Overwatch and then parading this lifeless corpse **** so as to squeeze as much as cash as possible."
