genre,game,commented_date,comment
Action,Red Dead Redemption 2,2025-03-13,"100 recommended for anyone looking for a true aaa experience, as immersive as a vr game, as fun as your entire steam library, the best story, and to actually cry. the story is beautiful. it made me laugh, made me cry, made me smile, its everything. 1010"
Action,Red Dead Redemption 2,2025-03-13,"this game is so good, makes you feel like youre part of a movie, extremely well made!"
Action,Red Dead Redemption 2,2025-03-13,"amazing game, both in gameplay  the story. can't wait for the next one"
Action,Red Dead Redemption 2,2025-03-13,"first of all, to be honest, i've never been a fan of westerns. but this game has so much to enjoy. i has the spaghetti western feel in some places, yet other areas are so beautiful, it's like taking a trip on horseback across many us national parks! the game play is fantastic, easy to learn and so natural. it can be calm and relaxing then suddenly thrilling, pending on what you chose to do. best fishing and hunting i've seen yet in a game. realistic horses. it's lots of fun and i can't recommend it enough!"
Action,Red Dead Redemption 2,2025-03-13,best video game story of all time. online is wack but every gamer needs to play through the story at least once.
Action,Red Dead Redemption 2,2025-03-13,"nothing more to say, one of the best games i've ever played. the story is amazing and the world is just incredible. i bought it 3 times so that's all you need to know."
Action,Red Dead Redemption 2,2025-03-13,you really wont regret it. it tells a really good and honest story. i recommend it to everybody ugh im in love with this gammmmeee
Action,Red Dead Redemption 2,2025-03-13,"best game ever imo gameplay is very diverse soundtrack is amazing story is legendary there is some negative thing like tedious collectibles or challenges mf gambler 8 but they are optional still, extraordinary game, a must play 910"
Action,Red Dead Redemption 2,2025-03-13,"this game actually changed me as a person. the story is amazing, the gameplay is amazing, the characters are amazing. the only thing i don't like is that red dead redemption online is pretty toxic and is very paytowin."
Action,Red Dead Redemption 2,2025-03-13,best immersion and best storyline. there's always new things to discover.
Action,Red Dead Redemption 2,2025-03-13,very fun to posse up with friends and just terrorize a town or do missions. i just wish more of the missions allowed more than 4 players. i'm trying to ride up on red ben clemson 7 deep.
Action,Red Dead Redemption 2,2025-03-12,"absolute masterpiece, changed my perspective on life and made me enjoy and do things better. if youre planning to buy this game, please do. its one of the best open world games and a wonderful world."
Action,Red Dead Redemption 2,2025-03-12,"great game, graphics are amazing. honestly you need to own this game, is just amazing. free world, if you like cowboys and like your own path type of game, this is the one."
Action,Red Dead Redemption 2,2025-03-12,game changes your perspective on who you are as a person. the all time greatest story driven game. would recommend to every human being i know
Action,Red Dead Redemption 2,2025-03-12,good game except that there is no crossplay
Action,Red Dead Redemption 2,2025-03-12,"the story is amazing, and the open world is fun and beautiful!"
Action,Red Dead Redemption 2,2025-03-12,"too many exploiters on pc, you fight back they push you into the ground reminding you that your nothing but a peice of dogshit to them as they continue to reek havoc on the server, you kill them once they are either stuck inside you or use tatics to kill you to compicate for their ass gameplay skills."
Action,Red Dead Redemption 2,2025-03-12,"amazing game with so much to explore even beyond missions. if you just want to relax and ride around on your horse, its perfect. but if you're in the mood for some bang bang action, jump into the missions and go fullon jesse james in the old west mode."
Action,Red Dead Redemption 2,2025-03-12,this game has changes my life prospective. i truly recommend this game and just try to push yourself through the first 2 chapters than it will be a game that will change you as a person.
Action,Red Dead Redemption 2,2025-03-12,the detail of this game is amazing. rockstargames never disappoint. you will enjoy this game. posting this before gta6 lol
Action,Red Dead Redemption 2,2025-03-12,"my horse had a diet consisting of nothing but pure sugar. he was an absolute beast, thriving on only quick energy and vitamin d."
Action,Red Dead Redemption 2,2025-03-12,"singleplayer story mode is very good. the freeroam aspect of the game feels like the whole world is alive, and there are things which can be discovered even after many hours of gameplay. little details and hidden things makes exploring the map an adventure in itself. but there is always something negative too, no game is perfect. i will list some of the bad that if removed, would make the game near perfect and way more enjoyable. the bad 1. the game is not supported with steam workshop and has no mods to experiment and improve the overall gameplay with 2. the vanilla game without any mods has a rather flawed law system, and will get annoying as the npcs in the game are too ''sensitive'' and will most likely start thretening you or shooting you if you accidentally bump on them or dosay something, this takes the immersion out of the game as it feels like the player is the only one who can not ''antagonize'' npcs in towns but they can antagonize the player without the law even caring about it. in most cases the player will be seen as a threat by all the npcs when the shooting starts, and it does not matter who starts the shooting. the player always ends up being targeted by all, even the outsiders in towns. even though it might seem that i wrote more negatives than positives about this game, i am still going to give a positive review since the positives outweigh the negatives. workshop mod support would fix most of the minor problems this game has and add more contentrealism to the game."
Action,Red Dead Redemption 2,2025-03-12,fantastic story and play it again over and over and it won't get boring
Action,Red Dead Redemption 2,2025-03-12,"nice story, nice graphics, overall a great game"
Action,Red Dead Redemption 2,2025-03-12,"i've put 170 hours into one playthrough of red dead redemption and i still didn't finish the entire game 100, it's crazy how the game just keeps on giving you things to do, learn, and uncover but at the same time manages to not feel boring. i never played the original rdr1 and it took me many years to actually try rdr2, i just had some feeling that i wouldn't like the whole cowboy genre of games, but boy was i so wrong. the whole world feels so alive in rdr2, people going about their normal days, animals hunting eachother and living their own lives, it really felt as if arthur morgan was another piece in this huge world. the story of arthur is also so deep and interesting that i truly felt that i was a part of dutch's gang, seeing how the characters develop and come in and out of arthur's life made me wonder why aren't all stories this encapsulating? however, because i came into rdr2 5 years after it first released, i already had some idea of what was going to happen. but luckily i didn't know exactly how the ending was going to pan out. gameplay, smooth as butter, i don't think i had any issues during my entire playthough. i'm sure if you are reading this, you've played games in the past that really leave a mark on you. whether it's from those long nights online with your friends laughing, the days as a kid when you were playing video games for the first time, or when you play a game with a story so deep that once you finish, it leaves you feeling like you've lost something. well, rdr2 is one of those games, before this, my favourite single player game of all time was witcher 3, i put around 200 hours into that and when i finished the story, i didn't know what to spend my time on next, rdr2 gave me the same feeling but more. wish i could play this game all over again for the first time, an absolute masterpiece."
Action,Red Dead Redemption 2,2025-03-12,what a amazing game so immersive even though i love gta 5 red dead 2 makes gta 5 look like gta 3 ot also massively expands on the first game basically blowing away all other games its story is so xcomplex and the ability to choose difffrent actions throughout truly makes this game a 2010
Action,Red Dead Redemption 2,2025-03-12,"thought i was getting a fun cowboy game. instead, i got an emotional masterpiece that set my gaming standards to an unreachable level. thanks, rockstar i guess. now no other game feels good enough. 1010"
Action,Red Dead Redemption 2,2025-03-12,"great story and gameplay, have yet to try online but i'm sure that it's just as great."
Action,Red Dead Redemption 2,2025-03-12,still very early in the game just raided colms cabin and got the shotgun was looting bodies got greedy ran into the law didnt want to lower my rating so i ran but i still had the default horse and it couldnt catch up and when it did i rode into a tree and died woke up immediately stole a train 1010 game
Action,Red Dead Redemption 2,2025-03-12,fun game for a while until the game mechanics kick in and sends your horse that you ranked up and spent a lot of time with hits a fence and then side steps into a train killing you and the horse and now the horse is gone. if i ended up dying in the game and having to reload in why the heck is my damn horse still dead!
Action,Red Dead Redemption 2,2025-03-12,"this game is phenominal, easily one of the greatest games i've ever played. 1010 would highly recommend if you want stunning visuals, a griping story, and lifelike characters."
Action,Red Dead Redemption 2,2025-03-12,"the game is great once you get into it. at first i didn't really care for it, since it's a bit slow, but i really did get invested after a while. when it works, it is really fun. good gameplay, story and graphics. however, i had nothing but issues, glitches, textures not loading, even key people not loading, bugs, crashes, super long loading screens10 minutes sometimes with a m.2 ssd, constant failed sign in attempts on rockstar and many more issues. i reinstalled several times, updated and verified files. same thing. by far the buggiest game i have ever played, and i like sonic games... i would recommend the game if it actually worked right. note i played this with an i9 12900k, rtx 3080 ti and a m.2 ssd"
Action,Red Dead Redemption 2,2025-03-11,"masterpiece, this game is gold, it left a mark on me in a way no other game has, it will probably remain my favorite game ever. you can buy this game and play it headfirst, i don't think you'll regret playing it."
Action,Red Dead Redemption 2,2025-03-11,this game is like onepiece it takes your entire lifetime to finish but its so rewarding when you do also the combat is some of the best the only problem i have is just that i think they stretch out the game waaaay too much cause im still on chapter 2 with 37 hours i honestly wish they made the chapters a little less long but overall this game gets 910 big booms boom boom boom boom boom boom boom boom boom
Action,Red Dead Redemption 2,2025-03-11,"one of the best games i've ever played, nothing will ever top this experience like the one i had playing this, the story is amazing, the weapons, the characters, and the online aspect when you have the right group, 1010, would play again"
Action,Red Dead Redemption 2,2025-03-11,game play 1010 story rich 1010 soundtracks 1010 world map 1010 graphics 1010 overall 1010 perfect game!!!
Action,Red Dead Redemption 2,2025-03-11,the story mode is great but the online portion is lame. imagine dayz with a minimap that shows where all the players are around you. everyone i pass pretty much just wants to shoot you for no reason. be nice if you could turn pvp mode off
Action,Red Dead Redemption 2,2025-03-11,this game is just amazing the steam version can be modded easily and provides a stable experience! just grabbed gta v and rdr 2 in a sale! thanks steam!
Action,Red Dead Redemption 2,2025-03-11,"when i first started playing the game i left it during the snowy part when i played it the second time, i finished it in less than 2 weeks. amazing story, amazing mechanics, amazing characters we need more money arthur"
Action,Red Dead Redemption 2,2025-03-11,really fun game to immerse yourself in. story mode is solid but online is tons and tons of fun. there are quite a bit of hackers depending on the game you spawn in but nonetheless a masterpiece of a game. thank you rock star games!
Action,Red Dead Redemption 2,2025-03-11,"not a big fan of the wild west cowboy topic so i'm really really late to this party. but it's worth a lots. plenty of storytelling, good one and great one. not a console player so it feels a lot easier to aim and play with keyboard and mouse. only 2 things i with the game can do better is crafting mechanic and adult activity.  it kinda simple and doesn't affect much. i finish the game before even craft a saddle, or a better tent. and then, all of my 3 stars material being useless since the game doesn't let you craft anything else anymore, beside of medicine.  the adult side nearly finish 60 of the story and then found out about hotel and bathing yeah, i know, i kinda focus on the gun too much at the first town and didn't realize it and that is it. i mean if they already try to add this path, why don't make it fully? why just stop at a little not so much? feel weird, tbh. it'd be better if it doesn't there in the first place."
Action,Red Dead Redemption 2,2025-03-11,"rdr2 is more than a gameits an unforgettable experience. the world is breathtakingly detailed, the story is emotionally gripping, and arthur morgan is one of the best protagonists ever written. the gameplay balances realism and fun perfectly, with deep mechanics and meaningful choices. while the pacing can be slow, its a minor flaw in an otherwise flawless game. a mustplay for anyone who loves openworld adventures or great storytelling. 1010  a timeless classic."
Action,Red Dead Redemption 2,2025-03-11,"this is a complete open world game, jaw dropping graphics, good story and playability. my only comments on improvement would be the easylinear missions that are mostly not challenging. overall 910."
Action,Red Dead Redemption 2,2025-03-11,one of best games i have ever played.. from graphics to story to physics.. its just unbeliviable game.. i hope anyone who didn't try this game to try it asap..
Action,Red Dead Redemption 2,2025-03-11,"probably the best made game of all time. bewilderingly amazing story, fun game play, intense drama and funny moments. you will cry, you will laugh, and you'll also jizz ur pants"
Action,Red Dead Redemption 2,2025-03-11,"55! best open world game ever. truly a living and breathing open world, the way it's supposed to be. i only play the single player mode by the way. you can go anywhere on the map and you will come across random npcs just living their life that's completely disconnected from what you are doing in the game unless you interact with them, and yeah, you can interact with them. never been into shooting games, this is my first one i've spent more than an hour on, but this game is an amazing game."
Action,Red Dead Redemption 2,2025-03-11,"this is the greatest video game i've ever played. the storytelling, the character development, the combat. it truly is the most beautiful game i've ever played and everyone should play it. if you play it, do not skip any cutscenes."
Action,Red Dead Redemption 2,2025-03-11,"red dead redemption 2 is probably the best game ive ever played. for years, people told me to play the first red dead redemption, but i just couldnt get into the idea. the whole cowboy thing sounded too slow and boring. then rdr2 came out, and once again, people were raving about how beautiful and immersive it was. i still ignored the recommendationsuntil it finally went on sale for 20. and let me tell you, that was the best and most rewarding purchase ive ever made. can a game feel this real? every detail, from the world to the characters, is so well thought out. i love the stories, the missions, the sheer freedom the game offers. rockstar has a way of creating games that feel truly fulfilling, and rdr2 is a perfect example of that. whether its hunting, fishing, racing, or getting into shootouts, every moment in this game feels meaningful. the time period itself adds so much depthyou feel like youre living in that era of rugged freedom. i cant believe i almost skipped out on this masterpiece. if you havent played rdr2 yet, dont make the same mistake i did. this game is an experience you dont want to miss."
Action,Red Dead Redemption 2,2025-03-11,so immersive and the scenery is amazing! what i hate is the story ended. i am in my third play through.
Action,Red Dead Redemption 2,2025-03-11,"i'd say play the first one then this one, just to not only appreciate where and how the story goes, but to also see just how far we've come in terms of games as a medium. i thought the first game was peak when it released, and i wasn't even into westerns at the time. that's how good it was. and with this game? oof. it's might be one of the best pieces of media that a normal person can purchase. it's that good. no notes. 910. the hunting rng is bullshit. everything else is great. never touched multiplayer and i don't care to."
Action,Red Dead Redemption 2,2025-03-10,"this game is an unforgettable masterpiece that will stay with me forever. the story is incredibly powerful, with complex characters and emotional depth that make every moment impactful. the graphics are stunning  every landscape, town, and character feels meticulously crafted, creating a world that feels truly alive. from breathtaking sunsets to small details like muddy streets, the visual experience is unparalleled. the enjoyment is endless, whether you're exploring, hunting, or simply soaking in the atmosphere. story 1010 graphics 1010 enjoyment 1010 i genuinely believe no other game will ever reach the level of rdr2. a true classic."
Action,Red Dead Redemption 2,2025-03-10,"a very nice game to be honest, if it was a third one with a story like this i would buy and play it."
Action,Red Dead Redemption 2,2025-03-10,"whats there not to like ? the game is perfect love it love it love it ,,,,,did i say i love it ? ,, the only thing they could do is have an update  ya hate updates too but this is a good idea  where the story mode gets extended to playing dutch and it be a free update ,,,, perhaps along the lines of dutch starting a new gang with micha or perhaps dutch gets caught by the pinkerton and works out a deal and becomes one of them ,,,,or perhaps michas story play as him on the run from the old gang ,made mean and well just plumb evil ,,"
Action,Red Dead Redemption 2,2025-03-10,"graphics awesome, game play awesome, story pretty awesome. there isn't much more to say about the game, its not perfect don't get me wrong but its very close."
Action,Red Dead Redemption 2,2025-03-10,"absolute masterpiece of a game. in terms of storytelling and worldbuilding, it is second to none. when it comes to gameplay, it was a bit easy for me. it would be a good thing if they made a hard mode. still it is a magnificent game that everyone should experience."
Action,Red Dead Redemption 2,2025-03-10,"even in 2025, still the most innovative, simply phenomenal experience in the world. arthur is and always will be the best fictional character in existence."
Action,Red Dead Redemption 2,2025-03-10,"amazing characters and very well written story, insanley good graphics"
Action,Red Dead Redemption 2,2025-03-10,"h1the best openworld gameh1 if youre a fan of openworld games and have never played this game what do you wait for?? play it now, but if you want something that tells you why you should play this game. i'll tell you. bred dead redemption 2b is an openworld action adventure game from rockstar games set in the wild west. the story follows outlaw arthur morgan and the van der linde gang as they fight for survival in a rapidly developing america. as for the story in chapter 1, many people say it's boring, but for me, who likes to enjoy the story, it's quite fun. h3gameplay910h3 rdr2 focuses on exploration, storytelling, activities such as shooting, robbing, hunting, and fishing, and also random events that can occur at any time, such as encountering an injured person, being robbed, etc. the controls focus on realism, which in my opinion makes shooting quite boring, since the guns of that era were quite slow. but overall, it's great. the difficulty is well balanced. the survival element lets you control arthur's wellbeing, while the honor system determines how the world will respond to your moral decisions. for example, if your honor is high, you will get a halfprice discount in all shops. if your honor is low, when you loot corpses, the drop rate will be better, so you will find more energy, accessories, and food. h3graphics 1010h3 the world of rdr2 is impeccable in terms of its beauty and realism. for example, the lush forests, vast grasslands, townspeople, and wildlife all have their own daily routines. each region has its own unique beauty and wildlife, which helps to enhance the realism of the game. the character models are equally impressive, reflecting detailed facial expressions. this makes the game require relatively high pc specs to produce beautiful graphics. in terms of bugs, i have rarely encountered any in my experience. h3sound  voice 1010h3 during exploration, there is ambient track, whereas during shootouts or heavy emotional beats, it becomes more intense with orchestral pieces. this kind of soundtrack adds a big ratio to the atmosphere to make even the most mundane things, like crossing the plains atop your horse, feel quite cinematic in tone. the dialogues are richly captivating and totally authentic. each character speaks according to their unique personalities and the time period they are supposed to belong to. the succinct tone of arthur morgan or dutch's manipulative charm  the voice acting and writing are incredible! h3conclusion 9.610h3 overall, red dead redemption 2 offers an excellent openworld design and deep story. from the realistic animations and beautiful scenery to the rousing soundtrack and excellent voice acting, every element works together seamlessly to create an immersive experience. while the deliberate control scheme and potential performance issues may present challenges at first, they ultimately add to the games cinematic realism. for players looking for a deep story, rich gameplay variety, and an immersive world, rdr2 is definitely worth every price you spend."
Action,Red Dead Redemption 2,2025-03-10,"i didn't know what to say. i kept hearing an unbelievable amount of praise for red dead 2 to the point that i thought it would be above the rating. because of that, my experience was ruined. i felt bored at many moments, even though the story was wonderful and beautiful, the characters were wellwritten, everything was excellentthe world, your impact on the world. in summary, red dead 2 is a technical masterpiece, but it doesn't deserve all that praise.  story 9.510  world design 1010  graphics 1010  songs 8.510  gameplay 8.510 my rating is 9.510."
Action,Red Dead Redemption 2,2025-03-10,"1010, woth it lah menurut gw. story 100000010 gameplay 9.210 graphics 1010 character development 10010"
Action,Red Dead Redemption 2,2025-03-10,graphics   you forget what reality is  beautiful  good  decent  bad  dont look too long at it  msdos  gameplay   very good  good  it's just gameplay  mehh  watch paint dry instead  just don't  audio   eargasm  very good  good  not too bad  bad  i'm now deaf  audience   kids  teens  adults  grandma  pc requirements   check if you can run paint  potato  decent  fast  rich boi  ask nasa if they have a spare computer  game size   floppy disk  old fashioned  workable  big  will eat 15 of your 1tb hard drive  you will want an entire hard drive to hold it  you will need to invest in a black hole to hold all the data  difficulty   just press 'w'  easy  easy to learn  hard to master  significant brain usage  difficult  dark souls  grind   nothing to grind  only if u care about leaderboardsranks  isn't necessary to progress  average grind level  too much grind  you'll need a second life for grinding  story   no story  some lore  average  good  lovely  it'll replace your life  game time   long enough for a cup of coffee  short  average  long  to infinity and beyond  price   it's free!  worth the price  if it's on sale  if u have some spare money left  not recommended  you could also just burn your money  bugs   never heard of  minor bugs  can get annoying  ark survival evolved  the game itself is a big terrarium for bugs  ?  10   1  2  3  4  5  6  7  8  9  10  author   httpsvojtastruhar.github.iosteamreviewtemplate
Action,Red Dead Redemption 2,2025-03-10,"red dead redemption 2 is a video game masterpiece that impresses with its incredible storyline, excellent graphics, and an unprecedented level of detail. the game world is alive, immersive, and full of exciting adventures, while the story of arthur morgan is one of the bestwritten narratives in the history of gaming. the gameplay mechanics, realism, and attention to detail make every moment in this western world unforgettable. this is a production that sets new standards in the industry and remains one of the best titles of all time. the ending brought me to tears. 1010. post scriptum i finished the game earlier on ps4, and the pc version is even more beautiful than the console version."
Action,Red Dead Redemption 2,2025-03-10,get this game for the singleplayer. best storymode in any game made to this day.
