genre,game,commented_date,comment
Action,Red Dead Redemption 2,2025-03-04,graphics   you forget what reality is  beautiful  good  decent  bad  dont look too long at it  msdos  gameplay   very good  good  it's just gameplay  mehh  watch paint dry instead  just don't  audio   eargasm  very good  good  not too bad  bad  i'm now deaf  audience   kids  teens  adults  grandma  pc requirements   check if you can run paint  potato  decent  fast  rich boi  ask nasa if they have a spare computer  game size   floppy disk  old fashioned  workable  big  will eat 10 of your 1tb hard drive  you will want an entire hard drive to hold it  you will need to invest in a black hole to hold all the data  difficulty   just press 'w'  easy  easy to learn  hard to master  significant brain usage  difficult  dark souls  grind   nothing to grind  only if u care about leaderboardsranks  isn't necessary to progress  average grind level  too much grind  you'll need a second life for grinding  story   no story  some lore  average  good  lovely  it'll replace your life  game time   long enough for a cup of coffee  short  average  long  to infinity and beyond  price   it's free!  worth the price  if it's on sale  if u have some spare money left  not recommended  you could also just burn your money  bugs   never heard of  minor bugs  can get annoying  ark survival evolved  the game itself is a big terrarium for bugs  ?  10   1  2  3  4  5  6  7  8  9  10
Action,Red Dead Redemption 2,2025-03-04,"w game winner of over 175 game of the year awards and recipient of over 250 perfect scores, rdr2 is the epic tale of outlaw arthur morgan and the infamous van der linde gang, on the run across america at the dawn of the modern age. also includes access to the shared living world of red dead online. recent reviews very positive 19,438 all reviews very positive 638,430 release date 5 dec, 2019 developer rockstar games publisher rockstar games"
Action,Red Dead Redemption 2,2025-03-04,i recomend this game because of its beauty and the hard work put into it. but the gameplay is a cowboy simulator sold as an action rpg so its dull and the realism make everything slow. i have to force myself to keep playing it just to give it a shot. rdr1 was better
Action,Red Dead Redemption 2,2025-03-04,it's a very fun open world game. the missions aren't like 2 hours long which is good too so you don't get bored easily. i started playing this game with low expectations but soon realized it's probably one of my favorite games.
Action,Red Dead Redemption 2,2025-03-04,"the game is an absolute masterpiece from start to finish, however there are quite some issues with the pc version. the game crashes randomly with an unfixable error code, sometimes the missions get bugged and npcs that you need to follow just dont move at all and the movement with keyboard and mouse isn't precise leading you to crash into trees or boulders while riding horsescoaches. i played rdr2 when it came out in 2018 on an one x and during my complete playthrough i haven't had a single issue like the ones above, so i would advise you to play it on a console instead of paying 60 euros for the pc version since the game is much cheaper on console anyways. i will still give it a thumbs up because it's impossible to dislike the game in itself, but if you own a ps4 pro  one x or better, grab it on console for less headaches."
Action,Red Dead Redemption 2,2025-03-04,"realy fun and immersive cowboy game. it is full of details, a gripping story, fun interactions, and great gameplay. would reccomend it if you can run it."
Action,Red Dead Redemption 2,2025-03-04,hands down the best game ever created. the immersion is insane and the story is perfect. almost 130 hours in and i'm on my second playthrough treating it more like a sandbox game not worrying about main story stuff. spoiler alert i just don't want arthur to get sick again  might just never finish the main story in this save. let arthur live out his best life enjoying the beautiful world around him and hunting and fishing and doing his little side quests. but all things come to an end eventually so i suppose ill have to let it go sometime...
Action,Red Dead Redemption 2,2025-03-04,"one of the best games ever created by mankind.... if you are alive and if you have the money and enjoy a good story, buy this"
Action,Red Dead Redemption 2,2025-03-04,game mechanics 1010 graphics 1010 gameplay 1010 opttimization 1010 storyline 1110!!! over all gameplay experience 1010
Action,Red Dead Redemption 2,2025-03-04,"the beginning of the campaign felt a bit slow, but then it really ramps up in pace and difficulty, proving why its one of the best games around, with great indepth storytelling along the way."
Action,Red Dead Redemption 2,2025-03-04,"very good story line, amazing graphics, runs smoothly. best game i have ever, played worth the money."
Action,Red Dead Redemption 2,2025-03-04,massive open world with many side activities to keep you occupied even after completing the story which is very long.
Action,Red Dead Redemption 2,2025-03-04,"the story and characters are fantastic, with one of the best protagonists in media history being front and center. the biggest gripes are that a lot of the actual story missions are highly predictable, and therefore lose a lot of their narrativeduringgameplay potential. secondly, the bounty system is wildly inconsistent when combined with the honor system. example you rob a train and everyone on it for extra cash, you end up having to shoot a few deputies before you can make your escape. after selling all the loot, you basically made 150.00. not bad! until you make it back to town and because you have low honor, the prices of almost all goods and services are nearly doubled. you lost money effectively, by successfully robbing a train. and the final gripe the online has been abandoned by rs, and is infested by cheaters on pc. rendering playing completely pointless. in conclusion get in, experience arthur morgan's story, and really take your time to get lost in it's world. when a lot of the elements come together, its truly magical. just force your way through the silly missions and don't be too much of a jerk."
Action,Red Dead Redemption 2,2025-03-04,so fun esspesially story mode and stuff i reccomend the game to everyone from ages 10  20
Action,Red Dead Redemption 2,2025-03-04,the game is an absolute masterpiece. its just a shame rockstar treats it like a red headed step child.
Action,Red Dead Redemption 2,2025-03-04,"a captivating story, big open world, terrific interactive npcs, good game play mechanics, amazing graphics. incredibly hard to fault this game."
Action,Red Dead Redemption 2,2025-03-04,"if you're looking for reasons not to buy the game, there are none. one of the greatest games ever made. storylines and quests are so interesting and interactive that you won't get bored after doing thousands of them , and don't get me started on the graphics, such a beautiful game that you will wish u bought sooner. cheers"
Action,Red Dead Redemption 2,2025-03-04,"this game has completely changed the way i approach games. normally, i'm all about rushing through the main story and skipping side quests or challenges. but after playing this masterpiece, i found myself regretting that mindset. i ended up restarting the game, and this time, i took my time to savor every moment. i immersed myself in every side quest, every interaction, and every detail of the world rockstar created. it's not just a game, it's an experience. a genuine masterpiece. honestly, it may not have won game of the year, but it easily couldve been game of the decade."
Action,Red Dead Redemption 2,2025-03-04,excellent story game! amazing graphics. truly a rockstar games classic. the game is made for everyone's skill levels.
Action,Red Dead Redemption 2,2025-03-03,"when people ask me what i think about this game, i often joke that it's a really good tv show where you occasionally need to press the triggers at random to progress the story. this is an incredibly detailed and well realized world, with very good characters that have impressive depth for a video game story, but my gripe with this game is that all of this is trapped inside of the formulaic and repetitive rockstar formula, with a mission structure that constricts the possibilities of the open space the game gives you and will only let you proceed if you play out your role exactly as it wants and not a milliliter out of step. while that sounds overly negative, i think the story is good enough to be worth playing it, it's well written and compelling, for the most part."
Action,Red Dead Redemption 2,2025-03-03,a very fun mixture of action and story with elements of mystery along side tension. lots of content to do aside from the story for many hours of play time. i would recommend this game 910.
Action,Red Dead Redemption 2,2025-03-03,"i've already finished this game once, but i bought it again just to experience it all over again. i simply can't get over it. red dead redemption 2 isn't just a game it's an emotional journey that stays with you long after the credits roll. the story, the characters, and the world are so immersive that i found myself laughing, crying, and feeling deeply connected to arthur morgan and the gang. every moment, from the quiet rides through the wilderness to the intense showdowns, is crafted with so much heart that it feels like i'm living in this world rather than just playing a game. no matter how many times i play it, the weight of the story, the beauty of the world, and the emotional impact never fade. this game is a masterpiece, one that i'll never forget."
Action,Red Dead Redemption 2,2025-03-03,like a mini movie. amazing story and open world. combat mechanics are great. micah is a rodent.
Action,Red Dead Redemption 2,2025-03-03,"hands down the most beautiful and emotional game i have ever played. the world is so intensely beautiful, the map in itself is a character that has a personality of its own. the world is alive, animals that hunt and play and interact with the landscape. you real feel as if it exists without you in it. the characters each have their own storyline as you progress, they grow, they change, they fail. gameplay is slow but extremely rewarding. each chapter is a specific feeling. this game with make you laugh, make you angry, make you cry. its beyond a game  its a masterpiece"
Action,Red Dead Redemption 2,2025-03-03,"great story, stunning gameplay. well worth taking the time to play it slow and enjoy the world."
Action,Red Dead Redemption 2,2025-03-03,"go back to a different time, live off the land, enjoy the natural surroundings. or, lie, cheat, steal, abuse and murder the choice is yours to make."
Action,Red Dead Redemption 2,2025-03-03,"at first, i thought i hadn't played an open world game so immersive with such an enjoyable story in so long. then it dawned on me that i had never played a game so in depth, immersive, and straight up fun. i put off this game for 7 years because i wasn't interested. now that i've given it a chance i am overly addicted, the story and characters are unmatched by anything i have ever playedwatched."
Action,Red Dead Redemption 2,2025-03-03,"rdr 2 is a masterpiece that immerses players in a stunningly detailed open world filled with breathtaking landscapes and rich storytelling. the game's attention to detail, compelling characters, and immersive gameplay make it an unforgettable experience. from the cinematic visuals to the emotional narrative, every aspect of rdr2 is crafted with precision and care. a true gem that deserves all the praise it receives!"
Action,Red Dead Redemption 2,2025-03-03,"i haven't finished the story yet, but i wholeheartedly recommend red dead redemption 2. the game offers a vast array of main and side quests that truly immerse you in its world. what stands out the most is how every character, from the gangsters to the random npcs, has their own unique story. the characterization is exceptional, making even the npcs feel incredibly real. arthur morgan's character development is particularly well done, giving players a deep understanding of life as part of a gang in the american west. the plot is infectious, drawing you in and keeping you engaged throughout. the graphics are stunning, and the world feels alive, filled with the stories of desperate gangsters painting a magnificent picture of life in the wild. if you're looking for the best singleplayer experience, red dead redemption 2 should be your first choice. it's a massive and beautifully crafted game that i love so much! if you have extra steam points, please give me some. thank you!"
Action,Red Dead Redemption 2,2025-03-03,the game is storyrich. i have played this for a total of 442hrs. finished the story and played online too. there are a lot of discoveries on this game and there is always something to find and looking forward to. it's wellthought off and the characters are easy to lovehate. i am attached!
Action,Red Dead Redemption 2,2025-03-03,very good story mode and great graphics
Action,Red Dead Redemption 2,2025-03-03,"it made me laugh, it made me cry. and most of all it was fun! the gameplay is great on a controller which im grateful for, not once was i bored with it. the the visuals are fantastic, this being the first modern triple a game i've played i can see the appeal of high fidelity realism even if its not my preference. there were definitely a few bugs and frustrations but nothing i couldn't solve on my own thankfully. overall a great experience."
Action,Red Dead Redemption 2,2025-03-03,"it plays like a western movie. it makes you want to avoid fast travel in favor of just riding your horse as slowly or quickly as you desire to your destination. the story! ye gods, the story! it's been a long time since i've played a game this damn good"
Action,Red Dead Redemption 2,2025-03-02,"after over 200 hours, ive finally completed chapter 6, and i can confidently say rdr2 is one of the best storydriven games ive ever played. with its breathtaking open world and captivating narrative, everything about this game is masterfully crafted. arthurs character arc is one of the most compelling ive seen, with topnotch writing and voice acting that bring him to life. the world in rdr2 is stunning, whether riding through snowy mountains, fishing by a river, or exploring the different settlements. every detail, from wildlife to random encounters, makes it feel alive. the gameplay is just as engaging. intense gunfights, hunting, treasure hunting, and more kept me hooked without ever feeling like a chore. i havent finished the epilogue yet, but im excited to see how the story wraps up."
Action,Red Dead Redemption 2,2025-03-02,"it's fun and both the side quests and main story missions are cool. red dead online is alright, it's just a lot of grinding and it takes forever to get gold."
Action,Red Dead Redemption 2,2025-03-02,"red dead redemption 2 is an absolute masterpiece, combining breathtaking visuals, a gripping story, and immersive gameplay. as arthur morgan, youre thrust into a world brimming with life, from the wildlife roaming the wilderness to the bustling towns filled with unique npcs. the attention to detail is incredible, with a dynamic world that reacts to your every action. the emotional depth of the story, along with the complex characters and their moral struggles, keeps you invested throughout the entire journey. the gameplay is equally impressive, offering everything from intense gunfights to peaceful moments of fishing and hunting. the controls are intuitive, making exploration and interactions with the world feel natural and rewarding. red dead redemption 2 is not just a game but an experiencea truly living world that encourages curiosity and offers unforgettable moments at every turn. its a mustplay for any fan of openworld games."
Action,Red Dead Redemption 2,2025-03-02,greatest single player story of all time. 1010 would get tuberculosis again
Action,Red Dead Redemption 2,2025-03-02,"awesome game! story is awesome, felt like a 48 hours movie for me. 1010"
Action,Red Dead Redemption 2,2025-03-02,i had this game on playstation for years. same on pc but you can get mods. even better on steam deck.
Action,Red Dead Redemption 2,2025-03-02,"absolute masterpiece. after i finnished the story, i was stunned. i was sitting, speechless. but what really got me wasn't the incredible story, but that insane soundtrack of this videogame. recommed to anyone, everywhere at any time"
Action,Red Dead Redemption 2,2025-03-02,"so incredibly good. with dlss4 it looks better than ever. and it is brilliant on the steam deck as well, with a framerate of about 45 fps with good visual settings. will there ever be a more welldeveloped game?"
Action,Red Dead Redemption 2,2025-03-02,one of the best story games ever created. super detailed characters and an insane story that you can't stop coming back to if you like to repeat games.
Action,Red Dead Redemption 2,2025-03-02,"this is the best game i have ever played. after over a decade of gaming, not a single game comes to mind that is better than this game. an amazing open world with a beautiful story and some of the best characters in gaming. 1010 life changing game."
Action,Red Dead Redemption 2,2025-03-02,"best game i have ever played, for all it matters, being called a good man at the end of ones' life is the biggest accomplishment"
Action,Red Dead Redemption 2,2025-03-02,"just bought this game last month for pc after having played it when it first came out on console years ago. it's even better than i remember probably due to playing on higher graphics and processing than console it also reminds me how far ahead this game and similar games were for the time they came out. i'm glad there has been a resurgence for this game and people are able to relive this game or even play it for the first time, we need games to return to the amount of care that was put into this game."
Action,Red Dead Redemption 2,2025-03-02,"second time i played this game after realese! still one of the best games ever made! if you like videogames, you need to play it!"
Action,Red Dead Redemption 2,2025-03-02,totally the goat. i play games since i was 5 and rdr2 gives me another level of gaming experience
Action,Red Dead Redemption 2,2025-03-02,"very good game and amazing story, could be a bit slow at times but it doesn't really matter because this game is the best and if i get dementia i would play this game so i can experience it again."
Action,Red Dead Redemption 2,2025-03-02,"this is genuinely the best game i have ever played. it caters to absolutely everything i could want in a single player story game with a massive open world. the story is absolutely amazing, with lovable and tragic characters that i really got attached to, though i know others have their criticisms of them and the plot as a whole. one thing that i feel is undeniably outstanding is the world. it looks amazing and is so full of life and activity, and aside from it feeling great to be in, there is so much to do. random encounters with strangers, weird stuff that probably shouldn't be there, some isolated house in buttfuck no where that got hit by a meteor, etc etc. that's not even including the actual side missions, which are great in my opinion. combat is satisfying and fun to play and i love the entire horse system. it is genuinely just a great game and i love it."
Action,Red Dead Redemption 2,2025-03-02,"very good game with a lot of content, very satisfying to remove people from life with firearms."
Action,Red Dead Redemption 2,2025-03-02,"this game is an experience. story and character relations are extremely tight, the world is massive and packed with content, and if i had to describe it with one word, it's simply just alive. gameplay is not enough to carry the game however, very slow and atmospheric, if you play games to get an adrenaline boost, this won't be it.sometimes, there is no action for a good 4 hours online is fine, unfortunately it doesn't get updated anymore, but you can still sink a good 100200 hours in there."
Action,Red Dead Redemption 2,2025-03-02,one of the best singleplayer story games i have ever played with great character development and many great scenes from people getting shot brutally to a beautiful sunset.
Action,Red Dead Redemption 2,2025-03-02,very rich in story and gameplay mechanics. not much more to say than its an amazing game with beautiful graphics. you have to play it
Action,Red Dead Redemption 2,2025-03-02,"really enjoyable game. i'm not so much into the immersion aspect of the game and found the game to be a bit slow from time to time. however, this didn't keep me from spending dozens of hours in the game. all the characters are super interesting and feel fleshed out. i liked most of the quests and the story kept me wanting to return to the game again and again."
Action,Red Dead Redemption 2,2025-03-02,"red dead redemption 2 is honestly one of those games that just sticks with you. the dialogue flows so naturally, it feels so human, the characters are written with such depth that you cant help but get attached, even the ones youre not supposed to like. i could just listen to the characters talk in the camp and it would be a great experience. its one of the best, or the best, open world experience for me, it has so many details that it just feels alive. even though the game released back in 2019, it looks better than most aaa games releasing these days, the landscapes are stunning, every sunset, every storm, its just breathtaking. and the soundtrack? oh boy, its one of the best i've heard, it perfectly captures the emotion of every moment. i decided to go for 100 completion, and honestly, it made me fall in love with the game all over again, the grind made me appreciate the game so much more compared to my first playthrough years ago. every little thing i did, every moment i spent in that world, felt meaningful. its one of those rare games where you dont mind putting in the extra time because its just that good. i think its not just a game, its an experience ill never forget."
Action,Red Dead Redemption 2,2025-03-02,story is really good and it just makes you feel like a cowboy in old times if i could wipe my memory and play this again i would
Action,Red Dead Redemption 2,2025-03-02,"i don't get how this game has not only better graphics than most modern games, but also runs way better than them too. and oh yeah, the story is magnificent."
Action,Red Dead Redemption 2,2025-03-02,"an amazing game with an emotional story. easily considered one of the greatest games of all time, and i would agree. if there's anything i can nitpick, it's that the game doesn't teach you enough about the controls and game mechanics. beyond that, i wish there was more story in the epilogue."
Action,Red Dead Redemption 2,2025-03-02,"this is one of the most indepth games you will experience, regardless of preference between 3rdperson and 1stperson shooter games. it will lure you in you win and keep you till the end. graphics are nextlevel, even to 2025 standards. the biggest negative i have are about the controls. the pc controls are hard to master throughout the game."
Action,Red Dead Redemption 2,2025-03-02,"the bar for video game narratives, motion capture performance, voice acting and world building. i cannot praise this game enough, played this many times now and it's always got new surprises even though i know the story back to front at this point. rockstar, compared to most other studios has an absurdly consistent track record, and i'm excited for what's next with gta"
Action,Red Dead Redemption 2,2025-03-02,"one of the best games i've ever played. the detail, the story, the nuance and the vast size of this game are incredible. you can't help but want to keep playing it, there's so much variety for the player to do, you're never bored. once you're past the first chapter you'll be having the best time and won't want to stop. you have been warned!"
Action,Red Dead Redemption 2,2025-03-01,"rdr2 red dead redemption 2 is great. play it, finish the story and you won't regret spending all the time playing the game"
Action,Red Dead Redemption 2,2025-03-01,very large open world game with a great story. probably the best. highly recommend!!
Action,Red Dead Redemption 2,2025-03-01,"don't sleep on this game. even in 2025, it looks and feels better than any game i've played thus far. on steam deck lock it to 40fps and you are set. don't lower the graphics either. you need to play this game once in your life, even if you aren't a cowboy."
Action,Red Dead Redemption 2,2025-03-01,yes and no this is a good game but it isnt at the same time it is a wild west type game with a online and story mode story is fun and all but i just stick in online
Action,Red Dead Redemption 2,2025-03-01,"played this game for years. grew up on the first as well as undead nightmare, and it's so nice to be able to have it on pc. the ability to mod the game is really nice, and online seems to be more active than it is on console for the most part at least. couldn't recommend the game more. a true masterpiece  if you're lucky like me as well, you might catch the game on sale for a solid 15 bucks, which in that case you are losing money not buying it."
Action,Red Dead Redemption 2,2025-03-01,"story mode gameplay 1010 graphics 1010 story and characters 1010 bugs not many, too hard to find one replayability 1010 online gameplay 110 very repetitive and grindy graphics 1010 story and characters 510 some characters are not very related to story mode bugs a lot, starting from no animals spawning ending with modders who ruin the game replayability 310 personally i wouldn't replay the entire online story p.s. online has a lot of microtransactions"
Action,Red Dead Redemption 2,2025-03-01,one of the best games its graphics wow just wow the game is worth the price
