genre,game,commented_date,comment
Action,Red Dead Redemption 2,2025-03-19,"single player story is an absolute treasure. online mode is impossible to enjoy due to rampant cheaters that the game developers apparently cannot control and cannot seem to prevent in any form. 910 lobbies will have at least 1 modder running around annoying the other players, destroying or spawning assets that shouldn't be in the game. its insane how a aaa company can put out such a spectacularly trash and unmoderated multiplayer option with a cash shop option."
Action,Red Dead Redemption 2,2025-03-19,"how to fast travel please read so you will enjoy the game make camp with your horse, sit by fire and you can fast travel to any major places. websites all say there's no fast travel but this is how to fast travel. you do not need to head back to your camp and look at the map like all the websites and forums say, just select camp when your on your horse on the same option as craft on the bottom of selection wheel and then you can fast travel from there. with the updates, they should have a message telling people how to fast travel since they have so many hint messages anyways."
Action,Red Dead Redemption 2,2025-03-19,"stopped playing in 2022 and came back in 2025, i've never lost my love for the game, made a lot of friends back in the day."
Action,Red Dead Redemption 2,2025-03-19,"i finally got this after i bought the disaster of a launch, monster hunter winds, a poorly optimised mess which didn't run properly at all and looks awful... like really bad. i can't stress it enough. i payed 60 for a game that looks like it belongs on the ps2 i wish i was joking. that being said, i just bought rdr2 because it was on sale i'm only a few hours into the game first time playing and i can truly say i understand the hype, it's unbelievably good. looks incredible compared to mhw which released almost 7 years after this! actual insanity. rdr2 is a super fun game so far and it looks incredible. it definitely deserves all the praise it's received and i'm only 2 hours in and loving it, can't wait to play more. this is how you make a game capcom. shame on you, you bunch of dorks!!"
Action,Red Dead Redemption 2,2025-03-19,"red dead redemption 2 is hands down one of the best games ive ever played. the story is deep and emotional, and it really makes you connect with the charactersespecially arthur morgan, who easily became one of my alltime favorite protagonists. the world is insanely detailed, and everything feels alive, whether youre interacting with npcs or just riding around, watching the scenery change. as for the gameplay, its smooth and satisfying. the gunplay feels great, the melee combat has real weight to it, and even the side activities like hunting and camping add to the immersion. this game pulled me in way more than i expected, and every time i go back to it, it feels like stepping into a real, living world. its an experience thats hard to top."
Action,Red Dead Redemption 2,2025-03-18,"this is the best written piece of fiction i have consumed. i never find myself attached to characters, and the end to the main story made me weep."
Action,Red Dead Redemption 2,2025-03-18,"still one of my all time favorite games, only thing about playing on here i found is that it doesnt like to work with headphones unless they are wired. it doesnt seem to like wireless headphones for some reason. still 1010 game"
Action,Red Dead Redemption 2,2025-03-18,what a game fantastic! i still waiting for red dead redemption 3 rockstar thank your this masterpiece
Action,Red Dead Redemption 2,2025-03-18,"excellent graphics, ai interaction and game play. like a lot of other games, online mode is over run by hackers...needs a private room option."
Action,Red Dead Redemption 2,2025-03-18,gets a bit repetitive but overall a great game
Action,Red Dead Redemption 2,2025-03-18,do not buy this genuinely it will not start after first play so if you are dumb enough ti buy like me just complete the game in one sitting cause you will not be able to open it ever again having the issue as i write this
Action,Red Dead Redemption 2,2025-03-18,"red dead redemption 2 is an absolute masterpiece, delivering an unparalleled openworld experience with mind blowing visuals and a gripping story. the level of detail in the world is astonishing, making every interaction feel immersive and alive. from the engaging characters to the dynamic gameplay mechanics, everything is crafted to perfection. whether you're exploring the vast landscapes, hunting, or just living the outlaw life, rdr2 is a mustplay for any gamer."
Action,Red Dead Redemption 2,2025-03-18,its a fun game would recommend for people who love wild west games or a horse game to play. quality is good for gaming computers.just do the intro to the game if you want to learn the basics and get a better horse than squarny nag. enjoy!
Action,Red Dead Redemption 2,2025-03-18,"i always come back to this game, at least once a year. red dead redemption 2 is a beautiful tale of the old west, and it takes us along through the magnificent, beautiful scenery of the american wilds. the first time i played this game, i purposefully avoided any spoilers prior to it, and it paid off immensely. you slowly see the gang unravel as more and more things arise and more problems happen and i remember that i just wept like a babe at the tail end of the storyline. i get back to this game because it's a wonderful story. it's compelling, the game itself is beautiful, the characters are amazing and it's just so damn good to experience it. if you're not feeling the story, go do some hunting, or other fun activities. i recommend this game because it's just got everything of what's good in a story. even if you haven't played red dead 1 yet much like myself, though i mean to now that it's on pc, this game will toss a lasso around your neck, drag you through the streets and leave you begging for more of it. 1010 game. if at any point you develop coughing through your playthrough, see a doctor immediately and avoid any stags."
Action,Red Dead Redemption 2,2025-03-18,"it takes a while to get used to the controls and you will hate it at first, but once you figure out how the controls work, you will love this game."
Action,Red Dead Redemption 2,2025-03-18,this game withstands the test of time. i come back to it every few years and it never gets stale.
Action,Red Dead Redemption 2,2025-03-18,best character development i've ever seen and insane details. game made me cry multiple times. just wish you could beat up micah in camp
Action,Red Dead Redemption 2,2025-03-18,"even though its old, still a fun game. the online is so much fun"
Action,Red Dead Redemption 2,2025-03-18,"never have i ever played a game quite like this one. i can go on and on about how unique this game is, with its story telling, atmosphere, music, game mechanics and much more. this game has definitely left a mark on me and has stood out from the 100s of other games out there. this is a game in which there was passion and love behind everything done. this game can truly be called an artistic wonder. 1010 would recommend this game in a heartbeat."
Action,Red Dead Redemption 2,2025-03-18,"graphics are incredible, the story and game play are captivating for hours. i love the freedom and open world that you can explore at all times. 1010 experience"
Action,Red Dead Redemption 2,2025-03-18,"its a fun game !! not my usual choice, but i'm game !! also know a couple others that i work with that play this game !!"
Action,Red Dead Redemption 2,2025-03-18,"the game was not what i expected, i was expecting high paced action. while the game does have its fair share of fast paced action, overall this game is very paced and slow. they are creating immersion in a wild west and it is incredibly fun once you buy into that experience. i only play single player and i am loving it so far."
Action,Red Dead Redemption 2,2025-03-18,this game can very much be a masterpiece. i cant say though as all i experienced was sound cracking from the start. was tinkering with windows settings that made it disappear for 15 minutes then returned. heard this game does not like usb headphones. shame as that is what i have and its the only game that does this to me. on top of this it requires rockstar account and with all this ubisoft ea bethesda2k launchers having to update itself nearly every single time i wish to play any game feels like a chore.
Action,Red Dead Redemption 2,2025-03-18,"a mastepiece, all open world game should be like this the world of rdr 2 is so alive so far this game has the best game i ever play best story best gameplay and the best detail game i ever play absolute cinema"
Action,Red Dead Redemption 2,2025-03-18,"probably the best game i have ever played. the story is so good it made go outside more. there is so much to do, and the open world is so immersive. it can also be a bit goofy especially when using mods which is only capable when playing on a pc."
Action,Red Dead Redemption 2,2025-03-18,you know it was good when you spent hours entertaining yourself with the open world without doing any story missions
Action,Red Dead Redemption 2,2025-03-18,"awesome graphics,best storyline"
Action,Red Dead Redemption 2,2025-03-18,finally had a chance to play after procrastinating for years. it's too damn fcu!ng fun.
Action,Red Dead Redemption 2,2025-03-18,"be prepared to feel all the emotions, one of the finest games i have ever seen, the story is 1010"
Action,Red Dead Redemption 2,2025-03-18,"rdr2 is a stunning openworld game with a gripping story, breathtaking visuals, and immersive gameplay. arthur morgans journey through a dying wild west is unforgettable, though the pacing and controls might not suit everyone. a solid 910."
Action,Red Dead Redemption 2,2025-03-18,i got a little bored with horses and installed the dmc delorean mod. i'm traveling through the wild west with my car and experiencing the back to the future 3 movie. it's pretty good. atlardan biraz skldm ve dmc delorean modunu kurdum. arabamla vahi batda seyahat ediyorum ve gelecee dn 3 filmini deneyimliyorum. olduka iyi.
Action,Red Dead Redemption 2,2025-03-18,"not sure what else i need to say that all the other positive reviews have already said. and what's worse is once you pick up the game and play through the story for the fist time, it'll only raise your standards for how a game should feel to play, how a game should evoke emotions in players. i've played many games, watched many movies and tv shows and have seen many characters liked, loved, hated, and despised throughout them all. and none of them, and i mean not one has ever brought me so much emotion, or even brought me to actual tears the way red dead redemption 2 did with the story of arthur morgan. on one side of the coin i hate this game because of the fact that i'll likely never have a game make me care this much about a character again because it shows that games can reach this level of design and i think that's something more story games should strive for. but on the other side, i love this game for doing it this well because not only is it the first game to make me feel this way for a character. and in the end, the only real downside i can say i have with this game, is that i can't play it again for the first time."
Action,Red Dead Redemption 2,2025-03-18,"beautiful graphics, interesting story line. worst save system and pc interface i've ever encountered. for example... saved and exited as soon after the bear hunt as the game would let me. came back to the message that i'd abandoned the legendary animal no recourse except to play the dang mission again. full on garbage! interface issues like having the weapon i wanted out only to have the game decide i should use something. random equipment reallocation, trash ability to store things for later, you know like the chest at camp. don't answer an npc.... he shoots at you and when you kill him in self defense you are the guilty party. glad i bought the game on sale, wished i could get my money back"
Action,Red Dead Redemption 2,2025-03-18,this game is very good. good story good graphics and good story. this game is 100 good.
Action,Red Dead Redemption 2,2025-03-18,"a masterpiece of storytelling and immersion, a mustplay for narrativedriven players, offering a poignant, unforgettable experience."
Action,Red Dead Redemption 2,2025-03-18,"it's a great game, great graphics, great story. would recommend."
Action,Red Dead Redemption 2,2025-03-18,my friends recomended this game to me at first i thought i wasnt gonna like it but my first hour into the game i was in love with it has a great story really recomend this game in my top five tierlist
Action,Red Dead Redemption 2,2025-03-18,this game has taken over my life outside of school. best game ever details insane storys great 1010
Action,Red Dead Redemption 2,2025-03-18,"i love this game, its incredible. the story makes me sad, online makes me feel things i havent felt since sliced bread, and the gameplay is just fun. 10010 would recomend"
Action,Red Dead Redemption 2,2025-03-18,"gameplay is amazing, story and narrative is very compelling and i really got into it when i first played it! thank you rockstar games!"
Action,Red Dead Redemption 2,2025-03-18,"fantastic story mode, online is full of hackers so watch out"
Action,Red Dead Redemption 2,2025-03-17,"it has an awesome openworld gameplay. you can play with honor and dishonorable, after completion, you can keep playing! the story line really pulls you in"
Action,Red Dead Redemption 2,2025-03-17,"knew about the game for a long time finally got a piece of hardware good enough for it. all i can say, dang, this is, truly unmatched, a absolute masterpiece."
Action,Red Dead Redemption 2,2025-03-17,one of the best video games ever made with an amazing story and an extremely realistic world.
Action,Red Dead Redemption 2,2025-03-17,"the real goal of the game is to listen for gunshots, then rush towards them. if you find a player that is in a shootout, loot all of the bodies before they can, it's free money and they can't stop you. grief, as always, is primary gameplay  just like eve online."
Action,Red Dead Redemption 2,2025-03-17,graphics  you forget what reality is  beautiful good decent bad dont look too long at it msdos  gameplay   very good good it's just gameplay mehh watch paint dry instead just don't  audio  eargasm  very good good not too bad bad i'm now deaf  audience  kids teens  adults grandma lizards  pc requirements  check if you can run paint potato  decent fast rich boi ask nasa if they have a spare computer  game size  floppy disk old fashioned workable big  will eat 10 of your 1tb hard drive you will want an entire hard drive to hold it you will need to invest in a black hole to hold all the data  difficulty  just press 'w'  easy easy to learn  hard to master significant brain usage difficult dark souls  grind  nothing to grind only if u care about leaderboardsranks only in online mode isn't necessary to progress average grind level too much grind you'll need a second life for grinding  story  no story some lore average good  lovely it'll replace your life  game time  long enough for a cup of coffee short average  long to infinity and beyond  price  it's free! worth the price  if it's on sale if u have some spare money left not recommended you could also just burn your money  bugs   never heard of minor bugs can get annoying ark survival evolved the game itself is a big terrarium for bugs  ?  10  1 2 3 4 5 6 7 8  a new challenger has appeared 8.5 9 10
Action,Red Dead Redemption 2,2025-03-17,"honestly, i found rdr2 hard to get on with for the first 2 or 3 sessions i played it, the controls are mildly janky to a new player. however, after i got past that sticking point, i began to really enjoy all the aspects of this game, and have spent many hours on it. excellent story, although if i were to make one complaint, it would be that some plot points that you think would be talked about amongst your camp mates, or be made more of a point of, just isnt, and i think that sort of takes you out of the emmersion slightly. it did for me. regardless, the story is still fantastic, the game is fun, and has a lot of twists and turns that kept playing exciting. also has fair potential for replay value. would def recommend."
Action,Red Dead Redemption 2,2025-03-17,"still stunning, although old. amazing story and immersive play, especially the hunting!"
Action,Red Dead Redemption 2,2025-03-17,"best game ever, bought it twice bought it on pc for mods and played story on xbox before that 1010 in almost every aspect. ive replayed it 4 times, perfect game."
Action,Red Dead Redemption 2,2025-03-17,"incredible story, out of this world, if only all games where made with this much dedication"
Action,Red Dead Redemption 2,2025-03-17,"great game, amazing graphics, love the gameplay and story line, perfection"
Action,Red Dead Redemption 2,2025-03-17,i really love the world that the game brings to me because it's so realistic. it immerses me in it for hours without getting bored. the money spent is truly worth it.
Action,Red Dead Redemption 2,2025-03-17,"this game was so perfect 1. immersive world red dead redemption 2 offers one of the most immersive open worlds ever created. from the vast, beautifully rendered landscapes to the small, intricate details like the way npcs interact with each other, it truly feels like youre living in the wild west. the level of attention to detail is incredible, making it easy to get lost in its world for hours. 2. engaging story the story is one of the most gripping in modern gaming. with unforgettable characters like arthur morgan, the game tells a tale of loyalty, survival, and morality. the emotional depth and wellwritten dialogue will make you care deeply about what happens to the characters, especially with the choices you face in the narrative. 3. phenomenal voice acting and animation the voice acting in red dead redemption 2 is stellar. every character feels fleshed out, with voices that match perfectly with their personalities and backstories. coupled with the fantastic animation and motion capture, the game is visually and emotionally stunning. stunning visuals the game is simply beautiful. whether you're riding across vast plains at sunset, traversing snowy mountains, or sitting by a campfire under the stars, the graphics are breathtaking. the level of detail in the environment, character models, and lighting design is exceptional. 4. dynamic gameplay and freedom the game gives players a tremendous amount of freedom. whether you want to follow the main story or just explore the wilderness, theres always something to do. you can hunt, fish, rob trains, or simply enjoy the stunning views. this flexibility keeps the gameplay fresh and exciting. 5. immersive sound design the sound design is another standout feature. the soundscape, from the wind rustling through the trees to the echo of gunshots, adds so much to the realism. the soundtrack, which includes sweeping orchestral pieces as well as more somber, reflective tracks, complements the games atmosphere perfectly. 6. robust online mode red dead online adds even more value to the game. it allows you to explore the world with friends, complete missions, and engage in pvp and cooperative activities. the experience is vast, and rockstar continues to update it with new content, making it feel fresh even after completion of the main game. 7. incredible detail in every aspect from interactions with animals and npcs to the weather systems and ecosystems, everything is thought out. the level of realism is so high that it sometimes feels like you're interacting with a living, breathing world, and every decision you make can have ripple effects."
Action,Red Dead Redemption 2,2025-03-17,the damn game crashes once i enter story mode.
Action,Red Dead Redemption 2,2025-03-17,"the most immersive and beautiful game i've ever played. the level of detail is beyond anything else. i love the ability to go slowly and savor actions like picking herbs, fishing, or hunting. and the story is incredibly moving."
Action,Red Dead Redemption 2,2025-03-17,"my all time favourite single player story game. graphics, gameplay, and atmosphere are all 1010"
Action,Red Dead Redemption 2,2025-03-17,the story line of this game is amazing! probably the best video game i've played in my 52 years on this earth. there are a few bugs still in the game but you'll have that with almost any game. but the story... the story is simply awesome! i want more! more games like this please! thank you kindly rockstar games!
Action,Red Dead Redemption 2,2025-03-17,i absolutely love the details in this game and just how much you can do. online is a little lacking but the story is so full of content!
Action,Red Dead Redemption 2,2025-03-17,amazing game play and graphics and very good story
Action,Red Dead Redemption 2,2025-03-16,"one of the best solostory type games i've ever played. but the multiplayer is terrible and filled with cheaters in my own experience, i'm sure there are cool private servers out there for it though. but i would say the campaign or whatever is worth it alone."
Action,Red Dead Redemption 2,2025-03-16,"100 recommended, from the people who want a story that is very flexible and powerful to the people who want to go guns and blazing or stealth, i feel even the fact that rockstar games made this was enough for me to say take my money, then you look at the trailer aswell. 1010 rockstar, another masterpiece as usual"
Action,Red Dead Redemption 2,2025-03-16,yes it has a good experience wheather its story or online and it has a good ecploration system its really good as it was released in 2018 for its grapgics and physics.
Action,Red Dead Redemption 2,2025-03-16,good game satisfied my high expectations though difficult for it to not get spoiled by the toxic ahh community
Action,Red Dead Redemption 2,2025-03-16,"fun game, i real like it, but i am never doing the quiet time mission. i'd rather play every game in the world over and over, before i even look at that mission. i really recommend this game for ppl who like farming and killing games"
Action,Red Dead Redemption 2,2025-03-16,the best story ever written for a video game. hands down. it's so good you cannot pass up the opportunity to binge this game.
Action,Red Dead Redemption 2,2025-03-16,"after 200 hours of game play, the rockstar launcher wants a verification code from an email i have not used in over a decade. during my 200 hours of game play, i did not sign in with the old account when playing red dead 2. i do not play online, nor do i use the social club. i cannot use my rockstar account that is connected to the email i use. there is no way in steam to change what rockstar account is linked to my steam account. steam support has no options that can resolve this issue, nor do they have a way to speak to a human about said issue. rockstar support is awful. edit rockstar support requires you to know the monthdayyear that you linked accounts. i do not have a photographic memory, and cannot access the email to look at the exact date. they close the ticket without offering any suggestions as to how to find the information they require."
Action,Red Dead Redemption 2,2025-03-16,do you like to burn time with one of the classic games? this is the game the story is rich but the side quests and the free roam is better. just buy the game when there is a sale or you will be bankrupt
Action,Red Dead Redemption 2,2025-03-16,"lennnnnnnnnnnnny!!! peak singleplayer story game, probably will be the greatest one for a while. multiplayer is also entertaining and fun, but the singleplayer story is just better."
Action,Red Dead Redemption 2,2025-03-16,"runs great but the ray tracing cards, and ray tracing in general, is bs... don't even get hooked because you think you can run it with this stuff enabled as if it's going to revolutionize your gaming forever... just enjoy the wellput together game and story, and have fun. online mode is a meh, and mods are meh, but i haven't bothered that much with them. toodles."
