genre,game,commented_date,comment
Action,Red Dead Redemption 2,2025-02-26,"thought i was getting a fun cowboy game. instead, i got an emotional masterpiece that set my gaming standards to an unreachable level. thanks, rockstar i guess. now no other game feels good enough. 1010"
Action,Red Dead Redemption 2,2025-02-21,"b this game is perfect from the getgo to the last scene. i got 100 completion, and it was worth every minute spent b at the beginning of the game, arthur is a tough cowboy, an outlaw through and through. but as the story goes on, he starts looking at his life from a different angle because of certain circumstances those whove played know what i mean ive watched a lot of rdr2 cast panels, and only roger clark arthur morgans actor had been working on the game for five years straight, which is incredible!"
Action,Red Dead Redemption 2,2025-02-23,"the best narrative game i've ever played, a perfect prequel and an amazing experience. took me 94 hours to finish and i didn't even play all available side content."
Action,Red Dead Redemption 2,2025-03-12,"this is, without a doubt, one of the alltime greatest storydriven games i have ever laid my hands on. i've played a bunch of them and let me tell you that this one will take you on a ride that you wouldn't want to miss. it starts slowly, which may put off some people, but it quickly picks up after the snowy region. the map is huge, full of secrets and treasures. there are over 200 species of animals combined. the weapon variety is also impressive. there are many minigames to choose from. every character in the camp is complex enough to make you care and sympathize with them. some side missions can feel like the main storyline at several points. the world scenery and game mechanics are just incredible. all of this is amazing and already over the top for a game, but the primary protagonist you control takes the cake. arthur morgan is one of the bestwritten characters in all rpgs. he is a deeply flawed man who made some pretty rough decisions in his life. since he is a teen, who takes an example from his outlaw father, to the time when he is found by the gang, he goes against the newly emerging societal norms in the wild west. but most of all, he always believes in dutch and the gang. he does everything for them  he lives, he murders, he robs. and when this is put to the ultimate test, against the clock, his true redemption begins. you will find that behind this immaculately strong personality, there is a scared man. of what he is, of what he will become. after this point, you will begin to realize what i'm talking about and why arthur is so loved by the entire community. he is not perfect, no one is. but he tries his best. take your time to experience this game. once you finish it, there won't be a second playthrough like the first."
Action,Red Dead Redemption 2,2025-02-24,"genuine masterpiece, unforgettable. this is a game i got completely and totally lost in, i fell in love with the world and the characters and the beautiful way it uses the gameplay to reinforce the narrative. the soundtrack is so phenomenal, and the writing is actually perfect. genuinely several of the best gaming moments of all time are in this game. the ride back after guarma i will never forget. arthur morgan is the best video game character of all time, hands down. the way the game makes you sit with him and shows you how he feels both through writing, gameplay and missions is genuinely a marvel and i don't think i'll quite play or experience anything like this ever again. it took me a while to get into it, the start is slow and feels a little aimless at first. my girlfriend recommended i push on with it and i am so glad i did. the best game i have played in my life, bar none. the story told here could not be done in any other medium, this is what a big aaa game is meant to be. genuinely inspiring and i can only pray i'll play something half as impactful as this again."
Action,Red Dead Redemption 2,2025-02-21,"rdr2 is an incredibly immersive wild wild west experience, drawing players into its richly detailed world. every aspect feels so alive. looking forward to gta6 with same level of quality and attention to detail.  coming from epic i was able to transfer all my progress to steam."
Action,Red Dead Redemption 2,2025-03-05,"unfortunately, i can no longer play this game due to login issues with the rockstar launcher. out of nowhere, rockstar required me to verify an unfamiliar email on their launcher. despite multiple backandforth messages, they have been unable to resolve the issue. bewarethe game works fine until it suddenly doesnt, all because of problems with the rockstar launcher. i am hoping that steam will get rid of this third party launcher applications soon."
Action,Red Dead Redemption 2,2025-03-16,"i've been playing this game very slowly as if i were arthur, each day going out doing a little quest, hunting, gambling etc... taking each and every second slowly as it comes. a fantastic offline single player escape."
Action,Red Dead Redemption 2,2025-03-13,"best western game ever maden, without doubts. i haven't played much online, i was focused on story. loved characters, van der linde gang, too many missions and side quests of camp or random characters made me fully immerse into wild west life. besides huge open world with different amazing locations makes satisfaction when you simply riding the horse. at first it reminds about gta cuz both games are from rockstar, but for me it's more similar to mafia series where story is more important part of game."
Action,Red Dead Redemption 2,2025-03-15,"great game. entirely ruined by rockstar launcher, even in story mode"
Action,Red Dead Redemption 2,2025-03-16,"not able to play this game, since my steam account is linked to the rockstar account, which is using my old email address and i'm unable to reset that, customer service didn't do me any good either, so i had to refund the game. i know it's a great game, but i'm just not able to play it so no can do"
Action,Red Dead Redemption 2,2025-02-28,"best game ever made. blind buy. do not wait for a sale. length 35 hours. the only con is that there is a lot of horseback commutation but it gets compensated for by the beautiful scenery and graphics. 1010, highly recommended."
Action,Red Dead Redemption 2,2025-03-17,"amazing story with some impactful choices, amazing characters  amazing stylevibes. the gameplay is quite slow  very deliberate but it commits to the bit so much that i respect it even if it's frustrating at times mods really help with it tho. you are a good man arthur morgan"
Action,Red Dead Redemption 2,2025-02-28,"i really enjoyed this game. the story was good a little slow at times though. i love how this game looks and all the realism, you really feel like your a cowboy. i can't get enough of just riding around and enjoying the view!"
Action,Red Dead Redemption 2,2025-03-03,"truly one of the most immersive games i have ever played. the story is simple, like a crescendo to catastrophe, yet the characters even npcs are almost as complex as real people, with each carrying their own burdens, stories, and flaws. their interactions feel deeply human, and your choices will have consequences. the world in red dead 2 is astonishingly beautiful, almost close to real life, and the graphics are equivalent to, if not, better than the current aaa games' standards. the only bug i noticed is when you're riding a horse, sometimes the movement gets messed up when you switch from first person to 3rd person. but other than that, it is a masterpiece."
Action,Red Dead Redemption 2,2025-03-01,"this game is literally a fever dream of cowboy romanticism. riding through dusty sunlit walleys, listening to a harmonica at a sundown, purple skies, storms, distant flickers of lanters, winds through threes, this world breathes on its own. so many times i felt like i'm not the main character, but the whole world is. rockstar really knows how to make games feel alive. everything feels slow, it's not type of game that holds your hand, things just happen, and when you start caring and being involved you realise it's not only about the story, it's about the whole idea of the west. moments where you realise all characters have their own lives, you see struggles in them, things unfold with or without you. every single town, every road, all feels so so real. and what hurts is the realty that time changes people, and you loose those same people. i love the idea that every choise that you make is somewhat heavy, not because the game is like ''this will affect the story in this way or that way'', but because you constantly wrestle with who you are and who you could be, because you're an outlaw, and sadly halfway through the game i realized you don't try to save west, you kinda witness it's funeral, and your journey isn't just a personal one, you just witness an era that was actually never ment to last. gangs fall apart, dreams collapse, people go and west fades as well. for me, red dead 2 is flawed, messy, slow,stubborn, but thats the point, just like people and times it portrays, and that's what makes it a masterpiece. hands down the best game i played in my life."
Action,Red Dead Redemption 2,2025-03-18,"for reasons unknown, you have to use the rockstar launcher to play this game and it's a coin toss whether or not the launcher will work. there's no way to play the single player part of this game without being able to connect to the rockstar social side of things for some damn reason. i have absolutely no desire whatsoever to play games with a bunch of people online. i play video games so i can not be around people. why the fuck can't i play this game without being connected to some stupid social club bullshit that i have no interest in? i don't regret buying this game, the short time i was able to play it was fun but for fuck's sake, don't make me have to be a part of some social club for a single player game. i expected better from rockstar."
Action,Red Dead Redemption 2,2025-03-19,"one of the greatest games i have ever played, intriguing story, fun gameplay, and a bittersweet ending. a true masterpiece."
Action,Red Dead Redemption 2,2025-03-18,this game is like if if you go to the beach and it is sunny and nice and the the drinks are so cold that your hands get cold and all your freinds are happy your there. but there is one rat there witch makes you sooooo happy of this game
Action,Red Dead Redemption 2,2025-03-18,"pretty good, basically horsey riding simulator, with a little bit of action."
Action,Red Dead Redemption 2,2025-03-17,rockstar and their stupid sign in bs is infuriating. why should i have to sign in to 4 different logins just to play a game offline by myself? what happened to buying a game and then getting to play that game? i refuse to play game that does this crap. if rockstar wants to make playing their games difficult then i wont bother playing.
Action,Red Dead Redemption 2,2025-03-17,"great pacing, feeling like im connecting with nature, even tho im rotting in my room"
Action,Red Dead Redemption 2,2025-03-16,"story mode is amazing, but online mode can not be played enjoyably due to all the hackers."
Action,Red Dead Redemption 2,2025-03-16,"giving rockstar's red dead redemption ii all the love it can get because damn what a masterpiece is this. at the moment of writing this review, i'm only 2 hours into the game, yet it feels like a much longer but so wonderful yourney. this is a must have for everyone who loves beautiful graphics, story and characters."
Action,Red Dead Redemption 2,2025-03-16,"this game is on a different level than the others. because it is much more beautiful, more realistic and the story is perfect. i recommend this game to everyone."
Action,Red Dead Redemption 2,2025-03-16,"got nostalgic and decided to play the game for the first time this year. i press shifttab to open the steam overlay and see that i have been in the game for 7 minutes. 7 minutes and i had already met a fucking modder. the story mode is a masterpiece, but the online part of the game is unplayable. get your shit together rockstar. and just to be clear, the modders were also the reason i had not played in a while. so it is not just that i got unlucky once and am basing my review on one experience. this has been going on for way too long."
Action,Red Dead Redemption 2,2025-03-15,i came across the kkk holding a promotion ritual of sort where they light a cross on fire. the fire spread to some of the hooded members and they started running around screaming in agony as i watched it happen on the sideline. after some of them had burned to death i told the blackhooded leader that they had it coming and the game rewarded me with honor. 65 would watch kkk members burn to death again and tell them that it was karma.
Action,Red Dead Redemption 2,2025-03-14,"red dead redemption 2  a masterpiece with dark sides the story of red dead redemption 2 is absolutely breathtaking. arthur morgans journey through the wild west is one of the best narratives ive ever experienced in a video game. the characters are deep, the dialogue feels authentic, and the atmosphere is so rich that you truly feel transported back to that harsh era. the graphics are stunning  whether youre riding through snowy mountains or getting lost in the swamps of lemoyne, everything looks incredible. its especially impressive that rockstar used reallife locations as inspiration. on top of that, there are countless easter eggs that make the world feel even more alive. but unfortunately, the fun ends as soon as you step into the online mode. rockstar has completely abandoned it. the servers are a disaster, crashes happen constantly, and when you do manage to get into a lobby, theyre often full of modders who take the fun out of everything. prime rewards? forget it  you just dont get them. it feels like rockstar has given up on the online mode entirely and couldnt care less about the community. on top of that, some gameplay decisions are pretty questionable. the horse handling is overly realistic, sure immersion is great, but when you go flying over the reins every time you hit a tiny rock, it gets frustrating. especially compared to the first game, a lot of things feel unnecessarily clunky, even though rdr1 already nailed so much of the gameplay. rdr2 is an absolute must for story lovers and western fans but if youre looking for online action, youre better off playing something else. i can only recommend it for the story only."
Action,Red Dead Redemption 2,2025-03-14,do i really need to explain to you why you should buy this game? as of writing its on spring sale for 15. quit reading my damn gibberish and buy the game. you wont regret it and itll be one of the best purchases youve ever made. hands down despite my hours on steam i can tell you this much this game was made with passion and love that you really dont see with modern games nowadays it has the best story im sure weve all heard of it by now and if you havent an even better reason to buy the game. a superb soundtrack seriously if you havent at least heard one song from rdr2 even without knowing the game id be surprised tight and amazing gameplay an amazing and wild setting well written and deep characters fun easter eggs and a boat load more no not the boat that will get us to tahiti boy! anyways do yourself a damn favour and buy this game. its worth every dime
Action,Red Dead Redemption 2,2025-03-13,"probably the best story in all of fiction, very interactive with its environment and characters. like able main casts. arthur morgan is goated, his redemption arc is defined with the color red"
Action,Red Dead Redemption 2,2025-03-12,this game is cool but the online so many modder
Action,Red Dead Redemption 2,2025-03-08,"man oh man, where do i even begin. i finally decided to play this game in 2025 for the first time and after completing the main story, i can say it's easily the best game i've ever played. in fact, i don't think there's a lot of games out there right now that even comes close to the quality of this masterpiece. the main story is captivating, emotional and unpredictable, even the side quests are enjoyable and never feel like a filler. the visuals, despite being released in 2019, still looks better than many newer games. most games often struggle to make you remember names or care about the ingame characters, but this one does it effortlessly. the voice acting is exceptional, capturing the emotions and bringing the characters to life. overall, this game is an easy 1010. it's a complete, immersive experience that sets a new high benchmark for my gaming standard."
Action,Red Dead Redemption 2,2025-03-06,1010 .  gameplay   boring  rock paper scissors  fun  hmm..........  entertaining  ace  godlike  difficulty   my grandma could play it  easy  normal  hard  a challenge to be reckoned  graphics   ms paint  bad  meh  normal  very good  an original artistic direction  beautiful  masterpiece  story   this game has no story  some lore  it's there for people who want it  well written  leading to more indepth researchesthoughts  a model to get inspired by  length   0 no story  short  average  long  to infinity and beyond  music   just filling noisesno music  trivial and uneventful  good andor fitting the game's artistic dispositions  memorable  transcending whispers of a forgotten world  interest   i would rather watch paint dry  hard to enjoy  repetitive andor uninspired  a good moment  sticking out of the pack  you will remember it long after  replayability   a onetime experience  only for achievements  if you wait a few monthsyears or with mods  definitely  infinitely replayable or almost
Action,Red Dead Redemption 2,2025-03-04,"easily the greatest story game ever made by mankind. such amazing designs of nature, buildings, characters etc. the story is filled with details that you will most definitely not notice during your first playthrough. i find this great as your second time playing through the story will be as much fun if not more fun than your first time. i usually get a ton of bugs when i play other games, but red dead redemption 2, no. the game runs smoothly and doesn't ever feel boring. the world, though very much just filled with nature still feels so alive. it feels so open and full of life. you can interact with everyone and stumble upon different situations out of nowhere. your decisions really matter to the game, as you have a honor system that follows every move you make. the npcs are really great and unique. other games like gta v has npcs that feel repetetive and boring, as you can't really do much with them. this game really makes the npcs not feel that robotic, something that you will come to enjoy. now back to the story. the side characters are absolutely amazing. i have played through the story mode of gta v and i find the difference between characters there and here to be huge, in the matter of fact, it's almost laughable. the characters in red dead are filled with personality and are so interesting. they all have their unique background while also seeming relatable. the characters are so great in fact that you feel personally tied to them, and their emotions really gets to you. the missions are also quite fun and really does fit the typical scene of rockstar games. all them years i went not knowing much about red dead, as i never play story games, but after thousands of reccomendations from friends, i finally gave it a try. i can confidently say that it is an amazing game that everyone should try. my review alone is probably missing a 100 different things that also makes this game so great. and for the love of god please don't get your whole social media filled with red dead 2 videos while playing through the game for the first time, as you will most likely get spoiled, something that is not fun. enjoy"
Action,Red Dead Redemption 2,2025-03-04,"if you're a person who is looking for a game that has deep story, beautiful graphics and some funny moments, i would really recommend rdr2."
Action,Red Dead Redemption 2,2025-03-03,ohh i can't explain how good is this if you think this western thing in games it's a problem try this yourself i has so good graphics and the graphics are literally perfect and the psychics are soo good it's like real life try the game yourself and you will see...
Action,Red Dead Redemption 2,2025-03-02,"the story is fire. the graphics are also fire. but man the realisem of this game is crazy, like i dont know any other game with this amount of realisem. just look at the wildlife or the hydrology of this game, you can follow every little stream and have a meaningful connection to a bigger river, there are even dried up waterbeds and rivers where water once flowed and carved into the landscape but its dried up now, how cool is that? would definitely recommend it."
Action,Red Dead Redemption 2,2025-03-01,"awesome game! the story and for that sake the world is definitely slower paced, so it won't be for everyone. it's very easy to sink 100200 hours plus on the story alone."
Action,Red Dead Redemption 2,2025-02-28,10  10 story 3  10 online if your new
Action,Red Dead Redemption 2,2025-02-28,"this game is, by far, my favourite game of all time. nothing will ever top it for me and i will recommend it to everyone who asks. however, it does have an incredibly frustrating habit of crashing as soon as i load it up every now and then last time it did this was 8mo ago, leading me to uninstall it  then redownload it... which takes 12hrs for me. very annoying but not enough to stop me from loving it"
Action,Red Dead Redemption 2,2025-02-28,"i have had this game for a year and 5 months and have 271 hours on it, i can start by saying it is my favorite game. if you are not convinced if you should buy it or not, let me help you. i will be sharing my points of view on the story, online play, graphics, and some experiences. first of all, the story of the game may seem long at first, try not to skip through it and don't get spoiled. take your time to enjoy it at it's fullest. my mistake was trying to finish it as fast as possible. i only did the main quests and did not focus on the secondary ones. the story is well thought and each action has an impact on it. it can be very random at times but that's what is interesting. the more you spend time in story mode the more you get attached to the characters and are really brought in the universe. the whole plot is so captivating. secondly, online play. at the start it can seem very confusing, it was for me. when i started i had spawned in a forest and had no idea what to do, i stole a horse and ended up in valentine where i instantly got killed. that made me go back to story mode and i came back to online after 5 months. make sure to use a vpn if you do not want people to see where you are. people cannot access your ip address unless they are modding the game. most servers have at least a modder in them. most of the modders are just trying to ruin other's gaming experience by using diverse weird actions like making your horse shoot fire out of it's a or simply just crashing your game. but some modders can be nice and leave you in peace. once you are advanced in online it may become boring but the character costumisation can be fun. you can join a posse and fight another one. there's lot's of events in which you can participate in. there's roles which you can develop and get rewards . or you can just join a huge fight in valentine. the graphics are amazing, especially if you take in account that the game was released in 2019. even if you run the game in optimal, you get to benefit of great graphics and a beautiful scenery. sometimes i just like to stand somewhere and enjoy the views i should probably be doing this in real life. the graphics bring the game such realism which makes the gaming experience wonderful. in story mode it just makes it even more great than it already is. i have met a lot of great people through this game, even if the ages can be very different everyone just gets along. probably one of my best gaming experiences was to integrate a group of red dead redemption players which has only last for some months but it was the funnest times. so many of our inside jokes have stuck to me and i would like to thank them for the times together. i definitely recommend this game, hope this helps!"
Action,Red Dead Redemption 2,2025-02-28,"i only play it for the horses and have it modded to be more as a horse gamehorseback riding simulator, and i absolute love it. the world is so incredible beautiful, it's insane. very much recommended! httpsyoutu.be1qip6ne2wni?sivlghz3636p0opfr"
Action,Red Dead Redemption 2,2025-02-28,"red dead redemption is nothing short of a masterpiece!!! from the moment i started playing, i was completely immersed into its world. its emotional, powerful, and deeply human every choice feels meaningful, every moment feels earned. rockstar has created a world so rich and alive, you can't help but get lost in it. the landscapes are jawdroppingly gorgeous, the characters are unforgettable, and the music lingers long after youve put the controller down. this game isnt just a game... its an experience, a true work of art. red dead redemption is, without a doubt, one of the greatest games ever made. i can't stop thinking about it. simply incredible! now waiting on rdr3!!! rockstargames rockstargames rockstargames"
