genre,game,commented_date,comment
Action,Red Dead Redemption 2,2024-09-04,"i never noticed the differences in their sketches... rdr2's attention to detail is mindblowing, man"
Action,Red Dead Redemption 2,2024-08-09,"one thing that can split them, who is the more ruthless?"
Action,Red Dead Redemption 2,2024-10-05,when you see a video from 5 years ago but instead of seeing 2015 you see 2018
Action,Red Dead Redemption 2,2024-08-09,its 50 until we pull up who lived longer
Action,Red Dead Redemption 2,2024-12-24,the deadeye sound for john is the same in rdr1
Action,Red Dead Redemption 2,2024-08-09,also theres a theory why john closes his left eye when aiming its cuz in colter he was attacked by wolves and in his left eye so he is blind in that eye
Action,Red Dead Redemption 2,2024-11-06,i feel like johns and arthur's dead eyes show what they are feeling when they shoot john is calm and collected with a slow heartbeat while arthur feels he needs to be fast by the ticking time
Action,Red Dead Redemption 2,2024-08-09,everyone forgets john is blind in his left eye
Action,Red Dead Redemption 2,2024-09-26,"i love both night in the woods and rdr2 for doing some sort of personal journal that the characters draws and write themselves physically, and i wished more games do this. it's much better and immersive than the game that tries to do this but just write a log in the menu screen and its just typed it in there."
Action,Red Dead Redemption 2,2024-08-06,so is john just worse than arthur?
Action,Red Dead Redemption 2,2024-09-26,arthur's dead eye sound has a clock ticking behind meaning he has not much time and die and in john's case there is heart beating meaning he will love in the game
Action,Red Dead Redemption 2,2024-08-09,john still better
Action,Red Dead Redemption 2,2024-10-28,the drawing difference is the coolest one to me.
Action,Red Dead Redemption 2,2024-11-26,the dead eye sound changes with honor.
Action,Red Dead Redemption 2,2024-10-15,"the ticking clock signifying arthur's dwindling time left on earth, compared to the beating heart signifying john's love for his family. such well done but minor differences"
Action,Red Dead Redemption 2,2024-09-05,"this is why after years, i still stay at chapter 2"
Action,Red Dead Redemption 2,2024-11-08,"hot take, john was a more iconic rdr character because he was first and the im still standing scene"
Action,Red Dead Redemption 2,2024-09-02,arthur will always be the best and always have a place in my heart. i started playing the game probably a week ago. im trying to do it as slow as i can because i dont want the end to happen and i noticed theres a couple ways it can happen one where he passes on looking at the sunto he gets stabbed by the douche he gets shot in the face by the douche in the same place that the first one happened. it depends on your honor level. im hoping i get the first one. i did the scene. i watched last night of charles going down finding him and making sure he buried him.
Action,Red Dead Redemption 2,2024-09-07,i never noticed the deadeye difference until i watched this. that clock ticking in arthur's deadeye make me tear up. imma go cry in a corner now bye.
Action,Red Dead Redemption 2,2024-09-16,they kept that dead eye sound for john
Action,Red Dead Redemption 2,2024-08-19,probably because he cant swim riveting use of logic there lol
Action,Red Dead Redemption 2,2024-09-24,also when arthur is running out of deadeye theres a clock sound reffering to his limited time and john has a hearth beat reffering to his love to family
Action,Red Dead Redemption 2,2024-09-04,this game has been out for a while now and its still things been discovered amazing stuff rockstar did
Action,Red Dead Redemption 2,2024-11-30,the ticking time dead eye i feel like would have a quote of times up. or be quick or die. then the heart beat dead eye would be my life depends on this. or its kill or be killed.
Action,Red Dead Redemption 2,2024-09-30,dead eye sound of arthur is goosebumps
Action,Red Dead Redemption 2,2024-10-03,the sad part about arthurs dead eye is its a ticking clock counting the time he has left resembling he doesnt have much time left
Action,Red Dead Redemption 2,2024-11-24,"timestamps!!! chapter 1 000000  outlaws from the west 002509  enter, pursued by a memory 004533  the aftermath of genesis 010327  master hunter 1 start 010505  old friends 012927  who the hell is leviticus cornwall? 014002  weapons expert 1 start chapter 2 014926  eastwood bound 021004  master hunter 1 complete 021209  sharpshooter 1 startcomplete 021305  herbalist 1 startcomplete 021649  herbalist 1 start 021806  a test of faith stranger start 023242  all that glitters stranger start 023253  who is not without sin 023828  gambler 1 startcomplete 030103  smoking and other hobbies stranger 030500  trading post 031319  gambler 2 startcomplete 032703  explorer 2 complete 033121  polite society, valentine style 035112  the noblest of men, and a women stranger 035641  good, honest, snake oil bounty 040859  americans at rest 042019  bandit 1 startcomplete 043936  the first shall be last 045757  geology for beginners stranger 051525  explorer 3 complete 052314  gambler 3 complete 053121  hunting requests wildlife art exhibition start 053337  ellie anne swan bounty 055242  exit pursued by a bruised ego 060354  horseman 1 start 061834  the legendary bear legendary animals 062704  explorer 4 complete 063746  money lending and other sins 1 065823  money lending and other sins 2 071106  home robbery javier side quest 072725  the noblest of men, and a woman flaco hernandez 075435  the legendary buck legendary animals 081952  hunting requests 1 082554  horseman 1 082725  master hunter 2 083431  gambler 4 valentine 084238  master hunter 3 085826  sharpshooter 2 090752  horseman 2 090909  the spines of america 092311  lilly millet debt 092826  chick matthews debt 093402  shack 1 093923  hunting requests 2 start 094302  bandit 2 095140  return all debts 095230  paying a social call 100313  weapons expert 1 complete 101339  the legendary elk legendary animals 103245  horseman 3 104315  gambler 4 105146  perfect rat hunting requests 2 105534  bandit 3 111252  bandit 4 saint denis 112646  we loved once and true 1 113156  we loved once and true 2 113521  we loved once and true 3 115520  master hunter 4 120622  a quiet time 123143  master hunter 5 13 124116  blessed are the meak? 124412  bandit 5 125554  gambler 4 flatneck station 125901  the noblest of men, and a woman emmet granger 130915  pouring forth oil 1 131415  pouring forth oil 2 132618  dynamite arrow pamphlet 133109  horseman 4 133440  horseman 5 134429  charles hunting mission 135838  pouring forth oil 3 140253  a fisher of men 142533  master hunter 5 23 143842  an american pastoral scene 145332  master hunter 5 33 150453  pouring forth oil 4 151935  horseman 5 152448  weapons expert 2 152744  the sheep and the goats 155247  a strange kindness chapter 3 160955  the new south 164440  further questions of female suffrage 165737  gambler 5 171227  fishing trip javier mission 172735  survivalist 1 173553  survivalist 2 173714  money lending and other sins 4 173917  survivalist 3 174350  a father of fish stranger 174727  the legendary cotote legendary animal 180316  explorer 5 181143  gywn hughes debt 182425  gambler 6 rhodes 183600  he's british, of course 1 stranger 183833  he's british, of course 2 stranger 184601  he's british, of course 3 stranger 185639  he's british, of course 4 stranger 190304  he's british, of course 5 stranger 190816  buying all the fishing lures 190957  survivalist 4 192801  the smell of grease paint 1 193343  gambler 6 van horn 193750  gambler 7 van horn 194605  the legendary muski legendary fish 195431  explorer 6 195732  master hunter 6 15 200434  herbalist 2 34 200849  herbalist 2 44 201040  secret shotgun 201615  the legendary steel head trout legendary fish 203302  perfect northern cardinal hunting request 2 203402  perfect woodpecker hunting request 2 compelte 203846  explorer 7 204511  explorer 7 complete 204738  the legendary perch legendary fish 205516  herbalist 3 211641  the smell of grease paint 2 stranger 212407  master hunter 6 25 213032  hunting requests 3 start 214110  american distillation 220402  robbery with sean 221728 fishing trip with kieran 222554  the legendary blue gill legendary fish 222912  an honest mistake 224646  herbalist 4 225004  herbalist 5 230135  survivalist 5 230832  the legendary sturgeon legendary fish 230914  survivalist 5 231420  the inequities of history 1 stranger 231947  the inequities of history 2 stranger 233537  the course of true love 240217  shack 2 241830  weapons expert 3 242306  survivalist 6 243032  survivalist 7 243946  gambler 7 valentine 244923  the legendary chain pickerel the legendary fish 245643  winton holes 250416  master hunter 6 35 251402  joshua brown bounty 252901  the smallmouth bass the legendary fish 253646  perfect robin hunting requests 3 254054  perfect chipmunk hunting requests 3 254153  perfect opossum hunting request 3 254317  hunting requests 3 complete 254605  gambler 7 strawberry complete 254855  horseman 6 startcomplete 260131  advertising, the new american art 1 261123  advertising, the new american art 2 262433  weapons expert 4 263116  survivalist 8 265246  preaching forgiveness as he went 271119  sodom? back homorrah 272813  weapons expert 5 272814  horseman 7 274149  no good deed stranger 280029  horse flesh for dinner 281648  bandit 6 283803  sharpshooter 3 285010  bandit 7 290005  master hunter 6 45 291352  weapons expert 6 292602  weapons expert 7 293005  sharpshooter 4 294359  the fine joys of tobacco 301040  the noblest of men, and a woman billy midnight stranger 302102  magicians for sport 304033  sharpshooter 5 305115  friends in very low places 310732  gambler 8 311617  blessed are the peacemakers 315435  a short walk in a pretty town 315542  weapons expert 8 320331  blood feuds, ancient and modern 321557  the battle of shady belle chapter 4 323505  the joys of civilization 325154  angelo bronte, a man of honor 331804  the gilded cage 333712  fatherhood and other dreams exotics quest 342018  duchessess and other animals 1 stranger 350141  lady of the night orchids 351812  duchessess and other animals 2 stranger 352043  heron plumes 352713  lady slipper orchids 354239  moccasin flower orchids 355630  duchessess and other animals 3 stranger 355841  gator eggs 361103  acuna's star orchids 361702  cigar orchids 362335  ghost orchids 363938  duchessess and other animals 4 stranger 364736  spoonbill plumes 365142  night scented orchids 365955  rat tail orchids 371657  spider orchids 373003  duchessess and other animals 5 stranger 373206  clamshell orchids 374134  dragon's mouth orchids 375254  queen's orchids 380052  sparrow's egg orchids 380500  herbalist 6 complete 382716  help a brother out stranger 383457  american fathers 1 383858  a bright bouncing boy 1 385234  hunting requests 4 385433  perfect toad hunting requests 4 385559  perfect bullfrog hunting requests 4 385939  perfect sparrow hunting requests 4 390221  perfect songbird hunting requests 4 390441  master hunter 6 complete 390615  horseman 8 complete 390728  perfect skunk hunting requests 4 391048  hunting requests 4 complete 391625  a bright bouncing boy 2 stranger 393509  bandit 8 400156  gambler 9 404349  sharpshooter 6 404859  american fathers 2 405514  sharpshooter 7 410536  master hunter 7 411935  special tonic pamphlet 412101  herbalist 7 412542  weapons expert 9 413816  bandit 9 415916  master hunter 8 420307  master hunter 9 420749  explorer 8 422200  sharpshooter 8 423506  brothers and sisters, one and all 424559  money lending and other sins 5 424852  robbery with lenny 430331  hunting with pearson 431402  no, no and thrice, no 432834  mark johnson bounty 433945  master hunter 10 434037  the giaguaro legendary animal 435256  the noblest of men and a woman black belle 440200  seeing a show 441341  horsemen, apocalypse 442756  algie davidson debt 443928  broken pirate sword 445142  legendary bullhead catfish legendary fish 450442  a fine night of debauchery 451217  gambler 10 start 452726  gambler 10 complete 452836  lyndsay woffard bounty 453715  civil war knife 454610  bandit 10 455823  shack 35 451307  viking hatchet 451552  rusted double bit hatchet 463025  wagon robbery with micah 464249  urban pleasures 470651  country purists 473626  revenge is a dish best eaten 474903  banking, the old american art"
Action,Red Dead Redemption 2,2024-11-24,my favorite game ever  incredible achievement.
Action,Red Dead Redemption 2,2024-12-01,possibly the longest video i have come across in youtube. a miracle youtube was able to process it in 720p. most videos that attempt 20 hours fail to get processed right and end up with sub par quality. congrats
Action,Red Dead Redemption 2,2024-12-29,shoutout to this guy putting all his effort to make a full 100 walkthrough and having to put a timestamp in the comments
Action,Red Dead Redemption 2,2024-12-12,this is unquestionably the longest youtube video i have ever seen. perfect for the best game ever.
Action,Red Dead Redemption 2,2024-12-22,"the longest video ive seen, for the best game ive played. incredible."
Action,Red Dead Redemption 2,2024-11-25,"i gotta respect the hard work that's been put into making this video, and nasa wifi for sure"
Action,Red Dead Redemption 2,2024-12-10,im a mom of a 3 month old and have always wanted to finishcomplete this game and havent had the chance. ive been craving some video games but cant actively always hold a remote right now with how busy things have been. i like to watch this on my downtime and im 5 hours in living vicariously through you so thank you for this. im determined to finish the whole 86 hours.
Action,Red Dead Redemption 2,2024-11-24,"thank you sourcespy91. you are my favorite no commentary gamer. great choices, great game play, care and quality."
Action,Red Dead Redemption 2,2024-12-24,i think this is the most longest video ive ever see on youtube. great game. one of the best games ever produced in my mind.
Action,Red Dead Redemption 2,2024-12-01,one last video before bed
Action,Red Dead Redemption 2,2024-11-24,the happiest moment of my life you posting this made my entire day  thank you so much
Action,Red Dead Redemption 2,2024-12-05,finally a full on rdr2 100 completion video i have been searching for!
Action,Red Dead Redemption 2,2025-03-12,i really appreciate the amount of dedication and sitting on your ass doing this definitely an awesome accomplishment!
Action,Red Dead Redemption 2,2024-11-24,"with my slow internet, i imagine, i will be uploading this nearly 87 hours video more thay you spent playing it d"
Action,Red Dead Redemption 2,2024-12-15,"i was at the early 100 gang, we are still at 0.1 all we are, cheers bro, well done, welcome to the club"
Action,Red Dead Redemption 2,2024-12-13,long plays of games like this make me think that a 6 season show can easily be made from this
Action,Red Dead Redemption 2,2025-01-21,"in addition to posting a video of 86 hours you also put timestamp, thank you very much for your effort and dedication take my like"
Action,Red Dead Redemption 2,2025-01-31,thanks!
Action,Red Dead Redemption 2,2025-01-18,i did it! i watched the full video. it took three weeks watching it off and on. beautiful game and wonderfully played.
Action,Red Dead Redemption 2,2025-03-21,its great that you put timestamps so i can follow this as a guide
Action,Red Dead Redemption 2,2025-01-01,just came across this video and im surprised at how long it is and the amount of dedication it required for u to do it. respect. this game is a masterpiece and it totally deserves to be played for this long.
Action,Red Dead Redemption 2,2025-01-02,just finished my 6th playthrough. best game ever. never got close to 100 achievement though. that's dedication.
Action,Red Dead Redemption 2,2024-11-24,thanks for this. i played this game a few times and never gets old. 86 hours wow. a masterpiece game
Action,Red Dead Redemption 2,2025-01-08,"this could be one of the legendary youtube videos of all time.. 86 frickin hours, with timestamps!"
Action,Red Dead Redemption 2,2024-11-26,you deserve way more views and subs dude  love the long vids
Action,Red Dead Redemption 2,2024-12-04,video popped up on my feed. i saw the video length and knew i had to watch the whole thing. itll take me a while but ill get it done.
Action,Red Dead Redemption 2,2024-12-27,best red dead playthrough vid on youtube. hands down!
Action,Red Dead Redemption 2,2024-11-24,your dedication is amazing
Action,Red Dead Redemption 2,2025-02-04,you have seen so much effort to make this video. i have never seen anyone who puts this much effort to youtube video. what an amazing person you are and what amazing video game taste you have.
Action,Red Dead Redemption 2,2024-11-25,"when you see and hear this introduction,be sure that's the best game of the history"
Action,Red Dead Redemption 2,2025-01-19,momit's time to go to bed mejust one more video momok the video
Action,Red Dead Redemption 2,2024-11-25,fantastic job doing the entire story in one video.
Action,Red Dead Redemption 2,2025-01-31,"bro are you a robot, i mean how did you do this cann't believe ,i really appreciate your efforts"
Action,Red Dead Redemption 2,2025-02-01,i don't know you can upload a video longer than 24 hours. nice.
Action,Red Dead Redemption 2,2024-12-19,great video!! im on gambler 8 at the moment and omg it takes forever. loved the celebration after you finished it!! made me chuckle
Action,Red Dead Redemption 2,2024-12-09,"excellent, thank you for uploading this video. i love playing red dead redemption 2 very much."
Action,Red Dead Redemption 2,2024-11-24,you were skill strategy im impressed keeping up
Action,Red Dead Redemption 2,2024-11-24,i feel bad for the people who couldn't get out of the snow and play the rest
Action,Red Dead Redemption 2,2024-11-28,good looking out bro. cant wait for you to 100 gta 6
Action,Red Dead Redemption 2,2024-12-31,what! 86 hours you have gone crazy i have never seen such a long video
Action,Red Dead Redemption 2,2024-12-01,i feel like watching a movie nice gameplay
Action,Red Dead Redemption 2,2024-11-26,yo it's been a while since i watch you upload a very long video
Action,Red Dead Redemption 2,2024-12-13,i absolutely loved how you saved the graves for last
Action,Red Dead Redemption 2,2024-11-24,wow never see game upload all this time 87 you are amazing man
Action,Red Dead Redemption 2,2025-01-30,"i'm crazy, i beat it 3 times 100.. on xbox series x, playstation 4 and pc"
Action,Red Dead Redemption 2,2025-01-03,beautiful!!! thank you for your dedication.
Action,Red Dead Redemption 2,2024-12-09,thanks for this. going to be playing soon.
Action,Red Dead Redemption 2,2024-11-26,hey i love your video and you should definitely do the arkham trilogy like from arkham asylum to arkham shadows now that would be an amazing video to watch
Action,Red Dead Redemption 2,2024-12-29,watched it fullthanks man
Action,Red Dead Redemption 2,2024-12-09,"i just started yesterday, thank you."
Action,Red Dead Redemption 2,2024-12-28,63747 i feel like strauss was watching the world collapse in on itself or something like that before his very eyes
Action,Red Dead Redemption 2,2025-01-24,now i need the 100hour version.
Action,Red Dead Redemption 2,2025-03-03,did you get gold for all missions or no? if you did you are a even more of a amazing youtuber than i thought if you didn't you are still a amazing youtuber
Action,Red Dead Redemption 2,2025-02-05,just one quick video before sleep.
Action,Red Dead Redemption 2,2025-03-15,"and finally, the eighth leg completes the cycle, always moving forward. victory is achieved by the web, where every choice leads to a new path."
Action,Red Dead Redemption 2,2024-11-28,this is so well organized! would you mind if i used your footage for a video essay i'm making? i'd normally record my own but long story short i ended up deleting my save file while trying to transfer it from my steam deck to my pc . no pressure if not! thanks for putting in all the work to make videos like this!
Action,Red Dead Redemption 2,2024-12-26,best channel in my opinion
Action,Red Dead Redemption 2,2024-12-21,impressive is an understatement
Action,Red Dead Redemption 2,2025-01-25,already watched it twice. amazing game.
Action,Red Dead Redemption 2,2025-01-02,last video before bed
Action,Red Dead Redemption 2,2024-11-25,i have youtube premium so im going to download this to have in my downloads for moments the internet goes out  merry christmas
Action,Red Dead Redemption 2,2024-11-24,"really, appreciate for this"
Action,Red Dead Redemption 2,2024-12-06,"over 86 hours! hell yeah, you just earn a new sub. also are you planning to 100 stalker 2?"
Action,Red Dead Redemption 2,2024-11-25,amazing can't wait for gta 6 playthrough of 86 hours
Action,Red Dead Redemption 2,2025-01-16,hercule spins two times at 490619 made me wheeze...
Action,Red Dead Redemption 2,2025-02-03,"you, sir, are a legend!"
Action,Red Dead Redemption 2,2025-02-24,imagine how long this took to upload
Action,Red Dead Redemption 2,2024-11-26,"at last my most favourite game , thanks man. hope you become a great streamer"
Action,Red Dead Redemption 2,2025-01-29,hi. fantastic job !!! thanks very much for the movie p ps is it possible that u omitted some ? on the map ?
Action,Red Dead Redemption 2,2024-12-13,86 hours is the craziest thing ive ever seen
Action,Red Dead Redemption 2,2025-01-13,that's insane. thanks for sharing.
Action,Red Dead Redemption 2,2024-12-07,thank you for including the subtitle speaker name!
Action,Red Dead Redemption 2,2024-12-14,this is the longest video i've ever seen oh my god
Action,Red Dead Redemption 2,2025-02-16,"i finished at the 2 weeks, only until to american venom."
Action,Red Dead Redemption 2,2024-11-24,best platinum trophy of my life
Action,Red Dead Redemption 2,2025-01-30,best guide thanks.
Action,Red Dead Redemption 2,2025-01-14,ur the goat earned a sub
Action,Red Dead Redemption 2,2024-12-14,i almost done with y first play through. seeing the very beginning again is sad because i know whats to come
Action,Red Dead Redemption 2,2024-12-29,good job brother
Action,Red Dead Redemption 2,2024-11-30,i just realized that on the way to horseshoe overlook the soundtrack sounds like skylanders spyros adventure
Action,Red Dead Redemption 2,2025-01-30,who sat through all those full 86 hours is an absolute legend
Action,Red Dead Redemption 2,2024-11-27,holy cow thats long!!!
Action,Red Dead Redemption 2,2024-12-03,"i got platinum 6 years ago, really really wonderful game, worth each penny"
Action,Red Dead Redemption 2,2025-01-17,top 10 all time best video game ever created.
Action,Red Dead Redemption 2,2025-01-31,135335 he worries about dummy killed bisons but 30 minutes before he killed an innocent woman by rope. weary nice
Action,Red Dead Redemption 2,2025-03-05,"most beautiful, most tragic game i have ever played"
Action,Red Dead Redemption 2,2024-12-21,good video
Action,Red Dead Redemption 2,2024-11-27,hey so this is fkn crazy but im 1000 here for it
Action,Red Dead Redemption 2,2025-02-03,my god...... this is a master peice........holy cow.....
Action,Red Dead Redemption 2,2025-01-23,one last video before going to bed
Action,Red Dead Redemption 2,2024-12-04,i just finished watching the entire video. if you dont mind asking how long did this take to upload?
Action,Red Dead Redemption 2,2025-01-11,i just finished watching it
Action,Red Dead Redemption 2,2024-11-24,i didnt even videos could be this long
Action,Red Dead Redemption 2,2024-12-24,longest vid i've seen on youtube.
Action,Red Dead Redemption 2,2025-01-11,..
Action,Red Dead Redemption 2,2025-01-25,this is so good
Action,Red Dead Redemption 2,2025-01-16,the game 0 of 5 clean train robberies arthur steals canned peas the game 1 of 5 clean train robberies veri naice
Action,Red Dead Redemption 2,2025-01-10,251606 you left him? wow thats just cold
Action,Red Dead Redemption 2,2025-01-14,"amazing gameplay, one question tho, why do you never interact with the chance encounters? i know you did them because you got 100"
Action,Red Dead Redemption 2,2025-03-21,boa tarde angola
Action,Red Dead Redemption 2,2025-03-21,"melhor jogo, top demais mano"
Action,Red Dead Redemption 2,2025-03-21,arruma funcionrio para trabalhar nas duas
Action,Red Dead Redemption 2,2025-03-21,muito bom
Action,Red Dead Redemption 2,2025-03-21,"oi lord estou gostando da srie gostaria de saber quantos cavalos vc consegue pegar pra andar junto com vc ? seria legal vc correndo com vrios cavalos juntos de vc , e fico imaginando uma msica do velho oeste tocando isso no sai da minha cabea."
Action,Red Dead Redemption 2,2025-03-21,boa doma!
Action,Red Dead Redemption 2,2025-03-21,salve lord
Action,Red Dead Redemption 2,2025-03-21,boa tarde de portugal
Action,Red Dead Redemption 2,2025-03-21,"bom dia, vc precisa fazer um curral e umas baias pra sua fazenda."
Action,Red Dead Redemption 2,2025-03-21,onde voc achou esse cavalo eu quero achlo
Action,Red Dead Redemption 2,2025-03-21,manuel savi
Action,Red Dead Redemption 2,2025-03-21,manda manda salve
Action,Red Dead Redemption 2,2025-03-21,porque nois ia tirar o like de um video bom desse
Action,Red Dead Redemption 2,2025-03-21,salve salve!
Action,Red Dead Redemption 2,2025-03-21,i us cavalu alemo
Action,Red Dead Redemption 2,2025-03-21,salve salve galera...mais um episdio do nosso cowboy
Action,Red Dead Redemption 2,2024-12-18,we uploaded this a week ago but it got age restricted and limited because of 3 curse words thanks youtube so wanted to change that and fix it so it doesn't restrict ppl from watching!
Action,Red Dead Redemption 2,2024-12-18,still best game ive ever played!
Action,Red Dead Redemption 2,2024-12-18,i still play that masterpiece of red dead redemption 2  everything about the game i just love it
