genre,game,commented_date,comment
Action,Red Dead Redemption 2,2017-09-28,i would say take my money but this mr. morgan character may already be in the process of doing that.
Action,Red Dead Redemption 2,2018-09-04,we got fanboys in 3 different countries after us
Action,Red Dead Redemption 2,2023-03-30,"we are in the middle of 2023, and this game is still a masterpiece"
Action,Red Dead Redemption 2,2024-06-14,oh damn the scene of hosea walking away with the braithwaite's manor burning down in the background is lot more epic here
Action,Red Dead Redemption 2,2017-09-28,those graphics look really good for a console game. and the storyline seems good as well. rockstar never disappoints with new game releases.
Action,Red Dead Redemption 2,2017-09-28,looks badass!
Action,Red Dead Redemption 2,2020-12-24,i blame rockstar to making this game too good. now im addicted to it eventhough ive already beat it for god knows how many times.
Action,Red Dead Redemption 2,2024-10-05,the first time i played this game i didnt want to finish it bc i got spoiled but now im one my second play through and i dont even want to do the last mission with arthur yet because i feel like its so much more i can explore and interactions i can find on the map. this is truly an 1110 game
Action,Red Dead Redemption 2,2020-06-10,the best game i have ever played
Action,Red Dead Redemption 2,2020-07-10,here in 2020 still the best open world and best story ever created. keep up the good work rockstar
Action,Red Dead Redemption 2,2017-10-02,maybe i'll keep her in black... on your behalf this mf is badass already
Action,Red Dead Redemption 2,2025-01-16,this is the one game i truly wish i could experience for the first time again
Action,Red Dead Redemption 2,2018-07-29,we should be getting a countdown trailer any day now
Action,Red Dead Redemption 2,2022-06-24,"one of, if not the best carefully crafted world and story in a video game i've ever experienced. completed 4 playthroughs and still finding and seeing things i never seen or completed yet."
Action,Red Dead Redemption 2,2022-07-05,"in 2018, nobody knew a game is coming which will write history in terms of gameplay, graphics, storyline and living as arthur morgan"
Action,Red Dead Redemption 2,2025-03-12,the video game is 7 years old and still holds up today as one of the best games ever!
Action,Red Dead Redemption 2,2020-02-03,if i ever lose my memory just remind me to play rdr2 again.
Action,Red Dead Redemption 2,2018-10-25,remember when ea said single player games are dying?
Action,Red Dead Redemption 2,2019-06-27,"red dead redemption 2 is a game i wish i never played, so i can experience it all again."
Action,Red Dead Redemption 2,2020-02-05,60 hour story. im like 70 hours in and in chapter 5..... i get distracted easily
Action,Red Dead Redemption 2,2018-10-25,ea single player is dead rockstar hold my horse currently enjoying the game. definitely game of the year. there's so much things to do and i love the world. this game is a must get.
Action,Red Dead Redemption 2,2018-10-25,horse testicles shrink in cold  goty
Action,Red Dead Redemption 2,2018-10-28,or as my wife calls it that damn horse game
Action,Red Dead Redemption 2,2020-09-05,best game i've ever played by far. when i finished the story mode it was the first ever time i cried over a video game. 1010
Action,Red Dead Redemption 2,2018-10-25,but in the end red dead does a great job of making you really feel like spider man
Action,Red Dead Redemption 2,2018-10-25,"just enough red, and the perfect balance of redemption. 1010  ign"
Action,Red Dead Redemption 2,2018-10-26,wildlife to discover blasts animal with shotgun
Action,Red Dead Redemption 2,2020-08-10,3.1k dislikes those damn o'driscolls
Action,Red Dead Redemption 2,2018-11-28,player i love my horse! ive had him since the beginning of the game and ive grown pretty attached to him rockstar laughs maniacally
Action,Red Dead Redemption 2,2019-06-02,for all of you on the fence wheather or not you should buy this game... listen this isnt even a videogame. this is something you havent seen anywhere else. this is monumental. this is in my humble opinion the single best videogame ever made. this is my number 1. rockstar thank you. thank you so much. buy this game!
Action,Red Dead Redemption 2,2018-10-29,"ea  singleplayer, nobody wants that today rockstar receives a 10 for masterpiece singleplayer, ea  damn"
Action,Red Dead Redemption 2,2020-06-01,this was the second game i ever played. my expectations are insanely high now. thanks rockstar
Action,Red Dead Redemption 2,2018-11-28,arthurs last ride was the most emotional moment in video game history.
Action,Red Dead Redemption 2,2019-05-07,this is the best game i've ever played ever
Action,Red Dead Redemption 2,2019-02-14,the only problem with rdr2 is that it has an end and maybe dutchs plan...
Action,Red Dead Redemption 2,2020-03-14,"gtav and rdr2 got perfect 10s, at this point rockstars next game should get an 11"
Action,Red Dead Redemption 2,2018-10-25,"the first red dead is my favorite game of all time. i've waited patiently for this day to arrive. and now we are here. time to go back to the old wild west guys! thank you rockstar. despite gta being such a selling machine, i'm very happy you guys stick to this franchise. rdr is not for everyone, specially not for young people who will not dig the slower pace. you probably won't make the billions you made last time. but rest asure, you've made people like me and many others very happy."
Action,Red Dead Redemption 2,2019-04-08,"1010 just the right amount of red, dead, and redemption."
Action,Red Dead Redemption 2,2022-08-29,"this is what is possible when we have a truly committed, passionate and very talented group of individuals with the appropriate direction to achieve a seemingly impossible vision. if only we had more rockstar like studios out there. theyre in a league of their own."
Action,Red Dead Redemption 2,2018-10-27,2018 is officially the year of groundbreaking single player games
Action,Red Dead Redemption 2,2018-10-25,"you wont have to sell me a rockstar game, these baby sell themselves"
Action,Red Dead Redemption 2,2018-11-22,rdr2 is better than gta5 change my mind.
Action,Red Dead Redemption 2,2021-10-26,"3 exact years later, still the greatest game to date."
Action,Red Dead Redemption 2,2018-10-27,"i love old western movies, this game is a dream come true."
Action,Red Dead Redemption 2,2018-10-26,time to leave my social life behind and immerse myself in this game! ... is what i would say if i actually even had a social life
Action,Red Dead Redemption 2,2018-10-25,this game won't get more than 1010 and thats for sure !
Action,Red Dead Redemption 2,2020-06-26,i want to invent a drug that can wipe out specific memories just so i can play this game again fresh
Action,Red Dead Redemption 2,2018-10-25,horse testicles shrink in cold  1010 ign
Action,Red Dead Redemption 2,2018-10-28,games are starting to look better than real life
Action,Red Dead Redemption 2,2018-10-25,rockstar horse testicles shrink depending on the weather in our game . me odd flex but okay.
Action,Red Dead Redemption 2,2022-08-19,"this game is definitely in the top 3 best games ever made. it's so masterfully made, so much detail, great story. man it's going to be tough to top this one."
Action,Red Dead Redemption 2,2018-10-28,guide to red dead redemption 2 1 . call in sick for work 2. give up on your social life 3. get enough food for a week
Action,Red Dead Redemption 2,2018-11-22,spoilers alert! dutch has a plan.
Action,Red Dead Redemption 2,2018-10-28,"i'm phoning my office tomorrow, apparently i broke my ankle and i can't go out for a month"
Action,Red Dead Redemption 2,2020-11-30,rdr2 is the greatest game ever created
Action,Red Dead Redemption 2,2018-11-02,this game is so unreal i can't believe the attention to detail i was walking through this random town and there was a group of drunk people about 10 of them i accidentally bumped into one of the guys that was sitting by the campfire he fell into the fire went into flames then inevitably died then about 30 seconds later after the crowd scattered a pig came up to the dead body and started eating it what the f lol
Action,Red Dead Redemption 2,2018-10-26,8 years for this. totally worth it!
Action,Red Dead Redemption 2,2018-11-21,i personally found gtav a bit boring. rdr2 is far more entertaining and genuine.
Action,Red Dead Redemption 2,2023-12-16,5 years later and this is still the greatest game ever made.
Action,Red Dead Redemption 2,2018-10-25,just typing so i can say i was alive when red dead 2 came out to show my grandkids
Action,Red Dead Redemption 2,2018-10-28,ea no one wants single player games anymore
Action,Red Dead Redemption 2,2018-10-25,no los santos customs for your horses. 3.7
Action,Red Dead Redemption 2,2020-07-13,"it's july 2020, we are living in a pandemic and i restarted rdr2 for the third time. this is hands down the best game ever made. every time i play again i notice different exceptional details that i haven't seen before. thank you, rockstar!"
Action,Red Dead Redemption 2,2018-10-26,221 the countryside of red dead redemption 2 is absolutely brimming with wildlife to discover shoots wildlife d
Action,Red Dead Redemption 2,2018-10-27,the country side of rdr2 is absolutely brimming with wildlife to discover proceeds to shoot animal in the face
Action,Red Dead Redemption 2,2018-10-25,red dead redemption 2 really makes you feel like red dead redemption 2
Action,Red Dead Redemption 2,2020-12-16,whos here after cyberpunk 2077
Action,Red Dead Redemption 2,2018-10-26,a lot of people are going to be late to work because of this game.
Action,Red Dead Redemption 2,2019-01-02,documents game rockstar games  bad games  this folder is empty
Action,Red Dead Redemption 2,2018-11-09,spoiler alert fans arthur is the best and most lovable character ever! rockstar loads gun
Action,Red Dead Redemption 2,2020-04-11,"this was the best game ive ever played. i cried really hard at the end, and ive never cried at the end of a game before."
Action,Red Dead Redemption 2,2018-11-05,357 i'm just going to ignore that foot.
Action,Red Dead Redemption 2,2018-10-27,the review sold me on dynamic horse nuts.
Action,Red Dead Redemption 2,2018-10-25,1010 it really makes you feel like a testicle
Action,Red Dead Redemption 2,2025-02-07,"6 years later, and still no other developer has risen to the challenge and topped this great game"
Action,Red Dead Redemption 2,2018-10-25,many companies should take notice how rockstar take years of planning and developing to put out a game and that's why they do so well
Action,Red Dead Redemption 2,2018-10-25,we all saw this by a mile
Action,Red Dead Redemption 2,2019-07-14,ign has no idea how to rate games smh it should be an 11
Action,Red Dead Redemption 2,2020-06-10,i could only dream of being able to play this game for the first time again. this was easily one of the best games i've ever played
Action,Red Dead Redemption 2,2018-10-25,"ea there are no single player games now. rockstar, santa monica and insomniac nice joke"
Action,Red Dead Redemption 2,2018-10-26,do not watch gamespots review of rdr2 it contains hella spoilers
Action,Red Dead Redemption 2,2018-10-25,remember this is a game where horse testicles shrink in cold
Action,Red Dead Redemption 2,2020-12-24,greatest game ever made. 100 hours and i didn't want it to end.
Action,Red Dead Redemption 2,2018-12-26,1960 were gonna have flying cars in 2018 2018 the horses testicles shrink in different weather
Action,Red Dead Redemption 2,2019-08-04,still don't know how it didn't win the game of the year
Action,Red Dead Redemption 2,2019-10-03,"already almost a year, bloody hell. one of those rare games that you wish you could play again as if it's your first time."
Action,Red Dead Redemption 2,2020-12-13,i actually bought rdr2 for my ps4 after already owning it on xbox just bc cyberpunks terrible messy launch made me appreciate rockstar even more.
Action,Red Dead Redemption 2,2018-10-26,"warning don't watch gamespot's review, it's full of what look like minor spoilers"
Action,Red Dead Redemption 2,2018-10-25,"practically no red, too much dead and the perfect amount of redemption. it's a 1010"
Action,Red Dead Redemption 2,2018-11-04,"when the credits rolled, i just stood up and clapped because i didn't think anything could beat the last of us, but this masterpiece did. arthur morgan is one of the greatest characters ever and his story is a pure piece of art."
Action,Red Dead Redemption 2,2021-04-22,can't believe cdpr even thought it could compete with this.
Action,Red Dead Redemption 2,2018-10-25,notice how the only games that go 1010 this year were single player games? when will ea and activision learn that multiplayer only games aren't what people want
Action,Red Dead Redemption 2,2018-10-25,horse testicles shrink in the cold best game ever 1010
Action,Red Dead Redemption 2,2019-09-22,the game makes you feel like arthur morgan
Action,Red Dead Redemption 2,2020-06-07,enemy you bastards shot my cousin! arthur well he started it! i died on that scene
Action,Red Dead Redemption 2,2018-11-11,perfection is an insult to this game red dead redemption 2 is way beyond that
Action,Red Dead Redemption 2,2019-01-09,this guy used first person more in a review than i did in the whole game.
Action,Red Dead Redemption 2,2018-10-26,"ea  single player is dead. rockstar let me hold your beer, youve had one too many."
Action,Red Dead Redemption 2,2020-10-05,i've just finished it and it is one of the best games i've ever played.
Action,Red Dead Redemption 2,2018-10-25,240 horse poop
Action,Red Dead Redemption 2,2018-11-15,people call this game gta with horses but i like to call it gta without cars
Action,Red Dead Redemption 2,2018-10-25,"but it doesnt make me feel like batman, 010"
Action,Red Dead Redemption 2,2020-06-26,"in this game, you can be a strongest badass gunslinger that can literally kill 100 enemies without using cheats. masterpiece."
Action,Red Dead Redemption 2,2018-12-04,"i have played the game extremely slowly. over 100 hours in and just reached chapter 5. the attention to detail, storyline, and the shear scale is quite simply unbelievable. i cannot find a fault in this game other than the fishing mechanics when trying to catch legendary fish, and the shooting mechanics are average...and there are a few frustrating glitches. that being said, definitely one of the games of the decade... one word of advice when playing...take it slow, dont rush through the main missions because you will miss a lot of content which is quite frankly just as interesting."
Action,Red Dead Redemption 2,2018-11-13,am i the only one that feels this should be made into an actual movie? seriously its one of the greatest old western stories ever told. 2 part series just like the game. fml please lord make it happen!
Action,Red Dead Redemption 2,2018-10-25,"this review has some personality and humor in it! i dig it, ign should keep this up"
Action,Red Dead Redemption 2,2020-04-14,this isn't just a video game.... this is an experience! it's a stunning work of art and the culmination of video game design and technology. few games have achieved legendary status... this will be one of them!
Action,Red Dead Redemption 2,2018-10-26,single player is dead. no one cares about single player  ea
Action,Red Dead Redemption 2,2018-11-07,"i wish rockstar would have implemented a friendrelationship system sort of like persona 5. it would have been cool if you could spend time with gang members of your choosing, build your relationship and eventually have them as a free roam companion. still give the game a 1010. incredible experience"
Action,Red Dead Redemption 2,2018-10-25,"luke reilly's ability to constantly put out great reviews is astounding. i wish ign gave him all the games, but since that isn't possible, i hope they realize this is the man to beat in the company. i just went back from gamespot's review and man, that was horrid. however, it's made me realize that the reviewer is waaaaay more important than the company it comes out of."
Action,Red Dead Redemption 2,2021-02-12,"what a masterpiece of a video game. best storytelling,best gameplay,best characters,1010 best game rockstar has ever made."
Action,Red Dead Redemption 2,2018-11-04,010. i can't play this on my phone. wyatt cheng
Action,Red Dead Redemption 2,2018-10-26,this game really makes you feel like red dead redemption 2.
Action,Red Dead Redemption 2,2018-10-29,this game skipped a console generation
Action,Red Dead Redemption 2,2020-05-13,i wouldn't even consider this playing a game this is more like living art. bravo r
Action,Red Dead Redemption 2,2018-10-25,i remember coming home at the age of 11 and playing the beauty that was red dead redemption. ive waited 8 years for this and im so ready
Action,Red Dead Redemption 2,2025-03-11,"use code 'max0r' for 10 off gamer supps httpsgamersupps.ggmax0r hi all! i wanted to include this little bit near the end, but i was rapidly running out of good footage and it was going to break the flow. i couldn't find a place to put this disclaimer on a more nuanced topic with full information in the video itself without breaking the flow. this video contains adaptations of a few memes and jokes from other sources. for instance, the fighting the copies of jack bit at 2412 is from what i believe is an instagram post, and so is the killing the entire gang bit, but often sent to me through so many reposts that it became extremely difficult to research the correct source for them. anyways, these all contain completely unique visuals, context, and followups, and i specifically add things to the jokes or entirely change their premises in order to adapt them to this video. another example of this that i want to be clear about are that i adapt a few memes which have their origin in the subreddit rokbuddyblacklung, thankfully i was actually able to track down the sources of those memes, which have since been reposted and sent to me later. for instance, turquoise purloined embroiling 2 and other color themed names for the game and abdullah morgan began on that subreddit, but i decided that i wanted to add a few things to the joke, add my own entirely unique visuals even the visual for the text saying turquoise purloined embroiling 2 is mine, etc etc etc. so they are different, especially the context and the way they are used, but i just wanted to be clear where my inspiration came from and what i was adapting. this is pretty common stuff, though, i tend to reference internet memes a lot. i like the idea of taking community memes that only exist in the form of images and making them into a video format where people who recognize the joke can see them and, hopefully, people who do not recognize the joke can find the source if they want more. or, in the case of the video memes, i straight up entirely changed the scenes in some cases, and in others, added things that i thought might have made the originals more funny, such as me adding the fact that jack goes flying after being kicked in my version."
Action,Red Dead Redemption 2,2025-03-11,"alcoholics dont run in my family, they drive"
Action,Red Dead Redemption 2,2025-03-11,it is an achievement that maxor made a 30 minute rdr2 video without mentioning a single thing that actually happened in rdr2
Action,Red Dead Redemption 2,2025-03-12,i add to the mystery of not playing the game by continuously spreading misinformation about it this is the mindset behind the man that got me to play ultrakill
Action,Red Dead Redemption 2,2025-03-11,"there is nothing wrong with drunk driving, it's all the drunk crashers that make the real drunk drivers look bad!"
Action,Red Dead Redemption 2,2025-03-11,"i could be making slop, but i choose to make garbage instead is my new creative motto"
Action,Red Dead Redemption 2,2025-03-12,"'get hit by small bullets so eventually you build a resistance to big ones killed me, i am now a skeleton"
Action,Red Dead Redemption 2,2025-03-11,your editing should be shown to psychology majors as a perfect visualisation of what adhd is like.
Action,Red Dead Redemption 2,2025-03-11,anime titles be like that time i overdosed and reincarnated as a middleaged man in the midwestern united states in the 20th century
Action,Red Dead Redemption 2,2025-03-12,orchard going son of a btch while running up to the giant horse at 853 killed me. and yelling dammit! while riding the tiny horse was just as great.
Action,Red Dead Redemption 2,2025-03-11,oh cool a new max0r video video immediately opens with him talking about drunk driving while a horse drawn carriage moves at fighter jet speeds oh yeah this is gonna be a good one
Action,Red Dead Redemption 2,2025-03-11,plan! money! yep that pretty sums up dutchs character
Action,Red Dead Redemption 2,2025-03-12,"in yharnam, they produce more blood than alcohol, as the former is far more intoxicating.  bloodborne challenge accepted.  red dead redemption 2"
Action,Red Dead Redemption 2,2025-03-11,we do love drunk driving
Action,Red Dead Redemption 2,2025-03-11,"max0r shot straight into my notifications the fastest brain damage in the west after watching watching the entire video, there's enough projectiles fired, kinetic energy transferred into frontal lobes, high velocity ragdolling  drunken horsepower that could turn silver the hedgehog into a catling gun on catnip velocity2  2kinetic energy over mass and you got a lot of kinetics  mass flying around insert dmc silver bullet joke"
Action,Red Dead Redemption 2,2025-03-15,1640 woke up to this part playing on autoplay. had a panic attack and thought that god was finally judging me for the anime amvs i made when i was a kid. 1010 great vid.
Action,Red Dead Redemption 2,2025-03-11,"i love how, after dozens of videos, now he explains the entire conceit of the channel."
Action,Red Dead Redemption 2,2025-03-11,"2022 my videos are puzzles where you try to find the correct information. puzzling, yes very puzzling. correct information, got some work to do in that department."
Action,Red Dead Redemption 2,2025-03-12,"and sometimes, i will make the screen do this. proceeds to destroy my eardrums"
Action,Red Dead Redemption 2,2025-03-11,"3141 i could just be making slop right now, but i choose to make garbage instead. that is a beautiful line right there. and also should probably get tossed on merch"
Action,Red Dead Redemption 2,2025-03-11,i love how micah isn't evil on this universe he just wants a ton of candles and he knows he can use dutch to have even more.
Action,Red Dead Redemption 2,2025-03-12,max0r's videos are like roguelike games both have infinite replayability. i'm gonna try a 1.25x speed debuff audioonly run in the morning. wish me luck!
Action,Red Dead Redemption 2,2025-03-11,"mister president, max0r just hit another family of 4"
Action,Red Dead Redemption 2,2025-03-11,it took rockstar 5 years to make red dead and this video took 5 years away from my lifespan
Action,Red Dead Redemption 2,2025-03-12,something i've always appreciated about your videos is that you somehow manage to make scenes both meaningful yet the weirdest thing on the planet as well and yet somehow it all still makes sense.
Action,Red Dead Redemption 2,2025-03-11,"genius move, making a 32 minute video, but making me spend hours watching it because i have to pause every 2 seconds to look at the funny colorful text that disappears after half a picosecond. really bringing in the revenure here, max0r."
Action,Red Dead Redemption 2,2025-03-11,this appeared in my fyp and immediately gave me kidney poisoning
Action,Red Dead Redemption 2,2025-03-15,full throttle with an empty bottle is the best quote ive ever heard.
Action,Red Dead Redemption 2,2025-03-11,a new max0r video? locks the doors lights the candles gets out the crucifix here we go again
Action,Red Dead Redemption 2,2025-03-12,i swear to god half of the video is the same sound of arthur morgan screaming as he flies uncontrollably through the air jesus christ i shot milkshake up my nose when i heard abdullah morgan
Action,Red Dead Redemption 2,2025-03-12,"rdr2 has such a slow and relaxing gameplay that even the max0rs montage has become calmer and its seems, even his trip wears off faster."
Action,Red Dead Redemption 2,2025-03-12,"as a video editor, i can already tell this piece of art is 100x less stressful than your ultrakill and first couple elden ring videos. 60 of your visual jokes being text has to be so relieving"
Action,Red Dead Redemption 2,2025-03-11,i'm watching this as i drive 120mph through a school zone under the influence of alcohol
Action,Red Dead Redemption 2,2025-03-12,"max or what you make is not garbage it's cinema, never stop making those videos you are a genius"
Action,Red Dead Redemption 2,2025-03-11,"1600 the rapture happened in 2015 and 3 people were sent to heaven, true words"
Action,Red Dead Redemption 2,2025-03-11,starting the video off with a psa to drunk driving followed by him committing felonies is truly the best start to a maxor video ever
Action,Red Dead Redemption 2,2025-03-15,"i don't want to even remotely think about what i would do without the distractions of your videos. please, never stop making your videos."
Action,Red Dead Redemption 2,2025-03-11,a normal person would play rdr2 completing side missions and the main story at a slow pace and get emotional with the ending max0r is not a normal person
Action,Red Dead Redemption 2,2025-03-11,hidden mechanic of learning to drive drunk is a great example of how the devs take their time to make things truly like in real life
Action,Red Dead Redemption 2,2025-03-13,"as someone with a traumatic brain injury, this is definitely an accurate representation of drunk driving. thanks for making me feel seen, max!! 3"
