genre,game,commented_date,comment
Action,Red Dead Redemption 2,2025-02-14,"after a stressful day, i come home and sit on my rdr2 game and i saved a spot in chapter 6 when arthur is healthy and hunting and riding on buell, and fishing and after a couple of hours i feel like a new person....the game is a masterpiece ...... and i'm 61 years old !!!!!"
Action,Red Dead Redemption 2,2025-02-23,i feel sorry for people who are not into games. they have no idea what they are missing out on. best game ever made
Action,Red Dead Redemption 2,2025-01-16,i returned to red dead online a few days ago and i still love this game it didn't feel like playing a game it felt like i entered a different world
Action,Red Dead Redemption 2,2025-01-16,this is the only game i play anymore. none of the newer games stir my interest.
Action,Red Dead Redemption 2,2025-01-16,"i've played games since pong. i prefer openworld games, but rdr2 is the only game i feel homesick for if i don't play. story mode or online, the world they created is one i feel comfortable in. a beautiful work of modern interactive art! thanks for continuing to point this out, cat. keep it fun folks!"
Action,Red Dead Redemption 2,2025-02-23,old game ugh...i've been working 7 days a week for about 9 years and had to put everything on hold. it feels so strange to hear about a game i was looking forward to playing being old.
Action,Red Dead Redemption 2,2025-01-16,i'll tell you why. because this game looks goddamn impossibly good like wtf? i simply can't understand how this game looks so good it pissed me off sometimes. i can go through the same forest i've crossed 30 times and still get a different vibe because the weather and lighting system of this game is just ridiculous. it's insane. i cannot wrap my head around how they did it. how did this run on a ps4????? love you pvpcat
Action,Red Dead Redemption 2,2025-01-16,"same, level 682, not stopping anytime soon. love it, will play it for ever. cowboys for life"
Action,Red Dead Redemption 2,2025-01-16,rdr2 is a work of art. people will keep looking for it
Action,Red Dead Redemption 2,2025-01-20,"playing rdo, with beers, solo session and spotify is perfection thats why, so chill"
Action,Red Dead Redemption 2,2025-01-16,"i reached rank 1000 yesterday, and ill still continue playing this beautiful game"
Action,Red Dead Redemption 2,2025-03-09,"been holding off and holding off wanting to play this since release, bought this 3 weeks ago , and what have i missed even today this is a masterpeice by any standards"
Action,Red Dead Redemption 2,2025-01-16,just recently replayed on pc to get 100 and it honestly just made me sad seeing everything rockstar gave up on
Action,Red Dead Redemption 2,2025-03-13,ive played through 3 times and the end still gets me. arthur is such a great complex character. best ive ever seen.
Action,Red Dead Redemption 2,2025-01-16,"they can never make me hate rdr2, but rdr2 made me hate rockstargames. hope gta6 will wash up their sins. outlaws4life"
Action,Red Dead Redemption 2,2025-03-16,"the storytelling in gta has often taken a backseataside from the standout example of gta ivto focus on immersing players in a sandbox filled with endless possibilities. the emphasis is more on how much chaos you can unleash, with missions serving as a secondary layer of engagement. rdr is all about the narrative. its primary goal is to channel the atmosphere of classic western films, placing you in a very detailed open world that prioritizes storytelling and immersion. i find myself engaging with these two game series in completely different ways. in gta, i try to cause as much mayhem as possibleblowing up cars and orchestrating massive shootouts, testing how long i can outlast the police. on the other hand, rdr inspires a more thoughtful, roleplaying approach. i tend to imagine how john or arthur would live their lives, allowing me to slip into their shoes and approach the game with a more characterdriven playstyle."
Action,Red Dead Redemption 2,2025-01-23,playing rdr2 again and enjoying it. bought a 32 inch screen for the immersion. the best part of the game is that it seems real. no spells or magic or leaping off buildings or soaring through the air or zombies or other monsters. just real people making good and bad decisions and living with the consequences. heightened real life. nice. thank you rockstar.
Action,Red Dead Redemption 2,2025-01-20,"yea i agree, i have around 2k hours on the game and still not bored with my character i just ride and explore the map"
Action,Red Dead Redemption 2,2025-01-16,"i played rdo way back when, but i just returned on dec. im having a blast after a slow start. i can see how it can be stale after finishing each role. but, right now, im loving it!"
Action,Red Dead Redemption 2,2025-02-14,"played rdr2 for the first time summer 2024 and was obsessed! i don't recall ever having cried so much for characters in a game since i was a kid. i cried for about 2 weeks after i finished the game, every time i thought about the ending. i still get teary eyed by that particular scene you showed, and had to fastforward as i'm at work right now, haha. this became my all time favorite game ever, and i just started getting into red dead online properly and super excited about it, even if it's dead."
Action,Red Dead Redemption 2,2025-01-16,"iam lvl 366 and play it when it was beta,now finally i try it again and fall in love again,6 days without griefing, sry german my english is not the best,keep up your good work,thx cat for the entertainment"
Action,Red Dead Redemption 2,2025-01-16,i truly love this game but as veteran who played it since pretty much realise i really do wont to play it again but its just the lack of contentupdates thats not making to come back
Action,Red Dead Redemption 2,2025-01-16,"i love this game, the problem of this game is i get forced to play on private community server cause of hacker invasion in the public online"
Action,Red Dead Redemption 2,2025-01-16,"story mode is still one of the best openworld rpgs, with a story as good if not better than any movie made in the last decade. most of the time, an openworld game has a story that feels weak and tacked on, and a game with a great story is often not openworld. while it's sad that rockstar squandered the multiplayer possibilities, the story mode is simply unmatched."
Action,Red Dead Redemption 2,2025-01-16,about 40 games in my steam library. used to play a dozen of them on a regular basis. then i found rdr2online. quit playing all the other games. rdr2o is literally all i need. used the  because i go back and forth between story and online modes.
Action,Red Dead Redemption 2,2025-02-06,to be honest i done the story about 10 times and i'm still playing story mode and online this is truly the most beautiful and best open world game ever in my opinion
Action,Red Dead Redemption 2,2025-01-23,just came here to say i quit playing last year but came to check in on your channel today as i used to watch every upload of yours. thank you for continuing the red dead content still as ive seen a couple move onto other games.
Action,Red Dead Redemption 2,2025-02-04,i just came back to platinum this masterpiece. feeling like its my 1st walkthrough
Action,Red Dead Redemption 2,2025-02-07,bro called it old. quite broke poor mammy's heart
Action,Red Dead Redemption 2,2025-01-16,"i bought this game ages ago, but never played it until now. saw plenty of others play it, but never got into it myself. i looked and i have 3.5 total hours in it. that said, someone got me into a role play server and i'm fast learning i may have to play the actual game. seems like i've missed a gem for sure."
Action,Red Dead Redemption 2,2025-01-20,yep. still playing this game. each time changing and challenging myself through the missions
Action,Red Dead Redemption 2,2025-01-16,i think many people fail to realize this is not that kind of game which just dies. rdr2 is rockstars minecraft.
Action,Red Dead Redemption 2,2025-03-16,i played this game endless when it came out and still gonna buy it again after 5 years hope it will be a good choice
Action,Red Dead Redemption 2,2025-01-16,the camp interaction with mb is one of my favs also.
Action,Red Dead Redemption 2,2025-01-17,literally the most detailed game having most immersive story. to think that this game was released in 2018 is giving more hype on the details that gta6 is gonna have.
Action,Red Dead Redemption 2,2025-03-05,i will never forget this game. 1010 masterpiece.
Action,Red Dead Redemption 2,2025-01-16,i just don't think this game can be topped just feels too much like a real life experience
Action,Red Dead Redemption 2,2025-02-04,"i just bought rdr2 on steam on my brand new pc since its on sale for only 15 right now, and itll be my first time ever playing it! im definitely excited to give it a go, ive never played a singleplayer campaignbased game before, ive always been a pvp multiplayer fan, but im starting to wanna branch out cause it gets tiring at times always tryna sweat to have fun and win those games"
Action,Red Dead Redemption 2,2025-01-16,im re playing the story rn. in the beginning i was intimidated by the shire size and stuff to do in the game. i got all the way to chapter 3 and moved to rd2 online. its was bare bones but i dumped so many hours into it. glad i'm replaying it again in 2025 and it simple hits different compared to gtagta online.
Action,Red Dead Redemption 2,2025-02-02,second play through since 2018. unreal. what a feeling this game gives you. 20 hours in and ive only completed about 4 main missions haha. amazing immersive experience. exploring the map.
Action,Red Dead Redemption 2,2025-01-23,"i just began my second playthrough last weekend, and i can't wait to hop back on it this weekend! there's so much i missed the first time around."
Action,Red Dead Redemption 2,2025-01-16,its not just a game. its a way of life.
Action,Red Dead Redemption 2,2025-01-18,i completed the story a year ago and am already getting nostalgia from it. that just goes to show hoe amazing it was. nothing will ever be able to compete with it.
Action,Red Dead Redemption 2,2025-01-18,"i just watched your legendary animal guide, man how much youve grinded starting from having a crappy mic to now."
Action,Red Dead Redemption 2,2025-02-05,"the reason why i still play rdr2 is because it is a masterpiece. the best game made in the last 10 years and among the best games ever made. details, story, gameplay, everything is 1010. not many games come up to this level"
Action,Red Dead Redemption 2,2025-01-16,"i still playing red dead online, and loving playing it. the players in freeroam are relax than gta online and more fun to interact with. i still hope that this game will get a upgrade to curent gen consoles. for now it feels like the old version of 7 days to die, this console version of that game got no updates for a long time  telltale games was broke and only bq the large player base still playing, we got a next gen upgrade. i hope red dead redemption will be the same."
Action,Red Dead Redemption 2,2025-01-19,"i don't consider 5 year games are old, i don't know, perhaps it's because i'm not young anymore but 5 year feels like yesterday to me."
Action,Red Dead Redemption 2,2025-01-16,"for me, its the greatest game ever made which makes it even more unbelievable why rockstar would abandon such a unique and special game"
Action,Red Dead Redemption 2,2025-01-16,"back in the day we were spoiled for choice with western themed games like gun, red dead revolver and call of juarez all releasing within a few years of each other. now however rockstar completely dominates the cowboy western themed genre with no other publishers pushing out a game to compete with it. with that in mind that is one of the reasons people keep playing rdr2 as its all we have in a market dominated by rockstar."
Action,Red Dead Redemption 2,2025-02-06,just started another playthrough and going strong in chapter 2. this will always be my favourite game.
Action,Red Dead Redemption 2,2025-02-06,"damn i can't believe i'm alive to see someone put the term old on this game, by far this gem is kicking the industry upcomings a lot and then i realize i will be 20 the next year damn"
Action,Red Dead Redemption 2,2025-01-16,i'm playing it again because i've upgraded my pc. in 4k this game is awesome.
Action,Red Dead Redemption 2,2025-01-28,"the world in rdr2 is very dynamic. everytime you go back to it, there is something new and you feel immersed in the amazing ecosystem."
Action,Red Dead Redemption 2,2025-02-08,"i found out about rdr2 in december 2023, i bought it off steam at like 20 bucks, i did not leave my house for a week after the first playthrough. i finished the story mode twice on low and high honor with all side missions as well. but i spent a bunch of time just enjoying the game, hunting, killing npcs, riding, etc. now i just started another playthrough and i want to finish only the main story without any side missions, and then complete them with john."
Action,Red Dead Redemption 2,2025-01-19,got the vr mod for it. i just like jumping in the game and explore the world from time to time. quick getaway from this urban life.
Action,Red Dead Redemption 2,2025-01-17,"rockstar made this masterpiece for 8 years just to abandon it, no 60fps patch on current gen, no updates or dlc for red dead online. this game also deserves the love gta v gets"
Action,Red Dead Redemption 2,2025-02-03,"how abandoned is you said. man, this game was made with so much love that it didnt need anything else afterwards. no dlcs or new content. the game is just perfect. in addition, its probably the best looking game so far."
Action,Red Dead Redemption 2,2025-01-16,"having this on my youtube frontpage is funny, i recently started lmao."
Action,Red Dead Redemption 2,2025-01-21,"as someone who has a hard time getting immersed in games, i felt very immersed in this game. much like i did when i was a kid."
Action,Red Dead Redemption 2,2025-01-16,"started playing rdo again lvl 75. there just something relaxing and soothing about the game. i usually do legendary bounties and hunting and i just love taking my time with the game and just taking it all in. im lvl 300 in gtao and in that game i just try to rush everything to get things done as quickly as possible but rdo, i soak it all in."
Action,Red Dead Redemption 2,2025-02-15,thats crazy i literally restarted to complete it one last time love this game
Action,Red Dead Redemption 2,2025-03-19,"just started the story for the first time, ive had the game since pc release over 1000 hours in online and probably just as much in redm waited all the way til i got a new pc to play story because i knew it would be way better with beautiful graphics"
Action,Red Dead Redemption 2,2025-01-28,"mate it happens i started playing this game again so i can actually finish it. i am amazed of how much better this game looks than most new games. even these dramatic conversations, npcs always have something to say. this game is amazing."
Action,Red Dead Redemption 2,2025-01-16,"best game ever made, in my opinion. it's certainly my favourite. i own it on xbox, i own it on playstation, and i recently bought it for pc during the winter sale and i'm about to play it through again for the umpteenth time. at 60fps dutch's plan has to work... right?"
Action,Red Dead Redemption 2,2025-02-25,"immersion  beautifully crafted open world  incredible stories and characters  best protagonist of all time?  little to no bugs  side content bounties, missions etc is s tier  timeless"
Action,Red Dead Redemption 2,2025-01-16,this game is one of the most realistic games and beautiful games ive ever played. but there are so many bugs in red dead online that is annoying. i wish rockstar could remove them.
Action,Red Dead Redemption 2,2025-01-16,"game so good gave me carpel tunnel, yeehaw, pardner"
Action,Red Dead Redemption 2,2025-01-16,the youtuber bw4yne was promoting a mod menu for rdr2 and even accepted a sponsorship. when i confronted him on his life chat i was told by another user likely a mod because he said he personally spoke to bw4yne tried to convince me that mod menu no longer works with rdr2 online but i can confirm it still does. im mentioning this because i have zero respect for content creators like him and the world of respect for creators like you. thankyou for always keeping our hopes up. you have inspired me to be a better player and exposing hackers and griefers. i uploaded my 1st video on griefers and will keep posting because there will never be a lack of content.
Action,Red Dead Redemption 2,2025-01-16,i finished the game over a year ago but never played the online until about 34 months ago and i was amazed all over again at how brilliant it is. i'm up to 195 now and logon every day and i still have more to see.
Action,Red Dead Redemption 2,2025-01-18,the disc stays in my ps4.
Action,Red Dead Redemption 2,2025-02-21,"i was playing rdr2 back in 2020 on my ps4 i haven't played rdr1 by the way so it was my first rdr. i mean the graphics were stunning, the huge and diversity open world with all the different climates even on my ps4. now i'm thinking about to get the game for my computer cause i don't own my ps4 anymore and play online with a friend of mine."
Action,Red Dead Redemption 2,2025-01-28,i recently returned to gaming but only for this game. nothing else really comes close
Action,Red Dead Redemption 2,2025-01-16,i want the next video to be why ppl are still playing red dead2 online in 2040...lol. i love this game
Action,Red Dead Redemption 2,2025-01-16,"i confess that i played the pirate for the first time. but after i completed everything i could offline, i bought the full game to play online. that's more than 730 hours of online alone, and i still love it. and i just want to play it more."
Action,Red Dead Redemption 2,2025-01-22,"i played rdr online less than two hours. and today, after playing story mode for 4030 hours i forgot how many times i replayed it and still love it."
Action,Red Dead Redemption 2,2025-01-23,"while i couldn't fathom playing rdo. the story mode is a relaxing experience once in a blue moon, but there's only so many times one can experience the exact same thing and still find enjoyment"
Action,Red Dead Redemption 2,2025-03-11,"started playing rdr2 for the third time this week but with minimal hud this time, no map."
Action,Red Dead Redemption 2,2025-01-16,hi cat when are you gonna be live streaming again btw great video
Action,Red Dead Redemption 2,2025-02-06,i finished yesterday the first one from 2010. cant wait to play the second!
Action,Red Dead Redemption 2,2025-02-26,"was just checking this on steam graphs, and rdr2 just broke the peak players record on steam again. 99.7k on the last 30 days february 2025."
Action,Red Dead Redemption 2,2025-01-30,"gave a second chance about 1 week ago, after a while at first i didnt liked the game man, i left off at middle of chapter 2, now i just started chapter 5 and i just can't stop playing, enjoying everything about the gameplay, the fights, the ambience. amazing game"
Action,Red Dead Redemption 2,2025-02-07,"i just went to pick this up on pc since i purchased one after playing through twice on my ps4. to my astonishment the singleplayer story mode is still 59euro. safe to say i will find an alternative route. i hope people remember cockstars conduct long after this business with rdr2online, the gta overhaul mods and so much more. assuming they will even continue to produce compelling content. we will see."
Action,Red Dead Redemption 2,2025-02-07,"the game is still the best looking game but in the aspect of overall distanced views, specifically checking how the ground looks and stuff shows imperfections like the textures or less polygons other games are now better at, but overall it still hits the eye better most of the times"
Action,Red Dead Redemption 2,2025-03-03,"it's not that old when you consider that grand theft auto online is still played by millions of people, the witcher still played by millions of people, and even skyrim is played by millions of people. classics will always be classics and will always stand the test of time."
Action,Red Dead Redemption 2,2025-02-01,"i bought it last month, idk why i thought i wouldnt like it but i actually love it"
Action,Red Dead Redemption 2,2025-01-16,what rockstar should do is. release rdr2 on ps5. faster load up screens and have the tresor de morts and rhodes bank robbery on the game.
Action,Red Dead Redemption 2,2025-01-16,"i preordered rdr2 the first day it was available. i finished the single player barely a year ago. the final scene that you showed was the one i got. when i finished rdr, i was like dang! the cops did john marston dirty. at the end of rdr2, i just teared up. it was the best ending i had ever seen in any game by far."
Action,Red Dead Redemption 2,2025-01-29,im on my 4 playthrough and i still find new things
Action,Red Dead Redemption 2,2025-02-09,just realized its going on nearly a decade since read dead redemption 2 came out
Action,Red Dead Redemption 2,2025-03-15,"graphically on ultra settings, still one of best looking games available. it seems the graphics engine rockstar games has developed is incredibly powerful. remember, rdr 2 came out in late 2018."
Action,Red Dead Redemption 2,2025-01-16,i'm still playing in full lobbies on ps network.
Action,Red Dead Redemption 2,2024-11-27,there are two kinds of people people who love red dead people who don't know red dead
Action,Red Dead Redemption 2,2024-11-28,dutch isn't talking about killing micah. he's talking about his final move against the pinkertons and leviticus cornwall. and the army. that final move was robbing the train carrying payload.
Action,Red Dead Redemption 2,2024-12-05,idk why but the while he is playable made me break into tears
Action,Red Dead Redemption 2,2025-01-06,fun fact. that chess opening dutch played is called dutch defence
Action,Red Dead Redemption 2,2025-02-27,"im sure that in paradise, peacefully departed arthurs eyes are blood shot because tb is a disease of the lungs, so humidity would most likely cause it to worsen"
Action,Red Dead Redemption 2,2025-03-11,"his eyes are bloodshot because at the start of that mission arthur's physical condition becomes unwell, and then in the mission the fork in the road becomes tuberculosis. hope i'm useful"
Action,Red Dead Redemption 2,2024-12-06,the best part about red dead is every play through has been something completely different with a crazy amount of different interactions i love it and always look forward to finding the new things
Action,Red Dead Redemption 2,2025-02-26,i have a...i have no plan
Action,Red Dead Redemption 2,2024-12-28,id bet rockstar themselves didn't even think of that last one
Action,Red Dead Redemption 2,2025-02-16,that last one feels like a stretch
Action,Red Dead Redemption 2,2025-03-10,great content creator keep going
Action,Red Dead Redemption 2,2024-11-27,have u mentioned that in a fine night of debauchery if u wear a fancy outfit before the mission there will be special dialoge
Action,Red Dead Redemption 2,2025-02-14,i love this game so i will subscribe you helped me do some amazing things on my play through
Action,Red Dead Redemption 2,2025-02-03,did you know after the chapter 5 mission if you sleep for 48 hours then go to sleep again and sleep another 48 hours your characters eyes will not become bloodshot anymore
Action,Red Dead Redemption 2,2024-12-13,wait the suit is red in low honour guess ive always been too much of a good guy to ever know that
Action,Red Dead Redemption 2,2025-02-19,i listened to this song while riding my horse it felt like i was actually in chapter 6
Action,Red Dead Redemption 2,2024-11-28,my vest color changed mid saint denis bank job
Action,Red Dead Redemption 2,2024-12-11,we need a undead nightmare 2
Action,Red Dead Redemption 2,2025-01-03,what are you doing here dutch same as you i suppose
Action,Red Dead Redemption 2,2024-12-23,i love your videos
Action,Red Dead Redemption 2,2024-11-28,it doesn't conclude the game's storyline at all. there's still more story in the first game
Action,Red Dead Redemption 2,2024-11-27,i think the vest was lime green in beta
Action,Red Dead Redemption 2,2024-11-27,seeing you in my feed after a long time lets go.
Action,Red Dead Redemption 2,2024-12-04,i finish red dead redemption 2 twice
Action,Red Dead Redemption 2,2025-02-06,while in the mission to save javier from the mexican people or smth i forgot who they are arthur coughs while they were in the cave. which also foreshadowed his tuberculosis.
Action,Red Dead Redemption 2,2024-12-13,the first one was cool
Action,Red Dead Redemption 2,2024-11-27,first one to comment!! hope ya doing good and keep up the great content
Action,Red Dead Redemption 2,2024-11-27,i'm just so proud of you 3
Action,Red Dead Redemption 2,2024-11-27,ho find red dead reception 2 is the best game
Action,Red Dead Redemption 2,2025-03-02,finally micah dyes i hate him
Action,Red Dead Redemption 2,2024-12-03,am i the only one who tought it was rdr1 at begginig brcause of graphics
Action,Red Dead Redemption 2,2024-12-01,he shoots micah? bro just spoiled this for me
Action,Red Dead Redemption 2,2024-11-27,fourth one in the chat boiiz.i love your rdr videos keep posting ok  those who like this dude
Action,Red Dead Redemption 2,2025-03-06,good video but dont play that music please its too sad im crying trying to watch the short
Action,Red Dead Redemption 2,2024-11-29,"do i play red dead? no. do i still watch, like, and sub to this? absolutely"
Action,Red Dead Redemption 2,2024-11-30,just like to know why i got two disks with the game but only used one ??
Action,Red Dead Redemption 2,2024-12-16,i got red vest
Action,Red Dead Redemption 2,2024-07-23,"arthur gave him life and he gave life to his family, his son"
