Video ID,Author,Date,Comment,Likes
2G4Fv5QIWsA,@hanifthanzeel6555,2025-02-09T19:14:17Z,"роирогрпНро▒ро┐ роЪроХрпЛродро░ро░рпЗ.ро▓рпЖрокройро╛ройрпН рокро╛.рооройрпНро▒родрпНродро┐ро▓рпН ро╣ро┐ро╕рпНрокрпБро▓рпНро▓ро╛ро╣рпН рокродро╡ро┐ роПро▒рпНро▒родрпИ роЕро▒ро┐ро╡ро┐родрпНродроорпИроХрпНроХрпБ..роЪро┐ропрпЛройро┐ро╖ро╡ро╛родро┐роХро│рпБроХрпНроХрпБроорпН,роЕродройрпН роХрпВроЯрпНроЯро╛ро│ро┐ роиро╛роЯрпБроХро│рпБроХрпНроХрпБроорпН роЪрпЖро░рпБрокрпНрокро╛ро▓рпН роЕроЯро┐родрпНрод рооро╛родро┐ро░ро┐ роЗро░рпБроирпНродро┐ро░рпБроХрпНроХрпБроорпН..",1
2G4Fv5QIWsA,@ImamdeenImamdeen-ln1jl,2025-02-09T19:09:25Z,роЙрогрпНроорпИропро┐ро▓рпН роЕроорпЖро░ро┐роХрпНроХро╛ро╡рпБроорпН роЗро╕рпНро░рпЗро▓рпБроорпН роЙро▓роХродрпНродро┐ро▒рпНроХрпБ роЗро░рпБ родрпАроп роЪроХрпНродро┐роХро│рпН роЗро░рогрпНроЯрпИропрпБроорпН роЕро┤ро┐роХрпНроХро╡рпЗрогрпНроЯрпБроорпН ЁЯТеЁЯЗоЁЯЗ▒ЁЯЗ║ЁЯЗ▓ЁЯФе,0
R1-taTwb0ms,@keith.loves.lasagna,2025-02-27T07:57:19Z,"Lakers are a contender (but not favorites).   But if they get a decent big next year, they're my favorites to win it all, at least once in the next 2 seasons.",1
R1-taTwb0ms,@josh4466,2025-02-27T07:29:55Z,They made the game soft so the EU players could thrive to make the game global,2
R1-taTwb0ms,@kylelvin1,2025-02-27T07:10:32Z,Hilarious how the Dallas owner used shaq as someone that was always in shape and committed yet he just said he always went out and partied after a game ЁЯШВЁЯШВЁЯШВ.  That is fine if youтАЩre handling your business.  It Clearly shows he knows nothing about basketball and his reasoning is idiotic to say the least.,0
R1-taTwb0ms,@arianluna4548,2025-02-27T05:35:37Z,Shaq needs an interpreter . Maybe a subtitle when he speaks can help.,1
R1-taTwb0ms,@brandonperez2267,2025-02-27T04:07:43Z,"No, he went to sleep.",0
R1-taTwb0ms,@scoutGOW,2025-02-27T00:35:13Z,Mavs have a very short time to be relevant and it doesnтАЩt look like this year will count!,1
R1-taTwb0ms,@Zuyo111,2025-02-26T23:26:59Z,IтАЩm keeping my Luka Mavs jerseys. Luka forever. IтАЩm a Mavericks fun. Hate that new owner!,5
R1-taTwb0ms,@adeebmomen4541,2025-02-26T22:56:54Z,Shaq is such a good guy by subtly standing up for Luka. He purposely made that тАЬIтАЩm hitting the clubтАЭ comment to go against that statement the Mavs owner said against Luka by citing Shaq as someone тАЬhardworking.тАЭ,7
R1-taTwb0ms,@deandegville3630,2025-02-26T22:40:19Z,It's crazy how this guy gets a lot criticism lately yet he dropped 73 points like it was nothing okay then,1
R1-taTwb0ms,@jaystevens9703,2025-02-26T22:28:58Z,Lakers just get Dwight Howard,0
R1-taTwb0ms,@Stanleyd-y7v,2025-02-26T22:14:46Z,Great start for Luka. CanтАЩt wait to watch this on April 9 in Dallas. ItтАЩll be more fun and show off than in LA ЁЯШВ,1
R1-taTwb0ms,@lesliewarren5394,2025-02-26T19:53:49Z,ЁЯЩМЁЯП╜ЁЯЩПЁЯП╜ЁЯТкЁЯП╜ЁЯТЬЁЯТЫЁЯФеЁЯТлЁЯТп,0
R1-taTwb0ms,@bandzyolo,2025-02-26T18:20:25Z,When Luka get in his prime itтАЩs over having a good triple double and 3 steals as an off game is crazy,0
R1-taTwb0ms,@leysin456,2025-02-26T18:12:36Z,Boo Hoo. A mega millionaire got traded to be a mega millionaire.,0
R1-taTwb0ms,@pizzathehut1674,2025-02-26T18:12:31Z,Mavs wouldтАЩve won this if AD was active,0
R1-taTwb0ms,@danielandric4956,2025-02-26T17:50:41Z,"think he feels emotionally betrayed, very disappointed",7
R1-taTwb0ms,@senpaiknight2247,2025-02-26T17:34:22Z,"Shaq be like тАЬMeet me at the Trail, itтАЩs going down
Meet me at the Mall, itтАЩs going down
Meet me at the Club, itтАЩs going down
Everytime you meet me, guaranteed itтАЩs going down!тАЭ ЁЯШВ",5
R1-taTwb0ms,@khemkaslehrling3840,2025-02-26T17:33:56Z,"He's a champ and is going to handle it.  But as a 25 yr old kid, it's going to be a process to sort out how he's been blindsided.",4
R1-taTwb0ms,@Allday1219,2025-02-26T17:29:20Z,Not a good win Mavs have a lot of injuries,0
R1-taTwb0ms,@Spletna.stran.po.meri111,2025-02-26T16:54:05Z,Where the Mavs centers? If they wouldnt be injured Lakers would lose,0
R1-taTwb0ms,@nnbegin2965,2025-02-26T16:36:12Z,SHAG was newer cheated by NICO....so he can dance after the game!,0
R1-taTwb0ms,@Dean-z4w,2025-02-26T16:32:52Z,Shaq went to the club kobe went to the gym no wonder he was traded,1
R1-taTwb0ms,@JettJohnLuciano-r3w,2025-02-26T16:31:03Z,ThatтАЩs why Kobe told Phil Jackson you need to get Shaq out of here ЁЯж╛ЁЯдкЁЯж╛,1
R1-taTwb0ms,@VaderLord1981,2025-02-26T15:59:01Z,"LeBron James is simply the fiercest there ever was
The man is not human after all
This superhuman physique coupled with his other abilities make him the GOAT

I know a lot of people hate him and will never acknowledge that

I think his greatest strength is that he leads his team tactically through every second on the field
His teammates benefit immensely from this

Kneel before the king",0
R1-taTwb0ms,@anoopmathew82,2025-02-26T15:32:22Z,Luka's demeanor/tone completely changed when Candace asked about Jkidds scheme against him. This dude knows that JKidd and Nico did him dirty together,26
R1-taTwb0ms,@thesportsguy126,2025-02-26T15:29:28Z,He didnt even have a good game. Everybody praising him like he took the game over.,1
R1-taTwb0ms,@slattslatt,2025-02-26T15:15:03Z,You can see he still canтАЩt believe it and finds it hard to believe,6
R1-taTwb0ms,@Yurica1983,2025-02-26T15:00:19Z,Shaq is the best! Haha,2
R1-taTwb0ms,@MateMagyar88,2025-02-26T14:47:38Z,Damn I was expecting Shaq to speak some Slovenian.,4
R1-taTwb0ms,@SPACE_BOOOOOST,2025-02-26T14:42:58Z,Shaq really forgot the lyrics to a chorus that has like 12 different words in it total.,0
R1-taTwb0ms,@brode7716,2025-02-26T14:38:02Z,2:59 we get it your shaq but can you let the other guy talk,0
R1-taTwb0ms,@graycie8512,2025-02-26T14:28:58Z,"I'm a Mavericks all the way and I still love Luka and Lakers color I find hard to see him inЁЯШв but to be honest this was not a fare match up for the Mavs cause AD, Gafford, Lively is out because of injury when our guys are health then I can say that's the match up we've been waiting but that win is no big significance to me, not the match up I'm waiting to see.",0
R1-taTwb0ms,@Babygirl-k2670,2025-02-26T13:52:49Z,"The anticipation of this game was very emotional for him, you could see it all over his face. This wasn't just a trade, they talked a lot of mess about him.  He is emotionally drained.",8
R1-taTwb0ms,@nayosum343,2025-02-26T13:51:30Z,"Idk what happened to him, but since he joined Lakers bro rly improved speaking english, for some odd reason. Anyone else or am I tripping?",3
R1-taTwb0ms,@kareesse02,2025-02-26T13:49:59Z,you all commenting he is sad. maybe he is just tired keep hearing about the trade from the media. even im tired of hearing or seeing it,0
R1-taTwb0ms,@LoneBear-one,2025-02-26T13:47:47Z,IтАЩm ready for a hamburger ЁЯНФ,0
R1-taTwb0ms,@LoneBear-one,2025-02-26T13:46:57Z,UhтАжuh..uhтАжwhat you trying to make me say hereЁЯШо,0
R1-taTwb0ms,@ihonestlydontevenknow4359,2025-02-26T13:43:05Z,mannnnтАж you can tell he wanna be in dallas,4
R1-taTwb0ms,@JuanJuarez00,2025-02-26T12:55:57Z,Luka sad. He knows he belongs in Dallas. As a mavs fan we know.,4
R1-taTwb0ms,@brucelau2023,2025-02-26T12:41:28Z,"HeтАЩs still a kid tho , but u can tell he was very upset about that",15
R1-taTwb0ms,@JayMuney-ce3bu,2025-02-26T12:38:57Z,that was shaq problem too busy in the club but not too busy in the GYMЁЯШВЁЯджЁЯП╛тАНтЩВя╕П,12
R1-taTwb0ms,@thatoneguy5512,2025-02-26T12:11:32Z,"Man i miss the old TnT crew, glad we still got Shaq",1
R1-taTwb0ms,@francescomarchesin5439,2025-02-26T12:10:40Z,Nothing to do with Luka.. but I just realize how lucky Shaq's taylor is... ЁЯШВ,2
R1-taTwb0ms,@alohatvn,2025-02-26T12:09:47Z,"Great game, Luka and the Lakers ЁЯШКЁЯШКЁЯШК..",4
R1-taTwb0ms,@stefanbraun7427,2025-02-26T12:03:12Z,He seems really sad.,1
R1-taTwb0ms,@PawlusFishing,2025-02-26T11:44:52Z,"Dude dropped triple double in W against his former club, coming out of injury and saying he had a bad game, nothing workedЁЯТА",7
R1-taTwb0ms,@bradmodd7856,2025-02-26T11:38:56Z,I thought the yellow uniform was their home game uniform?,0
R1-taTwb0ms,@portcityb214,2025-02-26T11:33:36Z,ItтАЩs just crazy my old 2k had Luka on the lakers and this mf really on the lakersЁЯдгЁЯдЭ,5
R1-taTwb0ms,@kkay3230,2025-02-26T11:06:54Z,Luka is the man,0
R1-taTwb0ms,@GSP-v6d,2025-02-26T10:44:43Z,"One day, theyтАЩre going to build a statue of Luka outside of Staples CenterтАж.right next to the statue of Nico Harrison.",2
R1-taTwb0ms,@masseysmaineentertainment,2025-02-26T10:33:40Z,"Kidd having to throw junk defense out there on Luka just so Luka doesn't show up Jason's boys.  Simple - you and the GM are on the hook after this year for that trade....you get bumped in the prelim or quarterfinals - you are unemployed.

Stop worrying about what people think of your dumb asses and start to figure out how you gonna stay out of the OKC bracket....",0
R1-taTwb0ms,@James6923.,2025-02-26T10:29:40Z,"Once Lebron retires, how mediocre that team will be. CanтАЩt wait ЁЯШБ",0
R1-taTwb0ms,@PHONIBRAXTON,2025-02-26T10:29:21Z,"IтАЩm not gonna lie IтАЩve been a Lakers fan since 2010 and since about 2012 itтАЩs been on and off for the Lakers, especially after Kobe officially retired like even before then when he was dealing with his injuries and he wasnтАЩt able to deliver like he used to in his prime, it has been very stressful for being a Lakers fan lol even with LeBron there it still hasnтАЩt felt like weтАЩve had an official long-term star for the Lakers and a long-term positive future weтАЩve been on and off on and off, but with Luca hopefully with us for at least the next 5 to 10 years hopefully it finally does feel like we are actually looking up! And that our future is gonna be competitive for years to come. IтАЩve been waiting on this moment for so long lol thank you Nico!!!!",8
R1-taTwb0ms,@bitcoinethereum9702,2025-02-26T10:27:56Z,Nico Harrison and AD had zero combined points,0
R1-taTwb0ms,@jpnoy,2025-02-26T09:27:28Z,тАЬLuka beating the Mavs.тАЭThatтАЩs something we thought we wouldnтАЩt say,37
R1-taTwb0ms,@bobbyb835,2025-02-26T09:16:57Z,I am from Dallas. Big Luka fan and I want him to do good and succeed but seeing him in Lakers Uniform makes me sick.  Turns my stomach. That SOB Nico Harris and the disgusting Mavs new casino owners all make me sick.  Disgusting humans.  The worse deal in NBA history.  ЁЯдоЁЯдоЁЯдоЁЯдоЁЯдоЁЯдоЁЯдоЁЯдоЁЯдоЁЯдо,5
R1-taTwb0ms,@TrainEatSleepRPT,2025-02-26T09:12:40Z,VCтАЩs return to Toronto when he was with the Nets was crazy. Anyone who hasnтАЩt seen that game should go watch it,7
R1-taTwb0ms,@kaijo7309,2025-02-26T09:04:49Z,Now put my Big man with the other three GOATS now. It feels empty as hell without those 3 foos тЭд,1
R1-taTwb0ms,@FaNdOm-y4f,2025-02-26T08:38:34Z,Is Luka real happy To Lakers or It's Just For Camera? Look into Her Eyes.. there's a lot of Pain,2
R1-taTwb0ms,@breezetn1089,2025-02-26T07:59:22Z,Did Shaq fall asleep for abit?,0
R1-taTwb0ms,@UMS-dj3sx,2025-02-26T07:47:32Z,"Why did TNT not have their A team on this? Load management while getting a ton of money? Where have I heard this before? Hopefully NBC can do a better job of promoting the NBA and the game of basketball. Sick and tired of these whiny, entitled old heads",1
R1-taTwb0ms,@KingProdigyGaming,2025-02-26T07:45:51Z,ItтАЩs the fact that you can see the sadness in Luka that hurts me the most he really never wanted to leave he wanted to be the next dirk. Mavs stole that from him. I promise if you wouldтАЩve talked contracts you wouldnтАЩt have had to pay him a max. He wouldтАЩve been happy to stay for anything. Give him 200 5 year he wouldтАЩve took it. Nico f*cked up,148
R1-taTwb0ms,@sodalimesalt,2025-02-26T07:39:29Z,He looks sad. Hang in there Luka. ItтАЩs a $#!t world. Things happen that are out of your control sometimes. DonтАЩt linger much. This too shall pass.,9
R1-taTwb0ms,@fourdtough,2025-02-26T07:38:54Z,thats my tweet/post. lol,2
R1-taTwb0ms,@aintkool,2025-02-26T07:38:49Z,"Nahh, passing on this announcer crew, they gel like gravel and electric as rubber shoes, whereтАЩs Chuck and Kenny?",0
R1-taTwb0ms,@DanielPak831,2025-02-26T07:37:24Z,Im impressed Vince knew what song shaq was trying to mumble,3
R1-taTwb0ms,@trenapier206,2025-02-26T07:35:01Z,I hear the sadness... Luka...ЁЯШвЁЯШвЁЯШв,54
R1-taTwb0ms,@kennethshaw6087,2025-02-26T07:21:00Z,The Lakers need to thank the Dallas Mavericks for that win,1
R1-taTwb0ms,@MK68979,2025-02-26T07:18:39Z,The Lakers win by 8 with Luka not breaking 20 points? This is a victory lap for Luka? The Lakers have no defense and center. Luka and LeStat chaser get rebounds by standing on the court. The Mavs do not have a center playing on their team...this was hardly meaningful for anything but a w in the win column.,0
R1-taTwb0ms,@micklexl1715,2025-02-26T07:17:39Z,Candice Parker looks so good. She is fine fine!!!!!!ЁЯе░ЁЯе░ЁЯе░ЁЯе░ЁЯе░ЁЯе░ЁЯе░ЁЯе░,2
R1-taTwb0ms,@DominikMusiol,2025-02-26T07:15:22Z,I donтАЩt think Shaq has partied in L.A. for a while. Sunset Blvd. is dead af. ЁЯШВ,3
R1-taTwb0ms,@alonzovilla589,2025-02-26T07:12:58Z,He wants to cry ЁЯШв f corruption,1
R1-taTwb0ms,@zachfelt2273,2025-02-26T07:10:12Z,"IтАЩm not gonna lie barely beat the mavs AD, lively, Gafford outЁЯди idk if lakers beat a fully healthy mavs teamЁЯТп",4
R1-taTwb0ms,@Dashrathlama,2025-02-26T07:03:24Z,Typical Shaq the hater,2
R1-taTwb0ms,@AntonioZambrano-vh2dr,2025-02-26T06:59:21Z,"M├йxico en la casa, paz para Sinaloa",0
R1-taTwb0ms,@jordanchou,2025-02-26T06:54:29Z,"Luka and LeBron work a lot better together than I was expecting. LeBron is doing great backing off, scoring off othersтАЩ passing, and getting boards.",5
R1-taTwb0ms,@zechariahzenith8762,2025-02-26T06:53:40Z,"In Dallas, ""Fire Nico!"" In LA, ""Thank you Nico!""",140
R1-taTwb0ms,@jharry1848,2025-02-26T06:52:20Z,"Nico really wasted an honest and loyal man right there.
Eyes looks really sad and emotional.
Bron carried this one.
Good game Mavs.",45
R1-taTwb0ms,@jdilla5622,2025-02-26T06:51:16Z,Temu crew,2
R1-taTwb0ms,@memoirmystery,2025-02-26T06:47:59Z,Shaq at the club after dropping 65 and 28 on the clippers,3
R1-taTwb0ms,@skeletor7708,2025-02-26T06:46:50Z,"""We have TNT crew at home"":",25
R1-taTwb0ms,@EngulvedSpirits,2025-02-26T06:45:19Z,"Luka, i've been in this situation before. Slight flex",3
R1-taTwb0ms,@jaybee2714,2025-02-26T06:41:22Z,Where's Charles Barkley?  I like to see him upset. I know how much he hates the Lakers. ЁЯШВ,1
R1-taTwb0ms,@g.o.a.tsports2880,2025-02-26T06:38:42Z,"HeтАЩs still struggling with his shot, too. Only shooting 38% since returning.",6
R1-taTwb0ms,@deanfirnatine7814,2025-02-26T06:38:41Z,"No Ernie, no Kenny, no Chuck",37
R1-taTwb0ms,@jacobl769,2025-02-26T06:36:02Z,"Nico, howтАЩs that decision treatin ya? AD keeping the bench warm fit the culture better?",13
R1-taTwb0ms,@уВ╗уГкуВ╣уГАуГкуГлуВ╕уВзуГГуГИ,2025-02-26T06:31:36Z,This is what you get if you delete a pass first young star on your squad.  Kyrie klay is hustling hard too much just to create a basket. You add AD and still it will be hard. Role players can't get going by themselves.,2
R1-taTwb0ms,@Thisisrance,2025-02-26T06:30:12Z,ЁЯШВ I donтАЩt care if you have 20 assist if youтАЩre shoot 1-8 from 3 and 5-15.  He literally bricked everything but a single 3 pointer that wasnтАЩt an uncontested bunny.  This was him in TRY HARD mode btwтАж heтАЩs absolutely washed.,1
R1-taTwb0ms,@infinityimpurity4032,2025-02-26T06:29:57Z,"You know what I will feel really good if I see Lakers and the Warriors in the western conference finals. Its either Luka getting his first championship, or Jimmy getting his. I would love to see that happen. Ofc steph and lebron going head to head another time is also on the list.",4
R1-taTwb0ms,@FurryTrioAdventures,2025-02-26T06:29:30Z,He's a kid still young. You could tell he was upset,113
R1-taTwb0ms,@Dukemyers,2025-02-26T06:25:37Z,"He looks sad man, from a Mavs fan, please come back someday when Nico is gone. Much love",16
R1-taTwb0ms,@dadabulbs7481,2025-02-26T06:25:18Z,"If the Mavs were healthy, would the outcome have been the same?",1
R1-taTwb0ms,@bimalpudasaini3576,2025-02-26T06:21:54Z,It is insane that Luka can lose 50 lbs in matter of a couple of weeks.,2
R1-taTwb0ms,@jesseshaw4495,2025-02-26T06:17:14Z,LetтАЩs go Mavs!!!,0
R1-taTwb0ms,@krngammaguy,2025-02-26T06:12:42Z,Luka fits so well in Lakers,7
R1-taTwb0ms,@Kevon420,2025-02-26T06:11:54Z,So happy for Luka for him to finally be at a big club.,3
R1-taTwb0ms,@lisbility,2025-02-26T06:11:44Z,Messed Around and got a triple double,12
R1-taTwb0ms,@VF1-RJ,2025-02-26T06:10:51Z,Luka looks in great physical shape. Not overweight at all. Great work!,5
R1-taTwb0ms,@Davidstone568,2025-02-26T06:08:14Z,Luka dumming down to talk to no stat shak,1
R1-taTwb0ms,@OldTimeTraveler,2025-02-26T06:06:16Z,"Luka is not there yet, mentally. He was nervous and off.",4
rNWDcetcZRU,@zuma5443,2025-02-27T19:58:26Z,De ware aard van Knoester komt steeds meer naar buiten. Wat een bs komt daaruit.,0
rNWDcetcZRU,@theraheemskerk9498,2025-02-27T14:54:58Z,"""Een volk dat voor tirannen zwicht, zal meer dan lijf en goed verliezen; dan dooft het licht."" Schrijver/dichter en verzetsstrijder H. M. van Randwijk.",1
rNWDcetcZRU,@Pokemonlight,2025-02-27T13:58:24Z,"Sinds wij massaal moslims dit land binnen halen is Nederland gewoon kapot aan het gaan en spreken we overal schanden van, terwijl in de tussentijd we onderhand bijna een buitenlander in ons eigen land zijn.",0
rNWDcetcZRU,@Pokemonlight,2025-02-27T13:57:21Z,"Lang verhaal kort: Islam is een haatzaaiende ideologie , waar alleen maar dood en verderf van komt. Nooit leuk nieuws, alijd gezeik met dat geloof. En uiteraard importeerd Nedeland MASSAAl van dit soort mensen..",0
rNWDcetcZRU,@qezbez2344,2025-02-27T12:35:44Z,Je vrouw van de trap laten afdonderen....meneer dersken is ook een vorm van eerwraakЁЯШв,0
rNWDcetcZRU,@robertovalero6186,2025-02-27T04:55:42Z,Schei uit man met je Islam.Als je wat zegt over ЁЯЗоЁЯЗ▒dan zijn de rapen gaar.Dat heeft die Derksen zelf ook nog eens mee gemaakt!!!Hij maakt die opmerking en de volgende dag kreeg hij alle bagger over zich heen.Die Pieter daar direct aan de bar......Frits Barend....enz....enz.....ЁЯдг,0
rNWDcetcZRU,@Sitz-hi8pc,2025-02-27T04:03:18Z,"En dat is eng waar wij worden gegijzeld door een groep mensen die wij hier binnen hebben gelaten geen journalist, BNer talkshows ect durft niet openlijk een mening te geven en het maar bagatelliseren.",0
rNWDcetcZRU,@rinussmans9070,2025-02-27T03:07:51Z,V├│├│r het leven benoemde mensen die hun broodheren de burgers ten alle tijden moeten beschermen tegen van alles en nog wat mogelijk schadelijk v├│├│r diezelfde broodheren KAN zijn !!! Nouw hoe moeilijk kan dat zijn !!! ONACCEPTABEL DEZE BELACHELIJKE TAFERELEN VAN DE GERECHTELIJKE MACHT TOV DE SAMENLEVING!!!ЁЯдвЁЯдоЁЯдоЁЯдоЁЯдоЁЯдм,0
rNWDcetcZRU,@matshanssen2070,2025-02-26T20:45:50Z,"Waarom ontbreekt
van der Gijp steeds 
vaker...? ЁЯдФЁЯе┤",1
rNWDcetcZRU,@charifl755,2025-02-26T20:43:27Z,Wat is er precies verkeerd aan de timing volgens Job Knoester: 0:44?,0
rNWDcetcZRU,@ndl8722,2025-02-26T20:37:22Z,Jullie zijn de haatpredikanten,0
rNWDcetcZRU,@ndl8722,2025-02-26T20:36:07Z,Niet goed voorbereid is zoooтАЩn harde cope man take de L,0
rNWDcetcZRU,@harrie2491,2025-02-26T19:18:36Z,misschien moet je als advocaat wat meer bezig zijn met de waarheid in plaats van winnen,0
rNWDcetcZRU,@askfaisalmuslim,2025-02-26T19:06:03Z,"Haatimams, haatpredikers? Jullie zijn zelf haatzaaiers en staan internationaal bekend om apartheid, een Nederlands woord?",0
rNWDcetcZRU,@rene9582,2025-02-26T19:02:23Z,"Nee, het verschil is dat Faber van de PVV is en Grapperhaus van de VVD. Daarom heeft de rechter besloten hen toe te laten. Alles wordt aangegrepen om de ideeen van de PVV tegen te werken. Scheding der machten is een farce in NL. Waarom wordt Wilders veroordeeld om de minder minder uitspraak terwijl Spekman opnelijk mag zeggen dat je Marokkanen moet vernederen??? Precies ja, het was een politiek proces en hier is het niet anders.",0
rNWDcetcZRU,@evertsmits1035,2025-02-26T18:51:02Z,"Advocaten gewoon met rust laten
Rechters en OM moeten echt eens in de spiegel kijken zij zijn diegene die de rechtstaat ondermijnen met hun zogenaamde uitspraken waar de boks van af zak en ik blijf erbij we hebben geen rechtspraak meer ze hebben keer op keer bewezen met hun uitspraken dat ze op de stoel vd politiek zitten o we krijgen het niet voor elkaar om dat het volk tegen stemt o dan duwen we het wel door de strot via de rechter ЁЯШд",0
rNWDcetcZRU,@BisantimidoloG,2025-02-26T18:45:54Z,Lale Gul ЁЯШВЁЯШВЁЯШВ weer enige voorbeeld,0
rNWDcetcZRU,@RonaldDebruyn,2025-02-26T17:45:57Z,Er zijn bijna geen onafhankelijke rechters  meer die zich aan de letter van de wet en de bewijsvoering houden veel d66 rechters is ook een feit net als bij bb de npo,0
rNWDcetcZRU,@fomofood1097,2025-02-26T17:43:54Z,Dit is belachelijk wat betreft vrijheid van meningsuiting,0
rNWDcetcZRU,@PALESTINO187,2025-02-26T17:43:24Z,Wilfred do you condemn this kiss??ЁЯШВЁЯШВ CIDI inside gaat kapot van binnenЁЯШВ hasbara propaganda is in een kus blootgelegd ЁЯШВ,1
rNWDcetcZRU,@EthicalTryMe,2025-02-26T17:37:26Z,"Daarom vind ik Najib Amhali de beste na Youp van 't Hek. Eerlijk is eerlijk. Youp maakte ook grappen over Moslims en ik als Moslim zijnde moest er wel om lachen, want het is zoals het is. hij riep niet dat ze het land uit moeten of weg ermee of welke vorm van directe extreem rechtse discriminatie-formules.  Najib maakt grappen over MENSEN met zijn eigen geloof. Die mensen hebben het toch ook niet over de Christenen of Katholieken? Ze hebben het over Nationaliteiten en niet over hun geloof. Nederlanders wijzen met hun vinger eerst naar het geloof van die mensen en benoemen daarna meteen hun nationaliteit.  En daar schaam ik me diep en diep voor, dat wij als Nederlanders eerst hun geloof moeten benoemen en daarna de nationaliteit en waar die mensen vandaan komen.",1
rNWDcetcZRU,@jamall-cr5dq,2025-02-26T17:12:01Z,"Eerwraak? als t  nlers zijn is t een Gezinsdrama. 
Rechters zijn over t algemeen d66 lui dus die worden door rechts bedreigt.... 
T is maar hoe je t bekijkt toch. Je mag ook niks over isreal/joden of onderdrukking Palestina zeggen ben je gelijk Antisemiet of je steunt Hamas etc.
Zo makkelijk allemaal...",0
rNWDcetcZRU,@aseq2,2025-02-26T16:56:24Z,We moeten veel vernietigender zijn over de islam. Dat gezwel moet verwijderd worden uit de maatschappij.,0
rNWDcetcZRU,@robvaniren2008,2025-02-26T16:16:42Z,Andre Manuel schrikt nergens voor terug.,1
rNWDcetcZRU,@flipflipflap8293,2025-02-26T16:10:56Z,"Wat een flauwekul betreft de cabret, een aantal  beledigen moslims nog steeds, anderzijds is het ook makkelijk scoren ...... en kan je overwegen om het achterwege te laten en een andere doelgroep te kiezen.",0
rNWDcetcZRU,@hansvanrijswijk1472,2025-02-26T16:10:26Z,Ik mag Rob Knoepert wel .    Als rechters bedreigd worden...oh jeeeee ! Dat mag niet hoor ...pas op !  En...van Weel...ik lach mij scheel ! En...Dick Schoof..ik ben Oostindisch doof .,1
rNWDcetcZRU,@pee2861,2025-02-26T16:03:30Z,Die rechter moet niet zeikenтАж.. hij wordt daar toch meer dan royaal voor betaald? Dan moet je ook de gevolgen accepterenтАж,0
rNWDcetcZRU,@barry260888,2025-02-26T15:53:58Z,Hans Teeuwen heeft wel een stuk over de islamЁЯШЙ,0
rNWDcetcZRU,@Karima-j8c,2025-02-26T15:35:11Z,"Johan neem lekker een koekie er is geen moslim die aan eerwraak doet!!! Dat is cultuur en geen islam! En waarom raak je nou zo in paniek man, blijf aub weg van racisten en laat je niks wijs maken kom op nou! Jij had ook problemen met je vader en de kerk is het dan miljoenen christen die de schuld hebben of de bijbel nee. Doe gewoon normaal joh en als je wilt weten wie die spreken zijn nodig ze dan uit ga met ze in gesprek. En iedereen moet zich aan de wet houden, dus als iemand bang is ja dan bel je 112 heel simpel!",0
rNWDcetcZRU,@EmmermetBloed,2025-02-26T15:05:41Z,Ben ik een gedrocht die nooit buiten komt? ЁЯзЯтАНтЩВя╕П,0
rNWDcetcZRU,@EmmersmetBloed,2025-02-26T14:49:39Z,heeft derksen fotos van zn dochter en haar moeder onder aan de trap?,2
rNWDcetcZRU,@meknesimeknes7429,2025-02-26T14:39:09Z,"Achja elk jaar bekeren zich in Nederland, Europa, Amerika etc steeds meer mensen tot de islam. Johan zelf helpt hiermee aan zonder bewust van te zijn. Johan en co en mensen als Johan die proberen haat te zaaien, maar mensen gaan uiteindelijk zelf uit op onderzoek en bekeren zoch tot de islam. Of je het leuk vindt of niet.",0
