Video ID,Author,Date,Comment,Likes
DjODCllZj4w,@HimikoTammy,2025-02-26T16:53:31Z,Margaret qualley,0
DjODCllZj4w,@HimikoTammy,2025-02-26T16:53:19Z,AVA VOIGHT,1
DjODCllZj4w,@SuusHengelo,2025-02-25T23:51:42Z,"Horrible! Most boring movie EVER made. The first half seemed okay, but it went nowhere. Don't waste your time.",0
DjODCllZj4w,@johnnyr8603,2025-02-05T01:24:20Z,"IтАЩm extremely disappointed. What a shitty ending to an otherwise great movie. The movie itself was really great, but the ending was terrible. I really wanted to see the homeowner get home and see what would happen if he got home and found Nemo still there. DonтАЩt get me wrong I love William Dafoe and his character Nemo was great but the movie just dragged on and we never get to see the man return to his apartment to confront Nemo.",0
DjODCllZj4w,@lizviceofficial,2025-02-03T21:43:04Z,I loved this movie. This felt like art.,0
DjODCllZj4w,@AliffJJ,2025-01-28T15:34:06Z,At last....we can see Carson Clay in action.... Playback Time!,1
DjODCllZj4w,@Alan-io2ew,2025-01-22T15:58:11Z,"OMG,what a mess to come home to.",0
DjODCllZj4w,@muradcaucasus2396,2024-12-19T16:39:57Z,he should brake the wall to the hall,0
DjODCllZj4w,@jotun_616,2024-12-10T10:49:28Z,And another willem goes crazy again. Bored.,0
DjODCllZj4w,@survivorturnover,2024-12-07T08:28:25Z,insanity bruh,0
DjODCllZj4w,@AnhTuPhucDerrickHoangCanada,2024-12-05T09:58:56Z,It's a machine,0
DjODCllZj4w,@JorgeIglesias-v8q,2024-12-02T00:06:28Z,ЁЯШо,0
DjODCllZj4w,@JorgeIglesias-v8q,2024-12-02T00:04:31Z,Todos est├бn locos,0
DjODCllZj4w,@austriantruther4648,2024-11-25T18:38:57Z,Amazing movie!!,2
DjODCllZj4w,@WestCityOfficial,2024-11-14T08:26:27Z,Waste of 30 minutes i spent fast forwarding cause i knew it was gonna be some low budget netflix original bs before i got through 2 mins of it,0
DjODCllZj4w,@bbharpoon822,2024-10-08T08:46:53Z,Worst movie ever watched,2
DjODCllZj4w,@MAHI-fo5sr,2024-09-20T09:43:43Z,"People how come after playing the legendary game 
ЁЯСЗ",0
DjODCllZj4w,@JetLagRecords,2024-09-13T23:23:39Z,"Focus Features, great video it was really good",1
DjODCllZj4w,@ChristopherThompson-g1h,2024-09-10T06:53:15Z,Mann Forest,0
DjODCllZj4w,@vitosway33BillionAir,2024-09-08T19:56:00Z,I love this movie Willem Defoe,2
DjODCllZj4w,@waheedbalushi4974,2024-09-07T19:30:23Z,This movie is a shithole,4
DjODCllZj4w,@tinasprout2034,2024-09-02T02:19:02Z,Never thought Norman Osborn became crazy again in other movieЁЯТАЁЯТАЁЯТА,0
DjODCllZj4w,@Eric-bk9pq,2024-08-31T14:32:44Z,"Into the wee hours you tread, and let movie night take you, on where no one else go, you may find a story you didn't say yes to, you may ask was it worth it to know? Somewhere there be dread where woah meet and find new way to woe ""Inside"" is one such to disturb you and as so it did do Dafoe. 

If ""Castaway"" were rewrit to make you feel dirty inside and ""pink Floyds the wall"" had traded its music for a monologue and those two movies had depleted uranium babies, Would it be worth your while to watch the finicky lil buggers romp? I say ""Yup"".",0
DjODCllZj4w,@OnlioneonYT,2024-08-26T23:24:54Z,"You know, I am something that is trapped inside, myself.",0
DjODCllZj4w,@misery3681,2024-08-22T20:54:57Z,I'm something of a trapped man myself,0
DjODCllZj4w,@Johannesfluke77,2024-08-10T08:48:33Z,"This brings flashbacks to his cameo in the "" Mr. Bean"" movie.",0
DjODCllZj4w,@PRINCESHARMA-ke1sy,2024-08-09T11:17:25Z,Bollywood ki movie Trapped ( rajkumar rao) se inspired lg rhi h,0
DjODCllZj4w,@TH3xDEADSHOT,2024-07-28T05:34:18Z,Can I get my hour and forty five minutes of my life back?,1
DjODCllZj4w,@tellotsotetsi1365,2024-07-16T16:26:52Z,Damn what a waste jerrrЁЯШв,0
DjODCllZj4w,@vasekvideos1313,2024-07-15T23:21:56Z,"watching in bed, hope I wonтАЩt die",0
DjODCllZj4w,@Nowars24,2024-07-12T23:24:48Z,"One word:""Zero""",0
DjODCllZj4w,@PeterJones-y9z,2024-07-05T18:00:41Z,"*Undoubtedly, the worst film I have ever seen in 59 years. These one time great actors are acting in some of the worst  films in history. Utter drivel. We gave up half way through. Could not take any more of this*",2
DjODCllZj4w,@Karl-f8x,2024-07-02T09:52:45Z,"""Inside"" Official Trailer This looks pretty good. I am a huge Willem Dafoe fan. I've got to watch this tonight before It leaves Amazon Prime. It looks very suspenseful & lots of twists & turns. Can't wait...SSSSS..",1
DjODCllZj4w,@deputybluevein93,2024-06-24T08:01:16Z,Just a world class actor,0
DjODCllZj4w,@MeschachTaylor-cj1nc,2024-06-22T16:19:22Z,He became the artist,0
DjODCllZj4w,@serkanileriart,2024-06-20T22:21:55Z,"─░├зerde kalan sanat eseri h─▒rs─▒z─▒ de─Яil,sanat koleksiyoncusu,,├Цzg├╝r olan sanat├з─▒.├Цp├╝c├╝k.",0
DjODCllZj4w,@BeslicMisel,2024-06-04T23:17:09Z,Totalna glupost!!!,0
DjODCllZj4w,@Burger_Fries11,2024-05-29T21:10:39Z,"Everybody : ""Great Movie!""
Me:"" WELCOME TO THE INTERNET, HAVE A LOOK AROUND""",1
DjODCllZj4w,@RandumbProduction,2024-05-29T15:54:06Z,bo,0
DjODCllZj4w,@LisaReyes-l7j,2024-05-23T01:34:46Z,"Easter eggs: 0:25 Batman mini figure 
I hope im not the one sees that ЁЯШЕ",0
DjODCllZj4w,@starkindustries616,2024-05-22T09:30:10Z,I think this is the movie that was shown in the movie mr.bean holidayЁЯШВЁЯШВ,0
DjODCllZj4w,@miracle4112,2024-05-20T17:42:34Z,Sooo boring,0
DjODCllZj4w,@just4therecord,2024-05-02T01:05:12Z,"What kind of apartment is this? Alarm goes off but security is not alerted. No running water. No cellphone. Landline doesn't work. No food and drinks in the fridge. Doors doesn't unlock from the inside. No stove, no oven. Not even a can opener",0
DjODCllZj4w,@christianjayramos1351,2024-04-30T06:41:31Z,Boring ЁЯШ┤,0
DjODCllZj4w,@IOSAShorts,2024-04-27T03:45:29Z,"Focus Features, This is so fun! I'm happy I found your channel!",0
DjODCllZj4w,@GuerrillaKnowledge,2024-04-15T05:18:01Z,"Hey, cranking up the heat is great tactic cops used to use on us! 

- Crank up the heat
- Full Blast
- Shut them in the car while you step out to grab a smoke! 
ЁЯСНЁЯСНЁЯСН",0
DjODCllZj4w,@ahmetdogan7989,2024-03-30T14:17:15Z,Please tell me if this movie is good or bad.,1
DjODCllZj4w,@feliperossi612,2024-03-24T22:47:39Z,"Nemo was the millionaire himself, the owner of the apartment. When you realize this, the movie takes on a new meaning.",0
DjODCllZj4w,@murkycave,2024-03-12T05:33:46Z,I always mistake him for the guy who played the Joker ЁЯШЕ,0
DjODCllZj4w,@DCFTW68,2024-03-10T20:07:47Z,"Even tho we're talking about one of the GOAT actors ever, the movie is shiaaaat! Omg ЁЯе▒ЁЯе▒ЁЯе▒ЁЯе▒",0
DjODCllZj4w,@_azstudio,2024-03-08T16:45:06Z,I think they got this movie from Mr Bean holiday,0
DjODCllZj4w,@ThreePhaseHigh,2024-03-06T10:04:15Z,"This is not a movie itтАЩs just stupidity, the same with all the special effects movies they simply donтАЩt make them regular movie anymore.",0
DjODCllZj4w,@austintaylor8246,2024-03-04T03:59:00Z,really sad how people couldnтАЩt see the art of the movie itself it leaves up for interpretation for the  viewers in so many ways,0
DjODCllZj4w,@quententrollipart1985,2024-03-01T18:31:50Z,"Willem Dafoe should have played in тАШCastawayтАЩ. Tom Hanks did brilliant, but man Dafoe would be absolutely phenomenal IтАЩm that role of being stranded on an island for years and going nuts, and How heтАЩd interact with Wilson",0
DjODCllZj4w,@jeffmagno9725,2024-02-25T18:46:17Z,A non sense movie why dont work on unscrewing the nut whole day,0
DjODCllZj4w,@шЗнщШ┐ш▓в,2024-02-24T14:41:08Z,ф╕АщГихЕЙцШОцЬГ хогхСКшжБч╡▒ц▓╗ф╕ЦчХМчЪДщЫ╗х╜▒ цГ│ч╡▒ц▓╗хЦФ хПкцЬЙчмишЫЛцЙНцЬГшвлхЕЙцШОцЬГцУНцОз,0
DjODCllZj4w,@raym6297,2024-02-24T14:39:18Z,Devil cult crap movie,0
DjODCllZj4w,@grimreaper7901,2024-02-13T21:59:56Z,This movie was a total waste time. I thought I would have paid money port of what I asked my money back. It was not worse. It was so ever here. I thought it was worth watching I just got done. Watch came in and it was not worth it whatsoever. A total waste of time you're welcome. I did it for you. Don't waste time with this thing тИТ1 school out of 13 perfect.  Calls if you want to know what to watch. Look up here. What my name is look at all the reviews? I gave and you'll find 13 skulls straight across-the-board. Watch those movies don't watch this crap,2
DjODCllZj4w,@romoaldosantos621,2024-02-13T21:38:04Z,Uma bosta..,1
DjODCllZj4w,@memet9292,2024-01-30T23:08:42Z,Shttiest movie i have seen in my 30years life,2
DjODCllZj4w,@BertRussell4711,2024-01-23T19:06:42Z,"Notwithstanding what appears to be a great performance by Dafoe, this film has ""stupidly implausible"" written all over it. Pass.",0
DjODCllZj4w,@asichka2,2024-01-17T16:19:13Z,"Wow,bulgarian joke...i am impressed!!!",2
DjODCllZj4w,@renataferreira4987,2024-01-12T01:30:11Z,Filme horr├нvel,2
DjODCllZj4w,@konstantinkoverchenko9587,2024-01-06T02:23:56Z,This film was intriguing and bit of a mind fuck as William slowly sunk into a state of madness.,1
DjODCllZj4w,@milhouse14,2024-01-04T09:41:17Z,"1:19 Willem Defore is talking to Dory

Fun fact: Willem Defoe was also in Finding Nemo. He played Gill, a moorish fish, the leader of the fishes in the dentistтАЩs aquarium.",2
DjODCllZj4w,@╨Ю╨╗╨╡╨║╤Б╨░╨╜╨┤╤А╨░╨д╨╡╨┤╨╛╤А╨╛╨▓╨░-╤П4╨╜,2023-12-26T18:52:57Z,╨е╤Г╨╣╨╜╤ПЁЯОЙЁЯОЙ,0
DjODCllZj4w,@MRHOTEL-hs7et,2023-12-15T20:16:57Z,"ЁЯР╗тАНтЭДя╕ПтЭдя╕П! This looks damn amazing, can't wait to see this. Wilhelm Dafoe in his full genius once again!",0
DjODCllZj4w,@Fernando10809,2023-12-15T02:09:39Z,Filme intediante,0
DjODCllZj4w,@deonteterrel8078,2023-12-14T08:01:21Z,тЬиINSIDE!!тЭдя╕ПЁЯТЩ________________________________________________________________________________________________________________________________________________________________,1
DjODCllZj4w,@zillsburyy1,2023-12-10T00:12:44Z,one of the most disgusting movies ever and he end leaves you hanging,2
DjODCllZj4w,@CRUCIALTRENDS,2023-11-27T02:38:27Z,not what I expected. could've done better,0
DjODCllZj4w,@NotoriousDonny,2023-11-26T07:58:26Z,DonтАЩt watch this. Huge waste of time. Shit ending. DoesnтАЩt make much sense and doesnтАЩt explain anything when itтАЩs over. I watched this for free and still want a refund,2
DjODCllZj4w,@alessandro4691,2023-11-25T22:46:14Z,"Non potevo non commentare,UN EMERITA PORCATA;noioso ripetitivo,a tratti  ridicolo;se non fosse per Dafoe,superbo in ogni sua interpretazione,sarebbe stato il piu grande flop degli ultini anni!!ЁЯСОЁЯСОЁЯСО",1
DjODCllZj4w,@banjaluka5912,2023-11-23T23:58:32Z,A total disaster of a movie!,2
DjODCllZj4w,@RevDany23,2023-11-20T17:52:13Z,"Dumb useless movie, i could not empathize with such a protagonist",0
DjODCllZj4w,@El-Mac795,2023-11-14T14:32:34Z,"""When I was a kid, my teacher asked me what I would save if my house was on fire. I said my cat groucho, my ACDC album and my sketchbook. I didn't mention my parents or my sister, does that make me a bad person. Cats die, music fades, but art is for keeps""",1
DjODCllZj4w,@shabbirmamujee1680,2023-11-14T12:23:21Z,Where can i see this movie on Internet,0
DjODCllZj4w,@╨Ю╨║╤Б╨░╨╜╨░╨Ь╤П╨║╨╕╤И╨╡╨▓╨░-╤И7╨▒,2023-11-11T11:22:24Z,"╨п ╨▓╨╡╤Б╤М ╤Д╨╕╨╗╤М╨╝ ╤Г╨│╨░╤А╨░╨╗╨░ЁЯШВЁЯШВЁЯШВ ╨░ ╨╜╨░╨┐╨╕╤Б╨░╨╜╨╛ ╤А╨╕╨╗╨╗╨╡╤А ╨╜╨░╨┤╨╛ ╨▒╤Л╨╗╨╛ ╨╜╨░╨╖╨▓╨░╤В╤М ,,╨в╨а╨н╨и,,╨Ш╨Ы╨Ш ,,╨а╨Р╨Ч╨а╨г╨и╨Ш╨в╨Х╨Ы╨м ╨Ъ╨Т╨Р╨а╨в╨Ш╨а,,╨░  ╨╗╤Г╤З╤И╨╡ ,,╨Ч╨Р╨б╨а╨Р╨Э╨Х╨жЁЯШВ,,",0
DjODCllZj4w,@╨Ю╨║╤Б╨░╨╜╨░╨Ь╤П╨║╨╕╤И╨╡╨▓╨░-╤И7╨▒,2023-11-11T11:17:14Z,"╨С╨╛╨╗╤М╤И╨╡ ╨▓╤Б╨╡╨│╨╛ ╨╝╨╜╨╡ ╨▓ ╤Н╤В╨╛╨╝ ╤Д╨╕╨╗╤М╨╝╨╡ ╨╢╨░╨╗╨║╨╛ ╨║╨▓╨░╤А╤В╨╕╤А╤ГЁЯШв╨║╨░╨║╨╛╨╣ ╨╛╨╜ ╤Е╤Г╨╗╨╕╨│╨░╨╜ ╨▓╤Б╤С ╨▓ ╨┤╨╛╨╝╨╡ ╨╕╤Б╨┐╨╛╤А╤В╨╕╨╗ ЁЯШВ╤З╤В╨╛ ╨▒╨╡╤А╤С╤В ╨▓╤Б╤С ╨▒╤А╨╛╤Б╨░╨╡╤В,╨▓╤Б╤О ╨▓╨░╨╜╨╜╤Г ЁЯТйЁЯТйЁЯТйЁЯЩИ",0
DjODCllZj4w,@Therealpeter10,2023-11-04T21:21:02Z,Joker best movie,0
DjODCllZj4w,@gabedavis4111,2023-11-02T23:25:43Z,This looks like one of the best Covid documentaries I've seen yet!,0
DjODCllZj4w,@mlefun1303,2023-10-27T07:06:39Z,"the worst movie ive ever watched, probably the worst movie ever made in human history",0
DjODCllZj4w,@TheHelloKid,2023-10-23T05:10:21Z,Romans 10:9 тЭд,0
DjODCllZj4w,@danminutsich7509,2023-10-20T01:38:04Z,"Let me guess, the ""twist"" is that we find out at the end that he is an art exhibit himself. If that's how it ends, it's super clich├й!",0
DjODCllZj4w,@BallakMustafa,2023-10-19T23:46:12Z,The movie was sucks!!!! ItтАЩs very bad he acted in such movie,2
DjODCllZj4w,@ThomasStClair-zr2lb,2023-10-19T23:32:00Z,I'm just glad to see a new movie for adults.,0
DjODCllZj4w,@MuhammadAslam-wj5ec,2023-10-11T00:39:37Z,Waste of time bull shit,1
DjODCllZj4w,@lukezotos,2023-10-10T21:50:54Z,Bo Burnham looks a lot older here,1
DjODCllZj4w,@felixfromming8459,2023-10-06T19:29:00Z,You have to watch the film twice the you understand the Message,4
DjODCllZj4w,@amritsonar1378,2023-10-06T08:21:11Z,Nice Movie тЭдтЭдтЭд,0
DjODCllZj4w,@johndrocket,2023-10-03T08:58:08Z,Waste. Of. Time. Why didn't they at least end it with seeing him free?  Boring and dumb.,1
DjODCllZj4w,@aryandhiman1441,2023-09-30T16:38:18Z,"рдмрд┐рд▓реНрд▓рд┐рдпрд╛рдБ рдорд░ рдЬрд╛рддреА рд╣реИрдВ, рд╕рдВрдЧреАрдд рдЦрд╝рддреНрдо рд╣реЛ рдЬрд╛рддрд╛ рд╣реИ, рд▓реЗрдХрд┐рди рдХрд▓рд╛ рд╣рдореЗрд╢рд╛ рдХреЗ рд▓рд┐рдП рд╣реИ

рдореИрдВрдиреЗ рдЖрдкрдХреА рддреАрди рдЪреАрдЬреЛрдВ рдХреЛ рдмрд░реНрдмрд╛рдж рд╣реЛрдиреЗ рд╕реЗ рдмрдЪрд╛рдпрд╛ рд╣реИ, рдореИрдВ рдЖрдкрдХреЗ рдШрд░ рдореЗрдВ рдХреБрдЫ рд╣реА рд╕рдордп рдХреЗ рд▓рд┐рдП рд░рд╣рд╛ рд╣реВрдВ, рдпрд╣ рдореЗрд░реЗ рд▓рд┐рдП рдПрдХ рдШрд░ рдерд╛, рдпрд╣ рдПрдХ рдкрд┐рдВрдЬрд░рд╛ рдерд╛, рдЕрдЧрд░ рдореИрдВрдиреЗ рдЗрд╕реЗ рдирд╖реНрдЯ рдХрд░ рджрд┐рдпрд╛ рддреЛ рдореБрдЭреЗ рдЦреЗрдж рд╣реИ, рд▓реЗрдХрд┐рди рд╢рд╛рдпрдж рдЗрд╕реЗ рдирд╖реНрдЯ рдХрд░рдиреЗ рдХреА рдЬрд░реВрд░рдд рдереАред",1
DjODCllZj4w,@ALLROY240,2023-09-29T13:48:46Z,"There is a black market for stolen artworks, and according to the head of the F.B.I.'s art-crime team, Bonnie Magness-Gardiner, their prices are inevitably a small fraction of the works' legitimate value. Some estimates put the average at 7 to 10 percent of perceived open-market value.",0
DjODCllZj4w,@warriorprincess91,2023-09-26T03:44:49Z,"The only reason why I finished this movie is because I was in the plane and had nothing else. I even regret it. ЁЯШД
One of the worst movies I have ever seen, and it left the bad feeling.",1
DjODCllZj4w,@DucVu-qd8qr,2023-09-25T07:13:15Z,тЭдтЭдтЭдтЭдтЭд,1
DjODCllZj4w,@doomsdayangel4647,2023-09-25T00:23:48Z,I like how he went from playing a cute fish trying to escape to brutally eating them in order to survive.,0
DjODCllZj4w,@wizzard6919,2023-09-24T21:24:15Z,Drecks film,0
DjODCllZj4w,@Ed-wd9qy,2023-09-24T19:10:04Z,"Unless you are a religiously bonafide Defoe fan, you can pass this slow-moving piece of crap.  The ending is really a bummer.  Do not tell me this movie is redeemable in any way . . .",0
DjODCllZj4w,@dabaydestrian415,2023-09-24T07:18:16Z,What a stupid ending,0
DjODCllZj4w,@CadenMichnal,2023-09-24T07:09:57Z,"Stupid ass movie. Someone could have wrote this movie in an hour. Way to weird and boring for me. This movie was about 1 simple task that was drug out for an entire movie with a lot of random scenes of random artwork, random doodling and some self talking here and there in between. Great movie to fall asleep too. What a waste of time. Whoever wrote this movie somehow had the money to be able to make a TERRIBLE idea that nobody wanted to get behind still come true.",0
uKkexzIykbo,@maxicba18,2025-02-27T18:58:27Z,"Neem het me niet kwalijk, ik deel dit alleen met goede bedoelingen. Groeten aan iedereen en een leuke video. Daytrading is de beste manier om geld te verdienen met de hulp van een ervaren trader. Naar mijn mening is het een van de belangrijkste vaardigheden om te leren, iedereen zou moeten investeren, niet sparen. Sommigen zullen het ermee eens zijn, anderen zullen het er niet mee eens zijn. Grote complimenten aan Donald Cutler voor de dagelijkse signalen en tips over goed geanalyseerde prognoses die ik heb ontvangen!!!.тЬКтЬК",56
uKkexzIykbo,@koekelmetperen,2025-02-27T18:37:24Z,"Al die praatshows horen op de radio
Dit is ook gewoon radio met een camera erop!",1
uKkexzIykbo,@SaganakiBijAlHayat-g9b,2025-02-27T17:18:53Z,draagt johan nog steeds de huid van zijn eerste vrouw?ЁЯдФ,0
uKkexzIykbo,@SaganakiBijAlHayat-g9b,2025-02-27T17:18:50Z,draagt johan nog steeds de huid van zijn eerste vrouw?ЁЯдФ,0
uKkexzIykbo,@SaganakiBijAlHayat-g9b,2025-02-27T17:18:48Z,draagt johan nog steeds de huid van zijn eerste vrouw?ЁЯдФ,0
uKkexzIykbo,@SaganakiBijAlHayat-g9b,2025-02-27T17:17:00Z,"Johan vond het wel normaal om zijn eerste vrouw van de trap te duwen 40 jaar geleden. En bij zijn huidige vrouw 3 jaar geleden probeerde hij dit ook, dat is mislukt en toen viel Johan zelf van de trap, hoe mooi is dat.",0
uKkexzIykbo,@SaganakiBijAlHayat-g9b,2025-02-27T17:16:57Z,"Johan vond het wel normaal om zijn eerste vrouw van de trap te duwen 40 jaar geleden. En bij zijn huidige vrouw 3 jaar geleden probeerde hij dit ook, dat is mislukt en toen viel Johan zelf van de trap, hoe mooi is dat.",0
uKkexzIykbo,@SaganakiBijAlHayat-g9b,2025-02-27T17:16:55Z,"Johan vond het wel normaal om zijn eerste vrouw van de trap te duwen 40 jaar geleden. En bij zijn huidige vrouw 3 jaar geleden probeerde hij dit ook, dat is mislukt en toen viel Johan zelf van de trap, hoe mooi is dat.",0
uKkexzIykbo,@Garcientes,2025-02-27T16:30:31Z,Wat een  gezeur over Talkshows!,0
uKkexzIykbo,@jorgl893,2025-02-27T15:42:52Z,Klagen over steeds weer dezelfde hoofden lol,0
uKkexzIykbo,@FrankAmelo-n4g,2025-02-27T15:02:36Z,"Kwalbert, master backstaber",0
uKkexzIykbo,@johannadekoning3468,2025-02-27T14:03:26Z,Gelukkig   hoeft  ook  niet  meer enge  man  zo  in  de  war,0
uKkexzIykbo,@AutoTurk-o3f,2025-02-27T13:56:16Z,"ik hoop dat ik johan met hond voor de auto krijg
ЁЯШ▓ЁЯШо",0
uKkexzIykbo,@AutoTurk-o3f,2025-02-27T13:56:14Z,"ik hoop dat ik johan met hond voor de auto krijg
ЁЯШ▓ЁЯШо",0
uKkexzIykbo,@AutoTurk-o3f,2025-02-27T13:56:11Z,"ik hoop dat ik johan met hond voor de auto krijg
ЁЯШ▓ЁЯШо",0
uKkexzIykbo,@DonJuan-b3v,2025-02-27T13:32:28Z,Weet niet wat zieliger is al de comments van Rob J of de mensen die deze eenzame droeftoeter nog steeds aandacht geven.,0
uKkexzIykbo,@Krijgnouwat,2025-02-27T12:06:34Z,"Hoef hem zo ie zo niet te zien, linke wiepen!",0
uKkexzIykbo,@andredongelmansbusdriver,2025-02-27T11:53:02Z,Gister zeiden ze dat Pauw vanaf maandag weer terug is,0
uKkexzIykbo,@RobinCauwels-c8f,2025-02-27T11:29:37Z,Kunnen ze misschien Gert Verhulst voor in de plaats zetten.,2
uKkexzIykbo,@EmmersmetBloed,2025-02-27T11:07:50Z,waarom heeft pauw zn vader van de boot gegooid?,3
uKkexzIykbo,@SuperG4ndo,2025-02-27T11:00:46Z,Hoe moeilijk is het om een jongere versie van Jeroen Pauw te vinden in Nederland,0
uKkexzIykbo,@ruppert5134,2025-02-27T10:33:29Z,Van die BNNvara mannetjes zoals pauw en nieuwkerk zijn helemaal pass├й .... met hun achterlijke talkshow gewauwel... NIEMAND kijkt meer extreem linkse NPO,0
uKkexzIykbo,@murrayroodbaard207,2025-02-27T09:35:51Z,"Bar Laat is gewoon het zoveelste programma dat alleen de grachtengordel als doelgroep heeft. Misselijkmakend vooringenomen links met steeds gasten uit hetzelfde incestueuze wereldje en dezelfde onderwerpen. 
Natuurlijk is dat een ramp. Dat was ook te voorspellen. Mensen zijn klaar met die meuk.",0
uKkexzIykbo,@keepow2,2025-02-27T09:32:21Z,Irritant hoe Johan tegen Raymond praat. Beetje stoer doen en dat is dan een vent van tachtig hahahahahahahahahaha,2
uKkexzIykbo,@Asielzoekertje1,2025-02-27T09:20:27Z,Ikke wil albert van achter pakken ikke ook schapen van achter pakke ЁЯРС,0
uKkexzIykbo,@mcsignificant3923,2025-02-27T09:13:29Z,Grappig dat Wierd Duk zegt dat bij Bar Laat altijd dezelfde hoofden zitten terwijl bij VI letterlijk altijd dezelfde hoofden zitten...,3
uKkexzIykbo,@agnesvanlambalgenvandersch4582,2025-02-27T09:12:05Z,Albert Verlinde is weet terug bij wat hij ooit was: een ordinaite rel en roddelnicht. Zonde van zijn mooie carri├иte bij de musical,0
uKkexzIykbo,@Asielzoekertje1,2025-02-27T09:11:10Z,Ikke eenzaam zijn,0
uKkexzIykbo,@albertvanelst1849,2025-02-27T08:57:39Z,"Vanaf 3 maart 2025 is Jeroen weer presentator van Bar Laat,  zeer goede redactie bij VI ЁЯШВЁЯШВЁЯШВЁЯШВЁЯШВ",7
uKkexzIykbo,@611jrj,2025-02-27T08:55:34Z,"Deze mededeling van Albert, had ik voor geen goud willen missen, nu maar hopen dat Shownieuws en Vandaag Inside er nog dagen over gaan hebben. ЁЯШв",1
uKkexzIykbo,@RobGrenzendicht,2025-02-27T08:48:29Z,"Nou prima, die Pauw en van Niewskerk zijn niet goed wijs met hun linkse retoriek.",6
uKkexzIykbo,@ollybeerbommel2596,2025-02-27T08:29:10Z,Wie interesseert barlaat nou,2
uKkexzIykbo,@kb62147,2025-02-27T08:16:50Z,Wat zijn de heren toch begaan met grootverdiener Pauw...,1
uKkexzIykbo,@AutoTurk-o3f,2025-02-27T08:12:28Z,ik hoop dat johan en zijn hond als krijgenЁЯШАЁЯША,0
uKkexzIykbo,@AutoTurk-o3f,2025-02-27T08:12:26Z,ik hoop dat johan en zijn hond als krijgenЁЯШАЁЯША,0
uKkexzIykbo,@AutoTurk-o3f,2025-02-27T08:12:23Z,ik hoop dat johan en zijn hond als krijgenЁЯШАЁЯША,0
uKkexzIykbo,@AutoTurk-o3f,2025-02-27T07:57:01Z,"Johan vond het wel normaal om zijn eerste vrouw van de trap te duwen 40 jaar geleden. En bij zijn huidige vrouw 3 jaar geleden probeerde hij dit ook, dat is mislukt en toen viel Johan zelf van de trap, hoe mooi is dat.",0
uKkexzIykbo,@AutoTurk-o3f,2025-02-27T07:56:58Z,"Johan vond het wel normaal om zijn eerste vrouw van de trap te duwen 40 jaar geleden. En bij zijn huidige vrouw 3 jaar geleden probeerde hij dit ook, dat is mislukt en toen viel Johan zelf van de trap, hoe mooi is dat.",0
uKkexzIykbo,@AutoTurk-o3f,2025-02-27T07:56:54Z,"Johan vond het wel normaal om zijn eerste vrouw van de trap te duwen 40 jaar geleden. En bij zijn huidige vrouw 3 jaar geleden probeerde hij dit ook, dat is mislukt en toen viel Johan zelf van de trap, hoe mooi is dat.",0
uKkexzIykbo,@maxmink1,2025-02-27T07:21:27Z,Eeuwig die zelfde hoofdenЁЯШВЁЯШВЁЯШВ Bij VI verschijnen gasten maximaal 3 maal per jaar?,4
uKkexzIykbo,@j.w.p.laurey2455,2025-02-27T07:10:47Z,"Haha, die Wierd Duk... ┬┤dan moeten ze eens andere mensen gaan uitnodigen ipv elke keer diezelfde hoofden┬┤... Zoals bij VI? Elke dag en elke week dezelfde gasten die niets zinnigs zeggen... ЁЯдг",1
uKkexzIykbo,@Brenda-g7d2s,2025-02-27T07:02:35Z,"Watching your channel is not just entertainment, it's a real educational journey. Thank you for that!ЁЯР╗ЁЯд╕тАНЁЯЯй",0
uKkexzIykbo,@Gretta-d1q,2025-02-27T07:01:58Z,Your videos are always so funny and exciting! Thank you for your creativity and your ability to make us laugh!тАНтмЫЁЯезЁЯеС,0
uKkexzIykbo,@Anna-f5i6k,2025-02-27T07:01:29Z,Every release is a little masterpiece. Thank you for your hard work and love!ЁЯжгЁЯж╛ЁЯдЩ,0
uKkexzIykbo,@Olivia-j6v3s,2025-02-27T07:01:13Z,Your channel is a real find for everyone who is looking for a share of good mood and joyful moments. Keep inspiring and making our days better!ЁЯР│ЁЯЩАЁЯР║,0
NP4AuKdb_dA,@Mury89,2025-02-27T01:55:46Z,this game is 10/10,0
NP4AuKdb_dA,@parejo31,2025-02-25T20:18:47Z,"1:38:29 the capsule is closed, does anyone know why? please┬б",1
NP4AuKdb_dA,@wohelfycopper7943,2025-02-25T04:40:19Z,1:44:00 Director dead,0
NP4AuKdb_dA,@ArkhamKratos,2025-02-24T16:47:04Z,this Game Looks Like  Limbo Meets LN Universe.,0
NP4AuKdb_dA,@simpsonianopro,2025-02-20T16:39:22Z,So the kid dies at the end?,0
NP4AuKdb_dA,@Funhun567,2025-02-20T13:10:24Z,which key are using in escape in water,0
NP4AuKdb_dA,@videostash413,2025-02-19T10:17:54Z,WTF horror game of the decade,0
NP4AuKdb_dA,@Rlq.th07,2025-02-19T01:03:11Z,Tem que ter muita cabe├зa pra esse jogo kkkkk,1
NP4AuKdb_dA,@hania5413,2025-02-17T11:32:53Z,The way this little boy running it's just the same when IAM running in my dream..,0
NP4AuKdb_dA,@sanzen.g.t,2025-02-16T18:50:10Z,If yall like this try out limbo its similar and its also very fun and intresting,1
NP4AuKdb_dA,@hartekunst554,2025-02-13T19:58:58Z,"I love the finale, but I really wish the ending would be more satisfying. You just roll downhill and...",1
