genre,game,commented_date,comment
Survival,Palworld,2025-01-03,so im only level 7 rn but i tind it funny when he was talking about pick an open area for your first base where he was looking at down the waterfall is exactly where i made my first base on the right side lol edit i actually built right where he built
Survival,Palworld,2024-02-16,"hey bro love your video great tips and all, i just found out something awesome you can put your palbox on your roof for better space and more area to use, just build step for your pal to come down."
Survival,Palworld,2024-02-10,thank you
Survival,Palworld,2025-03-10,1012 pals would recommend
Survival,Palworld,2024-11-30,i literally put like 20 hrs into my first base which is a couple feet from the first npc  worst decision ever. gotta go further in
Survival,Palworld,2024-02-10,thanks for sharing all this great information! huge time saver!
Survival,Palworld,2025-03-08,"corpse runs arent a thing because they are fun, they are a thing because it discourages dying"
Survival,Palworld,2024-09-25,im damn addicted to this game now.
Survival,Palworld,2024-06-19,the circle of a a 12x12 of foundations
Survival,Palworld,2024-10-09,can you take your character into different worlds and to what extent? keep your inventory? or new character for every world you join?
Survival,Palworld,2024-12-28,"bought the game for xmas in the jan sale, wow its so fun"
Survival,Palworld,2024-02-23,brilliant vid.
Survival,Palworld,2025-01-24,looked away for a sec when the ad started and bro was talkin about collecting captains i was so confused
Survival,Palworld,2025-01-16,here ive been hand feeding my dude and my pals
Survival,Palworld,2024-11-16,is this helpful in november 2024?
Survival,Palworld,2025-01-08,"pals don't die if they don't eat, they just get severely debuffed making them useless at nearly everything."
Survival,Palworld,2024-02-14,"thats the one thing i changed was dropping my gear on death, thats just annoying lol. i kept everything else the same and am enjoying it very much."
Survival,Palworld,2024-11-25,"i advise using the wooden club on small pals and getting your capture bonus on lamball, cattiva, chikipi, and tanzee. use the bat as soon as possible but dont unlock the bow. keep using the bat until you get high enough to unlock the crossbow or you can run around and open chest until you find the crossbow schematic. doing this saves a decent amount of tech points and lets you advance a good bit pretty fast since when you unlock the crossbow that early youll be one tapping a lot of small pals and itll be easier to melt the weaker alpha pals"
Survival,Palworld,2025-03-19,"japanese, brutal, extremely popular, controller support and a good price. let's go!!"
Survival,Palworld,2024-09-27,316 the chest is now a locked chest that needs a copper key
Survival,Palworld,2024-02-16,thanks for the awesome video
Survival,Palworld,2024-12-15,finally gave in and bought the game today and honestly so far it's great! i'm a little overwhelmed with some of it but being a new player that's normal. but i am absolutely in love with the elements of this game!
Survival,Palworld,2024-02-17,thank you!
Survival,Palworld,2025-01-08,as someone who just bought this game tonight! i want to play this with my partner do we have to play online or can i invite her to my world?
Survival,Palworld,2024-11-07,everyone calls this pokemon with guns when its actually ark with pokemon
Survival,Palworld,2024-11-05,listening while playing....... me stahp calling them pokemon! lol
Survival,Palworld,2024-03-01,5627 was the moment he singled out the pal he'd have to punish after thw camera was off  jk or is it
Survival,Palworld,2024-11-25,honestly i'm about to do a very hardcore run. after doing a normal custom
Survival,Palworld,2024-02-13,funny i put my base in the same spot lol
Survival,Palworld,2024-11-14,this is a type of game we want from pokemon
Survival,Palworld,2025-02-01,hello lucky ghost i am in a dilemma. i want to buy palworld but its still an early access on the steam deck. should i buy it because its still an early access and then wait to play it or should i wait to buy it when it is out of early access that is my dilemma so could you give me some info so i know what i can do so i could feel better because i really wanna play this game so much.
Survival,Palworld,2025-01-12,i wish the multiplayer for playstation was more multi player. from what i can tell you can only have 4 people join with your code which doesnt make sense when it lets you choose how many guilds and stuff there can be cause right now you can only have the guild you have theres not really much room for people to make more. and it says 130 for the guild even though you cant have that many people in your world
Survival,Palworld,2024-11-26,"deathbox runs build character, and holes in my wall"
Survival,Palworld,2024-11-12,i cannot use gold coins at vendors . is there a use for them?
Survival,Palworld,2025-03-08,it's still helpful in march 2025
Survival,Palworld,2024-09-26,just caught a big version of a beginner type pokmon
Survival,Palworld,2024-05-08,how do you get high quality pal oil without buying it?
Survival,Palworld,2024-03-08,what is the best food for pals? mine go through berries like crazy.
Survival,Palworld,2025-01-11,2739 did i hear a pokemon???
Survival,Palworld,2024-02-11,i built my base on like the first area and its already cramped and im only level 22 but moving gonna be so annoying what u think
Survival,Palworld,2024-08-06,gale claw. nuff said
Survival,Palworld,2024-02-04,strongest pal skill watering
Survival,Palworld,2024-04-13,frostailion laughing in corner
Survival,Palworld,2024-02-07,i guess relaxsaurus has the best genetics huh
Survival,Palworld,2024-02-21,clearly the best end game pal is chillet because unlike other pals he can walk and has his own theme song
Survival,Palworld,2024-02-17,shadowbeak be like hmm lemme show you something
Survival,Palworld,2024-02-05,sweepa and a gaggle a swee are all i need to keep those pals from cappin my knees.
Survival,Palworld,2024-02-16,anubis you can breed him early on with a digtoys and relaxsaurus
Survival,Palworld,2024-02-24,frostalion noct us the strongest dark pal because of the 100 percent damage buff from passive
Survival,Palworld,2024-02-08,"that necromus boss fight is rough, even with multiple jetragons"
Survival,Palworld,2024-02-07,"chillet is busted, but not because chillet itself is strong hes just the cheering section, along with 4 gobfins, all bred to have passives that increase player damage, and then full condensed to max out their partner skill, max out your player attack as well, and then from there its a simple matter of hopping on your chillet with a legendary rocket launcher and oneshotting everything that isnt a tower boss this build when optimized oneshots jetragon"
Survival,Palworld,2024-02-09,the hand full of end game pals make all other pals obsolete
Survival,Palworld,2024-07-31,rocklem is now the best ground type for raid boss fight. anubis best combat use is to convert player attack into ground
Survival,Palworld,2024-02-25,relaxsorous alright ladies lets get bu syyy
Survival,Palworld,2024-02-16,warsect love that pal so much
Survival,Palworld,2024-04-21,paladius laughing in the corner
Survival,Palworld,2024-02-09,that last lamball butcher was a bit personal bro
Survival,Palworld,2024-02-22,"ok so we got gyarados, lucario, zecrom but yellow, ceruledge, and salamence with iron jugulars wings"
Survival,Palworld,2024-02-18,the best for mining is depresso
Survival,Palworld,2025-03-15,"gyarados, lucario, electrivire, ceruledge, and salamence look so good here!"
Survival,Palworld,2025-02-27,"bellanoir libero, shes strong, shes hot, she make drugs, shes hot, she has her own diamond trait shes hot, did i mention shes hot?!"
Survival,Palworld,2024-02-20,"fyi y'all who still don't know, you can traverse on water with a flying mount without flying."
Survival,Palworld,2024-06-17,who was see this in june 17 date and now the best pal is god jetdragon
Survival,Palworld,2025-03-11,shadowbeak having a field day on the corner
Survival,Palworld,2024-02-07,i love how the giant blue barny somehow makes a dog
Survival,Palworld,2024-02-23,pokemon getting boring? wanna spice up your duels? add an ak47 and the fun never ends!
Survival,Palworld,2025-02-23,"i got my orserk by starting with a grizzbolt and a liffmunk and let me tell you that was a grind i'll never forget. not to mention i caught a lucky liffmunk later and had to restart the entire breeding chain halfway through to add lucky to the gene pool. ended with an orserk with lucky, musclehead, ferocious, and burly body."
Survival,Palworld,2024-02-15,i got super lucky and found a huge dragon egg while flying round... turned out to be an ignis jormuntide. 4 fire stat hes quite literally both transport and the soul of the forge.
Survival,Palworld,2024-06-16,new dragon pokemon laughing in corner
Survival,Palworld,2024-04-25,jormuntide ignis laughing in the corner
Survival,Palworld,2024-11-03,"the best pal is lamball , you can play with him even if he died"
Survival,Palworld,2024-07-25,frostallion noct is one of my personal favorites.
Survival,Palworld,2024-02-19,relaxsaurus with missile launcher ftw
Survival,Palworld,2024-02-16,"as a slamance lover jetragon was perfect , perfect to the least minute details"
Survival,Palworld,2024-06-05,"my party at level 50 has jettragon, frostallion, necromus, blazamut and paladius which are without a doubt the best pals for their respective types"
Survival,Palworld,2025-01-15,"just finished breeding an alpha anubis with serenity, demon god, legend and vampiric."
Survival,Palworld,2024-10-12,"been running with shadowbeakcondensed to 5perfect statspassives, jetdragaon condensed to 5, galeclawi refuse to use normal glider, anubisgood passives and ill eventually get to condensing for it, daedreamdazzi depending on what im fighting for some passive dmg."
Survival,Palworld,2025-01-03,he narutoruns  automatic goat x'd
Survival,Palworld,2024-02-07,end game pal? lol lvl 50 foxpark and chillet baby!!!
Survival,Palworld,2024-12-15,"anubis can naruto run, just keep him away from swings"
Survival,Palworld,2024-02-03,i dont know all i know is pokmon mom did something
Survival,Palworld,2024-04-12,"ahh yes its good to see gyarados , lucario and salamence"
Survival,Palworld,2025-02-17,suzaku is pretty cool made. a base that's a tower right by his spaw
Survival,Palworld,2024-06-14,henecromus is the best dark type pal mebellonoir libro laughing at the corner
Survival,Palworld,2024-02-09,zoe and grizzbolt is pretty op hp scales insanely high and they can practically never die
Survival,Palworld,2025-01-10,jormintude ignis why is my brother in this?
Survival,Palworld,2025-03-08,my endgame pals are sparkytenzeeroobynightwingsurfent! its a fun combo.
Survival,Palworld,2024-12-11,sweepa with a team of sweeps
Survival,Palworld,2024-02-23,damn so it's gyarados lucario salamence ceruledge sorry but this is too funny
Survival,Palworld,2024-10-01,anubis breed an bushi and a penking and add a cake to the breeding station
Survival,Palworld,2025-02-06,frosstalion laughing in corner
Survival,Palworld,2024-08-09,relaxsaurus  the god father
Survival,Palworld,2025-01-01,me rocking a lvl 60 boosted lovander with legend and ferocious
Survival,Palworld,2024-04-25,i freshly captured jet dragon and i am enjoying everything being ultra fast.
Survival,Palworld,2024-02-25,imagine a level 10 player with an astegon or anubis
Survival,Palworld,2024-02-21,hanguyyyyyy vanquish my enemies and my soul is yours
Survival,Palworld,2024-02-08,the carpet booming pal is so cool. i named him b2
Survival,Palworld,2024-02-21,i been using katness for everything. now when i find literally any skill fruit i just feed it to him.
Survival,Palworld,2024-12-31,and naruto runs everywhere
Survival,Palworld,2024-02-22,is it only me or does jetragon kinda look like a future paradox version of salamence and they both fly
Survival,Palworld,2024-06-17,who see's dattrax palworld  lucario laughing in the corner
Survival,Palworld,2024-10-12,"oh cool, gyarados, lucario, garchomp, ceruledge, and future paradox salamence"
Survival,Palworld,2024-06-10,most power ful pal is trox
Survival,Palworld,2024-04-19,frostallion laughing at the corner
Survival,Palworld,2024-10-31,necromus best dark type ? i think shadowbeak laughing somewhere
Survival,Palworld,2025-01-25,i have all of them other then necromus and my favouritedream pal
Survival,Palworld,2024-02-07,i paused my leveling and turned raids off at level 40 to breed the team i wanted to take into the end game fights to get those pals. but it's almost time to venture forward and into the end game!
Survival,Palworld,2024-10-04,you had me at lvl. 4 handiwork! it's time to butcher some useless loopmoons. thank you! wouldn't habe ever know if it wasn't for you! you're a great person
Survival,Palworld,2024-05-03,frostalion leaves the chat
Survival,Palworld,2024-03-09,frostalion laughing in the corner
Survival,Palworld,2024-05-21,"iam level 40 and i have a good shadowbeak, a boss jormontide,boss anubis, a fenglope for riding and galeclaw for flying."
Survival,Palworld,2024-07-13,you forgot to mention that anubis is no slacker in other skills too
Survival,Palworld,2024-02-24,you forgot the meat shield and for that i use zoe and grizzbolt
Survival,Palworld,2024-12-21,"helzephyr is underrated af, dark element plus fire moves and great attack means it is a fantastic midgame battle pal, also it has level 3 transporting, is nocturnal, and has high movement speed, so it is a very good base pal."
Survival,Palworld,2024-02-10,sweepa with 3x swee and shadowbeak for mount riding lmao
Survival,Palworld,2024-02-23,that one dude who still uses his lamball.
Survival,Palworld,2024-07-22,honarable mentions shadow beak
Survival,Palworld,2024-03-24,i choose frostalion because he can freeze his enemys and he can also fly which makes him a very good mount other than the rocket dragon which i like the rocket dragon as well.
Survival,Palworld,2024-02-07,"you can also breed an anubis with penking and bushi, which are admittedly even easier to get"
Survival,Palworld,2024-03-22,paladius and frostalian crying in corner
Survival,Palworld,2024-09-26,"for endgame bossfights 3x gobfins passive dmg boost to you, 1 galeclaw as dodgeglider, and one status inflicting tanky pal"
Survival,Palworld,2024-02-16,the true endgame in palworld is lambdall
Survival,Palworld,2024-02-19,the purple cliff t pose fly
Survival,Palworld,2024-03-16,bro really said jore moon tide and i understand not everyone understands it as yor mun tide like jormungandr but it makes me so sad
Survival,Palworld,2024-02-24,jetragon looks like roaring moon but from future
Survival,Palworld,2024-11-02,youre the first youtuber ive heard say jetragon correctly. praise cthulhu
Survival,Palworld,2024-02-21,shadowbeak will always be my number juan
Survival,Palworld,2024-08-17,wish there was a legendary for every type
Survival,Palworld,2024-03-25,i have an idea to catch up the powerful pals use the fall damage for pals make them fall from a high place then u can easily catch them without fighting!
Survival,Palworld,2024-05-15,"my end game pals are . shadowbeak , frostallion , orserk , faleris , anubis ."
Survival,Palworld,2024-02-20,i use a lvl 50 chipiki or something i gave him dark and plant elements
Survival,Palworld,2024-02-12,i would argue shadowbeak is a better dark type than necromjs because of its access to its exclusive attack. you can even breed the bosss shadowbeak attack into your own if you do the boss catch glitch and that attack is insane as well
Survival,Palworld,2024-06-11,t rox is laughing at the pal
Survival,Palworld,2024-02-16,i use rooby and have all my pocket slots full of them to increase the attack power of fire pals and it stacks so the more you have the more damage you do
Survival,Palworld,2024-05-07,i use a faleris as my main anubis for quickly building stuff grizzbolt for the gatling gun  a mod that disanles the cooldown and a mossanda lux cus the grenade launcher is fune last one is killamari for the glider
Survival,Palworld,2024-11-21,breeding with relaxasaurs sucks the offspring always will have gluten
Survival,Palworld,2024-03-26,i use level 50 shiny cativa
Survival,Palworld,2025-01-08,shadowbeak divine disaster is too op
Survival,Palworld,2024-05-09,jourmentide ignis laughing in the corner
Survival,Palworld,2024-04-12,frostallion left the chat
Survival,Palworld,2024-02-11,me with chillet that i bred with astegon and lucky cattiva
Survival,Palworld,2024-01-31,"coordinates are 183, 36"
Survival,Palworld,2024-02-21,now get tah spinnin partner! yeebah
Survival,Palworld,2024-12-13,"this video had every single piece of information i needed, and nothing i didn't. thank you."
Survival,Palworld,2024-01-31,everyones got this spot now
Survival,Palworld,2024-02-28,"as many people are using this place, its too op. palworld should take an example from valheim and randomize every world coming into existence through out each server"
Survival,Palworld,2024-01-30,"just set up my base here. it was a pain getting here at lvl12. the mobs are all lvl 25ish, have a huge aggro radius, and have strong ranged attacks. finally got here and the nods will help a lot."
Survival,Palworld,2024-03-06,i love your content so much
Survival,Palworld,2025-02-06,i love your accent
Survival,Palworld,2025-01-24,thank you for this!
Survival,Palworld,2024-02-09,"i found that spot my first day and built my 2nd base there, and forgot. a week later everyone in the server is trying to get me to join them because i have my base there lol"
Survival,Palworld,2024-02-10,also were the lvl 45 anubis boss is theres a lot there as well
Survival,Palworld,2025-02-23,what i do is get 4 bowser and put them all to work on the ore mining 3
Survival,Palworld,2024-02-08,ty needed this
Survival,Palworld,2024-02-16,get one of those bowsers!
Survival,Palworld,2024-02-10,"guys, who remember art money? it works"
Survival,Palworld,2024-12-17,or i could just get a coal mine in an area around a bunch of ore but overall this is probably a better way to get coal and ore
Survival,Palworld,2024-01-26,first lets goooo love your content man
Survival,Palworld,2025-01-21,thank you!!!!!!
Survival,Palworld,2024-10-05,i found a ore base nobody has talked about it's in volcano area near the axel and orzerk tower to the east i think it's to the right of it on a hill on map it's very close
Survival,Palworld,2024-03-02,the pal box is impossible to place
Survival,Palworld,2024-02-22,isn't astegon better than a digtoise? since it has lvl 4 mining and works all day and night
Survival,Palworld,2024-02-18,this spot is bugged for me. my pals collect the coal but the iron ore falls through the ground.
Survival,Palworld,2024-01-26,thats crazy bro always find bugs
Survival,Palworld,2024-02-10,i still havent used coal that much
Survival,Palworld,2024-02-25,thanks partner
Survival,Palworld,2024-01-30,thanks for the coordinates. very helpful of you
Survival,Palworld,2024-01-30,i need that bowser pal! where the heck do you find those???
Survival,Palworld,2025-01-10,coal and charcoal are two different things
Survival,Palworld,2024-06-16,how long till it respawns? i buid my base here and i don't see it respawning and yeah i didn't put anything in the place of ore and coal and yet it isn't respawning
Survival,Palworld,2024-11-16,i live here but the ore is respawning but not the coal? it was respawning for a while then just stopped
Survival,Palworld,2024-02-08,charcoal
Survival,Palworld,2024-10-24,what's the mount at the beginning of the video?
Survival,Palworld,2024-02-10,i have 20k of almost every resource in the game
Survival,Palworld,2024-03-01,charcoal?? i think you meant coal sir..
Survival,Palworld,2024-10-09,where to get that pal tho
Survival,Palworld,2024-02-09,dont use digitize hes slow use damud and anubis
Survival,Palworld,2024-02-15,for some reason my pals in this base barely ever mine coal its wayyyyy more ore than coal that they mine is there a reason?  i use penkings and digtoise
Survival,Palworld,2024-02-07,"190, 38 that the spot"
Survival,Palworld,2024-05-25,what are the cords?
Survival,Palworld,2024-01-28,i put my boys down and they just get stuck and die without mining and transporting somebody help
Survival,Palworld,2024-01-26,ik you dont do dmz much anymore. bit how do i do the dupe for auavmoney. im a solo and it might ve useful. im not gonna abuse it just get some gear so im not constantly on the death screen
Survival,Palworld,2024-01-26,is there any other spots ?
Survival,Palworld,2024-01-30,what pal is that
Survival,Palworld,2025-02-03,just get a anubis hes better
Survival,Palworld,2024-02-13,your using the worse mining buddy just to lyk
Survival,Palworld,2024-03-08,"this spot is overrated, and doesnt have that much of ore or coal. ive found better spots with better coal and ore."
Survival,Palworld,2024-01-28,scovo
Survival,Palworld,2024-01-29,rip knock off ark
Survival,Palworld,2024-06-08,and the ultra upgraded vixies make legend spheres
Survival,Palworld,2024-02-09,risk of rain 2 music moment
Survival,Palworld,2024-02-09,it actually works
Survival,Palworld,2025-01-24,yeah its perfectly normal that a sheep can shave its own wool out but not normal that a pal that digs cans dig up a pall sphere that get thrown thousands of times
Survival,Palworld,2024-02-08,coalescence w
Survival,Palworld,2024-02-08,palworld palworld palworld
Survival,Palworld,2024-02-19,some of them are good design for pokmon
Survival,Palworld,2024-08-01,i dont understand why you make it seem like its broken when you can only get the 2 worst pal spheres in the game sure its good for starters but you wont need them after 2 days of playing
Survival,Palworld,2025-01-10,time to catch 64 vixies
Survival,Palworld,2025-02-20,did that vixy just shit out a pal sphere
Survival,Palworld,2025-01-04,thanks a lot i'm going to be a pro
Survival,Palworld,2024-02-08,not gonna play this game but still good content
Survival,Palworld,2025-03-14,i don't need mega spheres lmao
Survival,Palworld,2025-02-20,i dot need palspheres or megas im lvl 56 im not a starter
Survival,Palworld,2024-12-25,but i still have to grind for the exotic spheres
Survival,Palworld,2025-01-24,can u breed them and do it that way or do they have to be wild?
Survival,Palworld,2024-02-08,i guess it better to crash down vivy
Survival,Palworld,2025-03-21,song?
Survival,Palworld,2024-02-11,what happened to halo
Survival,Palworld,2024-02-18,yeh but its useless in the late game
Survival,Palworld,2024-02-25,"never trust shorts, how do you not list the most meta and discussed best base location with 8 ore, 6 coal? i can't remember it myself off the top but its like 189, 38 i believe"
Survival,Palworld,2024-02-26,"spots are here, here, and here good luck"
Survival,Palworld,2024-02-25,the desert locations both have buggy ground and you fall thru and lose ore frequently. but i still suffered them!
Survival,Palworld,2024-02-25,proud to say i have bases at the ore and coal locations without any help from this video. just happy this validates my choices
Survival,Palworld,2024-03-01,"my base is up on a mountain around where the first base he suggested, and that base protected me from raids because they can't figure out how to get up where i am, even though there's a clear path to it. not even flying creatures can figure out how to get up the mountain."
Survival,Palworld,2024-02-26,do not walk on snow that has no texture in that area. you'll fall through.
Survival,Palworld,2024-02-27,first spot is best as there are 2 extremely close by cave dungeons and 2 more very close by cave dungeons that can be used to farm early alpha pals as well as the nodes that spawn in them.
Survival,Palworld,2024-02-27,quartz isn't as big of a problem as coal in my opinion usually i can make a trip gathering quartz last alot longer than a trip gathering coal.
Survival,Palworld,2024-02-25,never make a base for quartz actual waste. learned the hardway.
Survival,Palworld,2024-03-19,"188, 37ish on a super high level is a spot that has like 10 ore and 10 coal and a bunch of trees. it's just barely big enough for a base location in the center, but that makes it raidproof. if you can deal with somewhat uneven terrain, it's perfect for a mining base."
Survival,Palworld,2024-09-19,tnx dude
Survival,Palworld,2024-02-25,"you might as well post the coordinates of each in a text post, that'd be more handy. i can't see anything in this short."
Survival,Palworld,2024-03-08,thanks man! i built at the early game one already it's bomb. still my main base.
Survival,Palworld,2024-02-26,ok but you dont need the sulfer one at all cause theres a fast travel right next to it
Survival,Palworld,2024-03-17,"tip for beginnersfind a favorite spot. once you can build a second base,get a flying andor ground mount. travel to these locations and mark as mining spots on your map. set up base and use your best mining and gathering pals. build a wooden chest. gather all resources. once all resources are gathered at whatever location you choose, travel back to your main base and drop your resources. you can now delete your second base and set up at another marked mining spot and repeat. it's a grind but it's worth it...if you don't like to cheat"
Survival,Palworld,2024-02-25,"kek. this is a true palworld short. halfway in it l a g g e d and i had to restart. still great game though, what pokemon could've been."
Survival,Palworld,2024-03-12,"building on top of a huge plateau slightly south of the quivern boss or between that and the beakon boss area would be better imo. it's spacious, safe and secure from most raids they usually get stuck and eventually leaveaggro pals, aesthetic scenery, mostly flat topography, etc. ore is abundant and the other resources mentioned in this short would still be relatively close if you were to set up a base there. the plateaus where relaxaurus lux is located is also ideal."
