genre,game,commented_date,comment
Survival,Palworld,2024-04-01,now this is something i bet the pokmon company will be suing for
Survival,Palworld,2024-04-04,1010 concept would play
Survival,Palworld,2024-04-01,jumps onto draggys face garo im scared pls help im so very scared pls save me dont leave me here
Survival,Palworld,2024-04-02,funny i don't want pets one
Survival,Palworld,2024-04-15,first cult of the lamb now this
Survival,Palworld,2024-04-02,bro palworld player base is gonna be tripled after this comes out. mofos will get the actual palworld game and speedrun get their favorite pal they dated in the dating sim.
Survival,Palworld,2024-04-05,"i caught a chilet batman, i caught a chilet"
Survival,Palworld,2024-04-02,i feel like getting palworld now
Survival,Palworld,2024-04-24,when i heard what katress is like... just monika intensifies
Survival,Palworld,2024-04-05,"does anyone remember the game rivals of aether, and they made an april's joke trailer for lover of aether that ended up being a real game and released on the same day."
Survival,Palworld,2024-04-03,your my favorit youtuber
Survival,Palworld,2024-04-03,oh oh no this cant be... this cant be
Survival,Palworld,2024-04-22,cult of the lamb s3x update flashbacks
Survival,Palworld,2024-04-02,where did chillet go love the vids keep going
Survival,Palworld,2024-04-16,i swear if cult of the lamb is going to have this as well i mean the internet just spawned lot of dirty arts in the alleyways
Survival,Palworld,2024-04-30,i would like to nuzzle and cuddle with chilliet. he looks so innocent
Survival,Palworld,2024-04-01,they know what they're doing
Survival,Palworld,2024-04-01,where they take off their clothes can i interest you in the regular game with more pal options? 0 indivual personality but also 100 0 clothing on all pals.
Survival,Palworld,2024-04-01,"i'd gladly download it, ft it's going to be real and will be available on mobiles!"
Survival,Palworld,2024-04-04,quivern would be chillet's positive thinking best friend in my head lore
Survival,Palworld,2024-04-01,oooo! i'll check that out ..
Survival,Palworld,2024-04-27,the pink cat i totally didnt have her chan to the halls
Survival,Palworld,2024-05-01,we all know who we're going for lovander it's basically the gardevoir of palworld
Survival,Palworld,2024-04-07,"god i know it's gonna be a bit lewd but, i have a gut feeling it isn't gonna be a doki doki experience"
Survival,Palworld,2024-04-17,"okay, theres a couple ways that can go but i have a feeling its either regular dating sim or dlc with mostly nonhuman characters"
Survival,Palworld,2024-04-13,this is like a guardian tales story but it's ex update palworld
Survival,Palworld,2024-04-03,"don't be suspicious, don't be suspicious.don't be suspicious don't be suspicious"
Survival,Palworld,2024-04-01,best boy chillet
Survival,Palworld,2024-05-09,lovander's id being 69 is legendary.
Survival,Palworld,2024-04-01,"that last part is truly intense. garoblush if this game becomes a reality, it might be amazing to play it garopog"
Survival,Palworld,2024-04-16,this is like cult of the lamb all over again.
Survival,Palworld,2024-04-01,"i know i shouldn't be surprised, but i can't believe it already has over 6 thousand retweets! i'm sure they all have good intentions! definitely good intentions..."
Survival,Palworld,2024-04-01,chillet ill go for chillet theres my favorite and cute pal
Survival,Palworld,2024-04-02,if im in the game and offered pawsies then ill be happy
Survival,Palworld,2024-04-02,i would date the black market without a second thought
Survival,Palworld,2024-04-01,"yo, is that bug fables battle music!??!!!?!? yooooooooooooo!!!"
Survival,Palworld,2024-04-25,"chillet's my boi, just look how cute he is! meanwhile chillet having a fucking orgasm from belly rubs"
Survival,Palworld,2024-04-02,who needs lovander when you have the black marketer the most beautiful man ever
Survival,Palworld,2024-04-02,the devs know how people are with creature collector games
Survival,Palworld,2024-04-02,ok but why chillet so sus when you pet him
Survival,Palworld,2024-04-09,"i saw chillet in a cute school uniform, and it's a guy. i'm sold."
Survival,Palworld,2024-04-15,pal world was announced on april fools day too
Survival,Palworld,2024-04-02,"one of the reasons i hate april fools day, people just start dropping bangers only to turn back and say it will never happen and it was only a joke"
Survival,Palworld,2024-04-01,definitely chillit gay forever3
Survival,Palworld,2024-04-03,"i dont like palworld as a pokemon fan myself but this seems interesting, ill need to research the game once its released"
Survival,Palworld,2024-09-04,"ngl, i'd love to see dazzi"
Survival,Palworld,2024-04-01,interesting.
Survival,Palworld,2024-04-02,"i have interesting in this hotel story. it's way better than the the day they just got from. you know what? i mean, but i think it will be more interesting to see with this goes. yeah i'm i will play it"
Survival,Palworld,2024-05-05,imagine them making a real ex update
Survival,Palworld,2025-01-25,i'm not going to be surprised if they do
Survival,Palworld,2024-04-02,when i showed my friends palworld for the first time i said i need to breed some they thought i ment the player breeds with them so they thought i wanted to have fun with them i dont and deny it every time they also tell everyone like shut up if they found out about this i would never hear the end of it
Survival,Palworld,2024-04-23,idk if i should be scared on what the community is going to think about this or not
Survival,Palworld,2024-04-03,"the devs knew what they were doing, also that last frame  yeah ig dream big?"
Survival,Palworld,2024-04-02,theres no laws against the pokpal's batman
Survival,Palworld,2024-04-02,that is some last frame you gotta explain
Survival,Palworld,2024-04-19,"katress, at first i wasn't interested but after a dream i have no control of my choice has been decided."
Survival,Palworld,2025-02-24,"ik this is off topic, but my internet cut out and stopped the short right on the spot of the thumbnail  but funny to see there is a dating sim for pals"
Survival,Palworld,2025-02-15,ths is going to be interesting
Survival,Palworld,2024-04-01,i want to chill with chillet
Survival,Palworld,2025-01-23,hell nah bro i like the normal palworld not the dating palworld im lvl 45 one palworld and i have jetragon and more op dudes
Survival,Palworld,2024-04-15,"at first i was like what the fk? then i was like what the fk!? and then i was like oh, it's just a joke hahaha and finally i was like what the fk!?! but in all honesty, i actually wouldn't mind if this existed."
Survival,Palworld,2024-04-02,omg garo wants to lewd jetdragon xd... mine would be leezpunk hehe
Survival,Palworld,2024-04-02,most normal twitch stream right now
Survival,Palworld,2025-02-23,"splatterina, lyleen, lyleen noct, lumaris, katress, katress ignis. i will not explain why. harem"
Survival,Palworld,2025-03-20,"genteee! 2 cosas la primera los servidores de play tan caidos, aparentemente tienen un error y por eso an no tienen crossplay la segunda, aqu les dejo el video de los libros de trabajo httpsyoutu.be0absmn3j3g"
Survival,Palworld,2025-03-21,que buen video y est muy god que hayan agregado la mesa de dibujo para no estar farmeando tanto en conseguir los planos legendarios y est buena la caja dimensional pal para almacenar ms pals
Survival,Palworld,2025-03-20,"ola, pero ola de mar porque ando en la playa"
Survival,Palworld,2025-03-21,y yo que venda o tiraba los planos  que triste realidad
Survival,Palworld,2025-03-21,"excelentes videos bro siempre los miro queria agregar que el icono para los humanos cambio, tambien queria preguntarte si se puede jugar con los personajes de los diferentes mundos al mismo tiempo como una especie de cooperativo local ya que mi hijo tiene su mundo y yo tengo el mio y lo otro es que vi un video de una casa en el arbol estilo japonesa no se si lo hallas visto pero era para ver si depronto puedes explicar como fue que la trabajo para los cimientos"
Survival,Palworld,2025-03-21,"graaaaaande zorra, muchas gracias!!"
Survival,Palworld,2025-03-21,"uff que bueno, me fije que se actualizo pero no imagine que seria lo que vendra en la actualizacin, gracias zorragaming, me encanta como explicas. d"
Survival,Palworld,2025-03-21,abri un alfajor solo para sentirme importante al escuchar el buen provecho xddd
Survival,Palworld,2025-03-21,por ver la portada rpido pens que era de grounded jajaja me quiero matar
Survival,Palworld,2025-03-21,la mesa de dibujo es mega top
Survival,Palworld,2025-03-20,"yo ya regres al vicio nuevamente, grande zorra!!! y pronto estaremos los zorritos en un server juntos"
Survival,Palworld,2025-03-20,al fin saque el can de plasma legendario tena 5 planos picos para fabricarlo bendita actualizacin xd
Survival,Palworld,2025-03-21,"y yo que tiraba o vendia cientos de planos basura, y ahora me siento como un tonto. aunque una parte de mi, sabia que debia conservarlos."
Survival,Palworld,2025-03-21,"finally, trafico pal"
Survival,Palworld,2025-03-21,"hola, exc video, has pensado en hacer uno con las armas, como cuales son buenas llevar y donde conseguirlas?"
Survival,Palworld,2025-03-21,"cada dia me gustan los cambios que hacen, me gusta que se puedan tranferir cositas entre partidas, asi puedo pasar los pals que ya me mat criando hace meses, aunque creo que para seguir criando seguira siendo mejor en partidas privadas ya que en servers oficiales la crianza tarda mucho, lo de los planos esta bueno, nunca habia dedicado tanto tiempo a armas epicas o legendarias, supongo que ser bueno farmear full eso ahora, seria bueno que se pueda hacer venta de pals entre jugadores, no se qie tan conveniente sea, o intercambios, aunque en servers con randoms creo que estaria dificil porque nunca falta el vato castroso que nadamas jode porque si"
Survival,Palworld,2025-03-21,"725 en nintendo switch hay un boton para screenshot, quizas el empleado que le toco, penso cada quien tiene su boton de pantallazo, dejalo asi no mas"
Survival,Palworld,2025-03-21,arreglaron el bug de la estacin petrolera en el que los pals no luchan ni se mueven?
Survival,Palworld,2025-03-20,"crearas un servidor para jugar con subs? si la respuesta es si, crees que seria posible activar lo de llevar los pals de otros mundos porfa"
Survival,Palworld,2025-03-21,"pregunta, como apilaste las camas?"
Survival,Palworld,2025-03-21,"tengo una partida privada, como obtendro pals modificados de otros jugadores"
Survival,Palworld,2025-03-21,que padre
Survival,Palworld,2025-03-20,hola disculpa cuando sacaras el video de la base perfecta en palworld?
Survival,Palworld,2025-03-20,"perfecto, ayer estaba en el directo pero por culpa del trabajo no pude escuchar casi nada xd por cierto, an sigue pasando en xbox cloud lo del mapa borrado y el cierre del juego por el tamao del archivo"
Survival,Palworld,2025-03-21,"apenas me enter de la actualizacin y esto haciendo pruebas para poder pasar pals a otros mundos en otras plataformas tengo juego en steam y xboxl pero no encontraba como se hacia tal cual y moviendole a cosas di con una forma pero aun no se si esa es la forma o hay una forma mas directa y segura... tecnicamente mi metodo es el que quiera un clon, meti mi personaje secundario que es de xbox a la principal que es de steam, y entonces para poder clonar tengo que agarrar un pal de la caja dimensional de mi mundo de steam con mi personaje de xbox para ponerlo en la caja de mi base temporal en ese mundo y de ahi pasarlo a la caja global y clonar, salirme y en mi mundo de xbox al meter a la caja global ahi esta el clon para pasarlo a mi caja de base... esa es la forma en que se va a hacer o hay otra forma mas rpida?"
Survival,Palworld,2025-03-20,mi estimado podrias hacer tu una guia de ssar pals de crianza o como sacar los que son exclusivos o no estan?
Survival,Palworld,2025-03-21,"y para jugar entre ps5 y pc que recomiendas, un server oficial podria ser?"
Survival,Palworld,2025-03-21,y como se juega con amigos de otras plataformas?
Survival,Palworld,2025-03-21,"funciona cualquier tipo de plano o si quiero de arma ocupo usar los de arma epico para sacar los de legendarios?,o se puede 3 epicos de casco para sacar 1 legendario de arma?,y sabes si cuentan los planos que vende el vendedor?"
Survival,Palworld,2025-03-21,"est muy bien que los humanos ahora tengan aptitudes de trabajo, pero... cuando van a poder atacar con sus armas? xk tener un to enorme con una gatling y que no dispar con ella... hace que solo sean tiles los del bate de bisbol"
Survival,Palworld,2025-03-21,
Survival,Palworld,2025-03-21,"hola, gracias por el resumen, me dio mucha info que no conocia y daba paja leer jaja y otra cosa que me gustaria preguntar, no se si el crossplay funciona en xbox one a steam, porque 1 no puedo hostear una partida multijugador 2 no me deja unirme a una partida multijugador de steam al menos que es donde probe no se a que se deba eso, ya que cuando intento unirme me carga y me manda al menu otra vez y para hostear literal me dice que no puedo post data lo estoy jugando con game pass normal, no el ultimate, no se si afecte tambien en algo"
Survival,Palworld,2025-03-20,puedes aser un top 109 de juegos supervivencia si
Survival,Palworld,2025-03-21,"una pregunta, a todos se les reinicio el mapa? o solo a mi?"
Survival,Palworld,2025-03-21,"yo que tiraba todos los planos comunes,por qu no tena espacio"
Survival,Palworld,2025-03-20,"ola mi amor, buen video"
Survival,Palworld,2025-03-20,funconara com los pals jefes como zoe y grisboll???
Survival,Palworld,2025-03-21,mi momento ha llegado entren a mi servidor y les vendo pals perfectos
Survival,Palworld,2025-03-20,hola bro
Survival,Palworld,2025-03-20,saludos
Survival,Palworld,2025-03-20,yo estoy esperando a a metan mas objetivos difciles
Survival,Palworld,2025-03-20,fuaaaa
Survival,Palworld,2025-03-21,y yo que elimin un montn de planos de armas
Survival,Palworld,2025-03-21,"necesito gente para jugar, dejen su comentario y nos agregamos a un grupo o algo"
Survival,Palworld,2025-03-21,bro yo tire los planos lv 1 y 2 . ahora me toca flamear
Survival,Palworld,2025-03-20,primero en todo
Survival,Palworld,2025-03-21,"cmo puedo lanzar la bola con el pal a una batalla en xbox, no puedo hacerlo, aydala"
Survival,Palworld,2025-03-21,cmo funciona el pvp con el cross?
Survival,Palworld,2025-03-21,sigo insistiendo... este es un juegazo.. lastima que los idiotas de gamefreak les ha dado miedo de hacer un pokmon similar.
Survival,Palworld,2025-03-20,excelente parche
Survival,Palworld,2025-03-21,como sabemos si al servidor que vas esta habilitada la transferencia de pals? donde lo pone?
Survival,Palworld,2025-03-20,se confirma servidor con subs?
Survival,Palworld,2025-03-21,osea que tire todos esos planos del lanza misiles y rifle de asalto .........por que tengo tan mala suerte xd
Survival,Palworld,2025-03-21,bro esto significa que vas hacer un server
Survival,Palworld,2025-03-21,"esto solo deja claro que este juego aun no siendo el mejor juego, sus creadores si piensa en mejorarlo"
Survival,Palworld,2025-03-21,a alguien ms le pasa q no lo deja teletransportarse???
Survival,Palworld,2025-03-21,me gustara pasar con el mismo personaje y pals que tengo activos
Survival,Palworld,2025-03-20,relleno para apoyar
Survival,Palworld,2025-03-20,alguien me regala buenos pal? tipo me deje copiarlos?
Survival,Palworld,2025-03-20,can someone give me some good pals?
Survival,Palworld,2025-03-21,alguien invita jugar a su mundo?
Survival,Palworld,2025-03-20,primero en tdod
Survival,Palworld,2025-03-21,osea puedo poner mi partida en un x12 avanzar como me de la gana y ya poder jugar online en cualquier server.. me parece mal hubiese preferido que fuese como ark pero es lo que hay
Survival,Palworld,2025-03-21,primer comentario
Survival,Palworld,2025-03-21,prefiero algo ms guionado
Survival,Palworld,2025-03-20,ps5 no est jo
Survival,Palworld,2025-03-21,que juego mas aburrido ojala nintendo logre cerrarlo para siempre
Survival,Palworld,2025-01-15,"if a pal is caught, the homing sphere will be lostbut that's the price of simplified catching!"
Survival,Palworld,2025-01-19,you can also store food inside of a guild chest and it'll stop any spoilage.
Survival,Palworld,2025-01-18,"to be fair, just about anything in the world is faster than a mound, since mounds can't move, they're just piled up dirt..."
Survival,Palworld,2025-01-18,i like hangu but you can't shoot while gliding so i prefer to use galeclaw
Survival,Palworld,2025-01-18,i can only imagine someone's going to try to complete palworld only attacking with kicks. xd
Survival,Palworld,2025-01-16,"also put a medicine cabinet with basic meds in your farm bases you dont visit as often, those pals will get sicker faster and this way they can heal themself"
Survival,Palworld,2025-01-15,you can also press sort to stop anything and everything from rotting
Survival,Palworld,2025-01-16,also if you kill any pal and they are on the ground if you kick them you can move them away or launch them to mars
Survival,Palworld,2025-03-16,"useless, but i was surprised. lmao love the honesty and the approach"
Survival,Palworld,2025-01-17,you still want to do the research speed branch.. as the bottom of it gives a 2 increase to your pals attack and defense stats.. in each tree. totaling to 18
Survival,Palworld,2025-02-12,you can leap with the grapeling gun and the worst glider with a bit of good timing as early as lv 12. you can just aim from high areas down to the ground and use the momentum to fly with the grappling guns accelaration if you perform it correctly. pretty good to manuver dangerous high level areas with a lower level
Survival,Palworld,2025-01-20,kick only playthrough
Survival,Palworld,2025-01-17,pal expeditions are a thing. i somehow didnt know they existed until level 49
Survival,Palworld,2025-01-17,you still need the research branches cause they unlock the base damage and defense buffs
Survival,Palworld,2025-03-21,actually helpful
Survival,Palworld,2025-02-20,my friend found out you could attack with the kick emote after accidentally kicking a person and getting jumped by the pidf
Survival,Palworld,2025-01-17,actually pals will only eat the left most food that contains what they need sanhunger so whatever is closest to left thay suits their needs is so what they eat
Survival,Palworld,2025-01-23,i discovered multibase research but never considered samebase multiresearch! thanks!
Survival,Palworld,2025-01-15,palworld definitely tells you about assigning pals to specific things. i would've put in the method to stack garden plots to save space
Survival,Palworld,2025-01-19,me and a mate of mine were playing football with a dead lamball using that kick animation  they are unsurprisingly very bouncy
Survival,Palworld,2025-01-26,me kicking the level 10 bounty boss
Survival,Palworld,2025-02-07,halfway through the game i realized there was an option to toggle crafting dont make the same mistake
Survival,Palworld,2025-02-03,im lvl 60 but i only discovered the emotes and kick emote yesterday...
Survival,Palworld,2025-01-16,"i'm breeding 18 pals at once, takes a good 30 minutes to collect all eggs and incubate them"
Survival,Palworld,2025-01-19,the research thing never worked for me. once a pal is working on one all of them registered being used by that pal and assigning another pal changes who is working instead of having multiple
Survival,Palworld,2025-01-19,soooooo grind and grind and make tons of stations that take time to save time ..ok got it.
Survival,Palworld,2025-01-17,making jetragon even more of a waste of time lol
Survival,Palworld,2025-01-15,thanks
Survival,Palworld,2025-01-24,"question... if you stack rsearch stations, does it cost more resources to use?"
Survival,Palworld,2025-01-18,i still forget how to emote on console.
Survival,Palworld,2025-01-23,so if you use the homeming phere with the scatter shot sphere launcher how many spheres can you make orbit?
Survival,Palworld,2025-03-12,"i disagree on research, you will need those to get to the attack and defends ubgrades, what gives u at full research 18 attack and 20 defends for basepals raid."
Survival,Palworld,2025-02-04,what mod are you using to give you the iv potential in the hud?
Survival,Palworld,2025-02-01,i stopped playing this game for a month and surch it up on youtube. this is what is happening. this aint even the same gamr
Survival,Palworld,2025-01-16,salad or minestrone?
Survival,Palworld,2025-01-20,"i don't understand how these double jump boots work, is it normal jumping like space or do you need an extra key for that? i tried to jump twice for double jump, but even with the boots on, he just jumps once like normal."
Survival,Palworld,2025-02-03,does the stat increase from the fruits transfer through breeding?
Survival,Palworld,2025-01-27,how the f do you see the numbers like in the end ?
Survival,Palworld,2025-01-16,i have a question is that. do u guys know what location put down a base can trigger raid event. i have 2 bases and 140 days lv45. i don't encounter even once raid.
Survival,Palworld,2025-01-19,putting to the left in the feed box is not true.
Survival,Palworld,2025-01-15,ok
Survival,Palworld,2025-01-25,are you indian
Survival,Palworld,2025-01-17,jump boots air dodge and a pal slot to move. not worth
Survival,Palworld,2024-02-06,first
Survival,Palworld,2024-02-07,jormuntide should get a huge speed boost when he is in the water. it is criminal how slow he is
Survival,Palworld,2024-02-14,jormuntide absolutely needs a rework as player's pal but not as a boss pal. it's literally a wiggly noodle that wants to get stuck on top of everything.
Survival,Palworld,2024-02-07,"the moment i saw orserk throw a fork at somebody, i knew he was the one for me"
Survival,Palworld,2024-04-17,depresso. he is just so relatable
Survival,Palworld,2024-02-07,i remember hatching jormuntide ignis from a random egg i found when i was only lv27. i was so hyped. he has become my favorite when i gotta quickly smelt some ingots to repair armor before a boss fight. i can't wait to catchhatch the others.
Survival,Palworld,2024-02-09,i really like kitsun. his passive skill makes him the best pal for traversing all areas due to him making you literally immune to cold and heat environmental damage!
Survival,Palworld,2024-02-06,"katress for design and decent stats that makes it work 247, fenglope for zoomies if you have swift and runner and finally quivern for being absolutely cute fluff dragon."
Survival,Palworld,2024-02-19,"sweepa, the pal above all"
Survival,Palworld,2024-02-07,my fav is shadowbeak. no matter what. i just love him
Survival,Palworld,2024-10-17,"xenogard, could never forget the surprise when i was farming meteorites, expecting to see xenovaders like usual only to be surprised by it being there instead. also it being an absolute unit when i went after jetragon."
Survival,Palworld,2024-02-06,"never been much interested in survival games, but this one is really fun. i bet itll take a while, but ill look out for these!"
Survival,Palworld,2024-02-08,"i like suzaku and blazamout for design, love fenglope and amubis for how useful they are at the stage of the game where you have access to them"
Survival,Palworld,2024-02-10,"honestly, fenglope i've found can be extremely powerful when beefed up, and is faster, than paladius. and it tends to be smaller in normal size which means it fits even through every mineshaft, dungeon, even little crevices, and it's double jump is higher than paladius' triple jump. the mobility is far better, and less slidey. for getting around that i feel is the best terrestrial mount to get around with and again, can be quite powerful especially if you use the boss variant and a lucky one in breeding. i usually keep jetragon and fenglope in my party whenever i'm out exploring. there is something so satisfying about using it as a terrestrial mount, and i find myself using it more often than jetragon unless i'm crossing large swaths of mountains."
Survival,Palworld,2024-02-08,orserk is crazy. i have one on my team and for the fun of it at a group of relaxaurus that were twice the level and bro decimated all of em with that lightning aoe move. cemented his spot on my team for sure lmao.
Survival,Palworld,2024-02-07,"mossanda lux. decent power, large as hell, two grenade launchers to knock back and destroy, has consistent feather fall, looks punk as hell, and is good for bases for wood cuttingpunching transporting and handy work. good pal."
Survival,Palworld,2024-02-08,frostallion or noct ver both of them are strongest imo due to their mount partner skills. when you mount on the horse u not only get the specific element  also enhanced the element atk meaning you can do insane dmg with rocket or any firearm this including their moves as well.
Survival,Palworld,2024-02-07,i like direhowl because hes pretty good at all stages of the game and you can unlock his saddle early. also daedream as the necklace is easy to craft and it does great damage
Survival,Palworld,2024-04-11,my favorite pal is anubis speed work.. and fantastic attacks..
Survival,Palworld,2024-02-07,"i just adore that foxsparks allows you to hug him while he sets everyone ablaze, i'm not gonna lie, early game that was fun as hell"
Survival,Palworld,2025-01-04,paladious doin a double take ever sense those triple jump boots came out
Survival,Palworld,2024-02-08,"i've never been big on survival games, but this one is actually really enjoyable. it might take some time to get through, but i'll definitely keep an eye out for those"
Survival,Palworld,2024-02-17,fenglope is my favorite ground mount. super quick and has super high double jumps.
Survival,Palworld,2024-02-07,shadowbeak by far my favorite for combat. among non legendaries it has solid survivability and its exclusive skill divine disaster is fucken awesome.
