genre,game,commented_date,comment
Survival,Palworld,2025-01-16,"i'm thinking it's popular because it targets the younger demographic which is often overlooked within the game industry. that would explain why such a mundane game is so popular, i'm sure there are some older people who like games like this as well and i would probably find it mildly entertaining. sometimes a chill game like that can be pretty welcome too."
Survival,Palworld,2024-01-24,i agree it needs a lore. a story some quests and side quests more towns and npcs to interact with. i don't have much of a need to venture out other than to get that higher lvl pal.
Survival,Palworld,2024-01-24,"im still shocked and impressed at how a game that started out as a meme game upon first reveal turned out to be such a complete banger to play. i legot had more fun in this game than any triple a title thats come out.except for mhwi, that will always be the greatest!"
Survival,Palworld,2024-01-24,"i very rarely leave comments, but when you said talk about palworld in a year and if nintendo sued them into the dirt you had me rofl. thanks for all your before you buy videos!"
Survival,Palworld,2024-02-18,you know the real irony? the pocket pair ceo used to work at nintendo to some extent. and both nintendo and pocket pair hqs are both close by to each other.
Survival,Palworld,2024-01-24,early game boy pokemon game starting a character you cant go into the bushes without a pokemon this game fuck it. doom music
Survival,Palworld,2024-01-23,"around level 15 or so progress started to slack off. but there are world options, and you can give a slight multiplier in xp to keep progress increasing steadily. world settings are very much derivative of ark, however there are a few options i think the game could add, such as a slider that lets you increase the frequency of raids which currently seems pretty rare."
Survival,Palworld,2024-01-24,"im kind of hoping its closer to 50 or lower done cause, yes its huge, but i would love to see the whole level of complexity this game has the potential to have. its already deeper than pokemon in terms of the relationship between the player and creatures. id love to see it go even further. also there definitely needs to be way more human involvement in the world that makes the whole factions and designs more convincing"
Survival,Palworld,2024-11-29,"whether ppl like pw or not. i gotta say it's pretty dope pocket pair actually give game freak and pokemon some competition. competition is as healthy in gaming as it is with anything else. competition drives progress. so palworld might be constructive for pokemon. doesn't mean the products will become better automatically. we have far to many examples of the opposite. but still. i also think it's cool that a small studio are able to actually make a billion dollars worth studio..which happens to be one of the most popular franchises ever.. to show their claws. no matter if i like them or not, i always nod in respect for that. all in all though, i don't think palworld is an existential threat to pokemon as a brand or on any other lvl at all. nor will it ever be."
Survival,Palworld,2024-01-24,it's just weird how good it is. it's still super janky  souless but there's a lot interesting ideas  mechanics that are addictive. it has so much potential that i hope gets realized.
Survival,Palworld,2024-01-24,"its pokmon arceus capturing zelda botw graphics, climbing, gliding, fast travel points  ark survival guns, building and technology tree"
Survival,Palworld,2024-01-24,palworld is the game nobody asked for but it is the game we craved for
Survival,Palworld,2024-01-29,"palworld is absolutely the best early access game to release in years. and yes, it may be a bit lifeless at times, but i think, in five years, you won't recognize it from all the new content and features that get added. they've already released a couple quality of life updates, which speaks volumes about the devs. i have very high hopes for this one, as so far is combined all the elements from my favorite survival games and improved on most. as far as being a pokmon ripoff, it's just not. if anything it's a spoof of pokmon."
Survival,Palworld,2024-01-25,"i really love the game so far. i am surprised with how much there is on early access. the map is big and i enjoy exploring and finding eggs, effigies sp?, treasure chests and of course new pals. i believe with the success of this game, they will hopefully pour more love into this game and by that i mean really give us more and more to a perfect full fledged out game by next year. i am looking forward to all the new stuff coming in the future."
Survival,Palworld,2024-03-17,started on a mulitplayer swrver with friends and now im just doing a solo grind. the upgrading vixy for the better balls is gonna be such a huge help
Survival,Palworld,2024-03-09,you can also reset the timer of food by clicking sort in your inventory
Survival,Palworld,2025-02-24,"i might've missed it when you were talking about ancient technology points... but i found a pretty easy way to stock up on them quickly. do a dungeon, don't pick up or mine anything, kill the boss and grab the two chests at the teleporter. when you exit, turn around and go back into the dungeon. run through to the exit teleporter, there will be two more chests. rinse, repeat... you can usually do this 4 times or so, but i stop at 3 to make sure the timer doesn't run out and close the dungeon when i leave. on the 3rd time through, go ahead and mine and pick up mushrooms or whatever, go ahead and get that other chest that you have been skipping. most of the time there will be 3 of each thing because it just spawns items on top of items that you left behind on those other run throughs. now you have 3x as many chances of getting good stuff, including ancient tech and tech points."
Survival,Palworld,2024-03-09,i would recommend also using orserk in ur party while farming pal fluids doe to his pasive skill u get more pal fluids wich also increases when he is a 234 star
Survival,Palworld,2024-04-07,these are the types of tips i love. i've seen one that allows you to be super strong early on and for me it defeats the enjoyment that i would experience as i go through the journey.
Survival,Palworld,2024-03-10,"1934 ah yes, my favorite pal, germantide ignis. jk dude, nice vid"
Survival,Palworld,2024-04-30,"if you have a pal that you really love and don't want to accidently sell or butcher, give it a name."
Survival,Palworld,2025-03-11,"imma watch this whenever i start slowly down on progress, thank you very much for the tips!!"
Survival,Palworld,2024-08-07,"supply drops kinda break skill points, so you don't need to be as stingy with your points. i have mine spread out and i'm actually above where your hp and carry weight were at in this vid. seems an update is in order! also, due to multiclimate undershirt 1 along with any armor above metal, you no longer have any weakness to cold or heat, which completely nullifies this tip. save up 100 dog coins and become immune to the rest of the game as early as level 10. who needs switching when you never have to switch to begin with?"
Survival,Palworld,2025-02-11,"nowadays, unsure when it got added, for tip 39 theres a passive trait on pals that have the same effect as the mercy ring, which would make your pals unable to lower enemies under 1 hp. a good negative passive to have when capturing pals. the mercy ring is also active when youre riding a pal and use its active skills, meaning that you'll leave enemies down to 1 hp as long as youre riding the pal. slight thing you need to watch for however, dot will still do damage."
Survival,Palworld,2025-01-21,don't overbuild your base i hear as i move my overbuilt base from the starting spawn
Survival,Palworld,2025-03-21,some of these tips are mildly inaccurate now but are still all applicable in some capacity such as catching 10 pals for xp is now 12 pals. amazing video. succinct  empowering.
Survival,Palworld,2024-03-09,this is a great video! thanks for making it
Survival,Palworld,2024-03-09,selling nails no longer gives you a ton of gold
Survival,Palworld,2025-02-25,"here is a tip, if you use killarmari as a glider you can actually glide infinitely if you disable it and glide again every few seconds. it actually goes higher each time so you never run out of gliding time and can basically fly with it."
Survival,Palworld,2024-05-06,wish there was copy paste base system that lets you just pack up and place your base down wherever without having to destroy it and make 200 trips back and forth due to carry weight.
Survival,Palworld,2024-10-01,if your grinding pal captures you can use a pal with mercy hit so whatever they attack won't go under 1hp
Survival,Palworld,2024-12-29,"great tips, thanks a lot  i'm sure most of them are still usable today so that's very helpful for a newcomer like me currently lvl 35."
Survival,Palworld,2024-09-29,"one added update, you can now get pal fluid by having kelpsea in the ranch."
Survival,Palworld,2024-03-10,558 pressing tab on keyboard opens your inventory directly instead of the options menu
Survival,Palworld,2024-03-25,"hey man, really appreciated the video learn some stuff that im gonna utilize, any pointers on being able to make the legendary pal spears at a quicker rate. i got all the level two crafters like the final tier stuff, im having issues getting the materials"
Survival,Palworld,2024-10-16,the amount of times i've had to put up the gamma at night to see anything xd foxsparks is a nice tip
Survival,Palworld,2025-01-29,for traveling use a grapple hook with hangyu until you get jetdragon since hangyu floats up when you use it as a glider you can fly longer
Survival,Palworld,2024-12-18,"another tip that i found useful for the stairs is when you want smaller steps right in front of your build. often we need lil half steps or whatever because pals can't climb and will get stuck. i hit the switch build mode button. i think its r2 or l2 on playstation but when you hit that it lines the stairs up with the height perfectly fit to it. sometimes i build the foundation high, sometimes medium and this greatly help me with adding the steps to it"
Survival,Palworld,2024-07-02,"thanks, had the game in my library since day 1 but just started playing"
Survival,Palworld,2024-05-12,357 when you hit a certain level in the 20s you can unlock a hip lantern
Survival,Palworld,2024-03-26,why is your jetragon black and red?
Survival,Palworld,2024-07-23,i normally dont leave a comment but dude you rock !! great tips
Survival,Palworld,2024-04-06,i just adjusted the multipliers in the game settings and finished the game in a week. had fun
Survival,Palworld,2024-08-12,"i had beegarde in base and after every single raid, when i checked paldeck only she turned out to be dead. i thought she may be just very terrible at fighting but then i realized she had bee quiet xd"
Survival,Palworld,2024-03-24,i found a shiney celibythe sting ray once and had it down to half health. i alsed my dad to help and he killed it
Survival,Palworld,2024-09-25,hi from the future. he is correct about the playstation controllers. which is freaky!
Survival,Palworld,2024-03-18,"i personally put my stat points in health and damage. damage seems pontless, but you definitely do a ton more damage with those points on"
Survival,Palworld,2025-01-15,i appreciate you making this video. i just started and have been blindly trying to make my camp work. the food tip is especially helpful as i've been unintentionally killing my daedream camp pal as the food i've been giving them red berries has no san bonus.
Survival,Palworld,2024-03-09,nails dont work anymore been updated
Survival,Palworld,2025-02-18,"foxspark will also keep you warm at night if you're just starting out, and you don't have any clothes yet."
Survival,Palworld,2024-07-18,"another tip is, if u are in a cold place at night and dont have a kitsun u just need a torch because heats up when held it worked for me because kitsun just spaw at night"
Survival,Palworld,2024-07-06,"i'm really loving this new update. i love this game!!,"
Survival,Palworld,2025-01-17,"the ring of mercy also affects mounts while you are riding them. it's particularly helpful if you have a mount with stun or freeze abilities. for anyone who is unfamiliar, the ring of mercy gives the player mercy hit which prevents their straight damage from reducing the target below 1hp. damage over time like poison or burn can still kill the target."
Survival,Palworld,2024-03-09,thank you for your effort! there are many tips that i didn't know about.
Survival,Palworld,2025-03-06,a lot of good tips in the video for beginners but now kind of outdated because they added a lot of new features and pals that improve farming and fighting. would love to see a new updated video
Survival,Palworld,2024-07-14,this is gold!!! thank you!!
Survival,Palworld,2024-07-06,take note bring rank 4 katress when killing and capturing toco toco and your gunpowder willl flooding 2117
Survival,Palworld,2024-07-29,i like how you include playstation controls when palworld isnt on playstation yet. it gives me hope
Survival,Palworld,2024-10-15,good to know that movement passives dont effect glider pals. definitely didnt spend the last 2 days trait hunting and breeding yakumos for perfect movement to make the galeclaw process easier. got 3 tiers in. condescending definitely boosts it so worth it i guess.
Survival,Palworld,2024-09-25,i just realized 6 months ago you knew the controls for playstation lol. are you a wizard harry?
Survival,Palworld,2024-03-21,"tip 101 do no use lifmunk effigies because catch rates are not working as intended, if you level up, it will reduce your catch rate, that's why you get less catch rate in late game, even with low level pals"
Survival,Palworld,2024-03-21,"for the lifmunk effigy's you can just use the palworld interactive map, it is very accurate."
Survival,Palworld,2024-07-17,"841 you can't still do that at the start, right? or just not on singleplayer? or am i missing something?"
Survival,Palworld,2024-05-02,"i think overall lackey is better than the 20 type specific damage boost like flame emperor or divine dragon... for a 5 drop in type specific dps you get a 15 buff to all damage instead. before i had access to legend i bred for luckey 15 damage 15 work speed musclehead 30 attack 50 work speed ferocious 20 attack hooligan 15 attack work speed 10 it was very easy to breed out hooligan for legend. i did breed an army with legendmuscleheadferocioustype specific 20 boost but it turns out i only really use them for bella noir. my most used annubus gets the most use because it is neutral to almost all the end game bosses and they love putting electric attacks on fire bosses or ice attacks on dark types... so in a lot of cases using the type that is strong against the boss is actually a bad idea. ammo you need to start making metal in bulk well before you can ever use it. the metal is the pacing item, gunpowder is easy. i've never ever bought any ammo and i have thousands of rockets and bullets. if it takes more than 500 rounds to kill something you're using the wrong pals or weapons. when you produce ammo only ever keep a set amount of rounds on you and keep the rest in your basenever stop producing ammo even if you don't need it. every time you go to your base that produces ammo make ammo even if you don't need itsame with metal. the game gives you the materials you need for production long before you can produce weapons or bullets because by the time you can produce it you should have a massive backlog of the required materials."
Survival,Palworld,2025-01-14,"i dont know if its an update since you posted, but you can get palfluid from ranching kelpsea."
Survival,Palworld,2024-07-15,just started out manage to catch a alpha chillet and made a saddle for it
Survival,Palworld,2024-06-15,you can open the inventory with the tab key
Survival,Palworld,2025-02-25,bro didn't know about custom markers until he nearly beat the game. lmao
Survival,Palworld,2024-03-19,thanks!
Survival,Palworld,2024-08-29,with the ability to make up to 10 bases now the build a nice base in the location you want is kind of important but also... kinda not as important but still make sure it's a base location you actually want to keep before building up too much.
Survival,Palworld,2024-03-10,just need a way to get pals to put certain things in certain chests without putting multiple of one thing in several slots
Survival,Palworld,2024-10-10,damn this is good
Survival,Palworld,2024-12-24,for capturing pals you also can use ring of mercy
Survival,Palworld,2024-03-09,144 lol if you're on playstation
Survival,Palworld,2024-10-23,btw you can farm pal fluids now with i think a kelpsea or something like that i forgot its name
Survival,Palworld,2024-09-25,definitely use the marker function for trees!
Survival,Palworld,2024-12-03,"just play this game, this vdo help me a lot"
Survival,Palworld,2025-02-16,bro listed the whole tips and tricks section of the game
Survival,Palworld,2024-07-04,1931 does anyone know if the dragon eggs still spawn there nowadays? i went over there and there were only scorching eggs
Survival,Palworld,2024-03-11,"is this game all focus on min maxing? i notice if i show my progress on discord, i get trashed on for not following the meta, even on easier difficulty"
Survival,Palworld,2024-07-21,1819 bro massacred a whole village of gobfin
Survival,Palworld,2024-10-03,you can farm pal fluid easily by putting a kelpsea in the ranch
Survival,Palworld,2024-05-22,red jetdraegon? ! how!?
Survival,Palworld,2024-04-25,still very relevant info!! thank you!!
Survival,Palworld,2024-05-26,this is good advice for me when i finished the game 100 xd
Survival,Palworld,2024-12-02,i'm convinced that people are just either illiterate don't choose to read markers are literally told to you in the map press e to place them
Survival,Palworld,2024-03-09,and passive skills like swift etc. do have a effect on glider pals but the differrence is so slim it is not worth it
Survival,Palworld,2024-03-20,great vid ty
Survival,Palworld,2024-12-22,1124 ironic when you consider the clip used was a lvl 47 vs a lvl 23. . .
Survival,Palworld,2025-01-20,"10 months later, and this game looks completely different"
Survival,Palworld,2024-11-04,what would be a good ratio of health to weight point assignment?
Survival,Palworld,2025-02-17,how did u get the boss outfit
Survival,Palworld,2024-08-10,how did you get a black colored jetragon?
Survival,Palworld,2024-10-22,seen so many tips videos so lying isn't the one dude...
Survival,Palworld,2025-01-16,the fact before this vid i just got a gale claw
Survival,Palworld,2024-11-06,"the black marketeer trick no longer works, he just dies, no loot. t.t"
Survival,Palworld,2024-12-18,there's a pal you can put in tbe ranch for pal fluids
Survival,Palworld,2024-10-06,how do you get it to let you respawn in all those other locations? i cant get it at all!
Survival,Palworld,2024-06-06,"i honest to god did not know you can increase the density of groups, if i would have known that i would have maxed that up and killed a bunch of electric rats and penguins to farm up their parts"
Survival,Palworld,2024-08-27,how do you get the black jetragon?
Survival,Palworld,2024-03-20,how do you make sure dark type pals don't get depressed?
Survival,Palworld,2025-02-16,heres a tip with glider slide down a hill and jump then glide u go faster
Survival,Palworld,2024-09-05,what do you mean square on your playstation? u meant ps controller only right? cuz i've no idea when is palworld is available on ps store ever
Survival,Palworld,2024-03-09,nails got fixed bud
Survival,Palworld,2024-09-19,is making a glider at the beginning of the game bad?
Survival,Palworld,2024-12-07,the black market trick
Survival,Palworld,2024-10-16,this is completely off topic but i eas watching this to pass the time while playing the game i was new so i was fighting chillet and i tried catching it for shits and giggles it was low but not much low and i still ca7ght it
Survival,Palworld,2024-03-18,what kind of jetragon was that
Survival,Palworld,2024-11-08,"when i fight the dungeon bosses, i dont get no ancient technology points"
Survival,Palworld,2024-03-12,"want a real tip? when building up due to lack of space, be sure you build stairs 3 x 3 x 3 size going up as this will prevent pals from getting stuck and also allow bigger ones to go to top floor jormuntide boss will still have problems. there is more than just poision and frozen that increase catch rate. on fire or wet will also increase the chance and same goes for grass skill that rots the enemy into place. some short dragon skill can cause cause pals to burn on fire. the best way to farm palfluids early game is to visit starting areas islands not all are great and just run araund on your mount and 1 shot low lvl water pals with crossbow or short pal skill. super tip there is a chest in game that can give you pretty much any endgame gear  location however is secret and i will not tell you that. bonus is you dont need to use any keys."
Survival,Palworld,2025-02-16,the fire merchant shi did not work died ten times dont know why id thought it would work after the first
Survival,Palworld,2024-09-28,why doesn't your food have timers on them?
Survival,Palworld,2024-10-30,does changing world settings disable trophy progression for ps5 ?
Survival,Palworld,2025-01-26,do you have a mod for jetragon
Survival,Palworld,2025-03-21,bon visionnage !!
Survival,Palworld,2025-03-21,essaye de courir et t appuyer sur la touche c te ton clavier tu ira plus vite en descente
Survival,Palworld,2025-03-21,"1941 ah ! ca y est ! j'ai enfin compris ! asfax est une ia ! il est plutt bien cod en fait... et trs en avance sur son temps ! une technologie de pointe. bravo ! je suis impressionne. par contre, n'utilisez pas cette ia pour grer votre inventaire. c'est une catastrophe. clairement son gros point faible.  peuttre y auratil  l'avenir un patch ? une version asfax 2.0 capable de grer correctement un inventaire ? oui, on peut toujours rver !"
Survival,Palworld,2025-03-21,"incroyable comme vido, petit conseille il existe un png rare qui s appelle dr. brawn, il est super intressant a capturer il est vraiment rare"
Survival,Palworld,2025-03-21,super videos aujourd hui comme d abitude et chtaos ammigos
Survival,Palworld,2025-03-21,a quand le prochain arkfaxia?
Survival,Palworld,2025-03-21,gg asfax pour avoir presque fini le jeu mais stp continue la serie sur palworld et fais un jetdragon super rapide
Survival,Palworld,2025-03-21,slt asfax tu peux amliorer les stats de tes pals au marchand des pices canines il te vend des potions pour amliorer leur vie dfense attaque
Survival,Palworld,2025-03-21,trop bien
Survival,Palworld,2025-03-21,gnial la vido
Survival,Palworld,2025-03-21,super vido
Survival,Palworld,2025-03-21,a sent la fin de l'aventure
Survival,Palworld,2025-03-21,asfax tu peut modifier les iv avec des potion acheter au marchant des piece canine dog coin 300 pour 1 potion de 10 dans une stat
Survival,Palworld,2025-03-21,salut asfax reproduit frostallion et vanwyrm et a te fera un frostallion nocte
Survival,Palworld,2025-03-21,ggg
Survival,Palworld,2025-03-21,salut beau visionnage
Survival,Palworld,2025-03-21,tu peux voir les stats cts de leurs barre de vie  jetdragon
Survival,Palworld,2025-03-21,anubis frostalion
Survival,Palworld,2025-03-21,en fait ca se dit nocklem le k est muet
Survival,Palworld,2025-03-21,first
Survival,Palworld,2025-03-21,asfax tu pourrais fair une deuxime srie loupgarou on fait plain de mise  jour s'il te plat
Survival,Palworld,2025-03-21,second
Survival,Palworld,2025-01-19,"the best pal for medicine production is the nonbreedable bellanoir, but both lyleen and splatterina have level 3! and let bastigor handle the woodcutting!"
Survival,Palworld,2025-01-22,the number of potential breeding partner combinations in this game just floors me. i'm far too used to pokemon's limited breeding feature.
Survival,Palworld,2025-01-20,jormuntides would be good if they werent so huge that they get stuck on every building and cant reach anything in your base
Survival,Palworld,2025-02-12,the only breeding partner that should be included is myself and the pal i want.
Survival,Palworld,2025-01-21,got to love bastigor's expression when he's cooling
Survival,Palworld,2025-03-10,leaving this here as a reminder to watch this when i need it
Survival,Palworld,2025-01-20,thank you so much its very helpful your video!!!
Survival,Palworld,2025-01-22,"actually the best cooling pal is by far vanwyrm cryst, most of cooling pals sleep at night leaving the fridge and that returns the food for their original spoil time. vanwyrm cryst is a dark ice pal so he never sleeps so hes aways cooling the fridge plus you can aways do the sort button to reset their cooling spoil time."
Survival,Palworld,2025-01-19,"while clearing out the oil rig at lvl 20 i caught the incineram noct, and by a stroke of miracle it had remarkable craftmanship, and from that ive managed to get 10 anubis, 2 jormuntides and 2 jormuntide ignis' all with remarkable craftmanship at lvl 25"
Survival,Palworld,2025-02-19,"my friend sent me this, thanks! i'm new to the game"
Survival,Palworld,2025-03-12,the good thing about splatterina is that shes nocturnal since she is dark type. thats why i prefer her over anubis
Survival,Palworld,2025-01-20,well for the best planting pal is that new darkplant type since its nocturnal and you can upgrade her with those new books trust me its worth it when she can do everything besides watering to keep your pals fed
Survival,Palworld,2025-01-21,should have mentioned orserk. its power generation is as good as azuremanes and its got lv3 handiwork
Survival,Palworld,2025-02-17,it was very helpful
