genre,game,commented_date,comment
Survival,Palworld,2025-03-19,"palworld update v0.5.0 included some amazing new changes to the game, in this palworld guide i go over everything you need to know about these new qol additions. palworld palworldgame palworldgameplay 0000 intro  video overview 0103 drafting table guide 0230 dimensional pal storage guide 0348 global palbox guide 0519 transmog  cosmetic armour system guide 0620 photomode guide business only  dpjsc08outlook.com become a member of the channel  httpswww.youtube.comuserdpjsc08join subcribe for more  httpgoo.glqpp7k follow on x  httpsx.comdpjsc08 follow my instagram httpinstagram.comytdpjsc08 join my discord  httpsdiscord.ggzac5ggx"
Survival,Palworld,2025-03-19,what i like the most about this update is buildings can now be placed even if they overlap with a pal. it was rather annoying that a pal walking through somehow meant i couldn't place a building for construction.
Survival,Palworld,2025-03-20,"love the cosmetic armour system addition, cloth outfit is my favourite outfit in the game, so being able to wear it while having the defence of the best armour is just brilliant."
Survival,Palworld,2025-03-20,i'm glad that now you can collect blueprints and upgrade them to a higher tier. too bad i've pretty much sold most of my extra blueprints in my main save.
Survival,Palworld,2025-03-20,the drafting table giving us inevitability is the best kind of balance between rarity and determination. i love it.
Survival,Palworld,2025-03-19,"welp, i just made all my legendary gear with the draft table. it doesn't feel earned, but i'm just so glad that i no longer have to harass the oils rigs and yoink supply drops for hours on end. now i can focus on optimizing my bases and supercharging my pals."
Survival,Palworld,2025-03-19,the drafting table is the best thing that's happened in this update. since the time i was struggling to get the blue print of the lightweight legendary hexolite armore ... i had 6 epic blue prints in a chest ... now i have my legendary armor !!! unfortunately on ps5 the new trophies are bugged
Survival,Palworld,2025-03-19,"ugh, guess who sold all my 'useless' schematics yesterday...? thanks for this, and for being so quick. my download's only just finished!"
Survival,Palworld,2025-03-20,awesome i wanted a pal storge and transmog system for a very long time.
Survival,Palworld,2025-03-19,"finally, i can stop searching for my indentured merchant to sell my piles of blue and green schematics"
Survival,Palworld,2025-03-20,"great add of the box so if a world gets deleted, you don't have to lose that pal."
Survival,Palworld,2025-03-19,"i really didn't know about these things, thanks for the vid....now i know lol. you have a great channel here and i used to watch your destiny 2 vids a lot"
Survival,Palworld,2025-03-19,"that blueprint combined table makes legendaries easier for me because my luck is ridiculous. i got all legendary blueprints from all legendary pals first fight. but never got multi rocket, hexolite, or advanced bow legendary blueprints and i have been grinding for months."
Survival,Palworld,2025-03-19,"noticed a great thing youve done,advanced storage with sign boards ,never thought of that ,brilliant tip"
Survival,Palworld,2025-03-20,"751 the way you set up your bases, does that mean if you start a raid with xenolord ultra in one base with 20 base pals, then the left base and the right base will have another 20  20, meaning a total of 60 pals to fight that xenolord ultra? i think all it takes is, one shot from the boss to the other base to trigger the attack mode of the other bases"
Survival,Palworld,2025-03-19,dpjj i love youre content ! ive been watching your content since black ops two emblem days !!!!
Survival,Palworld,2025-03-20,"the drafting table is probably their best idea by far imo,like in pokmon you can't make a pokball table to make a master ball by using like 50 or 100 ultra balls or any apri balls as well,so this makes palworld even better by a massive mile over pokmon,don't get me wrong i love pokmon but that idea is something that pokmon should be doing,game freak seriously needs to step it tf up in future pokmon games cause palworld is getting better and better after each update,hopefully they announce a new expansion update for more pals a new location weapons and more soon,these devs are killing imo"
Survival,Palworld,2025-03-20,this update is amazing! i was just about to close my eyes too
Survival,Palworld,2025-03-19,o i did start playing palword abot 2 weeks ago after almost a year pause ....and i was going wild trying to get legendaries on end game and i got nothing ...but my hoarding made me keep all the recipes i dropped ...... even on some i have 15 best ...update ....ever
Survival,Palworld,2025-03-21,i wish i knew about the draft table ive been getting rid of all my extra schematics. great addition though.
Survival,Palworld,2025-03-19,"apparently, crafting pals using the global pal box doesnt count as catching the pals thus dont unlock the saddle."
Survival,Palworld,2025-03-19,thanks for showing all this very helpful
Survival,Palworld,2025-03-20,"i was curious to know if they gave dumud the water type, it's worded a little funny in the patch notes"
Survival,Palworld,2025-03-21,"the game keeps getting better and better with each update, it's a shame that it has lost the original hype as before"
Survival,Palworld,2025-03-19,"love this guide dpj ,explains some items perfectly"
Survival,Palworld,2025-03-20,palworld black marketeer now will spawn pidf guard guys... be careful if want to farm early
Survival,Palworld,2025-03-20,hi love the your videos they are very helpfull .question what happens to the pals in the global box if i creat hc world and they die?
Survival,Palworld,2025-03-19,"good lord, the souls of the xenolords will haunt your grandchildren's grandchildren with the amount you turned into sippyjuice!"
Survival,Palworld,2025-03-19,"frick,, i sold all my low tier bp's , keeping only one. damn."
Survival,Palworld,2025-03-20,"519 so here, you mean the xenolord mask is not very effective, so you can actually change the best mask in the game to look like the xenolord mask, so that you get the look, and the effectiveness of something else?"
Survival,Palworld,2025-03-20,i have been wondering where do you build your base you have so much space
Survival,Palworld,2025-03-20,"i truly believe that the developer are buying these feature xdd cuzz we have better palsphere upgrade where you take 3 sphere to get 1 of the next level.. i love palworld devs for these balance !!! i really love the blueprint upgrade if you have to many of them for a better version, like i have to many blue one xdd"
Survival,Palworld,2025-03-20,i wanted more and better furniture and to be able to put all base together better without saying it closed to each other.
Survival,Palworld,2025-03-19,still waiting for you to do hard boss fight without buffed settings
Survival,Palworld,2025-03-21,"dude, what the hell? this game looks so different from when it was released. i can't believe it's the same game."
Survival,Palworld,2025-03-19,"how did you get your base to be that large? beautiful design as well, very impressive and well thought out"
Survival,Palworld,2025-03-19,i'm baffled and quite curious where the accent is from! intriguing.
Survival,Palworld,2025-03-20,can you still do two oil extracts?
Survival,Palworld,2025-03-19,destiny music goin hard
Survival,Palworld,2025-03-21,"maaannn, i literally sorted my boxes out yesterday and deleted all my duplicate schematics"
Survival,Palworld,2025-03-20,did the global palbox make breeding redundant on servers since you can just infinitely port your best pals?
Survival,Palworld,2025-03-19,does global palbox allow server transfer?
Survival,Palworld,2025-03-19,does transferring pals work in randomizer mode?
Survival,Palworld,2025-03-19,do you know how many purple blueprints i have sold?
Survival,Palworld,2025-03-19,anyone know if you can pull from the new pal box for condensing?
Survival,Palworld,2025-03-21,palworld needs to upgrade the enemy npc ai cause it is a bit dumb not gonna lie
Survival,Palworld,2025-03-19,for a moment was about to ask how do you build def walls on structures and those are just gates. that was a downgrade...
Survival,Palworld,2025-03-19,i still believe you unlock drafting table way to late imo 30 would be a good level requirement
Survival,Palworld,2025-03-21,"drafting table isn't really all that useful. you might get 5 of the same schematic at tier 1 or 2 ...in a normal playthrough. might. more likely you'll get 3 t1's, 4 t2's, 2 t3's, 2 t4's, by the time you get 1 t5. so, in this scenario, you'd be one schematic away from crafting a t3 schematic, even though you already have 2 of those, and a several schematics beyond that as well. so at best, it is only useful as a very weak fix for rng which is rolling the bottom 12 of terrible looting luck. and it would rarely be useful even for that. if the cost was say 3 schematics, it would be semiuseful. 2 schematics as a cost would be very useful. 4 or more is pointless and it costs 5. at a cost of 5, i could easily see building a schematic workbench, and then never finding an opportunity to use it, for any schematic, ever. in fact, that seems very likely. that said, it probably creates an easy path for someone to make a mod, which is closer to the realism of looting in palworld than the dev's are. at 5 schematics as a cost, it's purely a decoration item for 99.9 of playthroughs."
Survival,Palworld,2025-03-20,mimsy!
Survival,Palworld,2025-03-19,hola suelo ver mucho tu vdeo me gustara si puedes poner los audios en espaol
Survival,Palworld,2025-03-21,let me rename my pal box tabs.
Survival,Palworld,2025-03-19,w for everyone who stockpiled schematic
Survival,Palworld,2025-03-20,what about any new pals???
Survival,Palworld,2025-03-20,sold my duplicate patterns recently. now they add an upgrade pattern option. ffs..
Survival,Palworld,2025-03-20,honig of online multipler at my ps5...
Survival,Palworld,2025-03-19,now all we need is a way to transfer our characters and inventories to different saves and the game would be perfect!... id love to be able to start from the beginning but with all my tech unlocked and all my equiptment i have... like a new game plus... and be able to transfer stuff back and forth like one can do on ark... when one beats the final boss of the island you take everything non element based with you meaning everything apart from the element resource is taken and you can use it when you start scorched earth etc. just a thought of course...
Survival,Palworld,2025-03-19,one thing the palboxes dont do is work between solo worlds and dedicated servers
Survival,Palworld,2025-03-20,nice work. i 'm learning a lot from you. keep going
Survival,Palworld,2025-03-20,palworld feybreak update guide of 15 things you missed which was added and even taken away from the latest v0.5.0 patch update for palworld. palworld palworldgame palworldgameplay 0000 intro  video overview 0039 new features 0110 infinite material  chest dungeon glitch fix 0220 npc rewards reset 0243 building in the feybreak chromite cave 0320 chromite changes reverted nerfs 0410 npcs  work suitability traits 0454 11 new achievements 0608 elemental chests  new rewards  all locations 0658 dumud water addition 0706 item retrieval machine change 0714 pal expedition site changes 0736 dark fragment models 0744 blueprint image changes 0750 pal favorites 0756 pal sorting order new additions new features w v0.5.0 patch update  httpsyoutu.bex7zhsprkjqy business only  dpjsc08outlook.com become a member of the channel  httpswww.youtube.comuserdpjsc08join subcribe for more  httpgoo.glqpp7k follow on x  httpsx.comdpjsc08 follow my instagram httpinstagram.comytdpjsc08 join my discord  httpsdiscord.ggzac5ggx
Survival,Palworld,2025-03-20,"one really useful thing i found.. if playing with a controller on pc when you select sort it now has the shortcut key for the sort button, so instead of having to move the cursor down to the sort button i can just hit the y button on the controller.. such a small thing, but considering i generally sort the palbox every time i move any pals, or had caught new ones.... it's a great thing."
Survival,Palworld,2025-03-20,"the human work skills are not random, from what i have seen. all the humans have mining, handiness, and lumbering. from there, each specific type of human has a set extra skill point. syndicate grenadiers, for example all have a point in transporting. the exceptions are the larger humans, who have extra points. the syndicate crusher has 3 transporting, and the fpa judicator has 3 gathering."
Survival,Palworld,2025-03-20,bud. your guides are the best i've seen for palworld. hope you keep doing these. it keeps me wanting to play the game
Survival,Palworld,2025-03-20,onions have models now not just in random bags also the bug when you add a weapon to your player. he will no longer do the t pose always do.
Survival,Palworld,2025-03-20,"now if they could make it so pals actually take breaks instead of working themselves to stress, i would be one happy girl. it mainly happens for mining or lumbering pals. it gets annoying because they keep going even when their sanity is low, then they get sick."
Survival,Palworld,2025-03-21,"i noticed the work suitability on humans right after the update releases. i captured a few wonderfully merchants, and up until now, all they did was stand around. all of a sudden, i didn't see them right away because in one base, my merchant was watering food plantations and in the other base, my merchant was mining ore. i think it's cool that they added this."
Survival,Palworld,2025-03-20,"if it hasn't been mentioned already, in the patch notes it said that the elemental chests that you have spawned in on patch so old chests still run off of the old loot table, you will need to open and reset them to get the new loot tables."
Survival,Palworld,2025-03-21,the raid boss slabs are whole now instead of pieces. this means no need to collect 4 to craft together to assemble into one raid boss slab for the altar. so far i've noticed it from expeditions and drops from some chests.
Survival,Palworld,2025-03-20,"the global pal transfer is completely bugged. the saves are separate from your local save so you can absolutely abuse the system by quitting without saving after uploading pals to duplicate resources. people are finding ways to duplicate pals, reuse iv fruit, and most importantly reuse suitability books. also if you haven't already don't interact with the friendly tamer for your book. you can savescum it for the book you want as it rolls it randomly some of the books are way more valuable than others."
Survival,Palworld,2025-03-20,"they changed the circle on the palbox base range, it is no longer a perfect circle but more of an octagon shaped is how i can best describe it...."
Survival,Palworld,2025-03-21,"dear god, that's an incredible base set up you got"
Survival,Palworld,2025-03-21,"222 i wonder how often you can come back for another applied technique book... i got one like 5am, and now it is 8pm... and i set the day and night speed to fastest, so 1 game day to me is 6 minutes... 1 hour is 10 game days... so... now it is 15 x 10  150 game days, but that npc is not giving me another one yet"
Survival,Palworld,2025-03-21,the chest still stack for me. just did it last night and i did it a little 5 times and it still works.
Survival,Palworld,2025-03-20,"the notes indicated that players would need to start a new world to experience the changes to the elemental chests. however, i am currently receiving dog coins and other items from the elemental chests without having to create a new world. i haven't obtained any pal suitability books yet, so they may still be missing from the loot table. additionally, i have not received any pal suitability books from the chest on the oil rig either. has anyone else had a similar experience? thanks for the great videos dpj!"
Survival,Palworld,2025-03-20,"didn't even know it was a thing, i always miss the exploits lol"
Survival,Palworld,2025-03-21,there wasn't a chromite nerf. there was a bug where most of the nodes were spawning under the map.
Survival,Palworld,2025-03-20,i've been using the glitch to stack dungeon loot the last couple weeks because of your video gg's
Survival,Palworld,2025-03-21,"my friend and i had beat the chopper before the update and have beat it since, but that achievement and all the new ones are not popping for us. also, what is the little dna looking thing in the sort options now?"
Survival,Palworld,2025-03-21,excellent video. the rhotacism made it better. sigh.. still no corner roof pieces? i tried building when the game came out and just couldn't get into it without corner roof pieces.
Survival,Palworld,2025-03-21,i hope they sort the passive skills list in the pal box filter
Survival,Palworld,2025-03-21,great vid dpj one thing would want to mention is the achievements aren't retroactive yet or at least not for everyone i say this since the world i have the most time in on xbox at this point finished the lab before this update by over a week  and i have 0 of the lab achievements
Survival,Palworld,2025-03-20,did you know on a regular fire food cooks by itself
Survival,Palworld,2025-03-20,"i have no idea if this is something that was already in and i never noticed it before or something that is new, but pals will transport your cakes into an available breeding pen"
Survival,Palworld,2025-03-21,did they fix going back into the dungeon after completing it and getting all the loot spawn again?
Survival,Palworld,2025-03-21,do i have to demolish the expedition station and rebuild to make it smaller?
Survival,Palworld,2025-03-20,ive found the elemental chests all over? are you talking about like specific chests with specific items in them? or just elemental chests? cuz ive found them before this new patch in the desert and just today i found one in the mushroom wastelands.
Survival,Palworld,2025-03-20,the patch notes said that new npcs were added... but i have been looking and havent found any npcs that are newer than dr brawn...
Survival,Palworld,2025-03-20,did they increase the amount given at least because that dungeon in out was dope af
Survival,Palworld,2025-03-20,"i encountered a weird ingame bug where i make cakes, but when i go to collect them, they just disappear. sometimes i'll make 100, and then after it makes 2, it resets to 1 and continues doing that without producing any cakes. dunno if this is a new or old bug, but its new for me after playing for about 40 days on ps5. never saw it happen before yesterday."
Survival,Palworld,2025-03-20,you can rotate when replacingupgrading roofs now
Survival,Palworld,2025-03-21,anyone else always try to get a shiny lamball?
Survival,Palworld,2025-03-20,thanks for the update.great video
Survival,Palworld,2025-03-20,650 you never use paldb??
Survival,Palworld,2025-03-20,"can anyone confirm to me if humans can have a fire suitability, if they can it makes humam only runs sooooo viable"
Survival,Palworld,2025-03-21,video starts at 1.10
Survival,Palworld,2025-03-21,maybe im blind i swore dumud already had watering not that great but yeah
Survival,Palworld,2025-03-21,anybody open to trading me a xenolord with demon god? i have plenty of xenolords with invader and diamond body. cant breed demon god on it for the life of me
Survival,Palworld,2025-03-20,i heard that cheevos are bugged if you already have done the requirements.
Survival,Palworld,2025-03-21,yup fun detected with dungeons nope not on my watch
Survival,Palworld,2025-03-21,u quit destiny such an failer
Survival,Palworld,2025-03-20,"of course they patch the cave dupe... don't fix an actual problem like the worlddata could not be loaded or mapwiping bugs, no, keep players from quickly farming large quantities of materials"
Survival,Palworld,2025-03-20,open your bag and hit sort and all your foods in bag the time will re sets
Survival,Palworld,2025-03-20,i showed this video to my friends and now we have a new ritual of laughing together every night
Survival,Palworld,2025-03-20,"if i had the talent to make videos like this, i'd be a youtube star by now. but i'm just watching"
Survival,Palworld,2025-03-21,"palworld feybreak new duplication glitch exploit guide. in this video i will show you how you can get infinite iv fruits, applied technique manuals to increase pals working stats, infinite pal souls, infinite skill fruits, infinite exp books.. basically unlimited of everything you can apply to pals! palworld palworldgame palworldgameplay 0000 intro  video overview 0053 credit 0106 what this glitch allows you to do! 0215 glitch explained short version  not recommended 0311 complete glitch guide  requirements 0344 how to get skill fruits 0351 how to get concerntrated all purpose pal extract and iv fruits 0427 how to get dog coins 0443 how to get applied technique manuals  work suitability books 0525 complete glitch guide  how to dupe items credit to professorpenking business only  dpjsc08outlook.com become a member of the channel  httpswww.youtube.comuserdpjsc08join subcribe for more  httpgoo.glqpp7k follow on x  httpsx.comdpjsc08 follow my instagram httpinstagram.comytdpjsc08 join my discord  httpsdiscord.ggzac5ggx"
Survival,Palworld,2025-03-21,i'm maxing out a merchant for suitabilty so he can just stay out all the time
Survival,Palworld,2025-03-21,you can take as long as you want for this btw just make sure auto save is max.
Survival,Palworld,2025-03-21,"nicely explained mate ,trying it out myself"
Survival,Palworld,2025-03-21,bots in the chat go crazy
Survival,Palworld,2025-03-21,can i join your server
Survival,Palworld,2025-03-21,"i tried to impress my boyfriend with a striptease. it was going well until i slipped on my own clothes and landed facefirst on the bed. smooth moves, right"
Survival,Palworld,2025-03-21,"my husband tried to surprise me with breakfast in bed. it was sweet until he accidentally spilled syrup all over the sheets. sticky situation, literally"
Survival,Palworld,2025-03-21,palworld has just teased another massive update is coming to the game which allows us to have tower boss allies as well as brand new skins for the top 3 ranked fav pals in the game! palworld palworldgame palworldgameplay business only  dpjsc08outlook.com become a member of the channel  httpswww.youtube.comuserdpjsc08join subcribe for more  httpgoo.glqpp7k follow on x  httpsx.comdpjsc08 follow my instagram httpinstagram.comytdpjsc08 join my discord  httpsdiscord.ggzac5ggx
Survival,Palworld,2025-03-21,"my hope is that recruiting zoe is like something we haven't seen yet, maybe she acts as a false multiplayer partner and can follow you around capturing pals as well, just something other than capturing her"
Survival,Palworld,2025-03-21,npc help during a raid would be amazing.
Survival,Palworld,2025-03-21,"imagine this, you have to shield zoe and grizzbolt from the rayne syndicate because she betrayed them by wanting to travel free of restrictions, could a new tower boss for rayne syndicate be a possible path for a story? its what comes to mind when they say zoe becoming an ally"
Survival,Palworld,2025-03-21,"you dismantled your pyramid to make a big man? you're silly, and i respect that."
Survival,Palworld,2025-03-21,"it's obvious why katress is higher then shadowbeak, it's humanoid and a goth cat. no need to beat around the bush, furries want to bang katress more then shadowbeak. it's par for the course in games like this, especially since palworld confirms in universe interbreeding with humans and pals happen."
Survival,Palworld,2025-03-21,"xenolord, orserk, bastigor, and shadowbeak. thats who i think should be getting skins"
Survival,Palworld,2025-03-21,"katress is awesome. i do hope for anubis they draw from ancient egyptology and make wepwawet his skin. wepwawet was the precursor opener of ways before anubis took the title, and he was a major god in lycanopolis. where anubis is a jackal, wepwawet is a wolf and grey to white in color."
Survival,Palworld,2025-03-21,"chillet, jetragon and quivern were my pick in the poll, so i'm happy 2 out of 3 will be getting a new skin. i understand chillet winning though it's pretty much the face of the game."
Survival,Palworld,2025-03-21,"well yeah, they asked us to vote for our favorites, not to vote for which one we wanted a new skin for"
Survival,Palworld,2025-03-21,can't believe we're not getting kikit and arrogant pal critic skins
Survival,Palworld,2025-03-21,"i hope they do something similar to other games for voting events like this, just hard bar the previous winners from getting skins if they win again or something so other units or pals in this case get a chance to shine with new skins. otherwise chillet might just have like ten skins it really doesn't need."
Survival,Palworld,2025-03-21,is chillit the charazard of palworld?
Survival,Palworld,2025-03-21,"323 four skins for chillet., chillet hunting forskins needs to be lore. xd"
Survival,Palworld,2025-03-21,"could be able to capture her or even better, in a story sense. maybe there will be a friendship system where you can grow her affection and recruit her that way?"
Survival,Palworld,2025-03-21,"oh yeah. first zoe, then saya. then the world"
Survival,Palworld,2025-03-21,if you go into your pal condenser they have a new sort option in there now thanks to last update
Survival,Palworld,2025-03-21,yes! my pals turn grey from time to time lol
Survival,Palworld,2025-03-21,astagon would look cool with a new skin
Survival,Palworld,2025-03-21,sounds like an option to maybe have zoe ane grizzbolt summinable for raid pal encounters. or oil rig encounters.
Survival,Palworld,2025-03-21,"love chillet, but cmon give someone else a skin. would love to see one for orserk"
Survival,Palworld,2025-03-21,chillet gang rise up!
