genre,game,commented_date,comment
Open-World,Cyberpunk 2077,2025-02-26,"i really wanted to like this game, but i guess it's just not for me. the character customization is much better than any other game i've played, so i'll give it that. but the story was hard to get invested in, the gameplay is just okay enough to be entertaining but not as in depth as i'd like for the genre, it's way too easy to become op and stops being challenging around the 25 mark even if you set it to a higher difficulty... realistically, i'd give it a 6 out of 10. i hope anyone else that tries it likes it more than i did, and you likely will this game's gotta be marked overwhelmingly positive for a reason."
Open-World,Cyberpunk 2077,2025-03-19,one of the best games ever made and still the most visually impressive game you can play 5 years after launch
Open-World,Cyberpunk 2077,2025-03-08,"great story, fun mechanics, engaging characters. cd projeckt red makes the best story driven games out there."
Open-World,Cyberpunk 2077,2025-02-25,"2 ,  .   ,,.,  ..   ,,            .               .             .               . 2010"
Open-World,Cyberpunk 2077,2025-03-14,"bought the game years ago when it came out and actually had to return it given the poor performance. i recently picked it up again due to the recent positive reviews. what an excellent game. storywriting were captivating, graphics were incredible and the combatgameplay was fun an interesting. would recommend"
Open-World,Cyberpunk 2077,2025-03-21,"2025 and still filled with bugs as fck can't rebind some controls without editing an xml file in the settings weapons gamefeel is bad driving gamefeel is bad the car in some cutscenes just slide weirdly do not listen to cd projekt fans, they are not objective about this yeah it was bad the time it came out but now it's better than ever better doesn't mean good the worst is  yeah this doesn't work but you can install a mod for it only good points graphics scenario dub in all languages don't buy this full price buy rdr2 instead, you'll thank me later"
Open-World,Cyberpunk 2077,2025-03-21,"after being in early access for nearly 3 years, cyberpunk 2077 is at it's peak after phantom liberty. cdpr has always been great when it comes to deep lore and immersion in their games. while the main plot might not hit home for everyone the world cdpr has built will make up for it. some of the dialogue that characters use can make me cringe. the lingo used in nc is very campy. but it has it's moments where it comes off as charming nothing is cooler than being a cyborg ninja who can double jump, dash through the air, slow time, and shoot at the same time. combat can get as chaotic as you want it, or you can keep things low profile if you want."
Open-World,Cyberpunk 2077,2025-03-21,review after completing main game and dlc. overall the game is very good but is overrated as one of the best rpg's of all time. the dlc is everything good about the main game but better. night city oozes with flavor and there is great story writing but a lot of it and the situations in the game are not super memorable. in particular most 'boss' fights in the game are just damage sponges with a mechanic or two. there are some great ones though to be had. there is significant variety in how you can choose to play the game and letting you respec at any time feels great to try out new things. stats also help you interact with the environment or through conversations as well leading to better immersion. on the downsides is there is serious side content bloat with not a lot of it feeling very memorable. most of it is also walled behind ticking off other markers on the map too which is both good and bad if you want to try to complete everything. there are also still lots of bugs and performance issues with the game. regardless the game is still very good in its final state and best played with the dlc.
Open-World,Cyberpunk 2077,2025-03-21,good story and and so much to do!
Open-World,Cyberpunk 2077,2025-03-21,"amazing visualization, world building, and one of the best side mission games."
Open-World,Cyberpunk 2077,2025-03-21,"wow, i really love the game, the story and the role playing are fantastic."
Open-World,Cyberpunk 2077,2025-03-21,still a bit janky and unpolished gameplay very fun and satisfying ost is banging night city is something else. schrodingers city. repulsive and attractive at the same time. great characters my ending came outta nowhere and had me dazed this game is something else
Open-World,Cyberpunk 2077,2025-03-21,"one of my favorite games. i bought it on my playstation and now on steam and it holds up still. if you think this game is bad because of it's launch, you really need to try it now."
Open-World,Cyberpunk 2077,2025-03-21,"very nice game. the graphics and game atmosphere are amazing. my only criticism is the janky ai characters walk through cars, ai cars drive all over the place and the mushy vehicle controls."
Open-World,Cyberpunk 2077,2025-03-21,awesome game!!! i preordered this on xbox  way before launch... but ms corpos had to eat shit and have no option to port my game data... but i can game on their shitty cloud? imma take it out on arasaka and militech... i am gonna stick to steam now... gonna have to start a new game after 5 years...
Open-World,Cyberpunk 2077,2025-03-21,quite possibly the best game i've ever played. everything about this game is 5 star. only criticism is that i've run out of missions!
Open-World,Cyberpunk 2077,2025-03-21,fantastic game! they really worked hard on this since its release to make it the amazing immersive experience that it is today!
Open-World,Cyberpunk 2077,2025-03-21,"love this game it has minor problems with graphics on the deck but with the massive game it is i can expect some issues. the mi or issues wont stop me from playing the game,"
Open-World,Cyberpunk 2077,2025-03-21,"very pog game honestly. idk, it might just be the aesthetic of the game  but at least in the beginning, its been very enjoyable. it has both serious moments, and moments that genuinely kinda light you up inside. also, silverhand is a badass."
Open-World,Cyberpunk 2077,2025-03-21,"this is a newly created steam account, as i discarded my old ones, however i purchased cyberpunk 2077 on its release date, i then refunded it due to all of its bugs, after noticing they admitted to their mistakes, and made absolutely massive changes, and put work into marketing and bringing it up to its roughly expected standard i purchased it again. i actually own it on 2 separate steam accounts now. the game looks amazing, performs well enough, and has an absolutely massive modding community. i recommend purchasing this game, just take your time and avoid rushing the main story."
Open-World,Cyberpunk 2077,2025-03-21,as an og cyberpunk rolegame player this game brings alive the world i once loved so much with my friends that we played our campaigns for weeks and months at a time.
Open-World,Cyberpunk 2077,2025-03-21,"i love being able to play as female v, as i myself am a female , i love the game play and story line, the romance, realism and the fact that what you do or say change the outcomes and endings its over all an amazing game and can forget i love the open world and driving!"
Open-World,Cyberpunk 2077,2025-03-21,"this game's plot makes the most sense when you play a nice guy nomad who wants to return to the nomad lifestyle with a new life and a new love after getting burned so badly in nc. it just so happens that my first play through in 2020 was exactly this character. other character types struggle, especially trying to be evil or bad, the default assumption of most side and main stories is that your character is highly motivated to get rid of the chip, really nice and wants to help people, and generally dislikes johnny until the 3rd act. if you play this game within those guardrails like i did my first time then this game is perfect. overall, 8.510 for a killer first play through."
Open-World,Cyberpunk 2077,2025-03-21,"genuinely some of the best written stories in the rpg genre. amazing combat, and highly recommend the dlc."
Open-World,Cyberpunk 2077,2025-03-21,"after 4 years of the game being out, it's definitely nowhere near as buggy as it used to be i just now started playing, just going based off what i've seen. sure there are definitely still bugs, practice makes perfect got stuck for me because i died as soon as the final arena was finished which meant i had to reload a save but that was fine i got through it no problem. i did encounter some other bugs here and there jackie went into an apose for a half second before the biochip mission, some visual inconsistencies but for the most part the game ran just fine. i was able to run the game at mediumhigh graphics settings and still get very high and mostly stable framerates which just made the game feel even better. i'd say i like this more than the witcher 3, but only because the tactical gameplay of the witcher 3 doesn't exactly sit very well with me. both games are arguably equally difficult at their core yes i know there are difficulty settings, but cyberpunk just flows better for me. maybe it's because it's a half shooter half melee game with vehicles in a city but regardless they're both amazing games however this one is more fun to my taste. if you're able to still pick it up while it's on sale, i highly recommend doing so. i did so myself and it's some of the best 24 i've spent on a game until a new halo comes out, if doom the dark ages is any good or when the black myth wukong dlc drops. later chooms"
Open-World,Cyberpunk 2077,2025-03-21,"don't forget to rotate saves if you don't want your game to bug out or have messed up textures! other than that, it was a great experience. good replay value based on the fact that you can approach the game in many ways storywise and gamplaywise writing this after my first playthrough. definetly get sons of liberty, adds variety to the game. contracts and gigs are a bit repetitive sadly."
Open-World,Cyberpunk 2077,2025-03-21,graphicsawesome with some room for improvement story so far great sound design awesome to alright
Open-World,Cyberpunk 2077,2025-03-21,amazing action gameplay with a couple of drama and so many other extras.
Open-World,Cyberpunk 2077,2025-03-21,overall great game with facinating playability and story.
Open-World,Cyberpunk 2077,2025-03-21,"played it a lot, it's an amazing game. i know that it had a rough start so i'm glad i played it now instead of then. i'm almost finished with the game even after so many hours. always been obsessed with the cyberpunk genre but having such a big world to explore is amazing. can't wait to see the new shows and whatever project orion will bring."
Open-World,Cyberpunk 2077,2025-03-21,cool game. bit glitchy but mechanically it's lots of fun and the story  style is preem. plus it has keanu.
Open-World,Cyberpunk 2077,2025-03-21,awesome game i love the story and the open world. combat is very good.
Open-World,Cyberpunk 2077,2025-03-21,"ive only played 5 hours but from what ive played this games great. the driving is good but it does take a while to adjust as it is a bit sensititve. the gun play is fun and most other things are good. a few downsides, i dont enjoy that at any point you can get shot at by enemies like i was driving to a mission and i just get shot at like crazy and it took me 20 minutes to just get to the mission. i also don't enjoy the bd missions as they are very slow and boring but apart from that this game is amazing"
Open-World,Cyberpunk 2077,2025-03-21,"great game. after multiple years of patches, its finally the game that was promised. incredibly well optimised."
Open-World,Cyberpunk 2077,2025-03-21,love the game so far except the driving but the rest makes up for it. runs great on the legion go.
Open-World,Cyberpunk 2077,2025-03-21,"it took a long time for the devs to address all the issues in the game but now it is finally fixed. the story is amazing, and the combat upgrades quickly turns your character into a ruthless killing machine. the city is also quite interesting to explore, and your motorbike is your best friend for navigation, or take the metro."
Open-World,Cyberpunk 2077,2025-03-21,amazing story and dlc
Open-World,Cyberpunk 2077,2025-03-21,"this game is a 1010 for me, i am currently on my 2nd playthrough of the game. the graphics, environment, storybuilding and overall uniqueness of the game is what makes it perfect to me. i stupidly met hanako at embers relativily quickly in my second playthrough and i'm just finding out about all the stuff that i missed out on. can't wait to play the dlc. a 100 would recommend game to anyone looking for their next favorite game."
Open-World,Cyberpunk 2077,2025-03-21,i played this game on launch date... and after buying it for the pc and seeing how much its changed.... damn it feels like a whole different game and its actually so good now.
Open-World,Cyberpunk 2077,2025-03-21,"this game is good, but god dam it still feels like its in beta."
Open-World,Cyberpunk 2077,2025-03-20,"highly recommended this game because this game is very wide, open world ang graphic like gta 5"
Open-World,Cyberpunk 2077,2025-03-20,"it's funny, but the beginning of sales of this game was terrible."
Open-World,Cyberpunk 2077,2025-03-20,"this might be the best story game i have ever played. i've only gotten one ending as of writing this but it was so well written that i don't want to try a different path and make this one feel less cannon even though i didn't find the ending satisfying. i can barely bring myself to keep playing from my last checkpoint because it would be a change in the events of my game and feel off, i might try tomorrow. the gameplay is amazing, traveling feels great, the city feels massive and the combat and stealth are amazing as well. the voice acting and music are movielevel too, just like the writing. one aspect of the game that shocked me is that the breathtaking graphics ran on my laptop with 0 crashes, great loading times, and the only glitches being a few boxes jumping in a shelve when something touched them every few hours. this is easily the most freefeeling game i've ever played with all the different weapons and cyberware and i feel like almost anyone could enjoy it because of all the ways to play the game. i highly recommend this game to anyone interested and can easily say it is a 1010 game, and despite not paying for it because i got it though family sharing, i can say without a doubt that it is worth every penny. i have incredible respect for the development team and everyone that helped to make this game as perfect as it is even with the rough release. i hope you found my review helpfull and decide to try this game if you have the chance. goodbye. update i bought myself a copy of the game along with the dlc partially to post this review because of how much i want this to convince more people to play this masterpiece."
Open-World,Cyberpunk 2077,2025-03-20,peak peak peak. peak play this. every side gig and the whole story my only problem are the ''wait to be called'' quests.. and a little bit of bugs but its enjoyable.
Open-World,Cyberpunk 2077,2025-03-20,"already played this on ps5 so i wanted to play it again on pc with mods to enhance my experience. i gotta say that this game is great and i love it but the amount of visual bugs almost made me stop playing already tried if it was a mods issue but it wasn't. having to optimise settings to fix them at the cost of lower performance and other shit is very annoying and i'm always crossing my fingers that it will run and look fine everytime i load in the game bruh. other than that crap, it's a great game with a great story, amazing graphics when it works, and memerable characters. 910 for me if only they actually fixed everything ."
Open-World,Cyberpunk 2077,2025-03-20,this game has amazing story characters and gameplay. theres a bunch of side quest to do with interesting lore
Open-World,Cyberpunk 2077,2025-03-20,"one of the best games of all time. as a guy who has sunk at least 2 years into morrowind, this is the closest i've come to playing something as amazing and free."
Open-World,Cyberpunk 2077,2025-03-20,"an absolute mess upon launch i still had fun though, played about 80 hrs then stopped for awhile, came back after the 2.0 update and finished my playthrough they got rid of some features i liked but they fixed most of the problems i had previously encountered. i am quite annoyed with the price of the dlc considering the state the game was in at launch and its 80 cad pricetag. overall this was an excellent game visually and story wise with great replayability, it has become one of my top 5 favourite games of the last 10 years."
Open-World,Cyberpunk 2077,2025-03-20,"i love it. it's a bit on rails sometimes when you start a story related quests. i think they could have done a bit more to make these parts more interactive instead of jumping from conversation to conversation. that said the story could easily make a blockbuster film. you can easily take a break from the story and just enjoy the city. i completed the main campaign, then started modding it, modded in and started a new game before attempting the dlc. added a ton of immersion, quality of life mods and just stuff to bring the world alive. so far i've had no conflicts with 64 mods, all just drag and drop to game folder. then i started the a new game and haven't put it down. i'm honestly shocked at how easily moddable the game is and just the sheer scope of some of the mods. they are seamless as well, like they should have been there all along. overall very satisfied. money well spent."
Open-World,Cyberpunk 2077,2025-03-20,the saddest i have been in recent memory was finishing this game and uninstalling it. 1010
Open-World,Cyberpunk 2077,2025-03-20,"don't play it on very hard and you won't have a frustrating experience i can't in good conscience recommend that decision for your first playthrough.. unless you find the frustrating part of dying over and over again fun, of course! basically, what i mean is, every one becomes your worst enemy, you either get 1shot, 2shot, or 3shot, no exceptions, don't matter how much armor you have, it doesn't exist, it's a joke and you better stock up on healing items and be prepared to run in circles or hide like a little bitch behind cover for a while when you're begging god almighty to recharge your healing items for your next inevitable use. the game is nice, there's a lot to do, and the characters are interesting to interact with, keep in mind that you'll be playing as someone else, you are not roleplaying as yourself, you are roleplaying as v. if you find that uncool for any reason you should look for something different to play.. i'd recommend fallout new vegas or the outer worlds not biased at all, totally, don't check out my profile to confirm.."
Open-World,Cyberpunk 2077,2025-03-20,"amazing game, i recommend it for who like playing games with alot of ability's of controlling the character, and thos who like to experience new things completely freely, special combats, betting fights, mission fights, combat with various types of weapons, high ability to develop and upgrade skills before entering a fight and even during combat the ability to modify skills and use them to suit the situation you are in combat, a great game."
Open-World,Cyberpunk 2077,2025-03-20,great game! i didnt really enjoy it the first time around but after updates this game runs pretty well on my set up also the edge runners anime really helped me get into it tbh
Open-World,Cyberpunk 2077,2025-03-20,"having played this game since launch day on the xbox one, xbox series x, and here on pc, i have a lot of things i can say about this game, but don't have the patience to type it all out here. the very horrible, false advertised and extremely buggy launch of cyberpunk still leaves a sour taste in my mouth. however with the improvements in performance, bug fixes, and major overhauls to almost everything in the years post launch, i'm now able to give this game credit where it was well overdue. there's still a lot that i wish can be done to this game, but it's an almost perfect product that i can recommend to anyone who not only enjoys a good story, but to anyone who enjoys open world and single player games similar to me. in short, cyberpunk has had a lot of ups and downs and still some very minor ones that can be ignored, but has made one hell of a comeback from the mess that was it's original release."
Open-World,Cyberpunk 2077,2025-03-20,o como  bom transar com a puta profissional o vem fuder no clima quente no calor de 30 grau.  quase escrevi professional com c vou me matar
Open-World,Cyberpunk 2077,2025-03-20,good game and the best part is playing offline mode if you not on wifi
Open-World,Cyberpunk 2077,2025-03-20,"came for the hype, stayed for the content. i am reaching a point where i just cannot 100 every games, and i am fed up by easy useless side quests in infinite open worlds. however, this game organises its content in a quite honest way, letting you know how far your are straying from the main quest when choosing a mission. doing the main and main characters' quests, it took me 35ish hours to finish it, with a satisfactory completion of that world, and state of my character. buy it !"
Open-World,Cyberpunk 2077,2025-03-20,"one of the best games i have ever played. some little things are bothering me but nothing that breaks the awesome storytelling and cool characters, also the awesome looks of the game. 1010"
Open-World,Cyberpunk 2077,2025-03-20,"honestly, this game has been one of my favorites of all time since patch 1.6 fixed all the major bugs and cleaned up the ui and gigs. 2.0 is just icing on the cake for me, and a great example of a proper expansion vs. dlc. if you don't like the game at this point, then it's just not your kinda game, and that's cool. the actual major problems are long gone."
Open-World,Cyberpunk 2077,2025-03-20,"you can just walk around the entire map and still find a lot to enjoy. now that the bugs have been mostly fixed i can say it's a fantastic incredible game. the map and world building are absolutely beautiful and the mechanics and fights are very well done. i'm not a big fan of first person shooters but this game was an exception. also, all the quests are fun and don't get repetitive."
Open-World,Cyberpunk 2077,2025-03-20,it was amazing at launch. its absolutely breath taking now
Open-World,Cyberpunk 2077,2025-03-20,"just approaching the end of my first play through. started out sceptical of first person only, but gradually got used to it. would still prefer at least the option of third person, but we have what we have. i know this is a just a shooterlooter with motor vehicles, not a dating simulator nor base builder, but i would like to have seen a more expansive romance setup. besides the above minor quibble, cdpr have created a fantastic world with immersive stories, side quests and interesting characters, and i'm glad i took the plunge. also like the few hattips to witcher 3"
Open-World,Cyberpunk 2077,2025-03-20,i wish there a biochip that make me forget this game so i can experience this story once again
Open-World,Cyberpunk 2077,2025-03-20,".    h1   h1      ,               ,       .           ,         . h1   h1        ,                   .     ,      ,       ,          ,             ,     . h1  h1                 .      ,     ,     ,     ,      ,       .       ,  , ,    .       ,      ,     .     ,   ,   .     ,       ,       , ,    ,        .     ,    ,    ,                  ,        . h1  h1 h2  h2  ,              ,       . h2   h2   ,            ,     . h2   h2       ,        ,          ,      ,         ,     . ,    ,       ,                          . h2  h2      ,    ,         ,             ,             . h1  h1    ,        ,      ,        . 910"
Open-World,Cyberpunk 2077,2025-03-20,"remember... the game is fixed.  idris elba it took some time, and they still deserve all the criticism in the world for releasing it in the state they did... but this game is really good. especially phantom liberty. it's almost not worth playing without it. but the world, the characters, the voice acting, the story is all some of the best i've ever experienced in a aaa game like this. i've been a fan of night city and cyberpunk for years before playing this, and to see the city and the characters i've only seen in my imagination so fully realised in a product like this is just so fulfilling. probably my favourite game of all time."
Open-World,Cyberpunk 2077,2025-03-20,"unforgettable experience. one of the master pieces that would be remembered and talked about in the decades to come in video game history. i sincerely appreciate the dedication to tell a great story and an immersive universe. for me, there is little i can ask for more."
Open-World,Cyberpunk 2077,2025-03-20,810 i didnt like the ending for the main game also dog town one too for president it would be 910 otherwise just wish all the setup i did for the ending mattered i did the panam ending and i think its good just the whole part of 6 months to live this was kinda cheap felt like none of the hard work i did really mattered i know its left to interpritation weather v found another way to live after besides that it was sweet a bit short for me also the dog town dlc has highs and lows like 4 hours of padding is crazy also felt very unsatifying for the end i guess thats the point still dont like it but over all i liked it never want to go in dog town again though its awful to navigate ill give the dlc a 710 because it had great moments
Open-World,Cyberpunk 2077,2025-03-20,"love this game, but damn steam u really gotta fix the playtime, stuffs weird played for 67 hrs shows 3hrs"
