genre,game,commented_date,comment
Open-World,Cyberpunk 2077,2025-03-14,"i recommend this because it's the only half decent scifi skyrim game available. and no, starfield doesn't rate even to this level. so, pros are straightforward  it's skyrim but cyberpunk. now for the cons. tons of bugs even years later. mission to stealth kill a boss. i get to the room, choose dialog option, it leads to combat. reload a save from outside the room and now the game refuses to offer the dialog option even though i was clean up to the save. i distract the boss via a terminal, he walks over to it back to me. i enter the room and he instantly rubber bands back to his original location  just flies backwards 20 feet  and then alerts and i fail the stealth part. even when the game works normally stealth playstyle is totally fucked. people just randomly turn on a dime and it forces a save and play approach which kills the fun. very hard mode makes most builds and playstyles completely untenable. actually here, you're best bet is stealth takedowns from behind with heavy use of savescumming. not fun. but if you like the idea of a stealth playstyle, maybe you'll focus on snipers. guess what, the only one you can run stealth is underpowered and won't kill anything above normal in one shot. so you'll actually do better sniping at long range with a silenced pistol than a sniper rifle. ludicrous. if you try to stealth attack with a katana you'll just injure them and alert everyone. but with your bare hands you instakill. again, totally absurd. tons of poor interface issues. like even on keyboard a lot of things bind to the same thing. so you'll finish a police scanner encounter and you have to wait like 15 seconds for the text of a journal drop to be available via a pop up. you need to wait, and trigger it then, or it's a pita to go through the journal interface. but then you got xp at the same time and that triggers your fixer calling you with some shit, which interferes. or you want to pick an item up but no matter where you hover the mouse you can't get it  but you can pick up this other thing 5 feet to the left. or the radio in your apartment and car that randomly reset every time you leave  as if some asshole keeps breaking into your apartment and turning it back on. there's a drop attack you can do, but if you don't land it right it'll screw up and then everyone is alerted so it's pretty unusable. you can use throwing knives but only one. then it magically reappears like you're the god of war. if you have more knives you can't use those  you have to wait for magic knife. like most recent games it has a hamfisted woke storyline shoved in in the form of a trans revenge murder side quest. still didn't spare cdpr from woke backlash anyway, but given their recent csuite exec wide eye stare youtube preaching fealty it's only going to get worse in their future games. at least it's not as bad as fc6 where someone gets murdered for the crime of misgendering. all of the endings are total ass. i get that it's a dystopian future but they really screw over the protagonist and, by extension, the friends that you choose to ultimately die for you, die for nothing. unless you read the spoilers to unlock the secret solo ending and even then you get a shit ending. or use the phantom liberty new ending option and.. yeah that's still super shitty but at least you don't get your friends killed. the newly added sandevistan builds are cool but then you can't disable cameras with the deck which makes the soft requirement to stealth half the quests impossible. so it's an end game build option and there is no end game. save all the cyberpsychos until late game with a cloak equipped. save the beat on the brats for end game and get gorilla arms. both of these get offered to you right at the start and just aren't set up for that."
Open-World,Cyberpunk 2077,2025-03-14,i rate this game 2nd place story and gameplaywise for me in that depratment nothing can beat the red dead games. but huge props to the devs for making this masterpiece and bringing us one of best animes of all time.
Open-World,Cyberpunk 2077,2025-03-13,"honestly, the first game in a long time that makes me want to replay it over and over again. it not being repetitive and unpredictable is what makes this game fun for me. there will always be cons in games and without being bias i think with that being said the cons that the game has now, are not as game breaking as they used to be. overall, i do recommend this to other players who are looking for something more free and immersive. the story is jam packed and compelling. game is very much enjoyable."
Open-World,Cyberpunk 2077,2025-03-13,"amazing graphics, great gameplay"
Open-World,Cyberpunk 2077,2025-03-13,"i bought this game when the ultimate edition was released but i only began to play it in earnest as of version 2.21 in 2025. i, like everyone else, had heard the negative things about it at launch. i can safely say none of that applies, now. this is a fun game. even as someone who doesn't play firstperson games and rarely enjoys shooters, i find the story, characters, and overall atmosphere of this game to be engaging. i highly recommend, and bonus if you are a fan of the cyberpunk genre, because the game definitely delivers the vibe."
Open-World,Cyberpunk 2077,2025-03-13,one of the games where i actually just picked the closest quest and just started completing everything. not a big fan of story mode style games but this one was pretty good. 100 would recommend. i've done two alternate endings and will probably do a few more.
Open-World,Cyberpunk 2077,2025-03-13,"best game i've ever played, incredible graphics, great story, fun gunplay and runs well. 1010"
Open-World,Cyberpunk 2077,2025-03-13,"a bit too much talk for my taste early, but it picks up quick and is very well made. quite an enjoyable game,"
Open-World,Cyberpunk 2077,2025-03-13,"the game on release was utter dog shit, but as the years past and the constant updates to fix the game it molded this game as amazing. the story path i went on was outstanding, the dialogue was great, and the combat was also clean. i highly recommend for anyone to get this game and experience it themselves even if it was already spoiled to them. this game also proves that consumers shouldn't rush the game devs to release games early and wait until the game is actually finished to play it."
Open-World,Cyberpunk 2077,2025-03-13,"pros the graphics, characters, effects and battle dynamics are excellent. the variety of weapons is enough. the characters are each like the real thing and taste more like a movie than a game. it's like an experience. this game makes you count down the days to do the next part. it's nice to have a roleplaying game and direct it to different ends, but it takes a while to fully learn the game. you may want to play the game constantly because there are many kills and ways to play. cons vehicle and motorcycle driving physics are bad. it turns too much and can go crooked. npcs are so stupid because he jumps in front of the car, dies, and as if that wasn't enough, the cops show up next to him 5 seconds later. if you're not a good player, keep the difficulty level down because they don't die. bugs still persist in the game, although not as much as before. it is quite possible to see 12 pieces every time you play. it's like rendering late and having the vehicles spawn in an instant. overall just buy and play it. it's really worth it"
Open-World,Cyberpunk 2077,2025-03-13,"best game i've ever played. the graphics are immersive, the story is compelling and the gameplay it self is very enjoyable."
Open-World,Cyberpunk 2077,2025-03-13,played and completed this game when it was at the buggy 1.0 and i loved it then and love it all the more in its polished glory. the developers really know how to make a world feel lived in and in turn immerse the player into the mindset that makes them want to scrape and crawl to the finish.
Open-World,Cyberpunk 2077,2025-03-13,graphics are amazing
Open-World,Cyberpunk 2077,2025-03-13,"love this game so much. i like open world games and being able to basically become max level before the first mission. so thats what i did, i dont like playing games and only getting the cool stuff and abilities towards the end or having them unlocked through newgame, no i want to be top dog right out the pound. multiple endings is also a good choice to have, probably only going to play it once but its dope to play it and see how i compared to my friends and what not 9.9910"
Open-World,Cyberpunk 2077,2025-03-13,saur good i had to acquire through legitimate means to support the devs. played during the rocky launch  was still phenom. vas and writers really went absolutely insane  more than made up for the bugs at the time
Open-World,Cyberpunk 2077,2025-03-13,"game keren. dulu waktu pertama keluar saya ingat banyak sekali bugnya. salut untuk developer game ini cd projekt red, bisa merubah game ini dari unplayable menjadi luar biasa seperti ini. meski butuh waktu 4 tahun. buat teman2 di indonesia, harus coba game ini sekali seumur hidup."
Open-World,Cyberpunk 2077,2025-03-13,"i love this game so much. might be my favorite game ever, except that i played it first on ps4 pro the day it came out and remember what that was like. even then though it still had one of the greatest worlds and stories i had ever experienced. the pain of realizing i couldn't do basic things like customize cars or scale legendary weapons into the late game i remember dumping thousands of materials into silverhand's pistol only for it to still be weaker than an epic revolver was eased with free patches. the game now is a masterpiece. loses points for having a final mission that is eternally in your quest log. ala fallout new vegas 910"
Open-World,Cyberpunk 2077,2025-03-13,"this is more than just a good looking game and a next gen technology show off. this is life. i don't want to finish this game, let hanako wait in amber forever. please add new story dlc."
Open-World,Cyberpunk 2077,2025-03-13,"910. the story was amazing and hooked me in every time i loaded it up, not experienced that feeling since half lifeportal series and gta v when it first came out. so glad they polished it and worked the severe bugs out! been on my wish list since it came on steam. just finished the main story right before i wrote this and i want more! will get the phantom liberty dlc!"
Open-World,Cyberpunk 2077,2025-03-13,super fun and addicting. lots of builds and replayablity
Open-World,Cyberpunk 2077,2025-03-13,"truly one of the best games i've ever played. the world building and setting are absolutely top tier accompanying a narrative with tough thought provoking choices and meaningful consequences. before cyberpunk i'd never had the pleasure of exploring a world so immaculately detailed and well thought out as night city. in addition to an unrivaled setting, the game play is a deep well of build variety and moment to moment choice to tackle each challenge however you the as the player see fit. this is a must play by any and all standards."
Open-World,Cyberpunk 2077,2025-03-13,"still has some minor bugs, but overall this game is a great experience."
Open-World,Cyberpunk 2077,2025-03-13,"no matter how the game started out, right now it is a masterpiece! the story especially is top tier!"
Open-World,Cyberpunk 2077,2025-03-13,still a bit buggy but incredible game holds up
Open-World,Cyberpunk 2077,2025-03-13,"while the launch was rocky, the wait and redemption was worth the wait. this is by far one of the greatest modern rpg's ever made. overall i'd give this a 1010"
Open-World,Cyberpunk 2077,2025-03-13,"just best game i've ever played. play with mods that improve immersion, don't fast travel anywhere and take time to do side quests. you won't be disappointed. also phantom liberty is great, get it."
Open-World,Cyberpunk 2077,2025-03-12,"very fun with story that grabbed me personally. but if your wanting to mod. just be careful though. it can either be a painful brain dance, or simple."
Open-World,Cyberpunk 2077,2025-03-12,great game. haven't met any bugs so far. think the patch really helped out the game. the expansion seems great too.
Open-World,Cyberpunk 2077,2025-03-12,amazing story. great atmosphere. graphics are beautiful!!! cruising night city at 2 am is just soul touching.
Open-World,Cyberpunk 2077,2025-03-12,"addictive, interactive. the next stage in cybernetics allowing us to bring our very own bodies to bleeding edge optimization. visit your local ripperdoc to learn more at s.h.a.d.e. enterprise s.h.a.d.e. we've got you covered"
Open-World,Cyberpunk 2077,2025-03-12,"cyberpunk has been the most enjoyable game i have ever played. the story is amazing and immersive, the game does not force you on a certain path and i feel like the game builds upon much of what makes the witcher 3, fallout 4 and even mass effect games fun. resulting in an experience which i don't believe to be matched by anything else. also the dlc is amazing. that being said, there are things which could have been done better.  inventory management and crafting system can take time getting used to.  many of the character builds which could be fun to play on are not obvious and trying them out requires commitment which can't be reversed.  the open nature of the game means you are likely to miss out on logbooks, quests and alternative endings. all of which could help you understand the world better and get more out of the game.  cyberpunk is also at least somewhat more gpu intensive that it has to be due to poorly implemented taa anti aliasing and upscaling. these are issues with many modern games and i can only hope that cdpr and the industry in general moves away from this direction in the future."
Open-World,Cyberpunk 2077,2025-03-12,"great story, great combat, great gameplay.. hell yeah i recommend this game!"
Open-World,Cyberpunk 2077,2025-03-12,the graphics and the immersion really blew me away. the dlc could be it's own game. put 52 hours into the game and still have so much more to do.
Open-World,Cyberpunk 2077,2025-03-12,just finished my 100 playthrough of the game. absolutely without a doubt a 1010 game. up there with my favorite games of all time. did a playthrough back when the game released and i'm happy to say the game is 110 better now. highly recommend this fantastic game!
Open-World,Cyberpunk 2077,2025-03-12,in this more or less final version the game is really great whether it be that you get lost in sidequests or follow the detailed main story line getting to know night city in and out.
Open-World,Cyberpunk 2077,2025-03-12,"i bought this game back in december of 2022. i remember having a meh attitude towards the whole game. the intro as a nomad, fixing your current car at the time, trying to become a known legend in night city, i was not drawn in immediately. meeting jackie for the first time and doing the shootout with him smuggling an iguana, that was as far as i gotten back then. for a little over two years i did not pick up this game. i saw memes and bugs online and it made me more disinterested as time went on. a friend of mine recommended that i give cyberpunk 2077 another shot after i told him i have beaten god of war. when i tell you that i am currently addicted to this game, words can not describe the euphoria i have experienced lately. i have not had this much fun since red dead redemption 2 came out back in 2018. the story telling and atmosphere is up there with some of the best rpgs i have ever played. it is not perfect, but since cd projekt red has teased possibly a few more updates, there is no complaint from me here. my entire play through so far, i have experienced one crash it involved doing several quick hacks against enemies and exploding a vehicle beside me. there have been npc's on the streets of night city that would float above the ground when sitting. i experienced a bug once where my car would just drive in loops around my character, impeding my chances of getting in. of all the hours i have put in, those have been minor inconveniences compared to stuff i experienced in 2022. it took me about two hours to reach night city and that is where things started picking up. the more you play and explore, you find yourself having a better understanding on how to play and interact with the game cyber ware, crafting, upgrading guns, receiving free cool cars through missions, exploring areas, and finding unique items or guns skippy. following through the main story or doing a side missions are well written and captivating. from a gonk of a launch, to a truly special game. if you were skeptical of trying the game regarding it's history, now is the time to give it another chance."
Open-World,Cyberpunk 2077,2025-03-12,"it didn't fully meet my expectations, but it offered an aboveaverage open world, enjoyable side quests, and a decent storyline, making for an overall fun experience. however, inconsistencies, bugs, and performance issues hindered my enjoyment. 710  a good game. i'm playing again after the new update and some issues seem to have been resolved"
Open-World,Cyberpunk 2077,2025-03-12,"beautiful game with very high replay ability, there is some minor visual bug and some quest is still bugged but nothing too major, highly recommended 810"
Open-World,Cyberpunk 2077,2025-03-12,"played when the game had originally dropped in 2020, and despite the bugs and glitches i had a blast and was invested in such a memorable story and setting. now, having played it a 2nd time after all the updates and fixes, as well as the dlc, i can say this game has solidified itself as a true classic amongst the titans of the gaming industry. and absolute mustplay, the ending still brings a tear to my eye."
Open-World,Cyberpunk 2077,2025-03-12,"in this game, you can shoot people, and run them over. also your character can have some very cool aesthetic features. i don't know what the plot is about, but, 1010 game."
Open-World,Cyberpunk 2077,2025-03-12,"you know, i remember seeing gameplay of this game when it first came out. i endlessly ragged on this game for just about everything from bugs to gameplay to what appeared at the time to be a shallow world. right now, i'm playing through all my games in a desperate no backlog challenge attempt, so that doesn't leave me much time to pursue side objectives in most of these games. however, i couldn't help myself here. i actually became quite immersed in everything this game had to offer. the combat was fun as hell and made me feel like a badass. i genuinely started to care for the characters and the results of my actions on the world around me. if i was near a side objective, i did it. if it was for a character i enjoyed, i did it. all this to say that i was genuinely impressed, and whatever insults i offered this game on launch, i take it back and instead offer my suggestion to absolutely try this game out. the ending was phenomenal and truly respects the character development and choices made along the way. i didn't even have phantom liberty and was quite satisfied. worth the time, and i'll likely come back in the end."
Open-World,Cyberpunk 2077,2025-03-12,"there are few moments that as a gamer you'd know a game is just more than a game, and this is one of those experiences. you'll be certainly in for something more than what you're expecting. gameplay various routes to build your character for combat and interaction with the world. each life route also provides a good insight to the world. the world is immersive and big to explore, my hours are low because i already spent longer hours on a different platform, but throughout over 600 hours of playing in total, never once the game play was tiresome. story as i said each life path gives a decent insight to the world, but when you start it does a perfect job of roleplaying if you only select the related dialogue options for you path. story is so immersive and character developments and storytelling is so perfect, that even after playing each ending, you'd still feel the certain highs as you did playing the first time. dlc adds a good chunk to both gameplay and story, while you can be fine just playing the base game, it's certainly worth the price."
Open-World,Cyberpunk 2077,2025-03-12,"buggy but some glitches make ya laugh,all though preem game fun weapons and good story"
Open-World,Cyberpunk 2077,2025-03-12,"great game, character, narrative and setting. game has some glitches, but nothing near bethesda level. fun all around and a good campaign. wish we had more stellar first person narratives nowadays."
Open-World,Cyberpunk 2077,2025-03-12,"just finished my first ending after finishing all the gigs and most side jobs. the game has a lot of moments where it's really good thought provoking and hype. but it's so rough around the edges mostly because of inconsistentcey with decision making and the consequences of being inconsistent. the couple endings i've seen so far end on the climax without enough of a real conclusion in my opinion. this isn't helped by the fact time spent with characters is too limited to become invested in any of them properly. all the side job and gig characters endings feel too abrupt and as if the team had to finish them to finish the product in time for a deadline instead of tell a full story. also dialogue is stiff and sound just kinda dumb in some scenes. except johnny because he's with you the whole game and does develop and change over time with v depending on how you act which is what i would have liked more from other characters. johnny's character, development and conclusion is by far my favourite part of the game. unfortunately the whole game feels like it's just better to wait for the sequel which will improve upon all the many minor issues with this game which hold it back from being one of the greats. especially as it's still littered with major bugs even on the 2.2 patch. the games main strengths are it's immersive, atmospheric and is backed by an awesome fitting soundtrack but it most importantly is very fun especially the combat so it's still worth playing for sure if you're interested. 7.510"
